UNIQUE_ID,COLLISION_ID,PERSON_ID,PERSON_TYPE,PERSON_INJURY,PERSON_SEX,PERSON_AGE,VEHICLE_ID,EJECTION,EMOTIONAL_STATUS,BODILY_INJURY,POSITION_IN_VEHICLE,SAFETY_EQUIPMENT,PED_LOCATION,PED_ACTION,COMPLAINT,PED_ROLE,CONTRIBUTING_FACTOR_1,CONTRIBUTING_FACTOR_2,CRASH DATE,CRASH TIME,BOROUGH,ZIP CODE,LATITUDE,LONGITUDE,LOCATION,ON STREET NAME,CROSS STREET NAME,OFF STREET NAME,NUMBER OF PERSONS INJURED,NUMBER OF PERSONS KILLED,NUMBER OF PEDESTRIANS INJURED,NUMBER OF PEDESTRIANS KILLED,NUMBER OF CYCLIST INJURED,NUMBER OF CYCLIST KILLED,NUMBER OF MOTORIST INJURED,NUMBER OF MOTORIST KILLED,CONTRIBUTING FACTOR VEHICLE 1,CONTRIBUTING FACTOR VEHICLE 2,CONTRIBUTING FACTOR VEHICLE 3,CONTRIBUTING FACTOR VEHICLE 4,CONTRIBUTING FACTOR VEHICLE 5,VEHICLE TYPE CODE 1,VEHICLE TYPE CODE 2,VEHICLE TYPE CODE 3,VEHICLE TYPE CODE 4,VEHICLE TYPE CODE 5,CRASH_DATETIME
12693787,4650966,fcf452f5-cdc6-4818-bdba-c44c6c4ca142,OCCUPANT,UNSPECIFIED,M,52.0,20488777.0,,,,,,,,,Registrant,,,08/02/2023,20:05,QUEENS,11420.0,40.66741,-73.82479,"(40.66741, -73.82479)",116 STREET,150 AVENUE,,0.0,0.0,0,0,0,0,0,0,Driver Inexperience,Unspecified,,,,Station Wagon/Sport Utility Vehicle,Station Wagon/Sport Utility Vehicle,,,,2023-08-02 20:05:00
9996143,4163260,ec934674-4edc-4d3a-bb9b-c3c3f360cf47,OCCUPANT,UNSPECIFIED,F,30.0,19014142.0,Not Ejected,Does Not Apply,Does Not Apply,Driver,Lap Belt & Harness,,,Does Not Apply,Driver,,,07/02/2019,0:00,BRONX,10455.0,40.81608,-73.917694,"(40.81608, -73.917694)",3 AVENUE                        ,EAST 149 STREET,,0.0,0.0,0,0,0,0,0,0,Other Vehicular,Unspecified,,,,Station Wagon/Sport Utility Vehicle,Station Wagon/Sport Utility Vehicle,,,,2019-07-02 00:00:00
10028449,4178569,cd427669-7847-43dc-8951-ec85d3330d71,OCCUPANT,UNSPECIFIED,M,28.0,19030362.0,,,,,,,,,Registrant,,,07/26/2019,14:00,BROOKLYN,11204.0,40.63291,-73.97957,"(40.63291, -73.97957)",43 STREET                       ,17 AVENUE,,0.0,0.0,0,0,0,0,0,0,Brakes Defective,Unspecified,Unspecified,,,Sedan,Station Wagon/Sport Utility Vehicle,Motorcycle,,,2019-07-26 14:00:00
5751429,3422108,343734,OCCUPANT,UNSPECIFIED,M,28.0,16946243.0,,,,,,,,,Registrant,,,04/12/2016,11:45,QUEENS,11691.0,,,,FAR ROCKAWAY BOULEVARD          ,OCEAN CREST BOULEVARD,,0.0,0.0,0,0,0,0,0,0,Unspecified,Unspecified,,,,4 dr sedan,,,,,2016-04-12 11:45:00
11340440,4328791,892955dc-ede2-4f1d-bff2-5e67e2b57951,OCCUPANT,INJURED,M,54.0,19707214.0,Not Ejected,Conscious,Head,Driver,Lap Belt & Harness,,,None Visible,Driver,,,07/13/2020,20:00,BROOKLYN,11238.0,40.674664,-73.97025,"(40.674664, -73.97025)",,,10        GRAND ARMY PLAZA              ,1.0,0.0,0,0,0,0,1,0,Driver Inattention/Distraction,Unspecified,,,,Sedan,Sedan,,,,2020-07-13 20:00:00
11444284,4355767,32444a07-7fa9-4653-b26d-a8669d107c49,OCCUPANT,UNSPECIFIED,,,19767762.0,,,,,,,,,Registrant,,,10/08/2020,6:40,BROOKLYN,11226.0,40.64944,-73.96308,"(40.64944, -73.96308)",CHURCH AVENUE                   ,EAST 18 STREET,,1.0,0.0,1,0,0,0,0,0,Failure to Yield Right-of-Way,,,,,Bus,,,,,2020-10-08 06:40:00
7192699,3685157,fbc98067-d46e-4ecf-9fc4-790709567665,OCCUPANT,UNSPECIFIED,,0.0,17633569.0,,,,,,,,,Registrant,,,06/06/2017,13:15,MANHATTAN,10021.0,40.765545,-73.95471,"(40.765545, -73.95471)",EAST 70 STREET                  ,YORK AVENUE,,1.0,0.0,0,0,0,0,1,0,Oversized Vehicle,Unspecified,,,,Station Wagon/Sport Utility Vehicle,Box Truck,,,,2017-06-06 13:15:00
11804923,4406753,29ec1ece-1be3-4ff3-92f9-dcfd659707a6,OCCUPANT,UNSPECIFIED,M,42.0,19977874.0,Not Ejected,Does Not Apply,Does Not Apply,Driver,Lap Belt & Harness,,,Does Not Apply,Driver,,,04/12/2021,13:08,,,40.812622,-73.92934,"(40.812622, -73.92934)",EAST 138 STREET                 ,,,0.0,0.0,0,0,0,0,0,0,Failure to Yield Right-of-Way,Unspecified,,,,Sedan,Sedan,,,,2021-04-12 13:08:00
10006789,4173273,80d03d53-040a-487c-8678-bf652d58d015,OCCUPANT,UNSPECIFIED,M,33.0,19019484.0,,,,,,,,,Registrant,,,07/19/2019,17:55,,,40.76333,-73.792,"(40.76333, -73.792)",190 STREET                      ,CROCHERON AVENUE,,0.0,0.0,0,0,0,0,0,0,Unspecified,Unspecified,,,,Sedan,Sedan,,,,2019-07-19 17:55:00
6648173,3582857,3099365,OCCUPANT,UNSPECIFIED,M,30.0,17372286.0,Not Ejected,Does Not Apply,Does Not Apply,Driver,Lap Belt & Harness,,,Does Not Apply,Driver,,,12/17/2016,1:00,,,40.692463,-73.81082,"(40.692463, -73.81082)",VAN WYCK EXPWY                  ,,,0.0,0.0,0,0,0,0,0,0,Following Too Closely,Unspecified,,,,Sedan,Sedan,,,,2016-12-17 01:00:00
9635135,4004554,e4c35394-ebdf-4fc6-82cf-a394229abec4,OCCUPANT,UNSPECIFIED,M,32.0,18835392.0,Not Ejected,Does Not Apply,Does Not Apply,Driver,Lap Belt & Harness,,,Does Not Apply,Driver,,,10/20/2018,13:39,BRONX,10469.0,40.866573,-73.83876,"(40.866573, -73.83876)",EAST GUN HILL ROAD              ,BARTOW AVENUE,,0.0,0.0,0,0,0,0,0,0,Driver Inattention/Distraction,Unspecified,,,,Sedan,Station Wagon/Sport Utility Vehicle,,,,2018-10-20 13:39:00
5981488,3446886,752041,OCCUPANT,UNSPECIFIED,,,17055681.0,,,,,,,,,Registrant,,,05/22/2016,17:10,,,,,,RFK BRIDGE MANH PLAZA           ,,,0.0,0.0,0,0,0,0,0,0,Passing or Lane Usage Improper,Passing or Lane Usage Improper,,,,Taxi,PK,,,,2016-05-22 17:10:00
7406905,3843590,386c8864-fc75-45db-8a02-d565190ca4ec,OCCUPANT,UNSPECIFIED,M,46.0,17738337.0,Not Ejected,Does Not Apply,Does Not Apply,Driver,Lap Belt & Harness,,,Does Not Apply,Driver,,,02/09/2018,11:13,STATEN ISLAND,10308.0,40.55708,-74.15801,"(40.55708, -74.15801)",,,233       BROOKFIELD AVENUE             ,0.0,0.0,0,0,0,0,0,0,Driver Inattention/Distraction,Driver Inattention/Distraction,,,,Station Wagon/Sport Utility Vehicle,Station Wagon/Sport Utility Vehicle,,,,2018-02-09 11:13:00
7080052,3700377,3f4b74f1-b89f-4e24-b924-d883e0f70774,OCCUPANT,UNSPECIFIED,M,37.0,17579559.0,Not Ejected,Does Not Apply,Does Not Apply,"Front passenger, if two or more persons, including the driver, are in the front seat",Lap Belt & Harness,,,Does Not Apply,Passenger,,,06/27/2017,18:10,,,40.703632,-73.85587,"(40.703632, -73.85587)",JACKIE ROBINSON PKWY            ,,,0.0,0.0,0,0,0,0,0,0,Other Vehicular,Driver Inattention/Distraction,,,,Station Wagon/Sport Utility Vehicle,Station Wagon/Sport Utility Vehicle,,,,2017-06-27 18:10:00
10225559,4224351,bc348de0-826e-4b27-a1f2-d177d7287223,OCCUPANT,INJURED,M,27.0,19129492.0,Not Ejected,Conscious,Entire Body,"Front passenger, if two or more persons, including the driver, are in the front seat",Lap Belt & Harness,,,Complaint of Pain or Nausea,Passenger,,,10/16/2019,20:00,QUEENS,11354.0,40.762333,-73.833176,"(40.762333, -73.833176)",PRINCE STREET                   ,36 AVENUE,,1.0,0.0,0,0,0,0,1,0,Following Too Closely,Unspecified,,,,Station Wagon/Sport Utility Vehicle,Station Wagon/Sport Utility Vehicle,,,,2019-10-16 20:00:00
11192350,4258153,20484759-6db7-4f9d-87a4-ac6473eb832a,OCCUPANT,UNSPECIFIED,F,69.0,19628877.0,Not Ejected,Does Not Apply,Does Not Apply,Driver,Lap Belt & Harness,,,Does Not Apply,Driver,,,12/13/2019,15:30,BROOKLYN,11216.0,40.671787,-73.95311,"(40.671787, -73.95311)",ROGERS AVENUE                   ,SAINT JOHNS PLACE,,0.0,0.0,0,0,0,0,0,0,Unspecified,Unspecified,,,,Station Wagon/Sport Utility Vehicle,Station Wagon/Sport Utility Vehicle,,,,2019-12-13 15:30:00
9907936,4150892,9a0e59cf-c444-4e36-82de-892ac3e1fd9e,OCCUPANT,INJURED,M,29.0,18970507.0,Not Ejected,Conscious,Knee-Lower Leg Foot,Driver,,,,Minor Bleeding,Driver,,,06/07/2019,22:50,,,40.67903,-73.9246,"(40.67903, -73.9246)",BUFFALO AVENUE                  ,,,2.0,0.0,0,0,0,0,2,0,Driver Inattention/Distraction,Driver Inattention/Distraction,,,,unkow,Motorcycle,,,,2019-06-07 22:50:00
10292004,4239019,c4f8e37d-f416-4fe9-969f-c12571d3fff1,OCCUPANT,UNSPECIFIED,F,52.0,19162554.0,Not Ejected,Does Not Apply,Does Not Apply,"Front passenger, if two or more persons, including the driver, are in the front seat",Lap Belt & Harness,,,Does Not Apply,Passenger,,,11/10/2019,10:10,,,40.703762,-73.94262,"(40.703762, -73.94262)",MOORE STREET                    ,,,0.0,0.0,0,0,0,0,0,0,Failure to Yield Right-of-Way,Unspecified,,,,Station Wagon/Sport Utility Vehicle,Station Wagon/Sport Utility Vehicle,,,,2019-11-10 10:10:00
12373647,4568082,9c2ee55d-98aa-4d80-a107-c1539c307d8a,OCCUPANT,UNSPECIFIED,M,52.0,20307214.0,Not Ejected,Does Not Apply,Does Not Apply,Driver,Lap Belt & Harness,,,Does Not Apply,Driver,,,09/27/2022,23:15,,,40.63043,-73.88593,"(40.63043, -73.88593)",BELT PARKWAY,,,1.0,0.0,0,0,0,0,1,0,Following Too Closely,Unspecified,Unspecified,,,Station Wagon/Sport Utility Vehicle,Station Wagon/Sport Utility Vehicle,Station Wagon/Sport Utility Vehicle,,,2022-09-27 23:15:00
9543444,3978754,9b229c25-bc2e-436e-85ab-1f380c1d3cc5,OCCUPANT,INJURED,F,57.0,18790093.0,Not Ejected,Conscious,Head,Driver,Unknown,,,Complaint of Pain or Nausea,Driver,,,09/10/2018,18:15,QUEENS,11421.0,40.697556,-73.852776,"(40.697556, -73.852776)",WOODHAVEN BOULEVARD             ,PARK LANE SOUTH,,1.0,0.0,0,0,0,0,1,0,Following Too Closely,Unspecified,Unspecified,,,Pick-up Truck,Station Wagon/Sport Utility Vehicle,Sedan,,,2018-09-10 18:15:00
11843213,4431417,3d85b6a5-6d5b-410b-be9b-4239565abb0d,OCCUPANT,UNSPECIFIED,M,61.0,20000425.0,Not Ejected,Does Not Apply,Does Not Apply,Driver,Lap Belt & Harness,,,Does Not Apply,Driver,,,06/23/2021,22:50,QUEENS,11373.0,40.745502,-73.888374,"(40.745502, -73.888374)",77 STREET,41 AVENUE,,1.0,0.0,1,0,0,0,0,0,Driver Inattention/Distraction,,,,,Station Wagon/Sport Utility Vehicle,,,,,2021-06-23 22:50:00
6990537,3654838,504eec8a-1a88-4092-96eb-cc1748e12faf,OCCUPANT,UNSPECIFIED,,0.0,17536813.0,,,,,,,,,Registrant,,,04/19/2017,21:15,,,40.76635,-73.95103,"(40.76635, -73.95103)",FDR DRIVE                       ,,,0.0,0.0,0,0,0,0,0,0,Following Too Closely,Reaction to Uninvolved Vehicle,,,,Sedan,RMP V,,,,2017-04-19 21:15:00
9969847,4161772,80dc1fd8-21c4-4a17-91b2-526299458400,OCCUPANT,UNSPECIFIED,F,32.0,19001080.0,Not Ejected,Does Not Apply,Does Not Apply,Driver,Lap Belt & Harness,,,Does Not Apply,Driver,,,06/30/2019,9:30,BRONX,10473.0,40.816765,-73.86475,"(40.816765, -73.86475)",COMMONWLTH AVENUE               ,RANDALL AVENUE,,0.0,0.0,0,0,0,0,0,0,Driver Inattention/Distraction,Unspecified,,,,Sedan,Van,,,,2019-06-30 09:30:00
11928107,4451970,4754bea3-3127-4fae-92b3-eb6abd045188,OCCUPANT,UNSPECIFIED,M,56.0,20050268.0,Not Ejected,Does Not Apply,Does Not Apply,Driver,Lap Belt & Harness,,,Does Not Apply,Driver,,,08/25/2021,13:20,STATEN ISLAND,10312.0,40.55413,-74.16837,"(40.55413, -74.16837)",RICHMOND AVENUE,STROUD AVENUE,,1.0,0.0,0,0,0,0,1,0,Driver Inattention/Distraction,Unspecified,Unspecified,,,Dump,Station Wagon/Sport Utility Vehicle,Sedan,,,2021-08-25 13:20:00
12155275,4511327,9ceaea1f-0811-40d2-bbfc-43091fcb5f4b,OCCUPANT,INJURED,F,22.0,20181757.0,Not Ejected,Conscious,Neck,Driver,Lap Belt & Harness,,,Whiplash,Driver,,,03/11/2022,23:46,,,40.76874,-73.90881,"(40.76874, -73.90881)",GRAND CENTRAL PKWY,,,2.0,0.0,0,0,0,0,2,0,Driver Inattention/Distraction,Unspecified,,,,Sedan,Station Wagon/Sport Utility Vehicle,,,,2022-03-11 23:46:00
9188681,3931475,fa2f98f4-0ae4-4829-bc45-d19f9553792e,OCCUPANT,UNSPECIFIED,F,60.0,18615925.0,Not Ejected,Does Not Apply,Does Not Apply,"Front passenger, if two or more persons, including the driver, are in the front seat",Lap Belt,,,Does Not Apply,Passenger,,,06/29/2018,12:20,BROOKLYN,11236.0,40.64891,-73.89256,"(40.64891, -73.89256)",FLATLANDS AVENUE                ,EAST 108 STREET,,0.0,0.0,0,0,0,0,0,0,Unspecified,Unspecified,,,,Station Wagon/Sport Utility Vehicle,Station Wagon/Sport Utility Vehicle,,,,2018-06-29 12:20:00
6630750,3508816,1756470,OCCUPANT,UNSPECIFIED,M,28.0,17363988.0,Not Ejected,Conscious,Does Not Apply,Driver,Unknown,,,Does Not Apply,Driver,,,08/28/2016,18:45,,,40.762486,-73.96298,"(40.762486, -73.96298)",EAST 62 STREET                  ,,,1.0,0.0,0,0,1,0,0,0,Driver Inattention/Distraction,Driver Inattention/Distraction,,,,Sedan,Bike,,,,2016-08-28 18:45:00
12432019,4583638,083f30c6-e6ce-4378-848e-71b94692943e,OCCUPANT,UNSPECIFIED,F,50.0,20340429.0,Not Ejected,Does Not Apply,Does Not Apply,Driver,Lap Belt & Harness,,,Does Not Apply,Driver,,,11/15/2022,21:32,BROOKLYN,11234.0,40.616848,-73.91169,"(40.616848, -73.91169)",AVENUE U,EAST 65 STREET,,0.0,0.0,0,0,0,0,0,0,Passing Too Closely,Driver Inattention/Distraction,,,,Station Wagon/Sport Utility Vehicle,Station Wagon/Sport Utility Vehicle,,,,2022-11-15 21:32:00
12115096,4500949,b3dbda51-65d5-431b-a69c-2f707e3f53c3,OCCUPANT,UNSPECIFIED,,,20158785.0,,,,,,,,,Owner,,,02/05/2022,6:08,,,40.52418,-74.2348,"(40.52418, -74.2348)",SOUTH BRIDGE STREET,,,0.0,0.0,0,0,0,0,0,0,Unsafe Speed,,,,,Sedan,,,,,2022-02-05 06:08:00
12787477,4675515,3fbb5156-8423-4b2e-b5a9-5cceb036238a,OCCUPANT,UNSPECIFIED,M,50.0,20542380.0,,,,,,,,,Registrant,,,10/31/2023,9:34,BROOKLYN,11201.0,40.69042,-73.978714,"(40.69042, -73.978714)",,,155       ASHLAND PLACE,1.0,0.0,0,0,1,0,0,0,Unspecified,Unspecified,,,,Bike,Sedan,,,,2023-10-31 09:34:00
7236352,3726934,5fed5871-894a-4e8e-a280-c30c420a903d,OCCUPANT,UNSPECIFIED,F,43.0,17654587.0,,,,,,,,,Registrant,,,08/07/2017,17:00,QUEENS,11378.0,40.726734,-73.90805,"(40.726734, -73.90805)",MAURICE AVENUE                  ,55 ROAD,,0.0,0.0,0,0,0,0,0,0,Oversized Vehicle,Unspecified,,,,Sedan,Station Wagon/Sport Utility Vehicle,,,,2017-08-07 17:00:00
9619659,4054219,142d3aaa-d2c1-4532-86f9-b3389cc83755,OCCUPANT,UNSPECIFIED,M,45.0,18827796.0,,,,,,,,,Registrant,,,12/29/2018,11:27,,,40.630234,-74.01685,"(40.630234, -74.01685)",BROOKLYN QUEENS EXPRESSWAY      ,,,0.0,0.0,0,0,0,0,0,0,Driver Inattention/Distraction,Unspecified,,,,Station Wagon/Sport Utility Vehicle,Sedan,,,,2018-12-29 11:27:00
7217812,3737747,f9290235-b5ae-422c-91f4-12691bd39fd5,OCCUPANT,UNSPECIFIED,M,59.0,17645715.0,Not Ejected,Does Not Apply,Does Not Apply,Driver,Lap Belt & Harness,,,Does Not Apply,Driver,,,08/26/2017,9:25,,,40.756317,-73.852295,"(40.756317, -73.852295)",GRAND CENTRAL PKWY              ,,,0.0,0.0,0,0,0,0,0,0,Backing Unsafely,Unspecified,,,,Sedan,Station Wagon/Sport Utility Vehicle,,,,2017-08-26 09:25:00
10104173,4172691,86d190f3-33ab-418d-b1a5-980988b10242,OCCUPANT,UNSPECIFIED,F,0.0,19068446.0,,,,,,,,,Registrant,,,07/13/2019,1:30,BROOKLYN,11212.0,40.666737,-73.90224,"(40.666737, -73.90224)",JUNIUS STREET                   ,BLAKE AVENUE,,0.0,0.0,0,0,0,0,0,0,Steering Failure,Unspecified,Unspecified,Unspecified,,Sedan,Station Wagon/Sport Utility Vehicle,Sedan,Sedan,,2019-07-13 01:30:00
9219752,4092106,0cb9525f-3bf4-4ef9-85a2-aac4f3e8cceb,OCCUPANT,UNSPECIFIED,F,27.0,18631116.0,Not Ejected,Does Not Apply,Does Not Apply,Driver,Unknown,,,Does Not Apply,Driver,,,03/06/2019,7:50,QUEENS,11358.0,40.768105,-73.804825,"(40.768105, -73.804825)",33 AVENUE                       ,160 STREET,,0.0,0.0,0,0,0,0,0,0,Following Too Closely,Unspecified,,,,Pick-up Truck,Sedan,,,,2019-03-06 07:50:00
9375588,3929389,71e96af7-85e6-469a-ba68-85a0f7d2f8ae,OCCUPANT,UNSPECIFIED,F,30.0,18707621.0,Not Ejected,Does Not Apply,Does Not Apply,"Front passenger, if two or more persons, including the driver, are in the front seat",Lap Belt,,,Does Not Apply,Passenger,,,06/22/2018,13:30,MANHATTAN,10036.0,40.762127,-73.99739,"(40.762127, -73.99739)",WEST 44 STREET                  ,11 AVENUE,,0.0,0.0,0,0,0,0,0,0,Driver Inattention/Distraction,Unspecified,,,,Sedan,Box Truck,,,,2018-06-22 13:30:00
9286681,4027757,94ee1356-a3ff-4e68-9389-f0a532624a01,OCCUPANT,UNSPECIFIED,M,22.0,18663897.0,Not Ejected,Does Not Apply,Does Not Apply,Driver,Lap Belt & Harness,,,Does Not Apply,Driver,,,11/17/2018,0:01,MANHATTAN,10023.0,40.777058,-73.98647,"(40.777058, -73.98647)",,,170       WEST END AVENUE               ,0.0,0.0,0,0,0,0,0,0,Alcohol Involvement,,,,,Station Wagon/Sport Utility Vehicle,,,,,2018-11-17 00:01:00
6411539,3528134,2105950,OCCUPANT,UNSPECIFIED,F,80.0,17259543.0,,,,,,,,,Registrant,,,09/23/2016,11:40,STATEN ISLAND,10310.0,40.6237,-74.113594,"(40.6237, -74.113594)",BROADWAY                        ,DOUGLAS AVENUE,,0.0,0.0,0,0,0,0,0,0,Failure to Yield Right-of-Way,Unspecified,,,,Sedan,Sedan,,,,2016-09-23 11:40:00
6896926,3695805,aa28b7ac-9a7e-450e-8e7b-8f5fd04d8d12,OCCUPANT,UNSPECIFIED,,0.0,17491894.0,,,,,,,,,Registrant,,,06/21/2017,8:30,,,40.55926,-74.201805,"(40.55926, -74.201805)",WEST SHORE EXPRESSWAY RAMP      ,,,0.0,0.0,0,0,0,0,0,0,Driver Inattention/Distraction,Unspecified,,,,Sedan,Station Wagon/Sport Utility Vehicle,,,,2017-06-21 08:30:00
12967307,4721983,bda50c18-5d50-4d7c-bd18-cfafd2b871d5,OCCUPANT,INJURED,M,45.0,20644410.0,Not Ejected,Conscious,Neck,Driver,Lap Belt,,,Whiplash,Driver,,,05/04/2024,1:06,BROOKLYN,11211.0,40.714073,-73.951,"(40.714073, -73.951)",,,527       METROPOLITAN AVENUE,1.0,0.0,0,0,0,0,1,0,Driver Inattention/Distraction,Unspecified,,,,Station Wagon/Sport Utility Vehicle,Station Wagon/Sport Utility Vehicle,,,,2024-05-04 01:06:00
12393211,4573408,c5deeeb3-ba5a-4f22-a8a6-bf110c9d5361,BICYCLIST,INJURED,M,48.0,20318461.0,Not Ejected,Conscious,Face,Driver,Unknown,,,Complaint of Pain or Nausea,Driver,,,10/14/2022,15:50,QUEENS,11417.0,40.68046,-73.84309,"(40.68046, -73.84309)",96 STREET,ROCKAWAY BOULEVARD,,1.0,0.0,0,0,1,0,0,0,Unsafe Speed,Unspecified,,,,Bike,,,,,2022-10-14 15:50:00
8955181,4066004,fb7fd580-e50e-4bbd-aa70-1cf7b477ef9d,OCCUPANT,UNSPECIFIED,M,35.0,18500257.0,Not Ejected,Does Not Apply,Does Not Apply,Driver,Lap Belt & Harness,,,Does Not Apply,Driver,,,01/13/2019,1:00,MANHATTAN,10018.0,40.75143,-73.98388,"(40.75143, -73.98388)",,,30        WEST 38 STREET                ,0.0,0.0,0,0,0,0,0,0,Unspecified,Unspecified,,,,Sedan,Station Wagon/Sport Utility Vehicle,,,,2019-01-13 01:00:00
12749100,4665530,3d066788-407d-4590-b58b-4882b7352d6d,OCCUPANT,UNSPECIFIED,,,20520610.0,,,,,,,,,Registrant,,,09/26/2023,16:46,BRONX,10474.0,40.816486,-73.89028,"(40.816486, -73.89028)",,,1231      LAFAYETTE AVENUE,0.0,0.0,0,0,0,0,0,0,Unspecified,Unspecified,,,,Station Wagon/Sport Utility Vehicle,Station Wagon/Sport Utility Vehicle,,,,2023-09-26 16:46:00
6560902,3558473,2658456,OCCUPANT,UNSPECIFIED,M,56.0,17330596.0,,,,,,,,,Registrant,,,11/10/2016,17:15,BROOKLYN,11204.0,40.609505,-73.97705,"(40.609505, -73.97705)",,,1559      WEST 3 STREET                 ,1.0,0.0,0,0,0,0,1,0,Unspecified,,,,,Station Wagon/Sport Utility Vehicle,,,,,2016-11-10 17:15:00
12587645,4623598,23dcbf48-f50e-43c9-9f3d-b406916d13fe,OCCUPANT,UNSPECIFIED,M,47.0,20428857.0,,,,,,,,,Registrant,,,04/25/2023,1:00,QUEENS,11355.0,40.753273,-73.82207,"(40.753273, -73.82207)",,,44-24     KISSENA BOULEVARD,0.0,0.0,0,0,0,0,0,0,Unsafe Speed,Unspecified,,,,Station Wagon/Sport Utility Vehicle,,,,,2023-04-25 01:00:00
7736228,3780015,8aba83de-5723-44dc-9fa2-6b5018a36fd5,OCCUPANT,UNSPECIFIED,M,42.0,17899724.0,,,,,,,,,Registrant,,,10/30/2017,14:00,,,,,,GRAND CENTRAL PARKWAY           ,JEWEL AVENUE,,0.0,0.0,0,0,0,0,0,0,Traffic Control Disregarded,Traffic Control Disregarded,,,,Sedan,Sedan,,,,2017-10-30 14:00:00
13329249,4803121,47061ff2-6b1b-4e3e-9f41-52e65f70669a,OCCUPANT,UNSPECIFIED,M,21.0,20851883.0,Not Ejected,Does Not Apply,Does Not Apply,Driver,Lap Belt & Harness,,,Does Not Apply,Driver,,,04/02/2025,7:57,,,40.61427,-74.156654,"(40.61427, -74.156654)",STATEN ISLAND EXPRESSWAY,,,0.0,0.0,0,0,0,0,0,0,Following Too Closely,Unspecified,Unspecified,,,Box Truck,Station Wagon/Sport Utility Vehicle,Station Wagon/Sport Utility Vehicle,,,2025-04-02 07:57:00
9669639,4038245,9c699414-4f77-434e-b6a7-a625cb725086,OCCUPANT,UNSPECIFIED,F,34.0,18852619.0,,,,,,,,,Registrant,,,12/04/2018,18:00,,,40.83302,-73.862724,"(40.83302, -73.862724)",WESTCHESTER AVENUE              ,WHITE PLAINS ROAD,,1.0,0.0,0,0,1,0,0,0,Brakes Defective,Unspecified,,,,Sedan,Bike,,,,2018-12-04 18:00:00
6013239,3452451,802263,OCCUPANT,UNSPECIFIED,F,8.0,17070648.0,Not Ejected,Does Not Apply,Does Not Apply,Right rear passenger or motorcycle sidecar passenger,Lap Belt & Harness,,,Does Not Apply,Passenger,,,05/29/2016,16:00,QUEENS,11106.0,40.767326,-73.92986,"(40.767326, -73.92986)",21 STREET                       ,31 AVENUE,,1.0,0.0,0,0,1,0,0,0,Traffic Control Disregarded,Unspecified,,,,Station Wagon/Sport Utility Vehicle,Bike,,,,2016-05-29 16:00:00
6072113,3601218,9f9e8dfa-fbe8-4050-90a5-d8b8e3d3cb6e,OCCUPANT,UNSPECIFIED,M,29.0,17098829.0,Not Ejected,Does Not Apply,Does Not Apply,Driver,Lap Belt,,,Does Not Apply,Driver,,,01/19/2017,11:06,,,40.651264,-74.003914,"(40.651264, -74.003914)",39 STREET                       ,,,1.0,0.0,1,0,0,0,0,0,Driver Inattention/Distraction,,,,,Sedan,,,,,2017-01-19 11:06:00
6742001,3589991,3232502,OCCUPANT,UNSPECIFIED,,0.0,17417521.0,,,,,,,,,Registrant,,,12/30/2016,17:50,,,40.752693,-73.932915,"(40.752693, -73.932915)",31 STREET                       ,,,1.0,0.0,0,0,0,0,1,0,Driver Inattention/Distraction,Unspecified,,,,Sedan,Sedan,,,,2016-12-30 17:50:00
11613239,4400728,51893afe-05d1-4154-99a0-3a7effe32f9c,OCCUPANT,UNSPECIFIED,F,26.0,19866726.0,Not Ejected,Does Not Apply,Does Not Apply,Driver,Lap Belt & Harness,,,Does Not Apply,Driver,,,03/21/2021,11:01,BRONX,10459.0,,,"(0.0, 0.0)",SOUTHERN BOULEVARD              ,INTERVALE AVENUE,,0.0,0.0,0,0,0,0,0,0,Unspecified,Unspecified,,,,Bike,Sedan,,,,2021-03-21 11:01:00
11869128,4436038,b183e0e8-e3c7-410f-a315-6c650e31de6b,OCCUPANT,UNSPECIFIED,M,26.0,20015751.0,Not Ejected,Does Not Apply,Does Not Apply,Driver,Lap Belt & Harness,,,Does Not Apply,Driver,,,07/12/2021,1:07,,,40.84525,-73.91499,"(40.84525, -73.91499)",CROSS BRONX EXPY,,,0.0,0.0,0,0,0,0,0,0,Following Too Closely,Unspecified,,,,Station Wagon/Sport Utility Vehicle,Sedan,,,,2021-07-12 01:07:00
12312720,4552301,09152e51-48a6-4cb0-a7ed-2f2093bac730,BICYCLIST,INJURED,M,46.0,20272038.0,Not Ejected,Conscious,Entire Body,Driver,Unknown,,,None Visible,Driver,,,08/02/2022,14:30,,,40.62459,-74.14129,"(40.62459, -74.14129)",FOREST AVENUE,DECKER AVENUE,,1.0,0.0,0,0,1,0,0,0,Unspecified,Unspecified,,,,Bike,Sedan,,,,2022-08-02 14:30:00
9450433,4040465,2dd1bf42-7656-4774-9d4f-5ec2e5b6e7a8,OCCUPANT,UNSPECIFIED,M,25.0,18744230.0,Not Ejected,Does Not Apply,Does Not Apply,"Left rear passenger, or rear passenger on a bicycle, motorcycle, snowmobile",Lap Belt & Harness,,,Does Not Apply,Passenger,,,11/29/2018,17:22,MANHATTAN,10002.0,40.71524,-73.996666,"(40.71524, -73.996666)",,,33        BOWERY                        ,0.0,0.0,0,0,0,0,0,0,Failure to Yield Right-of-Way,Unspecified,,,,Van,Sedan,,,,2018-11-29 17:22:00
13293608,4794097,e6d1c5d9-3cb3-45ca-b1e5-5b629859f878,OCCUPANT,UNSPECIFIED,M,31.0,20831614.0,Not Ejected,Does Not Apply,Does Not Apply,Driver,Lap Belt & Harness,,,Does Not Apply,Driver,,,02/18/2025,20:15,BROOKLYN,11229.0,40.598526,-73.95918,"(40.598526, -73.95918)",AVENUE U,HOMECREST AVE,,0.0,0.0,0,0,0,0,0,0,Unspecified,Unspecified,,,,Sedan,,,,,2025-02-18 20:15:00
7082677,3659357,86eb9d43-294c-4761-b3be-a7ab885e2900,OCCUPANT,UNSPECIFIED,M,24.0,17580848.0,Not Ejected,Does Not Apply,Does Not Apply,Driver,Lap Belt & Harness,,,Does Not Apply,Driver,,,04/28/2017,15:00,QUEENS,11413.0,40.682404,-73.75181,"(40.682404, -73.75181)",SPRINGFIELD BOULEVARD           ,132 ROAD,,0.0,0.0,0,0,0,0,0,0,Failure to Yield Right-of-Way,Unspecified,,,,Sedan,Station Wagon/Sport Utility Vehicle,,,,2017-04-28 15:00:00
11942338,4455586,25e7e9e5-eb01-44d4-825d-343b28898abc,OTHER MOTORIZED,INJURED,F,15.0,20058617.0,Not Ejected,Conscious,Knee-Lower Leg Foot,Driver,,,,Abrasion,Driver,,,09/09/2021,20:34,QUEENS,11106.0,40.764347,-73.92347,"(40.764347, -73.92347)",31 STREET,31 AVENUE,,1.0,0.0,0,0,0,0,0,0,Driver Inexperience,,,,,E-Bike,,,,,2021-09-09 20:34:00
9298905,3922921,a050b79f-24fc-4336-88e3-e4fb670cd310,OCCUPANT,UNSPECIFIED,M,27.0,18669890.0,,,,,,,,,Registrant,,,06/16/2018,22:00,BROOKLYN,11220.0,40.64606,-74.01648,"(40.64606, -74.01648)",3 AVENUE                        ,53 STREET,,0.0,0.0,0,0,0,0,0,0,Unspecified,Unspecified,,,,Sedan,Sedan,,,,2018-06-16 22:00:00
6730914,3516355,1881937,OCCUPANT,INJURED,M,84.0,17412148.0,Not Ejected,Conscious,Shoulder - Upper Arm,"Front passenger, if two or more persons, including the driver, are in the front seat",Lap Belt & Harness,,,Complaint of Pain,Passenger,,,09/08/2016,7:30,,,40.78214,-73.824844,"(40.78214, -73.824844)",WHITESTONE EXPRESSWAY           ,,,2.0,0.0,0,0,0,0,2,0,Following Too Closely,Unspecified,Unspecified,Unspecified,,Station Wagon/Sport Utility Vehicle,Station Wagon/Sport Utility Vehicle,Station Wagon/Sport Utility Vehicle,Station Wagon/Sport Utility Vehicle,,2016-09-08 07:30:00
5931132,3413708,541800,OCCUPANT,UNSPECIFIED,F,,17032225.0,Not Ejected,Does Not Apply,Does Not Apply,Unknown,Unknown,,,Does Not Apply,Passenger,,,04/07/2016,16:30,,,,,,,,CROSS BRONX EXPRESSWAY                  ,0.0,0.0,0,0,0,0,0,0,Backing Unsafely,Unspecified,,,,4 dr sedan,Bus,,,,2016-04-07 16:30:00
6671547,3565885,2791897,OCCUPANT,UNSPECIFIED,M,58.0,17383615.0,,,,,,,,,Registrant,,,11/22/2016,15:00,,,,,,EAST 57 STREET                  ,QUEENSBORO BRIDGE,,0.0,0.0,0,0,0,0,0,0,Other Vehicular,Driver Inattention/Distraction,,,,Sedan,Taxi,,,,2016-11-22 15:00:00
11206272,4257186,604bf746-a279-41ec-bb44-f1f062553dba,OCCUPANT,UNSPECIFIED,,,19635837.0,,,,,,,,,Registrant,,,12/12/2019,17:00,,,40.8452,-73.916885,"(40.8452, -73.916885)",CROSS BRONX EXPY                ,,,1.0,0.0,0,0,0,0,1,0,Driver Inattention/Distraction,Unspecified,Unspecified,,,Tractor Truck Diesel,Sedan,Tractor Truck Diesel,,,2019-12-12 17:00:00
7908865,3775235,c96c62f0-a789-4984-a169-26c2f84f1f0b,OCCUPANT,UNSPECIFIED,M,58.0,17984065.0,Not Ejected,Does Not Apply,Does Not Apply,Driver,Unknown,,,Does Not Apply,Driver,,,10/21/2017,11:00,BROOKLYN,11208.0,40.6786,-73.86782,"(40.6786, -73.86782)",,,1123      LIBERTY AVENUE                ,0.0,0.0,0,0,0,0,0,0,Unspecified,Unspecified,Unspecified,,,Station Wagon/Sport Utility Vehicle,Station Wagon/Sport Utility Vehicle,Station Wagon/Sport Utility Vehicle,,,2017-10-21 11:00:00
9354018,4002499,31b5cf00-c756-4441-979e-a02e0132c510,OCCUPANT,INJURED,M,22.0,18697119.0,Not Ejected,Conscious,Unknown,Driver,Lap Belt & Harness,,,Unknown,Driver,,,10/18/2018,2:58,BRONX,10463.0,40.876503,-73.904564,"(40.876503, -73.904564)",WEST 230 STREET                 ,MAJOR DEEGAN EXPRESSWAY,,2.0,0.0,0,0,0,0,2,0,Alcohol Involvement,Unspecified,,,,Sedan,Station Wagon/Sport Utility Vehicle,,,,2018-10-18 02:58:00
9978218,4164554,5b09ba09-95e9-43d4-b3c5-d9a5f57d812a,OCCUPANT,UNSPECIFIED,F,23.0,19005312.0,Not Ejected,Does Not Apply,Does Not Apply,"Front passenger, if two or more persons, including the driver, are in the front seat",Lap Belt & Harness,,,Does Not Apply,Passenger,,,07/05/2019,0:50,QUEENS,11434.0,40.664017,-73.7686,"(40.664017, -73.7686)",BREWER BOULEVARD                ,FARMERS BOULEVARD,,0.0,0.0,0,0,0,0,0,0,Driver Inattention/Distraction,Driver Inattention/Distraction,,,,Sedan,Station Wagon/Sport Utility Vehicle,,,,2019-07-05 00:50:00
7037549,3695575,17140d06-7b51-4fbc-b7bb-e9c43d18e323,OCCUPANT,UNSPECIFIED,M,46.0,17559351.0,,,,,,,,,Registrant,,,06/19/2017,10:00,BROOKLYN,11230.0,40.62893,-73.971375,"(40.62893, -73.971375)",OCEAN PARKWAY                   ,AVENUE H,,0.0,0.0,0,0,0,0,0,0,Driver Inattention/Distraction,Unspecified,,,,Sedan,Sedan,,,,2017-06-19 10:00:00
13371557,4814138,29255da6-fb42-4d28-9fdd-06a5344ed4db,OCCUPANT,UNSPECIFIED,M,23.0,20876023.0,,,,,,,,,Registrant,,,05/14/2025,14:40,BROOKLYN,11203.0,40.650368,-73.94356,"(40.650368, -73.94356)",,,955       BROOKLYN AVE,0.0,0.0,0,0,0,0,0,0,Unspecified,,,,,Sedan,Sedan,,,,2025-05-14 14:40:00
10002459,4171860,dba40528-5a6b-4e98-bf74-d1eeb1ad6331,OCCUPANT,UNSPECIFIED,,,19017300.0,,,,,,,,,Registrant,,,07/16/2019,7:30,,,,,,BELT PARKWAY RAMP               ,,,0.0,0.0,0,0,0,0,0,0,Driver Inattention/Distraction,Unspecified,,,,Station Wagon/Sport Utility Vehicle,Sedan,,,,2019-07-16 07:30:00
9991579,4169637,10fe26b4-f84c-4003-b298-0384508ccbc6,OCCUPANT,UNSPECIFIED,M,71.0,19011884.0,,,,,,,,,Registrant,,,07/13/2019,19:15,MANHATTAN,10010.0,40.7429,-73.99281,"(40.7429, -73.99281)",AVENUE OF THE AMERICAS          ,WEST 23 STREET,,0.0,0.0,0,0,0,0,0,0,Turning Improperly,Unspecified,,,,Station Wagon/Sport Utility Vehicle,Van,,,,2019-07-13 19:15:00
12916600,4708974,be93e077-0f51-4303-b34e-000b344e714c,OCCUPANT,UNSPECIFIED,M,40.0,20615719.0,Not Ejected,Does Not Apply,Does Not Apply,Driver,Lap Belt & Harness,,,Does Not Apply,Driver,,,03/06/2024,20:21,BROOKLYN,11221.0,40.688564,-73.93019,"(40.688564, -73.93019)",GATES AVENUE,REID AVENUE,,0.0,0.0,0,0,0,0,0,0,View Obstructed/Limited,,,,,Station Wagon/Sport Utility Vehicle,,,,,2024-03-06 20:21:00
9503405,4047755,33770c79-0106-403e-8802-e1911506d13f,OCCUPANT,UNSPECIFIED,F,42.0,18770274.0,,,,,,,,,Registrant,,,12/16/2018,20:50,,,,,,BRONX RIVER PARKWAY             ,ALLERTON AVENUE,,0.0,0.0,0,0,0,0,0,0,Other Vehicular,,,,,Station Wagon/Sport Utility Vehicle,,,,,2018-12-16 20:50:00
6498745,3566963,2810384,OCCUPANT,INJURED,F,17.0,17300951.0,Not Ejected,Conscious,Head,"Front passenger, if two or more persons, including the driver, are in the front seat",Lap Belt & Harness,,,Whiplash,Passenger,,,11/23/2016,19:30,BRONX,10453.0,40.855785,-73.90558,"(40.855785, -73.90558)",JEROME AVENUE                   ,EAST 181 STREET,,3.0,0.0,0,0,0,0,3,0,Unspecified,Unspecified,,,,Sedan,Sedan,,,,2016-11-23 19:30:00
6234311,3475144,1148496,OCCUPANT,UNSPECIFIED,M,51.0,17176227.0,,,,,,,,,Registrant,,,07/04/2016,0:00,,,40.718384,-73.95714,"(40.718384, -73.95714)",BEDFORD AVENUE                  ,,,1.0,0.0,1,0,0,0,0,0,Backing Unsafely,,,,,4 dr sedan,,,,,2016-07-04 00:00:00
7063375,3678380,a1d246ac-31cc-4683-abb8-69b511b58f88,OCCUPANT,UNSPECIFIED,F,73.0,17571602.0,,,,,,,,,Registrant,,,05/23/2017,13:00,,,40.75834,-73.95775,"(40.75834, -73.95775)",QUEENSBORO BRIDGE LOWER ROADWAY ,,,0.0,0.0,0,0,0,0,0,0,Driver Inexperience,Unspecified,,,,Station Wagon/Sport Utility Vehicle,Sedan,,,,2017-05-23 13:00:00
11023009,4276275,5a1d66f2-0b96-4f0c-b478-5aaff79ae077,OCCUPANT,UNSPECIFIED,M,27.0,19539597.0,Not Ejected,Does Not Apply,Does Not Apply,Driver,Unknown,,,Does Not Apply,Driver,,,01/19/2020,13:54,QUEENS,11370.0,40.756523,-73.88649,"(40.756523, -73.88649)",,,32-63     81 STREET                     ,0.0,0.0,0,0,0,0,0,0,Backing Unsafely,Other Vehicular,,,,Sedan,Taxi,,,,2020-01-19 13:54:00
9864971,4139030,8529b25d-c71b-4f98-a3f1-30dcf2fcc554,OCCUPANT,UNSPECIFIED,M,50.0,18949267.0,Not Ejected,Does Not Apply,Does Not Apply,Driver,Lap Belt & Harness,,,Does Not Apply,Driver,,,05/24/2019,16:47,,,40.813255,-73.93028,"(40.813255, -73.93028)",GRAND CONCOURSE                 ,EAST 138 STREET,,0.0,0.0,0,0,0,0,0,0,Failure to Yield Right-of-Way,Unspecified,,,,Station Wagon/Sport Utility Vehicle,Sedan,,,,2019-05-24 16:47:00
6128582,3604386,cc8dfb0b-852b-4817-92c8-d10b226fb2e9,OCCUPANT,UNSPECIFIED,M,22.0,17126086.0,Not Ejected,Does Not Apply,Does Not Apply,Driver,Lap Belt & Harness,,,Does Not Apply,Driver,,,01/25/2017,12:00,,,40.7105,-73.9565,"(40.7105, -73.9565)",ROCKAWAY BOULEVARD              ,,,0.0,0.0,0,0,0,0,0,0,Unsafe Lane Changing,Unspecified,,,,Sedan,Pick-up Truck,,,,2017-01-25 12:00:00
12767658,4670156,9caf6d71-f2b3-4092-b49d-de59d2c89be5,OCCUPANT,UNSPECIFIED,M,42.0,20531124.0,Not Ejected,Does Not Apply,Does Not Apply,"Front passenger, if two or more persons, including the driver, are in the front seat",Lap Belt,,,Does Not Apply,Passenger,,,10/12/2023,15:46,,,40.752403,-73.92442,"(40.752403, -73.92442)",39 STREET,,,0.0,0.0,0,0,0,0,0,0,Driver Inattention/Distraction,Unspecified,,,,Box Truck,Sedan,,,,2023-10-12 15:46:00
5767287,3411430,348205,OCCUPANT,UNSPECIFIED,F,57.0,16954045.0,,,,,,,,,Registrant,,,04/12/2016,12:37,BRONX,10474.0,40.817806,-73.88981,"(40.817806, -73.88981)",,,858       MANIDA STREET                 ,0.0,0.0,0,0,0,0,0,0,Passing Too Closely,Unspecified,,,,Sedan,Sedan,,,,2016-04-12 12:37:00
12928424,4712198,92e554d2-536d-4658-b1b6-9475dfa64bea,OCCUPANT,UNSPECIFIED,M,66.0,20622363.0,Not Ejected,Does Not Apply,Does Not Apply,Driver,Lap Belt,,,Does Not Apply,Driver,,,03/24/2024,18:02,MANHATTAN,10013.0,40.72123,-74.00655,"(40.72123, -74.00655)",,,50        VARICK STREET,0.0,0.0,0,0,0,0,0,0,Unspecified,,,,,Taxi,,,,,2024-03-24 18:02:00
6441828,3531234,2159099,OCCUPANT,UNSPECIFIED,M,59.0,17273877.0,Not Ejected,Does Not Apply,Does Not Apply,Driver,Unknown,,,Does Not Apply,Driver,,,10/01/2016,0:00,MANHATTAN,10011.0,40.738335,-73.991936,"(40.738335, -73.991936)",,,126       5 AVENUE                      ,0.0,0.0,0,0,0,0,0,0,Lane Marking Improper/Inadequate,Lane Marking Improper/Inadequate,,,,Station Wagon/Sport Utility Vehicle,Sedan,,,,2016-10-01 00:00:00
7395855,3853020,69005a1d-5c32-4bce-8876-117416c8cf8d,OCCUPANT,UNSPECIFIED,,0.0,17732972.0,,,,,,,,,Registrant,,,02/26/2018,10:30,BRONX,10462.0,40.845596,-73.864334,"(40.845596, -73.864334)",HOLLAND AVENUE                  ,MORRIS PARK AVENUE,,0.0,0.0,0,0,0,0,0,0,Passing Too Closely,Unspecified,,,,Pick-up Truck,Station Wagon/Sport Utility Vehicle,,,,2018-02-26 10:30:00
6260362,3479515,1205382,OCCUPANT,UNSPECIFIED,M,,17188360.0,,,,,,,,,Registrant,,,07/08/2016,18:40,,,40.624485,-74.07998,"(40.624485, -74.07998)",BROAD STREET                    ,CANAL STREET,,0.0,0.0,0,0,0,0,0,0,Traffic Control Disregarded,Unspecified,,,,4 dr sedan,4 dr sedan,,,,2016-07-08 18:40:00
7723576,3752513,36ed56a7-77c0-4762-80c7-9b3f6434faaf,OCCUPANT,INJURED,M,25.0,17893600.0,Not Ejected,Conscious,Shoulder - Upper Arm,Driver,Helmet (Motorcycle Only),,,Complaint of Pain,Driver,,,09/17/2017,4:30,,,40.741806,-73.8463,"(40.741806, -73.8463)",G.C.P / L.I.E. (CDR)            ,,,1.0,0.0,0,0,0,0,1,0,Driver Inattention/Distraction,Unspecified,,,,Station Wagon/Sport Utility Vehicle,Motorcycle,,,,2017-09-17 04:30:00
6416899,3476748,1177110,OCCUPANT,UNSPECIFIED,M,24.0,17262061.0,,,,,,,,,Registrant,,,07/08/2016,20:12,QUEENS,11420.0,40.682537,-73.80716,"(40.682537, -73.80716)",LINDEN BOULEVARD                ,135 STREET,,0.0,0.0,0,0,0,0,0,0,Failure to Yield Right-of-Way,Unspecified,,,,4 dr sedan,4 dr sedan,,,,2016-07-08 20:12:00
9935282,4157210,d91cd247-bc82-4045-a2c3-c3fcf7e665bd,OCCUPANT,UNSPECIFIED,M,45.0,18983980.0,,,,,,,,,Registrant,,,06/23/2019,11:49,,,40.884285,-73.898544,"(40.884285, -73.898544)",MAJOR DEEGAN EXPRESSWAY         ,,,0.0,0.0,0,0,0,0,0,0,Reaction to Uninvolved Vehicle,Unspecified,,,,Sedan,Sedan,,,,2019-06-23 11:49:00
8965554,4056929,99c541a4-3eac-44c8-91bf-925fdb610290,OCCUPANT,UNSPECIFIED,M,36.0,18505517.0,,,,,,,,,Registrant,,,01/18/2019,0:30,MANHATTAN,10033.0,40.847427,-73.931404,"(40.847427, -73.931404)",AMSTERDAM AVENUE                ,WEST 180 STREET,,0.0,0.0,0,0,0,0,0,0,Driver Inattention/Distraction,Unspecified,,,,Taxi,Taxi,,,,2019-01-18 00:30:00
11187151,4259802,f50e5bb1-eaed-45cf-8fb5-9134b7023157,OCCUPANT,UNSPECIFIED,F,60.0,19626208.0,,,,,,,,,Registrant,,,11/13/2019,16:40,,,40.674313,-73.95009,"(40.674313, -73.95009)",NOSTRAND AVENUE                 ,,,0.0,0.0,0,0,0,0,0,0,Driver Inattention/Distraction,Unspecified,,,,Sedan,Station Wagon/Sport Utility Vehicle,,,,2019-11-13 16:40:00
9614597,4006229,73a3b05f-6eb8-48b1-967f-6f40a2318179,OCCUPANT,UNSPECIFIED,,0.0,18825320.0,,,,,,,,,Registrant,,,10/19/2018,20:20,,,40.700954,-73.825676,"(40.700954, -73.825676)",JAMAICA AVENUE                  ,,,0.0,0.0,0,0,0,0,0,0,Driver Inattention/Distraction,Driver Inattention/Distraction,,,,Station Wagon/Sport Utility Vehicle,Station Wagon/Sport Utility Vehicle,,,,2018-10-19 20:20:00
11214105,4264324,0177e696-4bf5-4299-9803-1eeb90b273bc,OCCUPANT,UNSPECIFIED,M,35.0,19639797.0,,,,,,,,,Registrant,,,12/24/2019,14:25,,,40.701077,-74.01344,"(40.701077, -74.01344)",FDR DRIVE                       ,,,1.0,0.0,0,0,0,0,1,0,Unspecified,Unspecified,,,,Station Wagon/Sport Utility Vehicle,Taxi,,,,2019-12-24 14:25:00
11912563,4447635,218fec47-dd4a-47bd-b68d-bb157ea4253f,OCCUPANT,UNSPECIFIED,M,24.0,20041126.0,Not Ejected,Does Not Apply,Does Not Apply,Driver,Unknown,,,Does Not Apply,Driver,,,08/16/2021,9:17,QUEENS,11357.0,40.778885,-73.81454,"(40.778885, -73.81454)",150 STREET,22 AVENUE,,0.0,0.0,0,0,0,0,0,0,Failure to Yield Right-of-Way,Unspecified,,,,Station Wagon/Sport Utility Vehicle,Sedan,,,,2021-08-16 09:17:00
13044552,4741681,d00816ab-25eb-4fb9-914e-0505ea1b47f1,OCCUPANT,UNSPECIFIED,M,59.0,20688023.0,Not Ejected,Does Not Apply,Does Not Apply,Driver,Lap Belt & Harness,,,Does Not Apply,Driver,,,07/16/2024,8:34,,,40.82967,-73.931076,"(40.82967, -73.931076)",OGDEN AVENUE,,,0.0,0.0,0,0,0,0,0,0,Pedestrian/Bicyclist/Other Pedestrian Error/Confusion,Unspecified,,,,Bus,Sedan,,,,2024-07-16 08:34:00
7610001,3891312,9f9993d9-de72-4934-8152-01db2876376b,OCCUPANT,UNSPECIFIED,M,1.0,17838128.0,Not Ejected,Does Not Apply,Does Not Apply,"Middle rear seat, or passenger lying across a seat",Lap Belt & Harness,,,Does Not Apply,Passenger,,,04/29/2018,15:45,QUEENS,11385.0,40.71345,-73.915405,"(40.71345, -73.915405)",,,51-10     METROPOLITAN AVENUE           ,0.0,0.0,0,0,0,0,0,0,Unspecified,Unspecified,,,,Sedan,Station Wagon/Sport Utility Vehicle,,,,2018-04-29 15:45:00
9942058,4158386,7c456791-ee4b-4c46-b229-a98f9c344a6c,OCCUPANT,UNSPECIFIED,M,40.0,18987389.0,Not Ejected,Does Not Apply,Does Not Apply,Driver,Lap Belt & Harness,,,Does Not Apply,Driver,,,06/23/2019,14:24,,,40.88643,-73.895805,"(40.88643, -73.895805)",MAJOR DEEGAN EXPRESSWAY         ,,,1.0,0.0,0,0,0,0,1,0,Reaction to Uninvolved Vehicle,Following Too Closely,Following Too Closely,,,Station Wagon/Sport Utility Vehicle,Sedan,Station Wagon/Sport Utility Vehicle,,,2019-06-23 14:24:00
7336641,3825883,55f0cf48-e37e-4c07-94a1-db02635d000d,OCCUPANT,INJURED,F,48.0,17703784.0,Not Ejected,Conscious,Neck,Driver,Lap Belt & Harness,,,Complaint of Pain,Driver,,,01/10/2018,18:30,,,,,,14 AVENUE                       ,WHITESTONE EXPRESSWAY,,3.0,0.0,0,0,0,0,3,0,Failure to Yield Right-of-Way,Failure to Yield Right-of-Way,,,,Sedan,Sedan,,,,2018-01-10 18:30:00
9020254,4060287,a9d9159d-2812-460d-bb2b-05c8a5a06e4e,OCCUPANT,UNSPECIFIED,M,21.0,18532486.0,Not Ejected,Does Not Apply,Does Not Apply,Driver,Lap Belt & Harness,,,Does Not Apply,Driver,,,01/16/2019,18:27,,,,,,BRONX WHITESTONE BRIDGE         ,,,1.0,0.0,0,0,0,0,1,0,Following Too Closely,Unspecified,,,,Station Wagon/Sport Utility Vehicle,Station Wagon/Sport Utility Vehicle,,,,2019-01-16 18:27:00
13427214,4828899,5120b138-0695-465e-9c14-28991d5d5b5b,OCCUPANT,UNSPECIFIED,M,35.0,20908140.0,Not Ejected,Does Not Apply,Does Not Apply,Driver,Lap Belt & Harness,,,Does Not Apply,Driver,,,07/20/2025,3:55,BROOKLYN,11226.0,40.652313,-73.95189,"(40.652313, -73.95189)",,,180       LINDEN BLVD,0.0,0.0,0,0,0,0,0,0,Unspecified,Unspecified,,,,Station Wagon/Sport Utility Vehicle,Sedan,,,,2025-07-20 03:55:00
11078189,4284600,3d7bbc06-c58b-4ad3-8ca6-a146d7903f91,OCCUPANT,INJURED,M,51.0,19568120.0,Not Ejected,Conscious,Head,Driver,Lap Belt & Harness,,,Complaint of Pain or Nausea,Driver,,,02/05/2020,7:55,QUEENS,11418.0,40.696384,-73.81704,"(40.696384, -73.81704)",132 STREET                      ,ATLANTIC AVENUE,,1.0,0.0,0,0,0,0,1,0,Driver Inattention/Distraction,Unspecified,,,,Dump,Sedan,,,,2020-02-05 07:55:00
13498057,4847814,8d921fa8-1b0c-415b-b909-f35ec9fe3fa8,OCCUPANT,UNSPECIFIED,M,72.0,20948993.0,Not Ejected,Does Not Apply,Does Not Apply,Driver,Lap Belt,,,Does Not Apply,Driver,,,10/03/2025,14:45,BROOKLYN,11213.0,40.673996,-73.92784,"(40.673996, -73.92784)",ROCHESTER AVE,ST MARKS AVE,,0.0,0.0,0,0,0,0,0,0,Unspecified,Unspecified,,,,Sedan,Bus,,,,2025-10-03 14:45:00
7061986,3692812,e8f3d3d2-d4e7-4699-a173-3fc4104e3028,OCCUPANT,INJURED,M,45.0,17570898.0,Not Ejected,Conscious,Chest,Driver,Lap Belt & Harness,,,Complaint of Pain,Driver,,,06/16/2017,23:22,BRONX,10475.0,40.883602,-73.82717,"(40.883602, -73.82717)",,,2291      NEW ENGLAND THRUWAY           ,1.0,0.0,0,0,0,0,1,0,Unspecified,Unspecified,,,,Taxi,Taxi,,,,2017-06-16 23:22:00
7763465,3782671,6d486d5b-16d6-46c3-bac1-51f4f753511e,OCCUPANT,UNSPECIFIED,F,54.0,17912928.0,,,,,,,,,Registrant,,,11/03/2017,17:30,QUEENS,11432.0,40.71062,-73.78343,"(40.71062, -73.78343)",,,179-001   90 AVENUE                     ,0.0,0.0,0,0,0,0,0,0,Unspecified,Unspecified,,,,Sedan,Station Wagon/Sport Utility Vehicle,,,,2017-11-03 17:30:00
12674645,4636437,0ec79b98-b225-414d-929b-ce810f44b9f9,OCCUPANT,UNSPECIFIED,M,34.0,20477801.0,Not Ejected,Does Not Apply,Does Not Apply,Right rear passenger or motorcycle sidecar passenger,Unknown,,,Does Not Apply,Passenger,,,06/10/2023,22:08,QUEENS,11363.0,40.76226,-73.75699,"(40.76226, -73.75699)",CROSS ISLAND PARKWAY,NORTHERN BOULEVARD,,0.0,0.0,0,0,0,0,0,0,Traffic Control Disregarded,Unspecified,,,,Station Wagon/Sport Utility Vehicle,Station Wagon/Sport Utility Vehicle,,,,2023-06-10 22:08:00
12830369,4686603,501be2b3-e8cb-458d-8a6d-afe65c6b7f57,PEDESTRIAN,INJURED,M,10.0,,,Conscious,Hip-Upper Leg,,,Pedestrian/Bicyclist/Other Pedestrian Not at Intersection,"Crossing, No Signal, or Crosswalk",Contusion - Bruise,Pedestrian,Failure to Yield Right-of-Way,Unspecified,12/11/2023,14:25,QUEENS,11423.0,40.713463,-73.768364,"(40.713463, -73.768364)",,,90-15     192 STREET,1.0,0.0,1,0,0,0,0,0,View Obstructed/Limited,,,,,Sedan,,,,,2023-12-11 14:25:00
12150583,4509981,5324b378-1b15-46c6-b9ea-dfbc01dfd7b7,OCCUPANT,UNSPECIFIED,F,50.0,20179103.0,,,,,,,,,Registrant,,,03/12/2022,0:26,BROOKLYN,11203.0,40.644814,-73.93356,"(40.644814, -73.93356)",,,680       EAST 46 STREET,0.0,0.0,0,0,0,0,0,0,Unspecified,Unspecified,,,,Station Wagon/Sport Utility Vehicle,,,,,2022-03-12 00:26:00
6357013,3510513,1776026,OCCUPANT,UNSPECIFIED,M,38.0,17233739.0,Not Ejected,Does Not Apply,Does Not Apply,"Front passenger, if two or more persons, including the driver, are in the front seat",Lap Belt & Harness,,,Does Not Apply,Passenger,,,08/28/2016,17:30,,,40.838757,-73.882904,"(40.838757, -73.882904)",CROSS BRONX EXPY                ,,,0.0,0.0,0,0,0,0,0,0,Driver Inattention/Distraction,Following Too Closely,,,,Station Wagon/Sport Utility Vehicle,Sedan,,,,2016-08-28 17:30:00
7386543,3867447,d7920851-f206-45c7-9f12-cc57c6e80549,OCCUPANT,UNSPECIFIED,F,31.0,17728484.0,,,,,,,,,Registrant,,,03/21/2018,12:40,MANHATTAN,10032.0,40.83473,-73.940674,"(40.83473, -73.940674)",WEST 160 STREET                 ,AMSTERDAM AVENUE,,2.0,0.0,2,0,0,0,0,0,Driver Inattention/Distraction,,,,,Station Wagon/Sport Utility Vehicle,,,,,2018-03-21 12:40:00
10132537,4202429,de154a0d-90ae-4274-b4a0-4f6213607c94,BICYCLIST,UNSPECIFIED,M,56.0,19082771.0,Not Ejected,Does Not Apply,Does Not Apply,Driver,Lap Belt & Harness,,,Does Not Apply,Driver,,,09/06/2019,23:10,BROOKLYN,11206.0,40.702724,-73.95002,"(40.702724, -73.95002)",LORIMER STREET                  ,HARRISON AVENUE,,1.0,0.0,0,0,1,0,0,0,Traffic Control Disregarded,Unspecified,,,,Station Wagon/Sport Utility Vehicle,E-Sco,,,,2019-09-06 23:10:00
7397183,3839613,cab1791d-714b-477b-a91b-9fd3879a7b18,OCCUPANT,UNSPECIFIED,,0.0,17733603.0,,,,,,,,,Registrant,,,02/03/2018,3:11,,,40.675446,-73.81354,"(40.675446, -73.81354)",ROCKAWAY BOULEVARD              ,124 STREET,,4.0,0.0,0,0,0,0,4,0,Unspecified,Unspecified,Unspecified,,,Sedan,Sedan,Station Wagon/Sport Utility Vehicle,,,2018-02-03 03:11:00
9209610,3916800,4a267f6b-772d-4afc-9f1d-e3cb9d29b88e,OCCUPANT,UNSPECIFIED,F,66.0,18626242.0,,,,,,,,,Registrant,,,06/05/2018,17:00,,,,,,BELT PARKWAY                    ,,,1.0,0.0,0,0,0,0,1,0,Following Too Closely,Unspecified,,,,Station Wagon/Sport Utility Vehicle,Sedan,,,,2018-06-05 17:00:00
7072870,3696952,2e42df7a-3a6a-46e4-a2a9-0ee9535a9372,OCCUPANT,INJURED,F,56.0,17576170.0,Not Ejected,Conscious,Chest,Driver,Air Bag Deployed/Lap Belt/Harness,,,Complaint of Pain,Driver,,,06/22/2017,20:15,STATEN ISLAND,10306.0,40.572575,-74.11649,"(40.572575, -74.11649)",8 STREET                        ,ROSE AVENUE,,1.0,0.0,0,0,0,0,1,0,Failure to Yield Right-of-Way,Unspecified,,,,Station Wagon/Sport Utility Vehicle,Station Wagon/Sport Utility Vehicle,,,,2017-06-22 20:15:00
11756407,4426311,50cb8945-73cb-4c2d-bad9-eeb331106185,OCCUPANT,UNSPECIFIED,F,29.0,19949620.0,Not Ejected,Does Not Apply,Does Not Apply,"Front passenger, if two or more persons, including the driver, are in the front seat",Lap Belt & Harness,,,Does Not Apply,Passenger,,,06/12/2021,16:50,MANHATTAN,10002.0,40.710464,-73.986626,"(40.710464, -73.986626)",SOUTH STREET,CLINTON STREET,,1.0,0.0,0,0,1,0,0,0,Driver Inattention/Distraction,Unspecified,,,,Station Wagon/Sport Utility Vehicle,Bike,,,,2021-06-12 16:50:00
9281888,4027120,f6d0a42d-42e5-4627-99ae-059f61e17b66,OCCUPANT,UNSPECIFIED,,0.0,18661507.0,,,,,,,,,Registrant,,,11/15/2018,16:00,BROOKLYN,11231.0,40.673836,-74.0023,"(40.673836, -74.0023)",BUSH STREET                     ,CLINTON STREET,,1.0,0.0,0,0,0,0,1,0,Unspecified,Unspecified,,,,Sedan,Sedan,,,,2018-11-15 16:00:00
6081731,3610203,c0c1549f-0694-47fa-b704-c26da462fe49,PEDESTRIAN,INJURED,F,26.0,,,Conscious,Knee-Lower Leg Foot,,,Pedestrian/Bicyclist/Other Pedestrian Not at Intersection,"Crossing, No Signal, Marked Crosswalk",Complaint of Pain,Pedestrian,Driver Inattention/Distraction,Unspecified,02/03/2017,14:45,,,40.859016,-73.9002,"(40.859016, -73.9002)",FIELD PLACE                     ,,,1.0,0.0,1,0,0,0,0,0,Driver Inattention/Distraction,,,,,Station Wagon/Sport Utility Vehicle,,,,,2017-02-03 14:45:00
11545166,4382459,072919bc-bc30-4646-9edc-d92c4da08583,OCCUPANT,UNSPECIFIED,,,19826540.0,,,,,,,,,Registrant,,,01/08/2021,10:46,QUEENS,11422.0,40.66561,-73.73568,"(40.66561, -73.73568)",FRANCIS LEWIS BOULEVARD         ,SUNRISE HIGHWAY,,1.0,0.0,0,0,0,0,1,0,Unspecified,Unspecified,,,,Station Wagon/Sport Utility Vehicle,Station Wagon/Sport Utility Vehicle,,,,2021-01-08 10:46:00
7479513,3861361,c6adcb7a-bd98-41a1-a2fb-ed17afdf8b8a,OCCUPANT,UNSPECIFIED,M,0.0,17773989.0,,,,,,,,,Registrant,,,02/21/2018,5:15,,,40.737785,-73.93496,"(40.737785, -73.93496)",BORDEN AVENUE                   ,VANDAM STREET,,0.0,0.0,0,0,0,0,0,0,Unsafe Lane Changing,Unspecified,,,,Sedan,Sedan,,,,2018-02-21 05:15:00
7458563,3863154,800e7576-f594-4741-b825-b9bd340cb4e6,OCCUPANT,INJURED,F,63.0,17763575.0,Not Ejected,Conscious,Neck,"Front passenger, if two or more persons, including the driver, are in the front seat",Lap Belt,,,Whiplash,Passenger,,,03/15/2018,11:10,,,40.605328,-73.990295,"(40.605328, -73.990295)",80 STREET                       ,,,2.0,0.0,0,0,0,0,2,0,Driver Inattention/Distraction,Unspecified,,,,Station Wagon/Sport Utility Vehicle,Sedan,,,,2018-03-15 11:10:00
7244127,3739577,01ca8f3d-2c3a-4d7f-859e-570548bfda1c,OCCUPANT,UNSPECIFIED,M,41.0,17658309.0,,,,,,,,,Registrant,,,08/29/2017,2:53,,,40.88528,-73.82172,"(40.88528, -73.82172)",NEW ENGLAND THRUWAY             ,,,1.0,0.0,0,0,0,0,1,0,Unspecified,Unspecified,,,,Box Truck,Station Wagon/Sport Utility Vehicle,,,,2017-08-29 02:53:00
6959202,3666820,c86537c1-0ab6-43db-b583-d950f71cca93,OCCUPANT,UNSPECIFIED,M,54.0,17521687.0,Not Ejected,Does Not Apply,Does Not Apply,Driver,Lap Belt & Harness,,,Does Not Apply,Driver,,,04/20/2017,21:20,QUEENS,11378.0,40.723183,-73.90059,"(40.723183, -73.90059)",65 STREET                       ,GRAND AVENUE,,1.0,0.0,0,0,1,0,0,0,Pedestrian/Bicyclist/Other Pedestrian Error/Confusion,Unspecified,,,,Station Wagon/Sport Utility Vehicle,Bike,,,,2017-04-20 21:20:00
7062425,3691697,308928c8-3568-4b21-9790-e423baa15899,OCCUPANT,UNSPECIFIED,F,41.0,17571115.0,,,,,,,,,Registrant,,,06/15/2017,17:25,MANHATTAN,10036.0,40.7615,-73.997826,"(40.7615, -73.997826)",11 AVENUE                       ,WEST 43 STREET,,0.0,0.0,0,0,0,0,0,0,Other Vehicular,Other Vehicular,,,,Sedan,Pick-up Truck,,,,2017-06-15 17:25:00
12244726,4534209,0ed9c707-733f-44e9-9993-15f20515ad6d,OCCUPANT,UNSPECIFIED,F,24.0,20232865.0,,,,,,,,,Registrant,,,06/05/2022,1:00,QUEENS,11428.0,40.721016,-73.74839,"(40.721016, -73.74839)",91 AVENUE,212 PLACE,,0.0,0.0,0,0,0,0,0,0,Failure to Yield Right-of-Way,Unspecified,,,,Sedan,Sedan,,,,2022-06-05 01:00:00
9461051,3948108,cd488cfc-bb5b-40eb-8202-7771a1af21cd,OCCUPANT,UNSPECIFIED,F,27.0,18749471.0,Not Ejected,Does Not Apply,Does Not Apply,Driver,Lap Belt & Harness,,,Does Not Apply,Driver,,,07/25/2018,16:18,,,,,,HYLAN BOULEVARD                 ,WEST FINGERBOARD ROAD,,0.0,0.0,0,0,0,0,0,0,Following Too Closely,Unspecified,,,,Sedan,Sedan,,,,2018-07-25 16:18:00
11836273,4430778,fa9dbde9-a47f-40d9-9b38-ef4576612f8f,OCCUPANT,UNSPECIFIED,,,19996277.0,,,,,,,,,Registrant,,,06/24/2021,18:46,BROOKLYN,11204.0,40.611767,-73.97638,"(40.611767, -73.97638)",64 STREET,24 AVENUE,,1.0,0.0,0,0,0,0,1,0,Failure to Yield Right-of-Way,Unspecified,,,,Sedan,Pick-up Truck,,,,2021-06-24 18:46:00
11234859,4261992,794c74d2-8090-4d46-9a68-1f4d0a404f85,OCCUPANT,UNSPECIFIED,M,22.0,19650189.0,Not Ejected,Does Not Apply,Does Not Apply,Driver,Lap Belt & Harness,,,Does Not Apply,Driver,,,12/20/2019,19:19,BRONX,10467.0,40.871117,-73.87683,"(40.871117, -73.87683)",WEBSTER AVENUE                  ,EAST 204 STREET,,1.0,0.0,0,0,0,0,1,0,Driver Inattention/Distraction,Unspecified,,,,Sedan,Station Wagon/Sport Utility Vehicle,,,,2019-12-20 19:19:00
7516015,3798117,4e767a06-103d-4f38-89ec-2016b1b0e598,OCCUPANT,UNSPECIFIED,,0.0,17791896.0,,,,,,,,,Registrant,,,11/02/2017,10:30,MANHATTAN,10026.0,40.804024,-73.95656,"(40.804024, -73.95656)",,,322       WEST 115 STREET               ,0.0,0.0,0,0,0,0,0,0,Unspecified,Unspecified,,,,Station Wagon/Sport Utility Vehicle,Sedan,,,,2017-11-02 10:30:00
7261020,3712683,01237464-daa0-4dde-8141-c6538bbab93d,OCCUPANT,UNSPECIFIED,M,45.0,17666643.0,Not Ejected,Does Not Apply,Does Not Apply,Driver,Lap Belt & Harness,,,Does Not Apply,Driver,,,07/15/2017,22:55,,,40.669926,-73.89149,"(40.669926, -73.89149)",BRADFORD STREET                 ,,,0.0,0.0,0,0,0,0,0,0,Unspecified,Unspecified,,,,Station Wagon/Sport Utility Vehicle,Sedan,,,,2017-07-15 22:55:00
7494994,3849580,c6164034-eb52-4940-b7a9-c5354ad1ad98,OCCUPANT,UNSPECIFIED,F,45.0,17781592.0,Not Ejected,Does Not Apply,Does Not Apply,Driver,Lap Belt & Harness,,,Does Not Apply,Driver,,,02/19/2018,13:45,BROOKLYN,11239.0,40.65136,-73.86971,"(40.65136, -73.86971)",,,501       GATEWAY DRIVE                 ,0.0,0.0,0,0,0,0,0,0,Unspecified,Unspecified,,,,Station Wagon/Sport Utility Vehicle,Station Wagon/Sport Utility Vehicle,,,,2018-02-19 13:45:00
9302835,3918181,2631ac11-10f5-4539-89e3-4c539920f42a,OCCUPANT,UNSPECIFIED,M,35.0,18671874.0,Not Ejected,Does Not Apply,Does Not Apply,Driver,Lap Belt & Harness,,,Does Not Apply,Driver,,,06/08/2018,13:55,,,40.713974,-73.953094,"(40.713974, -73.953094)",BROOKLYN QUEENS EXPRESSWAY      ,,,0.0,0.0,0,0,0,0,0,0,Passing or Lane Usage Improper,Unspecified,,,,Station Wagon/Sport Utility Vehicle,Sedan,,,,2018-06-08 13:55:00
12024712,4477187,ebb87e98-1e0f-48e4-8690-72afdbe426cc,OCCUPANT,UNSPECIFIED,M,71.0,20106037.0,,,,,,,,,Registrant,,,11/13/2021,3:24,MANHATTAN,10034.0,40.86369,-73.91707,"(40.86369, -73.91707)",WEST 207 STREET,9 AVENUE,,0.0,0.0,0,0,0,0,0,0,Unspecified,Unspecified,,,,Sedan,Station Wagon/Sport Utility Vehicle,,,,2021-11-13 03:24:00
6541620,3544910,2417843,OCCUPANT,UNSPECIFIED,F,33.0,17321404.0,Not Ejected,Does Not Apply,Does Not Apply,"Middle rear seat, or passenger lying across a seat",,,,Does Not Apply,Passenger,,,10/22/2016,17:00,,,40.72293,-73.847336,"(40.72293, -73.847336)",QUEENS BOULEVARD                ,,,0.0,0.0,0,0,0,0,0,0,Passing or Lane Usage Improper,Unspecified,,,,Station Wagon/Sport Utility Vehicle,Sedan,,,,2016-10-22 17:00:00
13410693,4821267,abfa7c7b-06fd-45ac-addd-2b11888d353a,OCCUPANT,INJURED,M,38.0,20898373.0,Not Ejected,Conscious,Shoulder - Upper Arm,"Front passenger, if two or more persons, including the driver, are in the front seat",Unknown,,,Complaint of Pain or Nausea,Passenger,,,06/16/2025,15:16,QUEENS,11368.0,40.76163,-73.83962,"(40.76163, -73.83962)",,,129-02    NORTHERN BLVD,3.0,0.0,0,0,0,0,3,0,Unspecified,Unspecified,,,,Station Wagon/Sport Utility Vehicle,Sedan,,,,2025-06-16 15:16:00
7447928,3849107,f89d9532-7851-4802-a3a3-3670fc2b4799,OCCUPANT,UNSPECIFIED,M,35.0,17758423.0,Not Ejected,Does Not Apply,Does Not Apply,Driver,Lap Belt & Harness,,,Does Not Apply,Driver,,,02/19/2018,18:45,,,40.873657,-73.87142,"(40.873657, -73.87142)",BRONX RIVER PARKWAY             ,,,0.0,0.0,0,0,0,0,0,0,Driver Inattention/Distraction,Unspecified,,,,Sedan,Sedan,,,,2018-02-19 18:45:00
10246994,4229438,6f4b0b87-860a-446a-93ad-074c179fbd46,OCCUPANT,UNSPECIFIED,M,31.0,19140121.0,,,,,,,,,Registrant,,,10/18/2019,18:00,,,40.59255,-73.9946,"(40.59255, -73.9946)",BAY 38 STREET                   ,,,0.0,0.0,0,0,0,0,0,0,Unspecified,,,,,Sedan,,,,,2019-10-18 18:00:00
9477497,3927842,b0b428ba-7df5-41ab-9ae3-933832093072,OCCUPANT,UNSPECIFIED,M,46.0,18757562.0,,,,,,,,,Registrant,,,06/22/2018,8:50,QUEENS,11103.0,40.756676,-73.920876,"(40.756676, -73.920876)",STEINWAY STREET                 ,34 AVENUE,,0.0,0.0,0,0,0,0,0,0,Driver Inattention/Distraction,Unspecified,,,,Motorcycle,Sedan,,,,2018-06-22 08:50:00
12471856,4592536,7b5a900d-e027-4b65-8e85-2f4ffced7660,OCCUPANT,UNSPECIFIED,F,24.0,20363038.0,Not Ejected,Does Not Apply,Does Not Apply,Driver,Unknown,,,Does Not Apply,Driver,,,12/24/2022,19:37,,,,,,WILLIAMSBURG BRIDGE,SOUTH 5 PLACE,,2.0,0.0,0,0,0,0,2,0,Driver Inattention/Distraction,Unspecified,Unspecified,,,Station Wagon/Sport Utility Vehicle,Station Wagon/Sport Utility Vehicle,Sedan,,,2022-12-24 19:37:00
9252074,3910636,37baafc1-9599-4bde-a513-786f2a4cf282,OCCUPANT,UNSPECIFIED,,0.0,18646926.0,,,,,,,,,Registrant,,,05/29/2018,8:30,,,,,,3 AVENUE                        ,,,0.0,0.0,0,0,0,0,0,0,Turning Improperly,Unspecified,,,,Station Wagon/Sport Utility Vehicle,Sedan,,,,2018-05-29 08:30:00
6520465,3543046,2375773,OCCUPANT,UNSPECIFIED,,,,,,,,,,,,Witness,,,10/19/2016,9:45,BROOKLYN,11204.0,40.611614,-73.97459,"(40.611614, -73.97459)",63 STREET                       ,DAHILL ROAD,,1.0,0.0,0,0,1,0,0,0,Passing or Lane Usage Improper,Unspecified,,,,Sedan,Bike,,,,2016-10-19 09:45:00
6303808,4022773,929697,OCCUPANT,INJURED,F,23.0,17208752.0,Not Ejected,Conscious,Head,"Front passenger, if two or more persons, including the driver, are in the front seat",Lap Belt & Harness,,,Complaint of Pain,Passenger,,,06/12/2016,5:40,QUEENS,11412.0,40.69247,-73.75942,"(40.69247, -73.75942)",LINDEN BOULEVARD                ,192 STREET,,3.0,0.0,0,0,0,0,3,0,Unspecified,Unspecified,,,,4 dr sedan,4 dr sedan,,,,2016-06-12 05:40:00
7910864,3819750,e9cbe06d-8f9c-4fc3-b3c4-db4d623667df,OCCUPANT,UNSPECIFIED,M,60.0,17985021.0,,,,,,,,,Registrant,,,12/27/2017,14:00,QUEENS,11370.0,40.768913,-73.88873,"(40.768913, -73.88873)",DITMARS BOULEVARD               ,81 STREET,,0.0,0.0,0,0,0,0,0,0,Passing Too Closely,Unspecified,,,,Station Wagon/Sport Utility Vehicle,Station Wagon/Sport Utility Vehicle,,,,2017-12-27 14:00:00
11019200,4274451,63051c05-0d0f-4cda-ae5d-ae2d1b67aae8,OCCUPANT,UNSPECIFIED,M,45.0,19537649.0,Not Ejected,Does Not Apply,Does Not Apply,Driver,Lap Belt & Harness,,,Does Not Apply,Driver,,,01/16/2020,5:12,,,40.84506,-73.916855,"(40.84506, -73.916855)",CROSS BRONX EXPY                ,,,1.0,0.0,0,0,0,0,1,0,Failure to Yield Right-of-Way,Unspecified,,,,Sedan,Pick-up Truck,,,,2020-01-16 05:12:00
8956764,4068719,b2441c09-5415-40c8-993a-6aa5b7801bf0,OCCUPANT,UNSPECIFIED,M,43.0,18501036.0,,,,,,,,,Registrant,,,01/24/2019,13:10,MANHATTAN,10030.0,40.819096,-73.94093,"(40.819096, -73.94093)",WEST 141 STREET                 ,7 AVENUE,,0.0,0.0,0,0,0,0,0,0,Passing Too Closely,Unspecified,,,,Bus,Sedan,,,,2019-01-24 13:10:00
12266650,4540170,dec9cf39-1f09-4dbf-a44e-8e1bbc2637d1,OCCUPANT,UNSPECIFIED,M,67.0,20245462.0,,,,,,,,,Registrant,,,06/23/2022,23:14,,,40.67973,-73.75148,"(40.67973, -73.75148)",MERRICK BOULEVARD,218 STREET,,0.0,0.0,0,0,0,0,0,0,Passing or Lane Usage Improper,Unspecified,,,,Sedan,,,,,2022-06-23 23:14:00
11569511,4388926,abe04043-1ee3-400e-9794-c104b68b465b,OCCUPANT,UNSPECIFIED,M,,19840947.0,,,,,,,,,Registrant,,,02/03/2021,7:00,QUEENS,11375.0,40.7339,-73.85427,"(40.7339, -73.85427)",,,102-44    63 AVENUE                     ,0.0,0.0,0,0,0,0,0,0,Unspecified,,,,,Station Wagon/Sport Utility Vehicle,,,,,2021-02-03 07:00:00
10251492,4230205,bedbeb8c-2c84-4331-861f-f7832131ec94,OCCUPANT,UNSPECIFIED,M,60.0,19142279.0,,,,,,,,,Registrant,,,10/26/2019,18:30,,,,,,LONG ISLAND EXPRESSWAY          ,,,0.0,0.0,0,0,0,0,0,0,Failure to Yield Right-of-Way,Unspecified,,,,Station Wagon/Sport Utility Vehicle,Station Wagon/Sport Utility Vehicle,,,,2019-10-26 18:30:00
7020275,3697476,c7448978-52bf-4682-9703-2b23aa93f3b6,OCCUPANT,UNSPECIFIED,F,41.0,17551022.0,,,,,,,,,Registrant,,,06/16/2017,22:15,MANHATTAN,10022.0,40.760254,-73.967545,"(40.760254, -73.967545)",EAST 57 STREET                  ,3 AVENUE,,1.0,0.0,1,0,0,0,0,0,Driver Inattention/Distraction,,,,,Station Wagon/Sport Utility Vehicle,,,,,2017-06-16 22:15:00
12074310,4490088,0e40ad48-c952-4601-bdcc-a3bcabaa7f26,OCCUPANT,UNSPECIFIED,F,32.0,20134665.0,,,,,,,,,Registrant,,,12/27/2021,9:00,QUEENS,11368.0,40.75118,-73.85192,"(40.75118, -73.85192)",42 AVENUE,114 STREET,,0.0,0.0,0,0,0,0,0,0,Passing Too Closely,Unspecified,,,,Sedan,,,,,2021-12-27 09:00:00
5773777,3411453,390362,OCCUPANT,UNSPECIFIED,F,25.0,16957228.0,,,,,,,,,Registrant,,,04/15/2016,15:00,BRONX,10459.0,,,,ALDUS STREET                    ,FAILE STREET,,0.0,0.0,0,0,0,0,0,0,Unspecified,Unspecified,,,,4 dr sedan,4 dr sedan,,,,2016-04-15 15:00:00
10067148,4187463,deeef781-168d-4d1d-ae4d-7a82d129b0cf,OCCUPANT,UNSPECIFIED,F,39.0,19049709.0,Not Ejected,Does Not Apply,Does Not Apply,"Front passenger, if two or more persons, including the driver, are in the front seat",Lap Belt & Harness,,,Does Not Apply,Passenger,,,08/10/2019,16:00,,,40.716194,-73.996086,"(40.716194, -73.996086)",CANAL STREET                    ,BOWERY,,0.0,0.0,0,0,0,0,0,0,Unsafe Lane Changing,Unspecified,,,,Sedan,Sedan,,,,2019-08-10 16:00:00
7255901,3739137,dd955c02-36a4-4594-aa99-04afb539f84c,OCCUPANT,UNSPECIFIED,F,34.0,17664054.0,Not Ejected,Does Not Apply,Does Not Apply,Driver,Unknown,,,Does Not Apply,Driver,,,08/14/2017,13:15,,,40.764286,-73.95562,"(40.764286, -73.95562)",YORK AVENUE                     ,,,0.0,0.0,0,0,0,0,0,0,Unsafe Lane Changing,Unspecified,,,,Taxi,Station Wagon/Sport Utility Vehicle,,,,2017-08-14 13:15:00
7798513,3764120,0a24e002-d7ff-4d2e-9327-6d0fc36389ef,OCCUPANT,UNSPECIFIED,M,54.0,17929949.0,Not Ejected,Does Not Apply,Does Not Apply,Driver,Lap Belt & Harness,,,Does Not Apply,Driver,,,10/04/2017,9:44,BRONX,10461.0,40.84299,-73.82625,"(40.84299, -73.82625)",COUNTRY CLUB ROAD               ,BRUCKNER BOULEVARD,,0.0,0.0,0,0,0,0,0,0,Oversized Vehicle,Unspecified,,,,Sedan,Box Truck,,,,2017-10-04 09:44:00
7227236,3746660,ac9973b6-afca-42fc-a709-be4f6a12c8b2,OCCUPANT,UNSPECIFIED,,0.0,17650252.0,,,,,,,,,Registrant,,,09/10/2017,10:30,,,40.648773,-73.999344,"(40.648773, -73.999344)",7 AVENUE                        ,,,0.0,0.0,0,0,0,0,0,0,Unspecified,,,,,Sedan,,,,,2017-09-10 10:30:00
12146254,4509108,b4d7cc5e-a193-4e9e-9f93-c36c4dc7c617,OCCUPANT,INJURED,F,25.0,20176647.0,Not Ejected,Conscious,Head,"Middle rear seat, or passenger lying across a seat",Lap Belt & Harness,,,Complaint of Pain or Nausea,Passenger,,,03/10/2022,16:47,BROOKLYN,11218.0,40.654003,-73.979935,"(40.654003, -73.979935)",TERRACE PLACE,20 STREET,,1.0,0.0,0,0,0,0,1,0,Following Too Closely,Unspecified,,,,Station Wagon/Sport Utility Vehicle,Station Wagon/Sport Utility Vehicle,,,,2022-03-10 16:47:00
9623709,4001841,4407e828-616b-4ce7-bfa3-72aea908abcd,OCCUPANT,UNSPECIFIED,M,26.0,18829770.0,,,,,,,,,Registrant,,,10/17/2018,5:14,,,40.742496,-73.781006,"(40.742496, -73.781006)",LONG ISLAND EXPRESSWAY          ,,,0.0,0.0,0,0,0,0,0,0,Driver Inattention/Distraction,Unspecified,,,,Sedan,Sedan,,,,2018-10-17 05:14:00
12386035,4571230,f0a50f04-f652-4a5f-8d5b-442f99d7b060,OCCUPANT,UNSPECIFIED,M,37.0,20314378.0,,,,,,,,,Registrant,,,10/06/2022,22:42,,,40.72587,-73.76129,"(40.72587, -73.76129)",GRAND CENTRAL PKWY,,,1.0,0.0,0,0,0,0,1,0,Reaction to Uninvolved Vehicle,Unspecified,,,,Sedan,Sedan,,,,2022-10-06 22:42:00
7000535,3707480,aca7dbd8-fc0d-4243-9b6d-11b0af169538,OCCUPANT,UNSPECIFIED,M,49.0,17541499.0,,,,,,,,,Registrant,,,07/08/2017,14:30,,,40.7198,-73.953476,"(40.7198, -73.953476)",,,DRIGGS AVENUE                           ,0.0,0.0,0,0,0,0,0,0,Driver Inexperience,Unspecified,,,,Sedan,Sedan,,,,2017-07-08 14:30:00
12905789,4706109,f0bc6c68-42b6-4aea-8005-dba1bb5efc1d,OCCUPANT,INJURED,M,20.0,20609542.0,Not Ejected,Conscious,Entire Body,Driver,Lap Belt & Harness,,,Complaint of Pain or Nausea,Driver,,,02/29/2024,23:41,,,,,,CLEARVIEW EXPRESSWAY,HILLSIDE AVENUE,,3.0,0.0,0,0,0,0,3,0,Unsafe Speed,Unspecified,Unspecified,Unspecified,,Taxi,Sedan,Station Wagon/Sport Utility Vehicle,Sedan,,2024-02-29 23:41:00
7149909,3746568,c1a77deb-4e4c-4540-b586-70113f9e2a9d,OCCUPANT,UNSPECIFIED,M,66.0,17612976.0,,,,,,,,,Registrant,,,09/02/2017,17:30,BROOKLYN,11225.0,40.663124,-73.96244,"(40.663124, -73.96244)",FLATBUSH AVENUE                 ,EMPIRE BOULEVARD,,0.0,0.0,0,0,0,0,0,0,Failure to Yield Right-of-Way,Unspecified,,,,Station Wagon/Sport Utility Vehicle,Sedan,,,,2017-09-02 17:30:00
10261252,4223354,e79eda0f-d4d3-40ed-bc1a-617d957bf25a,OCCUPANT,UNSPECIFIED,M,41.0,19147130.0,,,,,,,,,Registrant,,,10/12/2019,15:30,,,40.80405,-73.91737,"(40.80405, -73.91737)",MAJOR DEEGAN EXPRESSWAY         ,,,0.0,0.0,0,0,0,0,0,0,Passing or Lane Usage Improper,Unspecified,,,,Station Wagon/Sport Utility Vehicle,Sedan,,,,2019-10-12 15:30:00
11104303,4298176,05cdefd1-bb64-4858-a481-825901b254a1,OCCUPANT,UNSPECIFIED,M,30.0,19581678.0,,,,,,,,,Registrant,,,03/04/2020,20:45,BROOKLYN,11219.0,40.63283,-74.00516,"(40.63283, -74.00516)",60 STREET                       ,10 AVENUE,,1.0,0.0,0,0,0,0,1,0,Failure to Yield Right-of-Way,Unspecified,,,,Station Wagon/Sport Utility Vehicle,Taxi,,,,2020-03-04 20:45:00
7762497,3788358,f60cfb17-93cc-4422-9cfd-d94103f92a56,OCCUPANT,UNSPECIFIED,M,54.0,17912449.0,Not Ejected,Does Not Apply,Does Not Apply,Driver,Lap Belt & Harness,,,Does Not Apply,Driver,,,11/12/2017,12:01,BROOKLYN,11230.0,40.619396,-73.969574,"(40.619396, -73.969574)",AVENUE L                        ,OCEAN PARKWAY,,0.0,0.0,0,0,0,0,0,0,Driver Inattention/Distraction,Unspecified,,,,Station Wagon/Sport Utility Vehicle,Station Wagon/Sport Utility Vehicle,,,,2017-11-12 12:01:00
5771550,3409506,377600,OCCUPANT,UNSPECIFIED,,,,,,,,,,,,Registrant,,,04/15/2016,9:57,MANHATTAN,10029.0,40.78875,-73.946754,"(40.78875, -73.946754)",,,1838      3 AVENUE                      ,0.0,0.0,0,0,0,0,0,0,Following Too Closely,Unspecified,Unspecified,,,Station Wagon/Sport Utility Vehicle,Dump,4 dr sedan,,,2016-04-15 09:57:00
7814038,3789557,28646991-5b0f-45c7-9a55-25fcbf16b911,OCCUPANT,UNSPECIFIED,M,25.0,17937498.0,,,,,,,,,Registrant,,,11/13/2017,14:30,BROOKLYN,11206.0,40.70121,-73.94485,"(40.70121, -73.94485)",,,41        WHIPPLE STREET                ,0.0,0.0,0,0,0,0,0,0,Driver Inattention/Distraction,Unspecified,,,,Sedan,,,,,2017-11-13 14:30:00
11150788,4250157,f757aa63-c6b8-430c-8c06-7a1d26198a68,OCCUPANT,UNSPECIFIED,,,19606648.0,,,,,,,,,Registrant,,,12/01/2019,14:00,,,40.832695,-73.94972,"(40.832695, -73.94972)",RIVERSIDE DRIVE                 ,,,0.0,0.0,0,0,0,0,0,0,Pavement Slippery,Unspecified,Unspecified,,,Station Wagon/Sport Utility Vehicle,Sedan,Station Wagon/Sport Utility Vehicle,,,2019-12-01 14:00:00
6991134,3670212,552a1e26-33b5-43bc-a49d-54ea5f030899,OCCUPANT,UNSPECIFIED,M,29.0,17537090.0,Not Ejected,Does Not Apply,Does Not Apply,Driver,Lap Belt & Harness,,,Does Not Apply,Driver,,,05/15/2017,0:30,,,40.80543,-73.92087,"(40.80543, -73.92087)",MAJOR DEEGAN EXPRESSWAY         ,,,0.0,0.0,0,0,0,0,0,0,Passing or Lane Usage Improper,Unsafe Lane Changing,,,,Sedan,Sedan,,,,2017-05-15 00:30:00
7233767,3728556,21f7d8ee-41c3-4cdd-8852-8f72d41e3708,OCCUPANT,UNSPECIFIED,M,32.0,17653395.0,Not Ejected,Does Not Apply,Does Not Apply,Driver,Lap Belt & Harness,,,Does Not Apply,Driver,,,08/10/2017,15:50,,,,,,CROSS BAY BOULEVARD             ,SHORE PARKWAY,,0.0,0.0,0,0,0,0,0,0,Driver Inattention/Distraction,Unspecified,,,,Station Wagon/Sport Utility Vehicle,Station Wagon/Sport Utility Vehicle,,,,2017-08-10 15:50:00
7837351,3768791,3ef854ac-723a-47a9-81be-7f57fb02008a,OCCUPANT,UNSPECIFIED,M,22.0,17948912.0,Not Ejected,Does Not Apply,Does Not Apply,Driver,Lap Belt & Harness,,,Does Not Apply,Driver,,,10/13/2017,15:00,,,40.56405,-74.11036,"(40.56405, -74.11036)",MILL ROAD                       ,,,0.0,0.0,0,0,0,0,0,0,Following Too Closely,Unspecified,,,,Sedan,Sedan,,,,2017-10-13 15:00:00
13148620,4758662,d29cea0b-4b50-4901-bc20-36b9e39a5cbe,OCCUPANT,UNSPECIFIED,F,43.0,20748135.0,Not Ejected,Does Not Apply,Does Not Apply,Unknown,Unknown,,,Does Not Apply,Driver,,,09/23/2024,8:00,MANHATTAN,10037.0,40.814053,-73.93484,"(40.814053, -73.93484)",EAST 138 STREET,MADISON AVENUE,,0.0,0.0,0,0,0,0,0,0,Driver Inexperience,Unspecified,,,,Station Wagon/Sport Utility Vehicle,,,,,2024-09-23 08:00:00
12752005,4666016,4ff9347a-22fe-4269-a833-7478ad8766af,OCCUPANT,INJURED,F,52.0,20522310.0,Not Ejected,Conscious,Back,Driver,Lap Belt & Harness,,,None Visible,Driver,,,09/27/2023,22:00,,,40.68714,-73.80801,"(40.68714, -73.80801)",VAN WYCK EXPWY,,,1.0,0.0,0,0,0,0,1,0,Unsafe Lane Changing,Unspecified,,,,Station Wagon/Sport Utility Vehicle,Sedan,,,,2023-09-27 22:00:00
11942132,4455701,3e1ccf7a-c09e-49b3-9b47-178cbbc74be9,OCCUPANT,UNSPECIFIED,M,37.0,20058476.0,Not Ejected,Does Not Apply,Does Not Apply,Driver,Lap Belt & Harness,,,Does Not Apply,Driver,,,09/10/2021,13:30,,,40.72579,-73.79175,"(40.72579, -73.79175)",UNION TURNPIKE,,,0.0,0.0,0,0,0,0,0,0,Following Too Closely,Unspecified,,,,Sedan,Station Wagon/Sport Utility Vehicle,,,,2021-09-10 13:30:00
7100386,3696662,4e453f1d-6b46-456c-9322-3884046f7116,OCCUPANT,UNSPECIFIED,F,24.0,17589244.0,Not Ejected,Does Not Apply,Does Not Apply,Driver,Lap Belt & Harness,,,Does Not Apply,Driver,,,06/23/2017,2:40,,,40.669094,-73.89711,"(40.669094, -73.89711)",SUTTER AVENUE                   ,,,0.0,0.0,0,0,0,0,0,0,Unspecified,,,,,Sedan,,,,,2017-06-23 02:40:00
7205962,3711942,f6898dd7-43c9-4b62-a1ac-d33c48f13b90,OCCUPANT,UNSPECIFIED,M,74.0,17640072.0,Not Ejected,Does Not Apply,Does Not Apply,Driver,Lap Belt,,,Does Not Apply,Driver,,,07/15/2017,20:22,BRONX,10467.0,40.871376,-73.86334,"(40.871376, -73.86334)",BURKE AVENUE                    ,BARNES AVENUE,,0.0,0.0,0,0,0,0,0,0,Unspecified,Unspecified,,,,Sedan,Station Wagon/Sport Utility Vehicle,,,,2017-07-15 20:22:00
12953344,4718269,920530eb-317d-4073-b41c-b42b5aaa22a7,OCCUPANT,UNSPECIFIED,F,39.0,20636500.0,,,,,,,,,Registrant,,,04/17/2024,14:20,QUEENS,11368.0,40.755066,-73.84419,"(40.755066, -73.84419)",,,123-01    ROOSEVELT AVENUE,1.0,0.0,0,0,0,0,1,0,Failure to Yield Right-of-Way,Unspecified,,,,Sedan,Pick-up Truck,,,,2024-04-17 14:20:00
6335425,3483139,1262582,OCCUPANT,UNSPECIFIED,F,40.0,17223561.0,Not Ejected,Does Not Apply,Does Not Apply,"Front passenger, if two or more persons, including the driver, are in the front seat",Lap Belt & Harness,,,Does Not Apply,Passenger,,,07/17/2016,12:00,BROOKLYN,11220.0,40.651054,-74.01112,"(40.651054, -74.01112)",3 AVENUE                        ,44 STREET,,0.0,0.0,0,0,0,0,0,0,Unspecified,Unspecified,,,,4 dr sedan,4 dr sedan,,,,2016-07-17 12:00:00
11580255,4391893,929f594a-f3bb-4092-bfe1-01dd574785bb,OCCUPANT,UNSPECIFIED,M,26.0,19847502.0,Not Ejected,Does Not Apply,Does Not Apply,Driver,Lap Belt & Harness,,,Does Not Apply,Driver,,,02/14/2021,17:35,QUEENS,11368.0,40.759716,-73.85022,"(40.759716, -73.85022)",,,125-00    NORTHERN BOULEVARD            ,0.0,0.0,0,0,0,0,0,0,Unspecified,,,,,Sedan,,,,,2021-02-14 17:35:00
6125266,3614389,7c97bd65-bec1-4983-8f33-3d6257884d87,OCCUPANT,UNSPECIFIED,M,48.0,17124474.0,,,,,,,,,Registrant,,,02/12/2017,12:20,,,40.687237,-73.82754,"(40.687237, -73.82754)",116 STREET                      ,,,0.0,0.0,0,0,0,0,0,0,Driver Inattention/Distraction,Unspecified,,,,Sedan,Sedan,,,,2017-02-12 12:20:00
7883309,3800468,6a12d576-9163-41a5-8458-09f9b9746ae9,OCCUPANT,UNSPECIFIED,F,46.0,17971388.0,,,,,,,,,Registrant,,,11/29/2017,22:55,STATEN ISLAND,10305.0,40.59034,-74.06663,"(40.59034, -74.06663)",SAND LANE                       ,CAPODANNO BOULEVARD,,0.0,0.0,0,0,0,0,0,0,Following Too Closely,Backing Unsafely,,,,Station Wagon/Sport Utility Vehicle,Sedan,,,,2017-11-29 22:55:00
9395474,4033748,453ad09c-8883-4fa2-b398-e9c9afa27de5,OCCUPANT,UNSPECIFIED,M,20.0,18717311.0,Not Ejected,Does Not Apply,Does Not Apply,Driver,Lap Belt & Harness,,,Does Not Apply,Driver,,,11/27/2018,15:45,BROOKLYN,11236.0,40.6407,-73.91874,"(40.6407, -73.91874)",,,8014      FOSTER AVENUE                 ,0.0,0.0,0,0,0,0,0,0,Following Too Closely,Unspecified,,,,Sedan,Station Wagon/Sport Utility Vehicle,,,,2018-11-27 15:45:00
13359256,4810972,22455ff7-f160-41ba-b5db-fb3a54df6bfb,OCCUPANT,UNSPECIFIED,M,,20869074.0,,,,,,,,,Registrant,,,05/07/2025,8:45,BRONX,10458.0,40.870777,-73.88623,"(40.870777, -73.88623)",BEDFORD PARK BLVD,BRIGGS AVE,,1.0,0.0,0,0,0,0,1,0,Traffic Control Disregarded,Unspecified,Unspecified,,,Station Wagon/Sport Utility Vehicle,Station Wagon/Sport Utility Vehicle,Bus,,,2025-05-07 08:45:00
9189812,4042070,1181e8ad-11c3-420d-bdfc-f09e8b590464,OCCUPANT,UNSPECIFIED,F,37.0,18616482.0,Not Ejected,Does Not Apply,Does Not Apply,Driver,Unknown,,,Does Not Apply,Driver,,,12/10/2018,17:40,,,40.59626,-73.76773,"(40.59626, -73.76773)",BEACH CHANNEL DRIVE             ,BEACH 35 STREET,,0.0,0.0,0,0,0,0,0,0,Driver Inattention/Distraction,Unspecified,Unspecified,,,Pick-up Truck,Station Wagon/Sport Utility Vehicle,Station Wagon/Sport Utility Vehicle,,,2018-12-10 17:40:00
7111764,3651411,9f8040c5-a064-4c12-9516-239f3079cf40,OCCUPANT,UNSPECIFIED,M,22.0,17594633.0,Not Ejected,Does Not Apply,Does Not Apply,"Front passenger, if two or more persons, including the driver, are in the front seat",Unknown,,,Does Not Apply,Passenger,,,04/15/2017,4:35,BROOKLYN,11238.0,40.672848,-73.9675,"(40.672848, -73.9675)",EASTERN PARKWAY                 ,UNDERHILL AVENUE,,0.0,0.0,0,0,0,0,0,0,Fell Asleep,Unspecified,,,,Sedan,Station Wagon/Sport Utility Vehicle,,,,2017-04-15 04:35:00
12155929,4511185,e119ebc0-5aff-449c-b259-578356ad03e2,OCCUPANT,UNSPECIFIED,,,20182116.0,,,,,,,,,Registrant,,,03/17/2022,17:30,,,40.705032,-73.85744,"(40.705032, -73.85744)",WOODHAVEN BOULEVARD,,,0.0,0.0,0,0,0,0,0,0,Turning Improperly,Unspecified,,,,Station Wagon/Sport Utility Vehicle,Sedan,,,,2022-03-17 17:30:00
9812366,4128852,8e4f6614-7071-4a17-8088-dd0615bea66b,OCCUPANT,UNSPECIFIED,M,57.0,18923292.0,,,,,,,,,Registrant,,,05/08/2019,18:30,BROOKLYN,11236.0,40.642544,-73.91973,"(40.642544, -73.91973)",,,1414      RALPH AVENUE                  ,0.0,0.0,0,0,0,0,0,0,Unspecified,Unspecified,,,,Sedan,Station Wagon/Sport Utility Vehicle,,,,2019-05-08 18:30:00
12439002,4585311,9db6dc52-b796-42d2-a84c-7752d9ed2fab,OCCUPANT,UNSPECIFIED,,,20344403.0,,,,,,,,,Registrant,,,11/27/2022,16:20,MANHATTAN,10009.0,40.732594,-73.97442,"(40.732594, -73.97442)",EAST 20 STREET,AVENUE C,,1.0,0.0,0,0,1,0,0,0,Unspecified,Unspecified,,,,Sedan,Bike,,,,2022-11-27 16:20:00
7783056,4025003,c647c748-c274-4671-b9ef-cc76e9f1602d,OCCUPANT,INJURED,F,7.0,17922336.0,Not Ejected,Conscious,Unknown,Unknown,Lap Belt,,,Unknown,Passenger,,,10/10/2017,17:10,BRONX,10451.0,,,,EAST 149 STREET                 ,ANTHONY J GRIFFIN PLACE,,31.0,0.0,0,0,0,0,31,0,Aggressive Driving/Road Rage,Following Too Closely,,,,Bus,Bus,,,,2017-10-10 17:10:00
6985750,3674653,88c6dd05-e9c3-481d-9c1f-aec4011c2f32,OCCUPANT,UNSPECIFIED,M,0.0,17534512.0,,,,,,,,,Registrant,,,05/21/2017,12:30,,,40.6081,-74.14477,"(40.6081, -74.14477)",,,467       NORTH GANNON AVENUE           ,1.0,0.0,0,0,0,0,1,0,Driver Inattention/Distraction,Unspecified,Unspecified,,,Sedan,Sedan,Sedan,,,2017-05-21 12:30:00
11460888,4360104,ceb53105-cf33-4771-9ab3-3ecbd122933b,OCCUPANT,UNSPECIFIED,F,66.0,19777365.0,,,,,,,,,Registrant,,,10/20/2020,23:30,,,40.669098,-73.93666,"(40.669098, -73.93666)",EASTERN PARKWAY                 ,,,1.0,0.0,0,0,0,0,1,0,Driver Inexperience,Other Vehicular,Traffic Control Disregarded,,,Sedan,Sedan,,,,2020-10-20 23:30:00
5744620,3427848,127913,OCCUPANT,UNSPECIFIED,M,57.0,16942826.0,Does Not Apply,Does Not Apply,Does Not Apply,Driver,Lap Belt & Harness,,,Does Not Apply,Driver,,,03/21/2016,18:10,,,40.734245,-73.8634,"(40.734245, -73.8634)",Long Island Expy                ,,,0.0,0.0,0,0,0,0,0,0,Following Too Closely,Unspecified,,,,Station Wagon/Sport Utility Vehicle,Station Wagon/Sport Utility Vehicle,,,,2016-03-21 18:10:00
12131782,4505252,8a19fa45-37d8-460d-9f19-4408df4898a9,OCCUPANT,UNSPECIFIED,F,28.0,20168275.0,Not Ejected,Does Not Apply,Does Not Apply,Driver,Lap Belt,,,Does Not Apply,Driver,,,02/23/2022,18:20,,,40.855385,-73.9181,"(40.855385, -73.9181)",MAJOR DEEGAN EXPRESSWAY,,,0.0,0.0,0,0,0,0,0,0,Unspecified,Unspecified,,,,Station Wagon/Sport Utility Vehicle,Sedan,,,,2022-02-23 18:20:00
6794325,3654581,d97e0e55-e967-46f0-9013-7c58878d7464,OCCUPANT,UNSPECIFIED,M,27.0,17442575.0,Not Ejected,Does Not Apply,Does Not Apply,Driver,Unknown,,,Does Not Apply,Driver,,,04/20/2017,11:30,,,40.779995,-73.976906,"(40.779995, -73.976906)",WEST 76 STREET                  ,,,0.0,0.0,0,0,0,0,0,0,Oversized Vehicle,Passing or Lane Usage Improper,,,,Box Truck,Station Wagon/Sport Utility Vehicle,,,,2017-04-20 11:30:00
6062319,3611346,2ba7e9dd-ba56-46b6-bc8b-96d9216d7588,OCCUPANT,UNSPECIFIED,M,25.0,17094064.0,,,,,,,,,Registrant,,,02/04/2017,4:30,MANHATTAN,10009.0,40.729847,-73.983116,"(40.729847, -73.983116)",,,407       EAST 12 STREET                ,0.0,0.0,0,0,0,0,0,0,Driver Inattention/Distraction,Unspecified,Unspecified,Unspecified,,Sedan,Sedan,Sedan,Sedan,,2017-02-04 04:30:00
12396958,4574326,001afdc6-18f7-47d3-9f6d-658f13dc4102,OCCUPANT,UNSPECIFIED,M,51.0,20320601.0,,,,,,,,,Registrant,,,10/18/2022,16:30,QUEENS,11377.0,40.74467,-73.8951,"(40.74467, -73.8951)",70 STREET,41 AVENUE,,0.0,0.0,0,0,0,0,0,0,Driver Inattention/Distraction,Driver Inattention/Distraction,,,,Station Wagon/Sport Utility Vehicle,Sedan,,,,2022-10-18 16:30:00
7668508,3753087,38e7295f-4677-4c5b-85a1-bb421480707f,OCCUPANT,UNSPECIFIED,M,44.0,17866697.0,Not Ejected,Does Not Apply,Does Not Apply,Driver,Lap Belt & Harness,,,Does Not Apply,Driver,,,09/16/2017,8:30,STATEN ISLAND,10314.0,40.61258,-74.129166,"(40.61258, -74.129166)",VICTORY BOULEVARD               ,QUINLAN AVENUE,,0.0,0.0,0,0,0,0,0,0,Following Too Closely,Unsafe Speed,,,,Sedan,Sedan,,,,2017-09-16 08:30:00
9286700,4016643,38865e11-e139-425c-ba05-03333f517abf,OCCUPANT,UNSPECIFIED,,0.0,18663904.0,,,,,,,,,Registrant,,,11/07/2018,19:30,,,40.848118,-73.93089,"(40.848118, -73.93089)",WEST 181 STREET                 ,,,0.0,0.0,0,0,0,0,0,0,Failure to Keep Right,Unspecified,,,,Chassis Cab,Station Wagon/Sport Utility Vehicle,,,,2018-11-07 19:30:00
6758293,3579072,3034216,OCCUPANT,UNSPECIFIED,M,42.0,17425290.0,Not Ejected,Does Not Apply,Does Not Apply,Driver,Lap Belt & Harness,,,Does Not Apply,Driver,,,12/13/2016,18:45,,,40.66835,-73.738106,"(40.66835, -73.738106)",LAURELTON PARKWAY               ,,,0.0,0.0,0,0,0,0,0,0,Driver Inattention/Distraction,Unspecified,Unspecified,,,Sedan,Station Wagon/Sport Utility Vehicle,Sedan,,,2016-12-13 18:45:00
8755944,4083616,e4b33e69-2de4-4b91-b552-c4ba95899bdf,OCCUPANT,UNSPECIFIED,F,29.0,18401471.0,Not Ejected,Does Not Apply,Does Not Apply,Driver,Lap Belt & Harness,,,Does Not Apply,Driver,,,02/20/2019,6:45,,,40.852814,-73.94197,"(40.852814, -73.94197)",HENRY HUDSON PARKWAY            ,,,0.0,0.0,0,0,0,0,0,0,Pavement Slippery,,,,,Station Wagon/Sport Utility Vehicle,,,,,2019-02-20 06:45:00
7330725,3830874,bb01994e-d6f6-486d-8f4c-40be6b28b147,OCCUPANT,UNSPECIFIED,F,59.0,17700869.0,Not Ejected,Does Not Apply,Does Not Apply,Driver,Lap Belt & Harness,,,Does Not Apply,Driver,,,01/18/2018,19:49,BROOKLYN,11229.0,40.60698,-73.94699,"(40.60698, -73.94699)",EAST 26 STREET                  ,AVENUE R,,0.0,0.0,0,0,0,0,0,0,Driver Inattention/Distraction,Unspecified,Unspecified,,,Station Wagon/Sport Utility Vehicle,Station Wagon/Sport Utility Vehicle,Sedan,,,2018-01-18 19:49:00
9601663,4050876,6523e931-ed99-4720-9473-ccc9b1d4b05f,OCCUPANT,UNSPECIFIED,M,0.0,18819020.0,,,,,,,,,Registrant,,,11/30/2018,11:30,QUEENS,11423.0,40.711945,-73.77451,"(40.711945, -73.77451)",186 STREET                      ,90 AVENUE,,1.0,0.0,0,0,0,0,1,0,Passing or Lane Usage Improper,View Obstructed/Limited,Unspecified,,,Sedan,Sedan,Station Wagon/Sport Utility Vehicle,,,2018-11-30 11:30:00
7100440,3677862,e5fab5d2-a00b-4ebf-bda5-673104d91403,OCCUPANT,UNSPECIFIED,M,62.0,17589269.0,,,,,,,,,Registrant,,,05/25/2017,13:09,,,40.78884,-73.81381,"(40.78884, -73.81381)",14 AVENUE                       ,,,0.0,0.0,0,0,0,0,0,0,Turning Improperly,Unspecified,,,,Station Wagon/Sport Utility Vehicle,Sedan,,,,2017-05-25 13:09:00
7538868,3861983,f89c34b8-abe8-4826-8489-3915a113ce04,OCCUPANT,UNSPECIFIED,M,53.0,17803142.0,,,,,,,,,Registrant,,,03/11/2018,16:05,,,40.764297,-73.90304,"(40.764297, -73.90304)",BROOKLYN QUEENS EXPRESSWAY      ,,,0.0,0.0,0,0,0,0,0,0,Driver Inattention/Distraction,Unspecified,,,,Station Wagon/Sport Utility Vehicle,Sedan,,,,2018-03-11 16:05:00
7124377,3715760,546fc79b-c171-413b-a34b-1166005c2747,OCCUPANT,UNSPECIFIED,M,68.0,17600652.0,,,,,,,,,Registrant,,,07/13/2017,0:00,MANHATTAN,10040.0,40.86155,-73.92472,"(40.86155, -73.92472)",DYCKMAN STREET                  ,NAGLE AVENUE,,0.0,0.0,0,0,0,0,0,0,Failure to Yield Right-of-Way,Unspecified,,,,Station Wagon/Sport Utility Vehicle,Sedan,,,,2017-07-13 00:00:00
9164061,4099003,68cabb51-6c36-40bb-b2f6-f37fb24b4f55,OCCUPANT,UNSPECIFIED,M,55.0,18603703.0,Not Ejected,Does Not Apply,Does Not Apply,Driver,Lap Belt & Harness,,,Does Not Apply,Driver,,,03/18/2019,16:15,,,40.66929,-73.842445,"(40.66929, -73.842445)",NASSAU EXPRESSWAY               ,,,0.0,0.0,0,0,0,0,0,0,Reaction to Uninvolved Vehicle,Following Too Closely,,,,Station Wagon/Sport Utility Vehicle,Sedan,,,,2019-03-18 16:15:00
12940376,4715020,a083daeb-e087-44f4-929d-cfb33a8da213,OCCUPANT,UNSPECIFIED,M,33.0,20629108.0,Not Ejected,Does Not Apply,Does Not Apply,Driver,,,,Does Not Apply,Driver,,,04/05/2024,14:00,BRONX,10469.0,40.85971,-73.85736,"(40.85971, -73.85736)",ASTOR AVENUE,WILLIAMSBRIDGE ROAD,,2.0,0.0,0,0,0,0,2,0,Driver Inattention/Distraction,Unspecified,Unspecified,,,Sedan,Sedan,Carry All,,,2024-04-05 14:00:00
9409874,3933899,9687bcd9-1b8d-46d7-927e-3017008d7ca3,OCCUPANT,UNSPECIFIED,,0.0,18724390.0,,,,,,,,,Registrant,,,07/03/2018,14:05,STATEN ISLAND,10306.0,40.578224,-74.10207,"(40.578224, -74.10207)",,,2145      HYLAN BOULEVARD               ,0.0,0.0,0,0,0,0,0,0,Turning Improperly,Unspecified,,,,Station Wagon/Sport Utility Vehicle,Sedan,,,,2018-07-03 14:05:00
9308539,4037620,6dea74e5-596b-47a0-87d1-430ece538656,OCCUPANT,UNSPECIFIED,M,30.0,18674690.0,Not Ejected,Does Not Apply,Does Not Apply,Driver,Lap Belt,,,Does Not Apply,Driver,,,12/03/2018,17:37,,,40.7736,-73.98158,"(40.7736, -73.98158)",WEST 66 STREET                  ,,,1.0,0.0,0,0,0,0,1,0,Other Vehicular,Following Too Closely,,,,Sedan,Station Wagon/Sport Utility Vehicle,,,,2018-12-03 17:37:00
10301147,4241393,8f3f0e44-0843-406f-bc75-33ebc4b2bbee,OCCUPANT,UNSPECIFIED,M,19.0,19167204.0,Not Ejected,Does Not Apply,Does Not Apply,Driver,Lap Belt & Harness,,,Does Not Apply,Driver,,,11/09/2019,10:45,BROOKLYN,11214.0,40.59727,-73.99868,"(40.59727, -73.99868)",BAY PARKWAY                     ,CROPSEY AVENUE,,0.0,0.0,0,0,0,0,0,0,Traffic Control Disregarded,Traffic Control Disregarded,,,,Sedan,Sedan,,,,2019-11-09 10:45:00
9609642,3981693,262dd61d-96ff-495a-84b6-9f9ab3888fa4,OCCUPANT,INJURED,F,74.0,18822942.0,Not Ejected,Conscious,Shoulder - Upper Arm,"Front passenger, if two or more persons, including the driver, are in the front seat",Lap Belt & Harness,,,Complaint of Pain or Nausea,Passenger,,,09/16/2018,15:20,QUEENS,11435.0,40.714256,-73.812874,"(40.714256, -73.812874)",HOOVER AVENUE                   ,SMEDLEY STREET,,1.0,0.0,0,0,0,0,1,0,Reaction to Uninvolved Vehicle,Unspecified,,,,Sedan,Sedan,,,,2018-09-16 15:20:00
11188785,3704012,ee61e46f-ae07-43e3-800f-dbc03c884030,OCCUPANT,UNSPECIFIED,M,20.0,19627034.0,Not Ejected,Does Not Apply,Does Not Apply,"Front passenger, if two or more persons, including the driver, are in the front seat",Lap Belt & Harness,,,Does Not Apply,Passenger,,,06/30/2017,18:50,QUEENS,11420.0,40.667572,-73.8257,"(40.667572, -73.8257)",115 STREET                      ,150 AVENUE,,0.0,0.0,0,0,0,0,0,0,Unspecified,Unspecified,,,,Sedan,Convertible,,,,2017-06-30 18:50:00
9957854,4165280,58e7a0ac-4ead-49e3-b239-8fd97801e279,OCCUPANT,UNSPECIFIED,F,9.0,18995218.0,Not Ejected,Does Not Apply,Does Not Apply,"Middle rear seat, or passenger lying across a seat",Lap Belt & Harness,,,Does Not Apply,Passenger,,,07/06/2019,17:20,,,40.73283,-73.97415,"(40.73283, -73.97415)",FDR DRIVE                       ,,,0.0,0.0,0,0,0,0,0,0,Driver Inattention/Distraction,Unspecified,Unspecified,,,Station Wagon/Sport Utility Vehicle,Sedan,Sedan,,,2019-07-06 17:20:00
13502539,4848938,990b6c8d-b43f-43a9-80f3-b692cc1a7c3a,OCCUPANT,UNSPECIFIED,M,44.0,20951512.0,,,,,,,,,Registrant,,,10/11/2025,16:22,,,40.754986,-73.74535,"(40.754986, -73.74535)",CROSS ISLAND PARKWAY,,,1.0,0.0,0,0,0,0,1,0,Driver Inattention/Distraction,Unspecified,,,,Sedan,Sedan,,,,2025-10-11 16:22:00
6525179,3529836,2142098,OCCUPANT,UNSPECIFIED,F,27.0,17313552.0,Not Ejected,Does Not Apply,Does Not Apply,Driver,Lap Belt & Harness,,,Does Not Apply,Driver,,,09/29/2016,16:30,,,40.6996,-73.81061,"(40.6996, -73.81061)",ARCHER AVENUE                   ,,,0.0,0.0,0,0,0,0,0,0,Turning Improperly,Unspecified,,,,Sedan,Sedan,,,,2016-09-29 16:30:00
10037307,4180714,4afdc4fb-39e6-435b-b593-1486c692ea2a,OCCUPANT,UNSPECIFIED,,0.0,19034800.0,,,,,,,,,Registrant,,,07/31/2019,15:50,,,,,,EAST 149 STREET                 ,,,0.0,0.0,0,0,0,0,0,0,Passing or Lane Usage Improper,Passing or Lane Usage Improper,,,,Station Wagon/Sport Utility Vehicle,Station Wagon/Sport Utility Vehicle,,,,2019-07-31 15:50:00
13451323,4835410,c1049e60-6ca5-49a2-84ea-2d3e9828f672,OCCUPANT,INJURED,F,11.0,20922116.0,Not Ejected,Conscious,Head,"Middle rear seat, or passenger lying across a seat",Unknown,,,Complaint of Pain or Nausea,Passenger,,,08/16/2025,20:53,,,40.71716,-73.79796,"(40.71716, -73.79796)",168 STREET,GRAND CENTRAL PARKWAY,,2.0,0.0,0,0,0,0,2,0,Traffic Control Disregarded,Unspecified,,,,Sedan,Station Wagon/Sport Utility Vehicle,,,,2025-08-16 20:53:00
11041235,4277958,5c5ae2c9-715a-4b91-aa75-b1a080e80257,OCCUPANT,UNSPECIFIED,M,6.0,19549047.0,Not Ejected,Does Not Apply,Does Not Apply,"Any person in the rear of a station wagon, pick-up truck, all passengers on a bus, etc",Lap Belt & Harness,,,Does Not Apply,Passenger,,,01/22/2020,17:13,QUEENS,11417.0,40.674137,-73.83903,"(40.674137, -73.83903)",97 STREET                       ,LINDEN BOULEVARD,,2.0,0.0,0,0,0,0,2,0,Failure to Yield Right-of-Way,Failure to Yield Right-of-Way,,,,Sedan,Bus,,,,2020-01-22 17:13:00
13424462,4828170,270b9155-4fb1-47b7-ba01-4e8f07ce45b1,OCCUPANT,UNSPECIFIED,M,28.0,20906502.0,,,,,,,,,Registrant,,,07/17/2025,7:50,STATEN ISLAND,10304.0,40.60878,-74.090805,"(40.60878, -74.090805)",RICHMOND RD,NARROWS RD S,,1.0,0.0,1,0,0,0,0,0,Unspecified,,,,,Sedan,,,,,2025-07-17 07:50:00
11991631,4468367,bf5ee8af-0420-4bf8-8d64-cb828ffa92bb,OCCUPANT,UNSPECIFIED,F,39.0,20087202.0,Not Ejected,Does Not Apply,Does Not Apply,"Front passenger, if two or more persons, including the driver, are in the front seat",Lap Belt & Harness,,,Does Not Apply,Passenger,,,10/17/2021,0:17,,,40.60719,-74.16242,"(40.6071903, -74.1624214)",VICTORY BOULEVARD,RICHMOND AVENUE,,2.0,0.0,0,0,0,0,2,0,Driver Inattention/Distraction,Unspecified,,,,Pick-up Truck,Sedan,,,,2021-10-17 00:17:00
11286845,4314736,7dae2462-1384-4b55-80cb-5a75a1db35b2,OCCUPANT,UNSPECIFIED,F,20.0,19676513.0,Not Ejected,Does Not Apply,Does Not Apply,Driver,Lap Belt & Harness,,,Does Not Apply,Driver,,,05/19/2020,17:00,,,,,,HENRY HUDSON PARKWAY            ,,,0.0,0.0,0,0,0,0,0,0,Unspecified,Unspecified,,,,Station Wagon/Sport Utility Vehicle,Taxi,,,,2020-05-19 17:00:00
11751976,4403602,2cf49403-1d88-4137-a82d-06960c884dd0,OCCUPANT,UNSPECIFIED,M,67.0,19947104.0,,,,,,,,,Registrant,,,03/31/2021,14:00,MANHATTAN,10034.0,40.86369,-73.91707,"(40.86369, -73.91707)",9 AVENUE                        ,WEST 207 STREET,,0.0,0.0,0,0,0,0,0,0,Backing Unsafely,Unspecified,,,,Station Wagon/Sport Utility Vehicle,Sedan,,,,2021-03-31 14:00:00
11796899,4419926,4abf7604-b945-4949-be2c-5e66805bd858,OCCUPANT,UNSPECIFIED,M,26.0,19973145.0,Not Ejected,Does Not Apply,Does Not Apply,"Front passenger, if two or more persons, including the driver, are in the front seat",Lap Belt,,,Does Not Apply,Passenger,,,05/21/2021,17:30,BROOKLYN,11213.0,40.67295,-73.92517,"(40.67295, -73.92517)",BUFFALO AVENUE,PROSPECT PLACE,,2.0,0.0,0,0,0,0,2,0,Other Vehicular,Other Vehicular,,,,Station Wagon/Sport Utility Vehicle,Sedan,,,,2021-05-21 17:30:00
11000884,4272506,86e2a226-f855-4f2e-a2e0-168fa4d12482,OCCUPANT,UNSPECIFIED,,,19528389.0,,,,,,,,,Registrant,,,01/12/2020,13:12,BROOKLYN,11234.0,40.614,-73.9161,"(40.614, -73.9161)",EAST 59 STREET                  ,AVENUE U,,0.0,0.0,0,0,0,0,0,0,Driver Inattention/Distraction,Unspecified,,,,Bus,Sedan,,,,2020-01-12 13:12:00
9545438,4006391,092d9363-a371-4690-8377-a66e82e8598d,OCCUPANT,UNSPECIFIED,M,0.0,18791080.0,,,,,,,,,Registrant,,,10/24/2018,5:57,BROOKLYN,11226.0,40.644512,-73.963135,"(40.644512, -73.963135)",BEVERLEY ROAD                   ,EAST 17 STREET,,1.0,0.0,0,0,0,0,1,0,Unspecified,Unspecified,,,,Sedan,Station Wagon/Sport Utility Vehicle,,,,2018-10-24 05:57:00
9837110,4134250,2d5a8e97-6aee-47d9-a65e-4e64c21328f2,OCCUPANT,UNSPECIFIED,,0.0,18935540.0,,,,,,,,,Registrant,,,05/17/2019,22:30,QUEENS,11357.0,40.778885,-73.81454,"(40.778885, -73.81454)",150 STREET                      ,22 AVENUE,,3.0,0.0,0,0,0,0,3,0,Passing or Lane Usage Improper,Failure to Yield Right-of-Way,,,,Sedan,Station Wagon/Sport Utility Vehicle,,,,2019-05-17 22:30:00
12751739,4664995,e9fab7b0-f0f1-4a5c-bf66-8c8e20e75868,OCCUPANT,UNSPECIFIED,M,11.0,20522163.0,Not Ejected,Does Not Apply,Does Not Apply,"Left rear passenger, or rear passenger on a bicycle, motorcycle, snowmobile",Lap Belt & Harness,,,Does Not Apply,Passenger,,,09/15/2023,15:00,MANHATTAN,10022.0,40.759617,-73.961975,"(40.759617, -73.961975)",EAST 59 STREET,1 AVENUE,,0.0,0.0,0,0,0,0,0,0,Driver Inattention/Distraction,Driver Inattention/Distraction,,,,Sedan,Pick-up Truck,,,,2023-09-15 15:00:00
12217251,4527394,b9c4737d-a311-47e9-b9d2-a03f07a8c04c,OCCUPANT,UNSPECIFIED,M,43.0,20217233.0,,,,,,,,,Registrant,,,04/11/2022,16:45,,,,,,MAJOR DEEGAN EXPRESSWAY,,,0.0,0.0,0,0,0,0,0,0,Following Too Closely,Unspecified,,,,Station Wagon/Sport Utility Vehicle,,,,,2022-04-11 16:45:00
7440360,3843370,bdeb9be7-ae34-4af3-be66-1390f75a07f2,OCCUPANT,UNSPECIFIED,,,17754673.0,,,,,,,,,Registrant,,,02/08/2018,14:30,QUEENS,11101.0,40.75703,-73.938126,"(40.75703, -73.938126)",22 STREET                       ,38 AVENUE,,0.0,0.0,0,0,0,0,0,0,Following Too Closely,Unspecified,,,,Sedan,Sedan,,,,2018-02-08 14:30:00
12242747,4533939,7c28b13d-c937-4d67-806c-b30d0e05329f,OCCUPANT,UNSPECIFIED,F,44.0,20231710.0,Not Ejected,Does Not Apply,Does Not Apply,"Front passenger, if two or more persons, including the driver, are in the front seat",Lap Belt & Harness,,,Does Not Apply,Passenger,,,05/22/2022,11:15,QUEENS,11365.0,40.736732,-73.80373,"(40.736732, -73.80373)",65 AVENUE,165 STREET,,0.0,0.0,0,0,0,0,0,0,Driver Inattention/Distraction,Unspecified,,,,Sedan,Station Wagon/Sport Utility Vehicle,,,,2022-05-22 11:15:00
7266566,3734942,dba60e7a-f023-4422-b77a-a9becdda3fed,OCCUPANT,UNSPECIFIED,,0.0,17669326.0,,,,,,,,,Registrant,,,08/21/2017,4:55,,,40.652752,-73.88629,"(40.652752, -73.88629)",PENNSYLVANIA AVENUE             ,,,1.0,0.0,0,0,0,0,1,0,Driver Inattention/Distraction,Unspecified,,,,Station Wagon/Sport Utility Vehicle,Station Wagon/Sport Utility Vehicle,,,,2017-08-21 04:55:00
12242844,4533980,3b08d174-7839-4132-98cc-2af1dd8c193a,OCCUPANT,UNSPECIFIED,F,14.0,20231770.0,Not Ejected,Does Not Apply,Does Not Apply,"Front passenger, if two or more persons, including the driver, are in the front seat",Lap Belt & Harness,,,Does Not Apply,Passenger,,,06/02/2022,8:45,,,40.732822,-73.8684,"(40.732822, -73.8684)",LONG ISLAND EXPRESSWAY,,,0.0,0.0,0,0,0,0,0,0,Unspecified,Unspecified,,,,Motorcycle,Station Wagon/Sport Utility Vehicle,,,,2022-06-02 08:45:00
11243638,4258220,a4b5ca60-164c-4d65-b266-eac4b453ccf9,OCCUPANT,UNSPECIFIED,F,54.0,19654695.0,Not Ejected,Does Not Apply,Does Not Apply,Driver,Lap Belt & Harness,,,Does Not Apply,Driver,,,12/12/2019,18:00,,,,,,G.C.P. / L.I.E (CDR)            ,,,0.0,0.0,0,0,0,0,0,0,Driver Inattention/Distraction,Unspecified,,,,Sedan,Sedan,,,,2019-12-12 18:00:00
6296916,3474438,1137164,OCCUPANT,UNSPECIFIED,F,53.0,17205501.0,,,,,,,,,Registrant,,,07/03/2016,13:30,BROOKLYN,11220.0,40.641747,-74.013824,"(40.641747, -74.013824)",56 STREET                       ,5 AVENUE,,0.0,0.0,0,0,0,0,0,0,Driver Inattention/Distraction,Unspecified,,,,4 dr sedan,Pick-up Truck,,,,2016-07-03 13:30:00
9252684,3920736,b7ada193-76a1-4f14-8c1b-e311b2d7b3de,OCCUPANT,INJURED,M,63.0,18647223.0,Not Ejected,Conscious,Elbow-Lower-Arm-Hand,Driver,Lap Belt & Harness,,,Complaint of Pain or Nausea,Driver,,,06/14/2018,10:05,,,40.59359,-73.99613,"(40.59359, -73.99613)",BELT PARKWAY                    ,,,2.0,0.0,0,0,0,0,2,0,Driver Inattention/Distraction,Unspecified,,,,Station Wagon/Sport Utility Vehicle,USPS,,,,2018-06-14 10:05:00
6760403,3587071,3172393,OCCUPANT,UNSPECIFIED,M,36.0,17426335.0,,,,,,,,,Registrant,,,12/25/2016,22:00,QUEENS,11428.0,40.71616,-73.744774,"(40.71616, -73.744774)",JAMAICA AVENUE                  ,213 STREET,,0.0,0.0,0,0,0,0,0,0,Driver Inattention/Distraction,Unspecified,,,,Sedan,Sedan,,,,2016-12-25 22:00:00
9593169,4038722,9a11ae9e-10bd-4914-a357-9220144fbb67,OCCUPANT,UNSPECIFIED,,0.0,18814861.0,,,,,,,,,Registrant,,,12/05/2018,10:43,,,40.75595,-73.99074,"(40.75595, -73.99074)",WEST 40 STREET                  ,,,0.0,0.0,0,0,0,0,0,0,Driver Inattention/Distraction,Unsafe Lane Changing,,,,Taxi,Flat Bed,,,,2018-12-05 10:43:00
9031029,4085741,b3279a1d-6cc0-4ba1-bee2-76266a28e93f,OCCUPANT,UNSPECIFIED,M,54.0,18537837.0,Not Ejected,Does Not Apply,Does Not Apply,Driver,Lap Belt & Harness,,,Does Not Apply,Driver,,,02/23/2019,0:01,MANHATTAN,10001.0,40.752686,-74.000534,"(40.752686, -74.000534)",WEST 31 STREET                  ,10 AVENUE,,0.0,0.0,0,0,0,0,0,0,Driver Inattention/Distraction,Unspecified,,,,Station Wagon/Sport Utility Vehicle,Station Wagon/Sport Utility Vehicle,,,,2019-02-23 00:01:00
12074743,4490350,292958a8-9e5a-48d1-a418-570a8cf2fdc5,OCCUPANT,UNSPECIFIED,,,20134912.0,,,,,,,,,Registrant,,,12/28/2021,19:53,BRONX,10474.0,40.811043,-73.88073,"(40.811043, -73.88073)",OAK POINT AVENUE,HALLECK STREET,,4.0,0.0,0,0,0,0,4,0,Unspecified,Unspecified,,,,Box Truck,Sedan,,,,2021-12-28 19:53:00
6752823,3563471,2749272,OCCUPANT,UNSPECIFIED,F,60.0,17422699.0,Not Ejected,Does Not Apply,Does Not Apply,Right rear passenger or motorcycle sidecar passenger,Lap Belt & Harness,,,Does Not Apply,Passenger,,,11/19/2016,5:45,,,40.667236,-73.770004,"(40.667236, -73.770004)",BELT PARKWAY                    ,,,0.0,0.0,0,0,0,0,0,0,Passing or Lane Usage Improper,Unspecified,Unspecified,,,Sedan,Station Wagon/Sport Utility Vehicle,Station Wagon/Sport Utility Vehicle,,,2016-11-19 05:45:00
5751397,3419517,212977,OCCUPANT,UNSPECIFIED,M,59.0,16946226.0,,,,,,,,,Registrant,,,03/30/2016,10:10,BROOKLYN,11213.0,,,,PARK PLACE                      ,TROY AVENUE,,1.0,0.0,0,0,1,0,0,0,Driver Inexperience,Unspecified,,,,4 dr sedan,Bike,,,,2016-03-30 10:10:00
7930647,3800545,38b176f3-341e-4f58-a2a9-69dc1e8e1ccb,OCCUPANT,UNSPECIFIED,M,52.0,17994718.0,,,,,,,,,Registrant,,,11/30/2017,14:50,,,40.798256,-73.82744,"(40.798256, -73.82744)",BRONX WHITESTONE BRIDGE         ,,,1.0,0.0,0,0,0,0,1,0,Following Too Closely,Unspecified,,,,Box Truck,Sedan,,,,2017-11-30 14:50:00
7419419,3873156,92518ab8-d218-48c9-a8f2-2067d8f255e0,OCCUPANT,UNSPECIFIED,F,41.0,17744439.0,Not Ejected,Does Not Apply,Does Not Apply,Driver,Lap Belt,,,Does Not Apply,Driver,,,03/31/2018,16:20,STATEN ISLAND,10312.0,40.55057,-74.16758,"(40.55057, -74.16758)",RICHMOND AVENUE                 ,KATAN AVENUE,,0.0,0.0,0,0,0,0,0,0,Unsafe Lane Changing,Unspecified,,,,Sedan,Pick-up Truck,,,,2018-03-31 16:20:00
11999830,4470259,d06de84f-2acd-4498-a82a-72bd901e0495,OCCUPANT,UNSPECIFIED,F,60.0,20091885.0,,,,,,,,,Registrant,,,10/19/2021,8:56,,,40.65227,-73.920746,"(40.6522703, -73.9207436)",RALPH AVENUE,CHURCH AVENUE,,1.0,0.0,1,0,0,0,0,0,Failure to Yield Right-of-Way,,,,,Station Wagon/Sport Utility Vehicle,,,,,2021-10-19 08:56:00
12326877,4555877,7e48c072-5c08-4714-8638-4b2a738076dd,OCCUPANT,UNSPECIFIED,M,55.0,20280171.0,Not Ejected,Does Not Apply,Does Not Apply,Driver,Lap Belt,,,Does Not Apply,Driver,,,08/13/2022,15:45,BROOKLYN,11207.0,40.67591,-73.89492,"(40.67591, -73.89492)",ATLANTIC AVENUE,VERMONT STREET,,4.0,0.0,0,0,0,0,4,0,Driver Inattention/Distraction,Unspecified,,,,Sedan,Station Wagon/Sport Utility Vehicle,,,,2022-08-13 15:45:00
11152824,3641125,79c7a935-3a88-4d7e-a525-954d10f098f5,OCCUPANT,UNSPECIFIED,M,45.0,19607788.0,,,,,,,,,Registrant,,,03/29/2017,11:40,,,40.695385,-73.840355,"(40.695385, -73.840355)",107 STREET                      ,JAMAICA AVENUE,,0.0,0.0,0,0,0,0,0,0,Passing or Lane Usage Improper,Unspecified,,,,Box Truck,Station Wagon/Sport Utility Vehicle,,,,2017-03-29 11:40:00
9374823,3936736,053bef4c-3b8c-423f-88f0-bac51c0fb316,OCCUPANT,UNSPECIFIED,M,21.0,18707243.0,Not Ejected,Does Not Apply,Does Not Apply,Driver,Lap Belt & Harness,,,Does Not Apply,Driver,,,07/08/2018,7:20,BROOKLYN,11211.0,40.70774,-73.95361,"(40.70774, -73.95361)",SOUTH 5 STREET                  ,HOOPER STREET,,0.0,0.0,0,0,0,0,0,0,Traffic Control Disregarded,Unspecified,Unspecified,,,Station Wagon/Sport Utility Vehicle,Station Wagon/Sport Utility Vehicle,Station Wagon/Sport Utility Vehicle,,,2018-07-08 07:20:00
9272787,3946791,6c6ba658-aa9c-4a3e-995e-57bb29630e79,OCCUPANT,UNSPECIFIED,,0.0,18657041.0,,,,,,,,,Registrant,,,07/21/2018,17:15,BRONX,10467.0,40.86403,-73.86742,"(40.86403, -73.86742)",,,2563      WHITE PLAINS ROAD             ,0.0,0.0,0,0,0,0,0,0,Driver Inattention/Distraction,Unspecified,,,,Station Wagon/Sport Utility Vehicle,Station Wagon/Sport Utility Vehicle,,,,2018-07-21 17:15:00
7010364,3683854,a43ca3f8-0e78-49a3-9e3d-bd29fd4c06cd,OCCUPANT,UNSPECIFIED,F,74.0,17546261.0,,,,,,,,,Registrant,,,06/04/2017,8:00,,,40.62391,-74.16741,"(40.62391, -74.16741)",SOUTH AVENUE                    ,AMADOR STREET,,0.0,0.0,0,0,0,0,0,0,Backing Unsafely,Unspecified,,,,Sedan,Sedan,,,,2017-06-04 08:00:00
7550293,3878335,ab63422a-a90b-4eff-9564-6785b12c705e,OCCUPANT,UNSPECIFIED,,,,,,,,,,,,Witness,,,04/10/2018,17:54,MANHATTAN,10036.0,40.76161,-73.99032,"(40.76161, -73.99032)",WEST 47 STREET                  ,9 AVENUE,,1.0,0.0,1,0,0,0,0,0,Following Too Closely,,,,,Sedan,,,,,2018-04-10 17:54:00
6386347,3578029,3044808,OCCUPANT,UNSPECIFIED,M,26.0,17247652.0,Not Ejected,Does Not Apply,Does Not Apply,Driver,Unknown,,,Does Not Apply,Driver,,,12/08/2016,15:15,MANHATTAN,10032.0,40.841934,-73.9361,"(40.841934, -73.9361)",,,513       WEST 171 STREET               ,0.0,0.0,0,0,0,0,0,0,Failure to Yield Right-of-Way,Unspecified,,,,Sedan,Van,,,,2016-12-08 15:15:00
11348881,4330719,198610df-3b94-402b-8b80-63b4cf9d335d,OCCUPANT,UNSPECIFIED,M,85.0,19712164.0,,,,,,,,,Registrant,,,07/21/2020,15:18,BROOKLYN,11216.0,40.6884,-73.95118,"(40.6884, -73.95118)",NOSTRAND AVENUE                 ,GREENE AVENUE,,1.0,0.0,0,0,1,0,0,0,Driver Inattention/Distraction,Unspecified,,,,Sedan,E-Scooter,,,,2020-07-21 15:18:00
6181595,3437833,2239813,OCCUPANT,UNSPECIFIED,F,30.0,17151648.0,Not Ejected,Does Not Apply,Does Not Apply,"Front passenger, if two or more persons, including the driver, are in the front seat",Unknown,,,Does Not Apply,Passenger,,,05/10/2016,17:50,BRONX,10451.0,40.82751,-73.92495,"(40.82751, -73.92495)",GERARD AVENUE                   ,EAST 161 STREET,,0.0,0.0,0,0,0,0,0,0,Following Too Closely,Unspecified,,,,4 dr sedan,4 dr sedan,,,,2016-05-10 17:50:00
7230218,3727085,d179088d-171c-44ca-a3ec-8e3fd600811c,OCCUPANT,UNSPECIFIED,F,22.0,17651656.0,Not Ejected,Does Not Apply,Does Not Apply,"Front passenger, if two or more persons, including the driver, are in the front seat",Unknown,,,Does Not Apply,Passenger,,,08/08/2017,9:00,,,40.877796,-73.86806,"(40.877796, -73.86806)",EAST GUN HILL ROAD              ,OLINVILLE AVENUE,,0.0,0.0,0,0,0,0,0,0,Passing or Lane Usage Improper,,,,,Sedan,,,,,2017-08-08 09:00:00
7300397,3828800,ec3994a5-1336-4f59-8e81-4489c0cbac08,OCCUPANT,INJURED,M,30.0,17686015.0,Not Ejected,Conscious,Entire Body,Right rear passenger or motorcycle sidecar passenger,Lap Belt & Harness,,,Complaint of Pain,Passenger,,,01/14/2018,14:00,BRONX,10463.0,40.881687,-73.90283,"(40.881687, -73.90283)",WEST 234 STREET                 ,BROADWAY,,1.0,0.0,0,0,0,0,1,0,Unspecified,Unspecified,,,,Sedan,Sedan,,,,2018-01-14 14:00:00
12235612,4532040,0d4f20c6-a9eb-4064-9635-34000dd9cbd9,OCCUPANT,UNSPECIFIED,F,51.0,20227599.0,,,,,,,,,Registrant,,,05/24/2022,18:50,MANHATTAN,10029.0,40.794613,-73.9321,"(40.794613, -73.9321)",,,545       EAST 116 STREET,0.0,0.0,0,0,0,0,0,0,Passing or Lane Usage Improper,Unspecified,Unspecified,Unspecified,,Station Wagon/Sport Utility Vehicle,Station Wagon/Sport Utility Vehicle,Sedan,Station Wagon/Sport Utility Vehicle,,2022-05-24 18:50:00
10062146,4186232,60847fdc-2d4a-4db1-ba87-8d544722c826,OCCUPANT,UNSPECIFIED,M,35.0,19047220.0,Not Ejected,Does Not Apply,Does Not Apply,Driver,Lap Belt & Harness,,,Does Not Apply,Driver,,,08/09/2019,13:30,,,40.61054,-74.103455,"(40.61054, -74.103455)",STATEN ISLAND EXPRESSWAY        ,,,1.0,0.0,0,0,0,0,1,0,Following Too Closely,Unspecified,,,,Station Wagon/Sport Utility Vehicle,Sedan,,,,2019-08-09 13:30:00
13157396,4747266,3f57adbf-2a47-46b8-8910-8462ff73bb47,OCCUPANT,INJURED,M,27.0,20753448.0,Not Ejected,Shock,Unknown,Driver,Lap Belt & Harness,,,Complaint of Pain or Nausea,Driver,,,08/11/2024,2:23,QUEENS,11361.0,40.762306,-73.78469,"(40.762306, -73.78469)",,,200-54    39 AVENUE,1.0,0.0,0,0,0,0,1,0,Passing or Lane Usage Improper,Unspecified,Unspecified,Unspecified,,Sedan,Sedan,Sedan,Sedan,,2024-08-11 02:23:00
12947232,4716876,22cd628a-68e1-43e3-8682-192077f5b813,OCCUPANT,UNSPECIFIED,M,41.0,20633067.0,Not Ejected,Does Not Apply,Does Not Apply,"Front passenger, if two or more persons, including the driver, are in the front seat",Lap Belt,,,Does Not Apply,Passenger,,,04/11/2024,16:08,,,,,,11 AVENUE,GANSEVOORT STREET,,0.0,0.0,0,0,0,0,0,0,Following Too Closely,Unspecified,,,,Sedan,Station Wagon/Sport Utility Vehicle,,,,2024-04-11 16:08:00
7895738,3748187,b644d4ce-b7ab-4738-adb1-39a958870d73,OCCUPANT,UNSPECIFIED,F,56.0,17977525.0,,,,,,,,,Registrant,,,09/11/2017,17:30,,,40.662395,-73.887115,"(40.662395, -73.887115)",VAN SICLEN AVENUE               ,,,0.0,0.0,0,0,0,0,0,0,Unspecified,Unspecified,,,,Sedan,Station Wagon/Sport Utility Vehicle,,,,2017-09-11 17:30:00
11295454,4316967,a53d21f0-6298-4e84-8721-61f51fca68ef,OCCUPANT,UNSPECIFIED,M,38.0,19681506.0,Not Ejected,Does Not Apply,Does Not Apply,Driver,,,,Does Not Apply,Driver,,,05/31/2020,7:34,BROOKLYN,11229.0,40.60815,-73.95977,"(40.60815, -73.95977)",,,1325      KINGS HIGHWAY                 ,1.0,0.0,0,0,1,0,0,0,Driver Inattention/Distraction,Unspecified,,,,Sedan,Bike,,,,2020-05-31 07:34:00
6551989,3554508,2587697,OCCUPANT,UNSPECIFIED,,0.0,17326353.0,,,,,,,,,Registrant,,,11/05/2016,15:50,BROOKLYN,11214.0,40.596703,-73.99803,"(40.596703, -73.99803)",CROPSEY AVENUE                  ,BAY 31 STREET,,0.0,0.0,0,0,0,0,0,0,Failure to Yield Right-of-Way,Unspecified,,,,Station Wagon/Sport Utility Vehicle,Sedan,,,,2016-11-05 15:50:00
13390055,4819119,bd377aaf-0a95-45f4-bf19-288b64354d41,OCCUPANT,UNSPECIFIED,F,39.0,20886586.0,,,,,,,,,Registrant,,,06/08/2025,17:06,BROOKLYN,11236.0,40.646175,-73.910545,"(40.646175, -73.910545)",E 92 ST,KRIER PL,,1.0,0.0,0,0,0,0,1,0,Following Too Closely,Unspecified,Unspecified,,,Taxi,Sedan,Station Wagon/Sport Utility Vehicle,,,2025-06-08 17:06:00
9298127,3931056,061eb6d2-9c33-4c6c-a20e-bdf1477a44a1,OCCUPANT,UNSPECIFIED,M,48.0,18669497.0,,,,,,,,,Registrant,,,06/28/2018,9:10,MANHATTAN,10022.0,40.759495,-73.96368,"(40.759495, -73.96368)",,,320       EAST 58 STREET                ,1.0,0.0,0,0,0,0,1,0,Other Vehicular,Passing or Lane Usage Improper,,,,Sedan,Station Wagon/Sport Utility Vehicle,,,,2018-06-28 09:10:00
6229195,3457693,888408,OCCUPANT,UNSPECIFIED,F,30.0,17173840.0,Not Ejected,Does Not Apply,Does Not Apply,"Left rear passenger, or rear passenger on a bicycle, motorcycle, snowmobile",Lap Belt & Harness,,,Does Not Apply,Passenger,,,06/06/2016,16:40,,,40.8049,-73.83165,"(40.8049, -73.83165)",Bronx Whitestone Bridge         ,,,3.0,0.0,0,0,0,0,3,0,Reaction to Uninvolved Vehicle,Passing Too Closely,,,,Tractor Truck Gasoline,4 dr sedan,,,,2016-06-06 16:40:00
12463009,4591464,606c87f6-321e-4ff3-af19-dc1296c4653a,OCCUPANT,UNSPECIFIED,M,31.0,20358008.0,Not Ejected,Does Not Apply,Does Not Apply,Driver,Unknown,,,Does Not Apply,Driver,,,12/18/2022,5:45,,,40.89664,-73.87049,"(40.89664, -73.87049)",EAST 233 STREET,,,2.0,0.0,0,0,0,0,2,0,Driver Inattention/Distraction,Unspecified,,,,Sedan,Sedan,,,,2022-12-18 05:45:00
12133483,4505734,3488b4fb-ccce-45e2-9943-f24c3702a673,OCCUPANT,UNSPECIFIED,M,60.0,20169303.0,Not Ejected,Does Not Apply,Does Not Apply,Driver,Lap Belt & Harness,,,Does Not Apply,Driver,,,02/26/2022,11:15,,,,,,49 STREET,ASTORIA BOULEVARD,,1.0,0.0,0,0,0,0,1,0,Following Too Closely,Unspecified,Unspecified,,,Station Wagon/Sport Utility Vehicle,Sedan,Sedan,,,2022-02-26 11:15:00
13015515,4732636,20b826a4-9ba9-4b43-8c59-e019df3c2a43,OCCUPANT,INJURED,M,68.0,20671334.0,Not Ejected,Unknown,Shoulder - Upper Arm,Driver,Unknown,,,Complaint of Pain or Nausea,Driver,,,06/09/2024,8:52,BROOKLYN,11238.0,40.68174,-73.95859,"(40.68174, -73.95859)",CLASSON AVENUE,FULTON STREET,,2.0,0.0,0,0,0,0,2,0,Traffic Control Disregarded,Unspecified,,,,Sedan,Sedan,,,,2024-06-09 08:52:00
6028494,4023856,cce83434-7ae3-4177-9e0c-d532acae4547,OCCUPANT,UNSPECIFIED,M,27.0,17077811.0,Not Ejected,Does Not Apply,Does Not Apply,Driver,Lap Belt & Harness,,,Does Not Apply,Driver,,,01/04/2017,18:33,,,40.742676,-73.839516,"(40.742676, -73.839516)",LONG ISLAND EXPRESSWAY          ,,,0.0,0.0,0,0,0,0,0,0,Following Too Closely,Unspecified,Unspecified,,,Station Wagon/Sport Utility Vehicle,Station Wagon/Sport Utility Vehicle,Sedan,,,2017-01-04 18:33:00
9796285,4125114,6a87d94e-d6cb-4f0c-9d4b-9e3a50161490,OCCUPANT,INJURED,F,1.0,18915413.0,Not Ejected,Conscious,Unknown,Unknown,Child Restraint Only,,,Unknown,Passenger,,,05/02/2019,17:01,,,,,,FOREST AVENUE                   ,VANPELT AVENUE,,1.0,0.0,0,0,0,0,1,0,Following Too Closely,Driver Inattention/Distraction,,,,Sedan,Station Wagon/Sport Utility Vehicle,,,,2019-05-02 17:01:00
7584702,3893601,5de2c125-3c3a-4270-a7e5-cfddb9862f00,OCCUPANT,UNSPECIFIED,M,61.0,17825677.0,Not Ejected,Does Not Apply,Does Not Apply,"Front passenger, if two or more persons, including the driver, are in the front seat",Unknown,,,Does Not Apply,Passenger,,,05/03/2018,12:55,QUEENS,11372.0,40.75682,-73.87358,"(40.75682, -73.87358)",,,94-15     NORTHERN BOULEVARD            ,0.0,0.0,0,0,0,0,0,0,Backing Unsafely,Unspecified,,,,Station Wagon/Sport Utility Vehicle,Station Wagon/Sport Utility Vehicle,,,,2018-05-03 12:55:00
11791793,4402622,3361ab0d-72c9-48f6-bb63-725fe96c2f9a,OCCUPANT,UNSPECIFIED,M,28.0,19970111.0,Not Ejected,Does Not Apply,Does Not Apply,Driver,Lap Belt & Harness,,,Does Not Apply,Driver,,,03/23/2021,20:43,,,,,"(0.0, 0.0)",PAULDING AVENUE                 ,,,0.0,0.0,0,0,0,0,0,0,Alcohol Involvement,Unspecified,,,,Sedan,Station Wagon/Sport Utility Vehicle,,,,2021-03-23 20:43:00
12692284,4650599,e18a3fef-153c-4d26-b14a-661684fb352d,OCCUPANT,UNSPECIFIED,M,3.0,20487911.0,Not Ejected,Does Not Apply,Does Not Apply,Unknown,Child Restraint Only,,,Does Not Apply,Passenger,,,08/01/2023,7:39,BRONX,10458.0,40.868805,-73.89055,"(40.868805, -73.89055)",EAST 197 STREET,VALENTINE AVENUE,,0.0,0.0,0,0,0,0,0,0,Turning Improperly,,,,,Bus,,,,,2023-08-01 07:39:00
7397866,3893775,07aeef60-cf18-44a3-95d1-b249b8571ea0,OCCUPANT,UNSPECIFIED,M,22.0,17733938.0,Not Ejected,Does Not Apply,Does Not Apply,Driver,Lap Belt,,,Does Not Apply,Driver,,,05/03/2018,16:02,,,40.78597,-73.96885,"(40.78597, -73.96885)",CENTRAL PARK WEST               ,,,0.0,0.0,0,0,0,0,0,0,Following Too Closely,Unspecified,,,,Motorcycle,Sedan,,,,2018-05-03 16:02:00
9812481,4128715,2fee4e39-49c8-4a52-90e6-67dd9b37ede4,OCCUPANT,UNSPECIFIED,M,26.0,18923352.0,Not Ejected,Does Not Apply,Does Not Apply,Driver,Unknown,,,Does Not Apply,Driver,,,05/03/2019,19:00,MANHATTAN,10017.0,40.750443,-73.96867,"(40.750443, -73.96867)",,,1         UN PLAZA                      ,0.0,0.0,0,0,0,0,0,0,Driver Inattention/Distraction,,,,,Sedan,,,,,2019-05-03 19:00:00
9445719,3919230,0bc84d71-eb95-4800-ba55-52ec8ce77286,OCCUPANT,UNSPECIFIED,,,18741901.0,,,,,,,,,Registrant,,,06/11/2018,6:45,QUEENS,11101.0,40.746704,-73.944214,"(40.746704, -73.944214)",JACKSON AVENUE                  ,45 AVENUE,,0.0,0.0,0,0,0,0,0,0,Driver Inattention/Distraction,Driver Inattention/Distraction,,,,Sedan,Box Truck,,,,2018-06-11 06:45:00
12868571,4696789,ee0972d8-c618-497e-8dd2-741d49174b45,OCCUPANT,UNSPECIFIED,M,35.0,20588388.0,,,,,,,,,Registrant,,,01/12/2024,18:22,BRONX,10465.0,40.823208,-73.81965,"(40.823208, -73.81965)",,,3883      EAST TREMONT AVENUE,3.0,0.0,0,0,0,0,3,0,Unsafe Speed,Unspecified,Unspecified,Unspecified,Unspecified,Station Wagon/Sport Utility Vehicle,Pick-up Truck,Sedan,Sedan,Sedan,2024-01-12 18:22:00
10180095,4213470,ab972d8f-6598-4da3-bd3f-0b343a716fe3,OCCUPANT,INJURED,F,53.0,19106732.0,Not Ejected,Conscious,Back,Driver,Lap Belt & Harness,,,Internal,Driver,,,09/26/2019,12:45,,,40.786785,-73.80971,"(40.786785, -73.80971)",CROSS ISLAND PARKWAY            ,,,1.0,0.0,0,0,0,0,1,0,Driver Inattention/Distraction,Unspecified,,,,Station Wagon/Sport Utility Vehicle,Taxi,,,,2019-09-26 12:45:00
12655250,4641220,67c41526-0bd0-4460-b0c4-f36856e69882,OCCUPANT,UNSPECIFIED,,,20466875.0,,,,,,,,,Registrant,,,06/26/2023,16:54,,,40.72225,-74.00592,"(40.72225, -74.00592)",CANAL STREET,AVENUE OF THE AMERICAS,,0.0,0.0,0,0,0,0,0,0,Driver Inattention/Distraction,Unspecified,,,,Pick-up Truck,Sedan,,,,2023-06-26 16:54:00
5810975,3433513,445656,OCCUPANT,UNSPECIFIED,M,32.0,16975389.0,,,,,,,,,Registrant,,,04/21/2016,16:05,,,,,,EAST 124 STREET                 ,2 AVENUE,,0.0,0.0,0,0,0,0,0,0,Driver Inattention/Distraction,Unspecified,,,,4 dr sedan,Station Wagon/Sport Utility Vehicle,,,,2016-04-21 16:05:00
13437040,4831718,c6254e5b-c125-4374-893d-15d4f878f198,OCCUPANT,UNSPECIFIED,M,51.0,20913879.0,Not Ejected,Does Not Apply,Does Not Apply,Driver,Lap Belt & Harness,,,Does Not Apply,Driver,,,07/30/2025,1:18,,,40.606182,-74.07613,"(40.606182, -74.07613)",STATEN ISLAND EXPRESSWAY,,,1.0,0.0,0,0,0,0,1,0,Following Too Closely,Reaction to Uninvolved Vehicle,,,,Tractor Truck Diesel,Sedan,,,,2025-07-30 01:18:00
12126420,4503858,6e397d67-3bfa-4ad1-95d2-cc0c8d60d248,OCCUPANT,UNSPECIFIED,M,59.0,20165120.0,,,,,,,,,Registrant,,,02/15/2022,15:40,QUEENS,11423.0,40.72014,-73.77601,"(40.72014, -73.77601)",,,86-09     188 STREET,1.0,0.0,0,0,0,0,1,0,Fell Asleep,Unspecified,,,,Sedan,Sedan,,,,2022-02-15 15:40:00
6322114,3508021,1727817,OCCUPANT,UNSPECIFIED,M,0.0,17217272.0,,,,,,,,,Registrant,,,08/26/2016,14:35,BROOKLYN,11221.0,40.691635,-73.91381,"(40.691635, -73.91381)",,,469       CENTRAL AVENUE                ,0.0,0.0,0,0,0,0,0,0,Driver Inattention/Distraction,Outside Car Distraction,,,,Station Wagon/Sport Utility Vehicle,Pick-up Truck,,,,2016-08-26 14:35:00
12983780,4726124,c5bd4394-3dcd-421c-ada4-706c9115ec46,OCCUPANT,UNSPECIFIED,F,31.0,20653679.0,,,,,,,,,Registrant,,,05/20/2024,17:15,,,,,,CLEARVIEW EXPRESSWAY,26 AVENUE,,0.0,0.0,0,0,0,0,0,0,Following Too Closely,Unspecified,,,,Sedan,,,,,2024-05-20 17:15:00
10032023,4178414,9664fec1-bd8d-44e0-9dab-b64146775ea0,OCCUPANT,UNSPECIFIED,F,50.0,19032142.0,,,,,,,,,Registrant,,,07/28/2019,0:26,,,40.61196,-73.96816,"(40.61196, -73.96816)",OCEAN PARKWAY                   ,,,0.0,0.0,0,0,0,0,0,0,Alcohol Involvement,Unspecified,Unspecified,,,Van,Station Wagon/Sport Utility Vehicle,Sedan,,,2019-07-28 00:26:00
12834119,4687623,96d672b9-dd90-4afd-aed6-90507eeba235,OCCUPANT,UNSPECIFIED,F,69.0,20568763.0,,,,,,,,,Registrant,,,12/09/2023,13:30,QUEENS,11422.0,40.66308,-73.73377,"(40.66308, -73.73377)",,,140-19    248 STREET,0.0,0.0,0,0,0,0,0,0,Passing Too Closely,Unspecified,,,,Sedan,Station Wagon/Sport Utility Vehicle,,,,2023-12-09 13:30:00
10224136,4223949,4529dd58-dd86-48f3-a69e-6d6a98c1874e,OCCUPANT,UNSPECIFIED,M,61.0,19128789.0,,,,,,,,,Registrant,,,10/12/2019,13:44,,,,,,CHURCH AVENUE                   ,OCEAN PARKWAY,,0.0,0.0,0,0,0,0,0,0,Unspecified,Unspecified,,,,Station Wagon/Sport Utility Vehicle,Tractor Truck Diesel,,,,2019-10-12 13:44:00
11047578,4279493,c6dbe868-4e96-4c79-bc58-0b2843bbc41c,OCCUPANT,UNSPECIFIED,F,59.0,19552303.0,,,,,,,,,Registrant,,,01/25/2020,18:10,QUEENS,11417.0,40.680164,-73.84095,"(40.680164, -73.84095)",ROCKAWAY BOULEVARD              ,98 STREET,,0.0,0.0,0,0,0,0,0,0,Driver Inattention/Distraction,Unspecified,,,,Sedan,Sedan,,,,2020-01-25 18:10:00
12871842,4697479,4052f179-4b60-4649-a97a-86301418d796,OCCUPANT,UNSPECIFIED,M,45.0,20590291.0,,,,,,,,,Registrant,,,01/23/2024,18:30,QUEENS,11375.0,40.70969,-73.84603,"(40.70969, -73.84603)",METROPOLITAN AVENUE,ASCAN AVENUE,,1.0,0.0,0,0,0,0,1,0,Driver Inattention/Distraction,Unspecified,Unspecified,,,Moped,Sedan,Station Wagon/Sport Utility Vehicle,,,2024-01-23 18:30:00
12981622,4725782,b3d6693f-84f0-4fdc-9c74-fdfb9e4e953a,OCCUPANT,UNSPECIFIED,M,57.0,20652457.0,Not Ejected,Does Not Apply,Does Not Apply,Driver,Lap Belt & Harness,,,Does Not Apply,Driver,,,05/18/2024,20:00,,,40.722576,-73.94049,"(40.722576, -73.94049)",BROOKLYN QUEENS EXPRESSWAY,,,1.0,0.0,0,0,0,0,1,0,Driver Inattention/Distraction,Unspecified,,,,Sedan,Sedan,,,,2024-05-18 20:00:00
12093574,4495341,970f670a-6edb-46ed-887f-c56d1663cc8c,OCCUPANT,UNSPECIFIED,M,33.0,20146071.0,Not Ejected,Does Not Apply,Does Not Apply,Driver,Unknown,,,Does Not Apply,Driver,,,01/13/2022,15:44,MANHATTAN,10023.0,40.781193,-73.97975,"(40.781193, -73.97975)",AMSTERDAM AVENUE,WEST 76 STREET,,0.0,0.0,0,0,0,0,0,0,Driver Inattention/Distraction,Unspecified,Unspecified,,,Station Wagon/Sport Utility Vehicle,Tractor Truck Diesel,Ambulance,,,2022-01-13 15:44:00
5935657,3448551,720590,OCCUPANT,UNSPECIFIED,M,25.0,17034319.0,Not Ejected,Does Not Apply,Does Not Apply,Driver,Lap Belt,,,Does Not Apply,Driver,,,05/20/2016,19:25,MANHATTAN,10025.0,40.80174,-73.96477,"(40.80174, -73.96477)",AMSTERDAM AVENUE                ,WEST 108 STREET,,0.0,0.0,0,0,0,0,0,0,Driver Inattention/Distraction,Unspecified,,,,4 dr sedan,4 dr sedan,,,,2016-05-20 19:25:00
9689491,3949971,db859ce3-c3f9-4ba4-875d-1415d04309c8,OCCUPANT,UNSPECIFIED,F,25.0,18862413.0,Not Ejected,Does Not Apply,Does Not Apply,Driver,Lap Belt & Harness,,,Does Not Apply,Driver,,,07/29/2018,5:00,QUEENS,11411.0,40.68547,-73.72799,"(40.68547, -73.72799)",,,120-11    237 STREET                    ,0.0,0.0,0,0,0,0,0,0,Fell Asleep,Unspecified,Unspecified,,,Station Wagon/Sport Utility Vehicle,Sedan,Pick-up Truck,,,2018-07-29 05:00:00
9158407,3935079,419b5755-a62e-4403-a8b1-c52f7110c006,OCCUPANT,UNSPECIFIED,,0.0,18600935.0,,,,,,,,,Registrant,,,07/03/2018,14:20,MANHATTAN,10040.0,40.86494,-73.92688,"(40.86494, -73.92688)",,,203       DYCKMAN STREET                ,0.0,0.0,0,0,0,0,0,0,Driver Inattention/Distraction,Unspecified,,,,Bus,Sedan,,,,2018-07-03 14:20:00
7670411,3880306,143e4fbd-10c2-4ac0-8930-72f80f097e49,OCCUPANT,UNSPECIFIED,M,68.0,17867622.0,,,,,,,,,Registrant,,,04/13/2018,9:35,QUEENS,11426.0,40.74165,-73.716576,"(40.74165, -73.716576)",81 AVENUE                       ,LITTLE NECK PARKWAY,,0.0,0.0,0,0,0,0,0,0,Traffic Control Disregarded,Unspecified,,,,Sedan,LIGHT,,,,2018-04-13 09:35:00
7680088,3796718,b18fc92b-2e79-4f49-848f-286c0998ca22,OCCUPANT,UNSPECIFIED,F,4.0,17872379.0,Not Ejected,Does Not Apply,Does Not Apply,Right rear passenger or motorcycle sidecar passenger,Lap Belt & Harness,,,Does Not Apply,Passenger,,,11/22/2017,19:30,,,40.681126,-73.96446,"(40.681126, -73.96446)",ATLANTIC AVENUE                 ,WASHINGTON AVENUE,,0.0,0.0,0,0,0,0,0,0,Unspecified,,,,,Sedan,,,,,2017-11-22 19:30:00
11348388,4330436,4cf0e85e-c4e9-48cd-bff1-7242e5b469aa,OCCUPANT,UNSPECIFIED,M,57.0,19711872.0,Not Ejected,Does Not Apply,Does Not Apply,Driver,Unknown,,,Does Not Apply,Driver,,,07/19/2020,21:10,,,40.783268,-73.82485,"(40.783268, -73.82485)",WHITESTONE EXPRESSWAY           ,,,0.0,0.0,0,0,0,0,0,0,Unsafe Lane Changing,Unspecified,,,,Station Wagon/Sport Utility Vehicle,Station Wagon/Sport Utility Vehicle,,,,2020-07-19 21:10:00
6844101,3692475,6a67a3a1-3d36-400f-b3fe-3717b7aad8ed,OCCUPANT,UNSPECIFIED,,,,,,,,,,,,Witness,,,06/15/2017,10:30,BRONX,10456.0,,,"(0.0, 0.0)",,,1465      WASHINGTON AVENUE             ,0.0,0.0,0,0,0,0,0,0,Passing Too Closely,Unspecified,,,,Station Wagon/Sport Utility Vehicle,Sedan,,,,2017-06-15 10:30:00
6950733,3643046,7e363467-98f4-4a8e-8b99-65187e11e60e,OCCUPANT,INJURED,M,49.0,17517585.0,Partially Ejected,Conscious,Entire Body,Driver,Lap Belt & Harness,,,Complaint of Pain,Driver,,,04/01/2017,8:15,,,,,,,,LIE                                     ,1.0,0.0,0,0,0,0,1,0,Driver Inattention/Distraction,Unspecified,,,,Sedan,Pick-up Truck,,,,2017-04-01 08:15:00
12013419,4474160,bafcd0ee-76f0-4729-902d-aa8ac6b51730,OCCUPANT,UNSPECIFIED,F,63.0,20099641.0,Not Ejected,Does Not Apply,Does Not Apply,Driver,Lap Belt & Harness,,,Does Not Apply,Driver,,,11/04/2021,15:05,QUEENS,11366.0,,,,73 AVENUE,187 STREET,,0.0,0.0,0,0,0,0,0,0,Driver Inattention/Distraction,Unspecified,,,,Sedan,Sedan,,,,2021-11-04 15:05:00
11449327,4357078,6d018cb8-657b-4b6a-94a9-d7a9ced3e8e7,OCCUPANT,UNSPECIFIED,M,29.0,19770663.0,Not Ejected,Does Not Apply,Does Not Apply,Driver,Unknown,,,Does Not Apply,Driver,,,10/12/2020,14:45,,,40.692497,-73.87954,"(40.692497, -73.87954)",JACKIE ROBINSON PKWY            ,,,1.0,0.0,0,0,0,0,1,0,Steering Failure,,,,,Sedan,,,,,2020-10-12 14:45:00
12844198,4690168,9f1e91be-2a8d-4a80-9355-69937d71ac5e,OCCUPANT,UNSPECIFIED,M,71.0,20574541.0,,,,,,,,,Registrant,,,12/22/2023,19:00,BROOKLYN,11207.0,40.677208,-73.89723,"(40.677208, -73.89723)",FULTON STREET,PENNSYLVANIA AVENUE,,0.0,0.0,0,0,0,0,0,0,Driver Inattention/Distraction,Driver Inattention/Distraction,,,,Sedan,Sedan,,,,2023-12-22 19:00:00
6186870,3527953,2091749,OCCUPANT,UNSPECIFIED,F,14.0,17154092.0,Not Ejected,Does Not Apply,Does Not Apply,"Middle rear seat, or passenger lying across a seat",Lap Belt & Harness,,,Does Not Apply,Passenger,,,09/25/2016,17:15,QUEENS,11693.0,40.60957,-73.81905,"(40.60957, -73.81905)",CROSS BAY BOULEVARD             ,EAST 6 ROAD,,0.0,0.0,0,0,0,0,0,0,Following Too Closely,Unspecified,,,,Station Wagon/Sport Utility Vehicle,Station Wagon/Sport Utility Vehicle,,,,2016-09-25 17:15:00
6936064,3683668,15c7389f-3988-477d-bf18-582924a34e40,OCCUPANT,UNSPECIFIED,M,18.0,17510568.0,Not Ejected,Does Not Apply,Does Not Apply,Driver,Unknown,,,Does Not Apply,Driver,,,06/02/2017,16:00,STATEN ISLAND,10314.0,40.617874,-74.11788,"(40.617874, -74.11788)",SLOSSON AVENUE                  ,RICE AVENUE,,0.0,0.0,0,0,0,0,0,0,Driver Inattention/Distraction,Unspecified,,,,Station Wagon/Sport Utility Vehicle,Station Wagon/Sport Utility Vehicle,,,,2017-06-02 16:00:00
6610387,3553610,2570844,OCCUPANT,UNSPECIFIED,M,40.0,17354221.0,Not Ejected,Does Not Apply,Does Not Apply,"Middle front seat, or passenger lying across a seat",Lap Belt & Harness,,,Does Not Apply,Passenger,,,11/03/2016,13:00,BRONX,10451.0,40.821167,-73.91356,"(40.821167, -73.91356)",ELTON AVENUE                    ,EAST 157 STREET,,0.0,0.0,0,0,0,0,0,0,Backing Unsafely,Unspecified,,,,Sedan,Carry All,,,,2016-11-03 13:00:00
11918020,4449722,00afa1e9-dd6e-415a-bd7d-26aa0f2a809f,OCCUPANT,UNSPECIFIED,,,20044303.0,,,,,,,,,Registrant,,,08/08/2021,4:15,MANHATTAN,10010.0,40.741623,-73.993744,"(40.741623, -73.993744)",WEST 21 STREET,AVENUE OF THE AMERICAS,,0.0,0.0,0,0,0,0,0,0,Alcohol Involvement,Unspecified,,,,Sedan,Sedan,,,,2021-08-08 04:15:00
9048771,4093619,79c56a8d-8d0b-4ed9-8527-ee12970995d0,OCCUPANT,UNSPECIFIED,,57.0,18546531.0,,,,,,,,,Registrant,,,03/09/2019,12:00,,,40.83801,-73.87329,"(40.83801, -73.87329)",BRONX RIVER PARKWAY             ,,,0.0,0.0,0,0,0,0,0,0,Following Too Closely,Unspecified,,,,Station Wagon/Sport Utility Vehicle,Station Wagon/Sport Utility Vehicle,,,,2019-03-09 12:00:00
12076984,4490764,16ae1576-e386-4bd0-a448-5903c74cbbc6,OCCUPANT,UNSPECIFIED,M,41.0,20136249.0,Not Ejected,Does Not Apply,Does Not Apply,Driver,Lap Belt & Harness,,,Does Not Apply,Driver,,,12/29/2021,17:50,,,40.703724,-73.95979,"(40.703724, -73.95979)",BROOKLYN QUEENS EXPRESSWAY,,,1.0,0.0,0,0,0,0,1,0,Driver Inattention/Distraction,Unspecified,,,,Station Wagon/Sport Utility Vehicle,Sedan,,,,2021-12-29 17:50:00
7928769,3809715,c8ae2d38-7aca-415e-a2a0-1b64796b0f13,OCCUPANT,UNSPECIFIED,M,22.0,17993773.0,,,,,,,,,Registrant,,,12/15/2017,17:00,QUEENS,11434.0,40.65965,-73.773834,"(40.65965, -73.773834)",FARMERS BOULEVARD               ,ROCKAWAY BOULEVARD,,2.0,0.0,0,0,0,0,2,0,Pavement Slippery,Unspecified,,,,Sedan,Station Wagon/Sport Utility Vehicle,,,,2017-12-15 17:00:00
6163334,3417642,1147830,OCCUPANT,UNSPECIFIED,,,,,,,,,,,,Witness,,,03/17/2016,16:00,,,40.663517,-73.957214,"(40.663517, -73.957214)",EMPIRE BOULEVARD                ,,,1.0,0.0,1,0,0,0,0,0,Backing Unsafely,,,,,Station Wagon/Sport Utility Vehicle,,,,,2016-03-17 16:00:00
11196645,4265982,4ddde110-c038-4252-b675-1a032879bf5d,OCCUPANT,UNSPECIFIED,,,19631070.0,,,,,,,,,Registrant,,,12/27/2019,9:20,BROOKLYN,11236.0,40.640236,-73.90598,"(40.640236, -73.90598)",FLATLANDS AVENUE                ,REMSEN AVENUE,,1.0,0.0,0,0,0,0,1,0,Unspecified,Unspecified,,,,Sedan,Station Wagon/Sport Utility Vehicle,,,,2019-12-27 09:20:00
12614757,4630762,97632de1-9b37-4704-b2f1-d82302d1bd1c,OCCUPANT,UNSPECIFIED,M,55.0,20444005.0,,,,,,,,,Registrant,,,05/21/2023,18:25,BROOKLYN,11201.0,40.698124,-73.98699,"(40.698124, -73.98699)",,,203       JAY STREET,1.0,0.0,0,0,1,0,0,0,Driver Inattention/Distraction,Unspecified,,,,Sedan,Bike,,,,2023-05-21 18:25:00
11467257,4361850,3ec3b83e-5b88-4304-b26a-05554d241826,OCCUPANT,UNSPECIFIED,F,8.0,19781086.0,Not Ejected,Does Not Apply,Does Not Apply,"Left rear passenger, or rear passenger on a bicycle, motorcycle, snowmobile",,,,Does Not Apply,Passenger,,,10/27/2020,16:00,,,40.806835,-73.924355,"(40.806835, -73.924355)",MAJOR DEEGAN EXPRESSWAY         ,,,0.0,0.0,0,0,0,0,0,0,Other Vehicular,Other Vehicular,,,,Sedan,Sedan,,,,2020-10-27 16:00:00
5752173,3414209,381006,OCCUPANT,UNSPECIFIED,M,,16946630.0,Not Ejected,Conscious,Does Not Apply,Unknown,Lap Belt & Harness,,,Does Not Apply,Passenger,,,03/24/2016,18:51,,,40.872585,-73.88128,"(40.872585, -73.88128)",,,BAINBRIDGE AVENUE                       ,0.0,0.0,0,0,0,0,0,0,Unspecified,Unspecified,,,,Sedan,Sedan,,,,2016-03-24 18:51:00
11592450,4395088,62ca723b-5c97-4d13-a4f0-88f0e52acc08,OCCUPANT,UNSPECIFIED,M,37.0,19854717.0,Not Ejected,Does Not Apply,Does Not Apply,Driver,Lap Belt,,,Does Not Apply,Driver,,,02/25/2021,8:30,BROOKLYN,11206.0,40.693905,-73.94892,"(40.693905, -73.94892)",MARCY AVENUE                    ,WILLOUGHBY AVENUE,,0.0,0.0,0,0,0,0,0,0,Unsafe Lane Changing,Unspecified,,,,Station Wagon/Sport Utility Vehicle,Tanker,,,,2021-02-25 08:30:00
13320755,4801180,f39c0c59-e4a4-453f-b9d5-ab555234b08d,OCCUPANT,UNSPECIFIED,M,70.0,20847097.0,,,,,,,,,Registrant,,,03/24/2025,18:10,,,40.7092,-73.9919,"(40.7092, -73.9919)",MANHATTAN BR UPPER,,,1.0,0.0,0,0,0,0,1,0,Following Too Closely,Following Too Closely,,,,Sedan,Sedan,,,,2025-03-24 18:10:00
12358393,4564354,c0d20092-bd74-44a5-96df-e512ccabb3c3,OCCUPANT,INJURED,F,25.0,20298356.0,Not Ejected,Conscious,Head,"Front passenger, if two or more persons, including the driver, are in the front seat",Lap Belt & Harness,,,Complaint of Pain or Nausea,Passenger,,,09/13/2022,7:55,QUEENS,11693.0,40.60701,-73.81945,"(40.60701, -73.81945)",,,803       CROSS BAY BOULEVARD,3.0,0.0,0,0,0,0,3,0,Driver Inattention/Distraction,Unspecified,,,,Sedan,Station Wagon/Sport Utility Vehicle,,,,2022-09-13 07:55:00
12577183,4621084,21631b08-03e1-4d85-8967-2de64c19412c,OCCUPANT,UNSPECIFIED,M,64.0,20423092.0,,,,,,,,,Registrant,,,04/15/2023,15:40,QUEENS,11423.0,40.716694,-73.76059,"(40.716694, -73.76059)",90 AVENUE,201 STREET,,2.0,0.0,0,0,0,0,2,0,Driver Inexperience,Driver Inexperience,,,,Station Wagon/Sport Utility Vehicle,Sedan,,,,2023-04-15 15:40:00
7809628,3788853,cdcf0181-b858-4c72-905a-fabc2c53cba1,OCCUPANT,UNSPECIFIED,,6.0,17935279.0,,,,,,,,,Registrant,,,11/10/2017,9:20,BROOKLYN,11249.0,40.70683,-73.9684,"(40.70683, -73.9684)",DIVISION AVENUE                 ,KENT AVENUE,,0.0,0.0,0,0,0,0,0,0,Failure to Yield Right-of-Way,Unspecified,,,,Pick-up Truck,Sedan,,,,2017-11-10 09:20:00
5735360,3414151,380635,OCCUPANT,UNSPECIFIED,F,29.0,16938014.0,Not Ejected,Does Not Apply,Does Not Apply,Driver,Lap Belt & Harness,,,Does Not Apply,Driver,,,03/17/2016,15:00,,,,,,bailey ave                      ,sedwick ave,,0.0,0.0,0,0,0,0,0,0,Unspecified,Unspecified,,,,4 dr sedan,Station Wagon/Sport Utility Vehicle,,,,2016-03-17 15:00:00
11473847,4363560,c11d6286-8329-4d0b-8809-360ee987dcc1,OCCUPANT,UNSPECIFIED,M,55.0,19784866.0,,,,,,,,,Registrant,,,11/01/2020,16:38,QUEENS,11418.0,40.699215,-73.81609,"(40.699215, -73.81609)",91 AVENUE                       ,135 STREET,,2.0,0.0,0,0,0,0,2,0,Driver Inattention/Distraction,Unspecified,Unspecified,,,Sedan,Sedan,Sedan,,,2020-11-01 16:38:00
12515759,4605509,9cdcd850-4c19-4943-8965-4acfd8b44f05,OCCUPANT,UNSPECIFIED,M,32.0,20388168.0,Not Ejected,Does Not Apply,Does Not Apply,Driver,,,,Does Not Apply,Driver,,,02/11/2023,14:38,MANHATTAN,10001.0,40.745556,-73.989395,"(40.745556, -73.989395)",,,44        WEST 28 STREET,0.0,0.0,0,0,0,0,0,0,Driver Inattention/Distraction,Unspecified,,,,Station Wagon/Sport Utility Vehicle,Box Truck,,,,2023-02-11 14:38:00
11504297,4371549,68114736-7dc5-4af5-95a8-142fd1e3f14d,OCCUPANT,UNSPECIFIED,,,19802542.0,,,,,,,,,Registrant,,,11/29/2020,11:55,BRONX,10472.0,40.832546,-73.86749,"(40.832546, -73.86749)",,,1295      SAINT LAWRENCE AVENUE         ,0.0,0.0,0,0,0,0,0,0,Unspecified,Unspecified,Unspecified,Unspecified,,Station Wagon/Sport Utility Vehicle,Station Wagon/Sport Utility Vehicle,Station Wagon/Sport Utility Vehicle,Station Wagon/Sport Utility Vehicle,,2020-11-29 11:55:00
11153350,4257874,18e3b0a9-fa83-4e79-8e29-d8be7df1352e,OCCUPANT,UNSPECIFIED,M,33.0,19608075.0,Not Ejected,Does Not Apply,Does Not Apply,"Front passenger, if two or more persons, including the driver, are in the front seat",Lap Belt,,,Does Not Apply,Passenger,,,12/14/2019,21:46,,,40.827103,-73.94997,"(40.827103, -73.94997)",WEST 146 STREET                 ,,,0.0,0.0,0,0,0,0,0,0,Driver Inattention/Distraction,Driver Inattention/Distraction,,,,Taxi,Sedan,,,,2019-12-14 21:46:00
12815096,4682631,d04fa768-53e7-429b-a6b1-70cbf0084682,OCCUPANT,UNSPECIFIED,M,39.0,20557986.0,,,,,,,,,Registrant,,,11/26/2023,16:05,,,,,,BRONX WHITESTONE BRIDGE,,,0.0,0.0,0,0,0,0,0,0,Following Too Closely,Following Too Closely,,,,Station Wagon/Sport Utility Vehicle,Station Wagon/Sport Utility Vehicle,,,,2023-11-26 16:05:00
12605637,4628382,a97fee8d-fc4e-4970-9637-40b1202296a5,OCCUPANT,UNSPECIFIED,M,56.0,20438976.0,,,,,,,,,Registrant,,,05/12/2023,21:13,BROOKLYN,11209.0,40.624325,-74.030716,"(40.624325, -74.030716)",85 STREET,3 AVENUE,,0.0,0.0,0,0,0,0,0,0,Passing or Lane Usage Improper,Unspecified,,,,Sedan,Sedan,,,,2023-05-12 21:13:00
9174153,3916326,22a7583c-cb58-4084-895d-2fdd37a40ed1,OCCUPANT,UNSPECIFIED,M,43.0,18608731.0,,,,,,,,,Registrant,,,06/05/2018,9:21,BRONX,10467.0,40.88709,-73.87803,"(40.88709, -73.87803)",JEROME AVENUE                   ,BAINBRIDGE AVENUE,,0.0,0.0,0,0,0,0,0,0,Unspecified,Unspecified,,,,Station Wagon/Sport Utility Vehicle,Sedan,,,,2018-06-05 09:21:00
12892952,4702852,8727beb6-13d0-42a3-8d18-bb277f860f22,OCCUPANT,UNSPECIFIED,F,47.0,20602193.0,,,,,,,,,Registrant,,,02/04/2024,13:26,QUEENS,11413.0,40.69013,-73.74813,"(40.69013, -73.74813)",121 AVENUE,NASHVILLE BOULEVARD,,0.0,0.0,0,0,0,0,0,0,Unspecified,,,,,Station Wagon/Sport Utility Vehicle,,,,,2024-02-04 13:26:00
9319382,3989426,f2c70342-c22e-4abe-a9db-8a6787ef8256,OCCUPANT,UNSPECIFIED,,17.0,18680008.0,Not Ejected,Does Not Apply,Does Not Apply,Unknown,Unknown,,,Does Not Apply,Passenger,,,09/27/2018,18:50,BRONX,10471.0,40.88939,-73.89839,"(40.88939, -73.89839)",BROADWAY                        ,WEST 242 STREET,,0.0,0.0,0,0,0,0,0,0,Unspecified,Unspecified,,,,Bus,Station Wagon/Sport Utility Vehicle,,,,2018-09-27 18:50:00
6892270,3685767,d6d8a98c-80be-4c41-922c-16843a919d70,OCCUPANT,UNSPECIFIED,M,92.0,17489641.0,Not Ejected,Does Not Apply,Does Not Apply,Driver,Lap Belt & Harness,,,Does Not Apply,Driver,,,06/07/2017,8:45,BROOKLYN,11236.0,40.635506,-73.913284,"(40.635506, -73.913284)",FLATLANDS AVENUE                ,EAST 80 STREET,,0.0,0.0,0,0,0,0,0,0,Unspecified,Unspecified,,,,Station Wagon/Sport Utility Vehicle,Sedan,,,,2017-06-07 08:45:00
11802397,4425120,7bf41bfd-8b50-4053-947a-310590821797,OCCUPANT,UNSPECIFIED,F,68.0,19976363.0,Not Ejected,Does Not Apply,Does Not Apply,Driver,Unknown,,,Does Not Apply,Driver,,,06/08/2021,10:40,,,,,,TRIBOROUGH BRIDGE,,,2.0,0.0,0,0,0,0,2,0,Following Too Closely,Following Too Closely,Unspecified,,,Station Wagon/Sport Utility Vehicle,Sedan,Pick-up Truck,,,2021-06-08 10:40:00
9216235,3919868,13d4a3fc-5d5a-4c21-b3a3-f6ec3e458f66,OCCUPANT,UNSPECIFIED,M,36.0,18629431.0,Not Ejected,Does Not Apply,Does Not Apply,Driver,Lap Belt & Harness,,,Does Not Apply,Driver,,,06/12/2018,8:29,BROOKLYN,11234.0,40.624245,-73.93506,"(40.624245, -73.93506)",,,4018      KINGS HIGHWAY                 ,0.0,0.0,0,0,0,0,0,0,Following Too Closely,Unspecified,Unspecified,,,Station Wagon/Sport Utility Vehicle,Sedan,Sedan,,,2018-06-12 08:29:00
10990468,4269083,d1ebc532-31a2-476f-a7fb-0231f752f564,OCCUPANT,UNSPECIFIED,M,45.0,19523113.0,,,,,,,,,Registrant,,,01/05/2020,15:00,BRONX,10462.0,40.84169,-73.86012,"(40.84169, -73.86012)",,,2000      EAST TREMONT AVENUE           ,0.0,0.0,0,0,0,0,0,0,Driver Inattention/Distraction,Unspecified,Unspecified,Unspecified,,Sedan,Sedan,Sedan,Station Wagon/Sport Utility Vehicle,,2020-01-05 15:00:00
6279531,3468417,1058945,OCCUPANT,UNSPECIFIED,M,49.0,17197308.0,Not Ejected,Does Not Apply,Does Not Apply,Driver,Lap Belt & Harness,,,Does Not Apply,Driver,,,06/25/2016,11:00,QUEENS,11375.0,40.719368,-73.836006,"(40.719368, -73.836006)",113 STREET                      ,75 AVENUE,,0.0,0.0,0,0,0,0,0,0,Failure to Yield Right-of-Way,Unspecified,,,,Station Wagon/Sport Utility Vehicle,4 dr sedan,,,,2016-06-25 11:00:00
7043480,3702666,673060db-9486-42cd-ae0c-634b85f58ba2,OCCUPANT,UNSPECIFIED,F,46.0,17562210.0,Not Ejected,Does Not Apply,Does Not Apply,Driver,Lap Belt & Harness,,,Does Not Apply,Driver,,,07/01/2017,13:16,BRONX,10453.0,40.861862,-73.91282,"(40.861862, -73.91282)",WEST FORDHAM ROAD               ,MAJOR DEEGAN EXPRESSWAY,,0.0,0.0,0,0,0,0,0,0,Following Too Closely,Unspecified,Unspecified,,,Sedan,Sedan,,,,2017-07-01 13:16:00
6933132,3687258,a1b41c64-dd9e-41ec-a4ae-abc2a7b9f763,OCCUPANT,UNSPECIFIED,F,38.0,17509228.0,Not Ejected,Does Not Apply,Does Not Apply,Driver,Lap Belt & Harness,,,Does Not Apply,Driver,,,06/07/2017,7:05,,,40.65711,-73.91335,"(40.65711, -73.91335)",STRAUSS STREET                  ,,,0.0,0.0,0,0,0,0,0,0,Driver Inattention/Distraction,Following Too Closely,,,,Sedan,Sedan,,,,2017-06-07 07:05:00
7673636,3795156,24b9861f-e43d-4308-8078-8e2e4b58ba6d,OCCUPANT,UNSPECIFIED,,0.0,17869198.0,,,,,,,,,Registrant,,,11/21/2017,21:03,BROOKLYN,11236.0,40.63895,-73.90585,"(40.63895, -73.90585)",,,947       EAST 89 STREET                ,0.0,0.0,0,0,0,0,0,0,Driver Inattention/Distraction,Unspecified,,,,Sedan,Sedan,,,,2017-11-21 21:03:00
7819247,3763304,41996f48-b817-46bc-a3ad-da17d29e9fe2,OCCUPANT,UNSPECIFIED,M,55.0,17940038.0,,,,,,,,,Registrant,,,10/02/2017,19:58,,,,,,48th Ave                        ,206 STREET,,1.0,0.0,1,0,0,0,0,0,,,,,,Station Wagon/Sport Utility Vehicle,,,,,2017-10-02 19:58:00
6948294,3684328,bc992740-ae23-4ef8-9117-1b6d3f06bc01,OCCUPANT,UNSPECIFIED,F,15.0,17516418.0,Not Ejected,Does Not Apply,Does Not Apply,"Any person in the rear of a station wagon, pick-up truck, all passengers on a bus, etc",Lap Belt & Harness,,,Does Not Apply,Passenger,,,06/03/2017,23:51,,,40.800983,-73.92927,"(40.800983, -73.92927)",TRIBOROUGH BRIDGE               ,,,0.0,0.0,0,0,0,0,0,0,Following Too Closely,Unspecified,Unspecified,Unspecified,,Sedan,Sedan,Sedan,Sedan,,2017-06-03 23:51:00
11239383,3989590,43a2592d-d1f8-4c6b-bf9b-9be7a6bb573a,OCCUPANT,UNSPECIFIED,F,47.0,19652477.0,,,,,,,,,Registrant,,,09/28/2018,9:00,QUEENS,11427.0,40.732536,-73.765564,"(40.732536, -73.765564)",UNION TURNPIKE                  ,CLEARVIEW EXPRESSWAY,,1.0,0.0,0,0,0,0,1,0,Failure to Yield Right-of-Way,Unspecified,,,,Sedan,Station Wagon/Sport Utility Vehicle,,,,2018-09-28 09:00:00
6615781,3581597,3085016,OCCUPANT,UNSPECIFIED,M,41.0,17356817.0,Not Ejected,Does Not Apply,Does Not Apply,Driver,,,,Does Not Apply,Driver,,,12/14/2016,14:10,MANHATTAN,10001.0,40.744762,-73.99517,"(40.744762, -73.99517)",7 AVENUE                        ,WEST 24 STREET,,0.0,0.0,0,0,0,0,0,0,Unsafe Lane Changing,Unspecified,,,,Sedan,Station Wagon/Sport Utility Vehicle,,,,2016-12-14 14:10:00
6473146,3545093,2371605,OCCUPANT,UNSPECIFIED,M,24.0,17288731.0,Not Ejected,Does Not Apply,Does Not Apply,Driver,Lap Belt & Harness,,,Does Not Apply,Driver,,,10/18/2016,21:40,MANHATTAN,10016.0,40.742496,-73.98209,"(40.742496, -73.98209)",,,137       EAST 28 STREET                ,0.0,0.0,0,0,0,0,0,0,Backing Unsafely,,,,,Station Wagon/Sport Utility Vehicle,,,,,2016-10-18 21:40:00
10296145,4240207,5a19c1de-66ea-4fc9-bb49-3da8902e0ca5,OCCUPANT,UNSPECIFIED,F,33.0,19164649.0,Not Ejected,Does Not Apply,Does Not Apply,Driver,Lap Belt,,,Does Not Apply,Driver,,,11/12/2019,22:53,MANHATTAN,10004.0,40.703598,-74.0144,"(40.703598, -74.0144)",STATE STREET                    ,BRIDGE STREET,,0.0,0.0,0,0,0,0,0,0,Following Too Closely,Unspecified,,,,Station Wagon/Sport Utility Vehicle,Station Wagon/Sport Utility Vehicle,,,,2019-11-12 22:53:00
12910344,4707433,05de6006-761a-4294-b98a-47c9a8c10708,OCCUPANT,UNSPECIFIED,F,42.0,20612142.0,,,,,,,,,Registrant,,,03/05/2024,16:34,BROOKLYN,11210.0,40.632145,-73.952736,"(40.632145, -73.952736)",BEDFORD AVENUE,CAMPUS ROAD,,0.0,0.0,0,0,0,0,0,0,Passing or Lane Usage Improper,Unspecified,,,,Station Wagon/Sport Utility Vehicle,Station Wagon/Sport Utility Vehicle,,,,2024-03-05 16:34:00
12771270,4671153,56300280-c90f-44ec-8b23-cc84e269e27a,OCCUPANT,UNSPECIFIED,M,16.0,20533169.0,Not Ejected,Does Not Apply,Does Not Apply,"Front passenger, if two or more persons, including the driver, are in the front seat",Lap Belt & Harness,,,Does Not Apply,Passenger,,,10/14/2023,14:25,,,40.613804,-74.11338,"(40.613804, -74.11338)",VICTORY BOULEVARD,,,0.0,0.0,0,0,0,0,0,0,Unspecified,Unspecified,,,,Sedan,Station Wagon/Sport Utility Vehicle,,,,2023-10-14 14:25:00
9915700,4152234,acc9a1ce-8ca4-4c64-b5f7-34928264f0da,OCCUPANT,UNSPECIFIED,F,52.0,18974363.0,Not Ejected,Does Not Apply,Does Not Apply,Driver,Lap Belt & Harness,,,Does Not Apply,Driver,,,06/14/2019,13:00,BROOKLYN,11233.0,40.67619,-73.9081,"(40.67619, -73.9081)",ATLANTIC AVENUE                 ,EASTERN PARKWAY,,0.0,0.0,0,0,0,0,0,0,Unspecified,Unspecified,,,,Station Wagon/Sport Utility Vehicle,Station Wagon/Sport Utility Vehicle,,,,2019-06-14 13:00:00
12380199,4569952,31221ea9-c9ea-43bd-a5a2-fdf9f607ca0d,OCCUPANT,UNSPECIFIED,,,20310992.0,,,,,,,,,Registrant,,,10/03/2022,21:56,MANHATTAN,10010.0,40.737404,-73.98421,"(40.737404, -73.98421)",,,256       3 AVENUE,1.0,0.0,1,0,0,0,0,0,Unspecified,,,,,Bus,,,,,2022-10-03 21:56:00
9598689,4036459,a08c220e-1ca9-482a-9387-37450e5112cc,OCCUPANT,UNSPECIFIED,M,29.0,18817589.0,Not Ejected,Does Not Apply,Does Not Apply,Driver,Unknown,,,Does Not Apply,Driver,,,12/01/2018,17:50,BRONX,10468.0,40.867474,-73.89741,"(40.867474, -73.89741)",EAST KINGSBRIDGE ROAD           ,JEROME AVENUE,,0.0,0.0,0,0,0,0,0,0,Failure to Yield Right-of-Way,Unspecified,,,,Station Wagon/Sport Utility Vehicle,Sedan,,,,2018-12-01 17:50:00
11301749,4318614,f5e81b31-d4b4-4bda-a7e2-b9682b34abd2,OCCUPANT,UNSPECIFIED,M,39.0,19685119.0,,,,,,,,,Registrant,,,06/06/2020,14:28,,,40.81328,-73.89749,"(40.81328, -73.89749)",BRUCKNER EXPRESSWAY             ,,,0.0,0.0,0,0,0,0,0,0,Driver Inattention/Distraction,Unspecified,,,,Motorcycle,Sedan,,,,2020-06-06 14:28:00
12108633,4498221,0d783e4b-52d5-4d91-8219-ce2a41bb221d,OCCUPANT,UNSPECIFIED,M,64.0,20154940.0,,,,,,,,,Registrant,,,01/29/2022,0:00,,,,,,CROSS BRONX EXPY RAMP,,,2.0,0.0,0,0,0,0,2,0,Pavement Slippery,,,,,Station Wagon/Sport Utility Vehicle,,,,,2022-01-29 00:00:00
7703713,3888600,cc607e49-2add-45d2-bd21-b5e1e398ceee,OCCUPANT,UNSPECIFIED,,0.0,17884012.0,,,,,,,,,Registrant,,,04/26/2018,8:00,QUEENS,11354.0,40.76536,-73.82787,"(40.76536, -73.82787)",35 AVENUE                       ,UNION STREET,,0.0,0.0,0,0,0,0,0,0,Other Vehicular,Passing Too Closely,,,,Sedan,Sedan,,,,2018-04-26 08:00:00
11118498,4296508,ab299f58-f9f2-4e3f-b8bb-98c9c6ae9d44,OCCUPANT,UNSPECIFIED,,,19589100.0,,,,,,,,,Registrant,,,03/02/2020,15:45,BRONX,10454.0,40.80348,-73.90781,"(40.80348, -73.90781)",WALNUT AVENUE                   ,EAST 139 STREET,,0.0,0.0,0,0,0,0,0,0,Reaction to Uninvolved Vehicle,Unspecified,,,,Station Wagon/Sport Utility Vehicle,Sedan,,,,2020-03-02 15:45:00
13449175,4834920,c1ba784f-ff9e-4e5e-bfb9-c4eab9f99fa5,BICYCLIST,INJURED,M,14.0,20920892.0,Ejected,Conscious,Knee-Lower Leg Foot,Driver,,,,Fracture - Distorted - Dislocation,Driver,,,08/06/2025,19:40,BROOKLYN,11233.0,40.676937,-73.92182,"(40.676937, -73.92182)",RALPH AVE,ATLANTIC AVE,,1.0,0.0,0,0,1,0,0,0,Driver Inattention/Distraction,Driver Inattention/Distraction,,,,Sedan,Bike,,,,2025-08-06 19:40:00
6305073,3488273,1299506,OCCUPANT,UNSPECIFIED,F,38.0,17209363.0,Not Ejected,Does Not Apply,Does Not Apply,Driver,,,,Does Not Apply,Driver,,,07/22/2016,19:30,BROOKLYN,11210.0,40.628162,-73.94137,"(40.628162, -73.94137)",,,1844      BROOKLYN AVENUE               ,0.0,0.0,0,0,0,0,0,0,Driver Inattention/Distraction,Unspecified,,,,Station Wagon/Sport Utility Vehicle,4 dr sedan,,,,2016-07-22 19:30:00
9150336,4112306,27aaeaad-26da-461c-b2db-fcd1fa97b59d,OCCUPANT,UNSPECIFIED,F,36.0,18596938.0,Not Ejected,Does Not Apply,Does Not Apply,"Any person in the rear of a station wagon, pick-up truck, all passengers on a bus, etc",Lap Belt,,,Does Not Apply,Passenger,,,04/10/2019,8:00,,,40.709805,-73.76882,"(40.709805, -73.76882)",190 STREET                      ,,,0.0,0.0,0,0,0,0,0,0,Passing Too Closely,Passing Too Closely,,,,Sedan,Bus,,,,2019-04-10 08:00:00
11004759,4276780,c5a0a5cf-cad1-4c03-ab49-c14a5ffba0bc,OCCUPANT,UNSPECIFIED,M,27.0,19530335.0,,,,,,,,,Registrant,,,01/21/2020,6:35,,,40.78614,-73.93929,"(40.78614, -73.93929)",FDR DRIVE                       ,,,0.0,0.0,0,0,0,0,0,0,Driver Inattention/Distraction,Unspecified,,,,Station Wagon/Sport Utility Vehicle,Station Wagon/Sport Utility Vehicle,,,,2020-01-21 06:35:00
6005511,3433030,521098,OCCUPANT,UNSPECIFIED,F,,17067020.0,Not Ejected,Does Not Apply,Does Not Apply,"Middle front seat, or passenger lying across a seat",Lap Belt & Harness,,,Does Not Apply,Passenger,,,04/29/2016,12:49,QUEENS,11358.0,,,,33 AVENUE                       ,169 STREET,,0.0,0.0,0,0,0,0,0,0,Failure to Yield Right-of-Way,Unspecified,,,,Station Wagon/Sport Utility Vehicle,Station Wagon/Sport Utility Vehicle,,,,2016-04-29 12:49:00
7617117,3899527,81a97413-ab56-4197-950f-8200afcd5da3,OCCUPANT,UNSPECIFIED,,,17841608.0,,,,,,,,,Registrant,,,05/14/2018,6:00,MANHATTAN,10022.0,40.762913,-73.96981,"(40.762913, -73.96981)",EAST 59 STREET                  ,PARK AVENUE,,0.0,0.0,0,0,0,0,0,0,Driver Inattention/Distraction,Driver Inattention/Distraction,,,,Taxi,Sedan,,,,2018-05-14 06:00:00
7724167,3796218,87b6a03c-67df-46e1-a0b0-a7aa1ea53593,OCCUPANT,UNSPECIFIED,M,22.0,17893910.0,Not Ejected,Does Not Apply,Does Not Apply,"Left rear passenger, or rear passenger on a bicycle, motorcycle, snowmobile",Lap Belt,,,Does Not Apply,Passenger,,,11/23/2017,0:00,BRONX,10457.0,40.846546,-73.895584,"(40.846546, -73.895584)",,,612       EAST TREMONT AVENUE           ,2.0,0.0,0,0,0,0,2,0,Following Too Closely,Unspecified,Unspecified,,,Station Wagon/Sport Utility Vehicle,Station Wagon/Sport Utility Vehicle,Station Wagon/Sport Utility Vehicle,,,2017-11-23 00:00:00
12611518,4629525,0b811fcd-8f9d-437d-96c2-460d15eec24d,OCCUPANT,UNSPECIFIED,F,55.0,20442213.0,,,,,,,,,Registrant,,,05/15/2023,12:55,BROOKLYN,11239.0,,,,ERSKINE STREET,SCHROEDERS AVE,,0.0,0.0,0,0,0,0,0,0,Other Vehicular,Following Too Closely,,,,Sedan,,,,,2023-05-15 12:55:00
7384174,3843698,d3669dde-11ca-4ec9-a500-2c408bc894ae,OCCUPANT,UNSPECIFIED,M,31.0,17727314.0,,,,,,,,,Registrant,,,02/08/2018,17:29,,,40.804264,-73.91349,"(40.804264, -73.91349)",BRUCKNER BOULEVARD              ,EAST 137 STREET,,0.0,0.0,0,0,0,0,0,0,Other Vehicular,,,,,Sedan,,,,,2018-02-08 17:29:00
10151429,4206681,eb29fc4b-7f43-4625-a29f-1eb43d924b3e,OCCUPANT,UNSPECIFIED,F,31.0,19092362.0,Not Ejected,Does Not Apply,Does Not Apply,Driver,Lap Belt,,,Does Not Apply,Driver,,,09/10/2019,15:30,QUEENS,11103.0,40.769283,-73.91615,"(40.769283, -73.91615)",,,25-16     34 STREET                     ,0.0,0.0,0,0,0,0,0,0,Passing Too Closely,Unspecified,,,,Station Wagon/Sport Utility Vehicle,Sedan,,,,2019-09-10 15:30:00
7490721,3886705,52059219-9a72-4fc4-8147-412e866a3f84,OCCUPANT,UNSPECIFIED,F,53.0,17779492.0,,,,,,,,,Registrant,,,04/20/2018,16:45,,,40.736988,-73.97489,"(40.736988, -73.97489)",FDR DRIVE                       ,EAST 25 STREET,,2.0,0.0,0,0,0,0,2,0,Following Too Closely,Unspecified,,,,Station Wagon/Sport Utility Vehicle,Station Wagon/Sport Utility Vehicle,,,,2018-04-20 16:45:00
11400598,4317519,fa636c39-37d1-430a-8ea6-4202e8c9308a,OCCUPANT,UNSPECIFIED,M,23.0,19742345.0,Not Ejected,Does Not Apply,Does Not Apply,Driver,Lap Belt,,,Does Not Apply,Driver,,,06/03/2020,10:10,BRONX,10468.0,40.867355,-73.89749,"(40.867355, -73.89749)",,,2666      JEROME AVENUE                 ,0.0,0.0,0,0,0,0,0,0,Unspecified,,,,,Sedan,,,,,2020-06-03 10:10:00
10184672,4214802,1583ba0f-dbbc-42aa-9d84-4cbcaa7223d3,OCCUPANT,INJURED,M,27.0,19108975.0,Not Ejected,Conscious,Knee-Lower Leg Foot,Driver,Air Bag Deployed/Lap Belt/Harness,,,Complaint of Pain or Nausea,Driver,,,09/28/2019,13:00,QUEENS,11418.0,40.698822,-73.84701,"(40.698822, -73.84701)",FREEDOM DRIVE                   ,PARK LANE SOUTH,,7.0,0.0,0,0,0,0,7,0,Unsafe Speed,Unspecified,,,,Sedan,Sedan,,,,2019-09-28 13:00:00
6267389,3463921,985855,OCCUPANT,UNSPECIFIED,F,20.0,17191720.0,Not Ejected,Does Not Apply,Does Not Apply,Right rear passenger or motorcycle sidecar passenger,Lap Belt & Harness,,,Does Not Apply,Passenger,,,06/17/2016,22:28,,,40.75428,-73.89751,"(40.75428, -73.89751)",NORTHERN BOULEVARD              ,,,0.0,0.0,0,0,0,0,0,0,Unspecified,Unspecified,,,,4 dr sedan,Station Wagon/Sport Utility Vehicle,,,,2016-06-17 22:28:00
11609116,4399397,66bc363f-7fc4-4361-9a68-3e90a623aa00,OCCUPANT,UNSPECIFIED,F,43.0,19864324.0,Not Ejected,Does Not Apply,Does Not Apply,Driver,Lap Belt & Harness,,,Does Not Apply,Driver,,,03/16/2021,9:15,,,40.8444,-73.90159,"(40.8444, -73.90159)",CROSS BRONX EXPY                ,,,0.0,0.0,0,0,0,0,0,0,Passing or Lane Usage Improper,Passing Too Closely,,,,Sedan,Tractor Truck Diesel,,,,2021-03-16 09:15:00
11359036,4333574,475701de-7afb-4a1d-9f43-ae2188956255,OCCUPANT,UNSPECIFIED,M,23.0,19718132.0,,,,,,,,,Registrant,,,07/31/2020,3:16,BRONX,10458.0,40.86309,-73.88946,"(40.86309, -73.88946)",WEBSTER AVENUE                  ,EAST 194 STREET,,0.0,0.0,0,0,0,0,0,0,Unspecified,Unspecified,Unspecified,,,Sedan,Station Wagon/Sport Utility Vehicle,Station Wagon/Sport Utility Vehicle,,,2020-07-31 03:16:00
13435018,4831068,dbbf1b02-b249-46a8-819d-7ac831c12f7c,OCCUPANT,UNSPECIFIED,M,21.0,20912728.0,,,,,,,,,Registrant,,,07/27/2025,22:45,,,40.737152,-73.93082,"(40.737152, -73.93082)",BORDEN AVE,GREENPOINT AVE,,0.0,0.0,0,0,0,0,0,0,Driver Inattention/Distraction,Unspecified,,,,Convertible,Convertible,,,,2025-07-27 22:45:00
9539874,3986129,1888b4a1-f003-464c-a2e3-80e7080c523c,OCCUPANT,UNSPECIFIED,F,36.0,18788328.0,Not Ejected,Does Not Apply,Does Not Apply,Driver,Lap Belt,,,Does Not Apply,Driver,,,09/22/2018,13:30,BROOKLYN,11203.0,40.65011,-73.930214,"(40.65011, -73.930214)",UTICA AVENUE                    ,SNYDER AVENUE,,0.0,0.0,0,0,0,0,0,0,Alcohol Involvement,Turning Improperly,,,,Station Wagon/Sport Utility Vehicle,Sedan,,,,2018-09-22 13:30:00
13028975,4737778,9c6be1e4-1990-46a8-ade0-fbe397a472d7,PEDESTRIAN,INJURED,M,6.0,,,Conscious,Shoulder - Upper Arm,Unknown,,Pedestrian/Bicyclist/Other Pedestrian Not at Intersection,"Crossing, No Signal, or Crosswalk",Complaint of Pain or Nausea,Pedestrian,Pedestrian/Bicyclist/Other Pedestrian Error/Confusion,Unspecified,07/03/2024,19:45,QUEENS,11428.0,40.716305,-73.75473,"(40.716305, -73.75473)",,,93-13     207 STREET,1.0,0.0,1,0,0,0,0,0,Unsafe Speed,,,,,Sedan,,,,,2024-07-03 19:45:00
12921008,4710441,81fec724-768d-4c34-b850-8bb37ebbee11,OCCUPANT,INJURED,M,5.0,20618195.0,Not Ejected,Conscious,Head,Right rear passenger or motorcycle sidecar passenger,Air Bag Deployed/Child Restraint,,,Abrasion,Passenger,,,03/16/2024,14:05,QUEENS,11694.0,40.582584,-73.83022,"(40.582584, -73.83022)",ROCKAWAY FREEWAY,BEACH 108 STREET,,1.0,0.0,0,0,0,0,1,0,View Obstructed/Limited,,,,,Station Wagon/Sport Utility Vehicle,,,,,2024-03-16 14:05:00
12410203,4577509,7c643c9b-6a44-4922-ab2c-454ddcd9fa28,OCCUPANT,INJURED,M,28.0,20328066.0,Not Ejected,Conscious,Head,Driver,Lap Belt & Harness,,,Minor Bleeding,Driver,,,10/31/2022,0:35,,,40.834415,-73.92854,"(40.834415, -73.92854)",OGDEN AVENUE,,,1.0,0.0,0,0,0,0,1,0,Passing Too Closely,Passing Too Closely,,,,Sedan,Station Wagon/Sport Utility Vehicle,,,,2022-10-31 00:35:00
11340573,4328803,ce1d46b3-078b-46be-b162-bdbaa6b1bc01,OCCUPANT,UNSPECIFIED,F,43.0,19707308.0,Not Ejected,Does Not Apply,Does Not Apply,"Front passenger, if two or more persons, including the driver, are in the front seat",Lap Belt & Harness,,,Does Not Apply,Passenger,,,07/15/2020,16:00,,,40.583992,-73.96752,"(40.583992, -73.96752)",BELT PARKWAY                    ,,,1.0,0.0,0,0,0,0,1,0,Driver Inattention/Distraction,Unspecified,,,,Station Wagon/Sport Utility Vehicle,Sedan,,,,2020-07-15 16:00:00
7123158,3711243,ddd86b9a-e870-49f6-bcd3-61bbbcb78397,OCCUPANT,UNSPECIFIED,M,38.0,17600040.0,Not Ejected,Does Not Apply,Does Not Apply,Driver,Lap Belt,,,Does Not Apply,Driver,,,07/13/2017,10:58,,,40.68916,-73.99263,"(40.68916, -73.99263)",COURT STREET                    ,PACIFIC STREET,,0.0,0.0,0,0,0,0,0,0,Unsafe Lane Changing,Unspecified,,,,Pick-up Truck,Sedan,,,,2017-07-13 10:58:00
7478280,3886238,c8a215ad-b48b-42d9-a622-7a754bcd2e97,OCCUPANT,UNSPECIFIED,M,31.0,17773350.0,Not Ejected,Does Not Apply,Does Not Apply,Driver,Unknown,,,Does Not Apply,Driver,,,04/19/2018,14:24,BROOKLYN,11216.0,40.680447,-73.95046,"(40.680447, -73.95046)",,,1271      FULTON STREET                 ,0.0,0.0,0,0,0,0,0,0,Oversized Vehicle,Unspecified,,,,Sedan,Box Truck,,,,2018-04-19 14:24:00
11973311,4463550,65f038b7-92b3-4c24-a323-fc0621a8fb6c,PEDESTRIAN,INJURED,F,75.0,,,Conscious,Elbow-Lower-Arm-Hand,,,Does Not Apply,Crossing With Signal,Complaint of Pain or Nausea,Pedestrian,Unspecified,Unspecified,10/03/2021,13:40,BROOKLYN,11211.0,40.713085,-73.94415,"(40.713085, -73.94415)",AINSLIE STREET,GRAHAM AVENUE,,1.0,0.0,1,0,0,0,0,0,Aggressive Driving/Road Rage,,,,,Bike,,,,,2021-10-03 13:40:00
5962002,3431259,534454,OCCUPANT,UNSPECIFIED,F,35.0,17046677.0,Not Ejected,Does Not Apply,Does Not Apply,"Left rear passenger, or rear passenger on a bicycle, motorcycle, snowmobile",Lap Belt,,,Does Not Apply,Passenger,,,04/30/2016,20:20,MANHATTAN,10036.0,,,,8 AVENUE                        ,WEST 42 STREET,,0.0,0.0,0,0,0,0,0,0,Driver Inattention/Distraction,Unspecified,,,,4 dr sedan,Taxi,,,,2016-04-30 20:20:00
5803166,3430188,330756,OCCUPANT,UNSPECIFIED,,,16971620.0,,,,,,,,,Registrant,,,04/11/2016,10:20,,,,,,CHRISTOPHER LANE                ,VICTORY BOULEVARD,,0.0,0.0,0,0,0,0,0,0,Driver Inattention/Distraction,Unspecified,,,,Station Wagon/Sport Utility Vehicle,Station Wagon/Sport Utility Vehicle,,,,2016-04-11 10:20:00
6097971,3610786,b804f699-02ff-4d16-a695-7eff97c40e61,OCCUPANT,UNSPECIFIED,F,43.0,17111292.0,,,,,,,,,Registrant,,,02/04/2017,15:05,QUEENS,11432.0,40.711823,-73.78786,"(40.711823, -73.78786)",HILLSIDE AVENUE                 ,175 STREET,,2.0,0.0,0,0,0,0,2,0,Reaction to Uninvolved Vehicle,Following Too Closely,,,,Station Wagon/Sport Utility Vehicle,Sedan,,,,2017-02-04 15:05:00
13132023,4722793,1fdcde4e-64d0-4cdd-bc10-91b7faec84fe,OCCUPANT,UNSPECIFIED,M,53.0,20738154.0,Not Ejected,Does Not Apply,Does Not Apply,Driver,Unknown,,,Does Not Apply,Driver,,,05/07/2024,7:50,BROOKLYN,11226.0,40.64939,-73.9558,"(40.64939, -73.9558)",,,2240      BEDFORD AVENUE,1.0,0.0,0,0,1,0,0,0,Driver Inattention/Distraction,Driver Inattention/Distraction,,,,Bike,Station Wagon/Sport Utility Vehicle,,,,2024-05-07 07:50:00
12791554,4676586,21e2901f-a006-4679-8de7-c5b4b66adbd7,OCCUPANT,UNSPECIFIED,M,34.0,20544619.0,,,,,,,,,Registrant,,,11/05/2023,4:20,BROOKLYN,11228.0,40.61606,-74.02576,"(40.61606, -74.02576)",92 STREET,DAHLGREN PLACE,,0.0,0.0,0,0,0,0,0,0,Unsafe Speed,Unspecified,,,,Taxi,Sedan,,,,2023-11-05 04:20:00
9246286,3933270,33dba3de-29e1-4eab-85d1-2989eecbe62f,OCCUPANT,UNSPECIFIED,M,31.0,18644094.0,,,,,,,,,Registrant,,,07/02/2018,9:09,BRONX,10453.0,40.858387,-73.90279,"(40.858387, -73.90279)",WALTON AVENUE                   ,EAST 183 STREET,,0.0,0.0,0,0,0,0,0,0,Driver Inattention/Distraction,Driver Inattention/Distraction,,,,Sedan,Sedan,,,,2018-07-02 09:09:00
5980140,3432909,526597,OCCUPANT,INJURED,M,31.0,17055067.0,Not Ejected,Conscious,Neck,Driver,Lap Belt,,,Complaint of Pain,Driver,,,04/30/2016,18:15,QUEENS,11420.0,40.677654,-73.82866,"(40.677654, -73.82866)",,,110-00    ROCKAWAY BOULEVARD            ,3.0,0.0,0,0,0,0,3,0,Driver Inattention/Distraction,Unspecified,,,,4 dr sedan,4 dr sedan,,,,2016-04-30 18:15:00
9602935,4000011,dbfb98e4-9b7c-4be7-be0a-3b6511eee2a3,OCCUPANT,UNSPECIFIED,M,33.0,18819654.0,Not Ejected,Does Not Apply,Does Not Apply,Driver,Lap Belt & Harness,,,Does Not Apply,Driver,,,10/12/2018,19:51,QUEENS,11416.0,40.685513,-73.85808,"(40.685513, -73.85808)",,,83-02     ATLANTIC AVENUE               ,0.0,0.0,0,0,0,0,0,0,Driver Inattention/Distraction,Following Too Closely,,,,Station Wagon/Sport Utility Vehicle,Station Wagon/Sport Utility Vehicle,,,,2018-10-12 19:51:00
11382215,4339586,c225bdb9-2895-49b9-bbcf-2a5fa23fd681,OCCUPANT,UNSPECIFIED,F,46.0,19731633.0,,,,,,,,,Registrant,,,08/18/2020,14:14,BROOKLYN,11236.0,40.65295,-73.911026,"(40.65295, -73.911026)",ROCKAWAY PARKWAY                ,AVENUE B,,1.0,0.0,0,0,0,0,1,0,Traffic Control Disregarded,Traffic Control Disregarded,Unspecified,Unspecified,,Sedan,Station Wagon/Sport Utility Vehicle,Station Wagon/Sport Utility Vehicle,Station Wagon/Sport Utility Vehicle,,2020-08-18 14:14:00
11175926,4267911,8049c5c2-ceee-440e-9939-6959e6850383,OCCUPANT,UNSPECIFIED,M,47.0,19620264.0,,,,,,,,,Registrant,,,12/31/2019,18:40,MANHATTAN,10029.0,40.790234,-73.95199,"(40.790234, -73.95199)",,,1468      MADISON AVENUE                ,0.0,0.0,0,0,0,0,0,0,Other Vehicular,Unspecified,,,,Station Wagon/Sport Utility Vehicle,Sedan,,,,2019-12-31 18:40:00
6705063,3579079,3023455,OCCUPANT,UNSPECIFIED,M,25.0,17399612.0,,,,,,,,,Registrant,,,12/05/2016,3:45,QUEENS,11364.0,40.746605,-73.77214,"(40.746605, -73.77214)",,,58-01     CLEARVIEW EXPRESSWAY          ,1.0,0.0,0,0,0,0,1,0,Alcohol Involvement,,,,,Sedan,,,,,2016-12-05 03:45:00
9557538,4016143,cb836fcc-4ceb-48e5-b371-9de148fc442e,OCCUPANT,INJURED,M,22.0,18797141.0,Not Ejected,Conscious,Neck,Right rear passenger or motorcycle sidecar passenger,Lap Belt & Harness,,,Complaint of Pain or Nausea,Passenger,,,11/05/2018,20:00,,,40.87306,-73.87864,"(40.87306, -73.87864)",EAST 204 STREET                 ,,,3.0,0.0,0,0,0,0,3,0,Driver Inattention/Distraction,Driver Inattention/Distraction,,,,Sedan,Station Wagon/Sport Utility Vehicle,,,,2018-11-05 20:00:00
6010103,3451718,809068,OCCUPANT,UNSPECIFIED,F,,17069189.0,,,,,,,,,Registrant,,,05/28/2016,16:30,QUEENS,11420.0,40.666855,-73.80425,"(40.666855, -73.80425)",NORTH CONDUIT AVENUE            ,135 STREET,,1.0,0.0,0,0,0,0,1,0,Unspecified,Unspecified,,,,4 dr sedan,,,,,2016-05-28 16:30:00
11832770,4430497,50ba2828-2c13-411d-9791-2bb756de6074,PEDESTRIAN,INJURED,F,16.0,,,Conscious,Knee-Lower Leg Foot,,,Pedestrian/Bicyclist/Other Pedestrian at Intersection,Crossing With Signal,Contusion - Bruise,Pedestrian,Failure to Yield Right-of-Way,Traffic Control Disregarded,06/23/2021,6:35,,,,,,HYLAN BOULEVARD,NARROWS ROAD SOUTH,,1.0,0.0,1,0,0,0,0,0,,,,,,,,,,,2021-06-23 06:35:00
7709535,3783542,a3c30d38-05b0-4505-a5e1-2b59a64d9dac,OCCUPANT,UNSPECIFIED,M,38.0,17886835.0,Not Ejected,Does Not Apply,Does Not Apply,Driver,Lap Belt & Harness,,,Does Not Apply,Driver,,,11/04/2017,17:00,MANHATTAN,10001.0,40.74468,-73.99303,"(40.74468, -73.99303)",,,137       WEST 25 STREET                ,0.0,0.0,0,0,0,0,0,0,Driver Inattention/Distraction,Unspecified,,,,Pick-up Truck,Station Wagon/Sport Utility Vehicle,,,,2017-11-04 17:00:00
5980575,3450108,712740,OCCUPANT,UNSPECIFIED,M,43.0,17055253.0,Not Ejected,Does Not Apply,Does Not Apply,Driver,Lap Belt & Harness,,,Does Not Apply,Driver,,,05/18/2016,21:25,,,,,,BELT PARKWAY                    ,SHORE ROAD,,0.0,0.0,0,0,0,0,0,0,Unsafe Lane Changing,Unspecified,,,,Pick-up Truck,Taxi,,,,2016-05-18 21:25:00
7067336,3699127,554177d0-bea6-4be0-a461-e8bc9563faed,OCCUPANT,UNSPECIFIED,M,5.0,17573529.0,Not Ejected,Does Not Apply,Does Not Apply,Right rear passenger or motorcycle sidecar passenger,Lap Belt & Harness,,,Does Not Apply,Passenger,,,06/25/2017,21:46,BRONX,10473.0,,,,SOUND VIEW AVENUE               ,BANYER PLACE,,0.0,0.0,0,0,0,0,0,0,Turning Improperly,Unspecified,,,,Station Wagon/Sport Utility Vehicle,Sedan,,,,2017-06-25 21:46:00
9835420,4133450,46b08a1c-00dc-44ee-b9e7-4fa984c982b1,OCCUPANT,INJURED,M,38.0,18934707.0,Not Ejected,Conscious,Neck,Driver,Lap Belt & Harness,,,Complaint of Pain or Nausea,Driver,,,05/17/2019,7:40,BROOKLYN,11207.0,40.653065,-73.88979,"(40.653065, -73.88979)",COZINE AVENUE                   ,ALABAMA AVENUE,,1.0,0.0,0,0,0,0,1,0,Traffic Control Disregarded,Unspecified,,,,Pick-up Truck,Sedan,,,,2019-05-17 07:40:00
11495472,4369294,75169848-934b-4a7e-800a-0e713e499a2c,OCCUPANT,UNSPECIFIED,F,33.0,19797421.0,Not Ejected,Does Not Apply,Does Not Apply,"Front passenger, if two or more persons, including the driver, are in the front seat",Lap Belt & Harness,,,Does Not Apply,Passenger,,,11/20/2020,9:25,,,40.69597,-73.7766,"(40.69597, -73.7766)",SAYRES AVENUE                   ,,,0.0,0.0,0,0,0,0,0,0,Unsafe Speed,,,,,Station Wagon/Sport Utility Vehicle,,,,,2020-11-20 09:25:00
7047963,3705127,362dd77e-34b3-4b4e-9dd1-7138823beb49,OCCUPANT,UNSPECIFIED,M,41.0,17564312.0,,,,,,,,,Registrant,,,07/05/2017,10:30,MANHATTAN,10016.0,40.74668,-73.9745,"(40.74668, -73.9745)",EAST 37 STREET                  ,2 AVENUE,,0.0,0.0,0,0,0,0,0,0,Following Too Closely,Unspecified,,,,Station Wagon/Sport Utility Vehicle,Sedan,,,,2017-07-05 10:30:00
10213001,4221794,c81621d6-4aa8-48d7-86f6-0f32ce7281b3,OCCUPANT,UNSPECIFIED,M,49.0,19123247.0,Not Ejected,Does Not Apply,Does Not Apply,"Left rear passenger, or rear passenger on a bicycle, motorcycle, snowmobile",Lap Belt & Harness,,,Does Not Apply,Passenger,,,10/11/2019,18:57,BROOKLYN,11234.0,40.61782,-73.94309,"(40.61782, -73.94309)",,,3201      KINGS HIGHWAY                 ,0.0,0.0,0,0,0,0,0,0,Failure to Yield Right-of-Way,Unspecified,,,,Sedan,Station Wagon/Sport Utility Vehicle,,,,2019-10-11 18:57:00
9339594,3933004,d768dd32-c573-417a-85ab-ea8bf3851bec,OCCUPANT,UNSPECIFIED,F,20.0,18689926.0,Not Ejected,Does Not Apply,Does Not Apply,"Middle rear seat, or passenger lying across a seat",Unknown,,,Does Not Apply,Passenger,,,06/30/2018,21:05,BRONX,10451.0,40.819057,-73.92923,"(40.819057, -73.92923)",GERARD AVENUE                   ,EAST 149 STREET,,0.0,0.0,0,0,0,0,0,0,Failure to Yield Right-of-Way,Unspecified,,,,Station Wagon/Sport Utility Vehicle,Station Wagon/Sport Utility Vehicle,,,,2018-06-30 21:05:00
12952629,4718275,6b70de18-bc38-48ee-b6a9-f8fadcfa5ae5,OCCUPANT,UNSPECIFIED,,,,,,,,,,,,Witness,,,04/14/2024,11:55,BROOKLYN,11211.0,40.71727,-73.94989,"(40.71727, -73.94989)",,,680       LORIMER STREET,0.0,0.0,0,0,0,0,0,0,Driver Inattention/Distraction,Unspecified,,,,Station Wagon/Sport Utility Vehicle,Station Wagon/Sport Utility Vehicle,,,,2024-04-14 11:55:00
11899041,4444142,88b576a7-43ab-4a05-9179-d17c7f055281,OCCUPANT,UNSPECIFIED,M,42.0,20033149.0,Not Ejected,Does Not Apply,Does Not Apply,Driver,Lap Belt & Harness,,,Does Not Apply,Driver,,,08/01/2021,15:50,,,40.733685,-73.92396,"(40.733685, -73.92396)",BROOKLYN QUEENS EXPRESSWAY,,,0.0,0.0,0,0,0,0,0,0,Unsafe Speed,Unspecified,,,,Sedan,,,,,2021-08-01 15:50:00
7739073,3786504,be3175d0-2527-43ca-94d0-c414892ee897,OCCUPANT,UNSPECIFIED,,0.0,17901074.0,,,,,,,,,Registrant,,,11/06/2017,5:30,MANHATTAN,10036.0,40.758427,-73.99264,"(40.758427, -73.99264)",WEST 42 STREET                  ,9 AVENUE,,0.0,0.0,0,0,0,0,0,0,Unspecified,Unspecified,,,,Pick-up Truck,Tractor Truck Diesel,,,,2017-11-06 05:30:00
9973898,4160741,f83d5096-db30-4317-8f0f-f637ea2807be,OCCUPANT,UNSPECIFIED,F,21.0,19003148.0,Not Ejected,Does Not Apply,Does Not Apply,Driver,Lap Belt & Harness,,,Does Not Apply,Driver,,,06/28/2019,10:30,QUEENS,11103.0,40.758587,-73.919334,"(40.758587, -73.919334)",,,32-32     STEINWAY STREET               ,0.0,0.0,0,0,0,0,0,0,Unspecified,Unspecified,,,,Sedan,Station Wagon/Sport Utility Vehicle,,,,2019-06-28 10:30:00
7359006,3841479,77303b34-3639-4d46-81c9-72cdc495fa00,OCCUPANT,UNSPECIFIED,M,57.0,17714823.0,,,,,,,,,Registrant,,,02/06/2018,8:10,BRONX,10468.0,40.859604,-73.90778,"(40.859604, -73.90778)",UNIVERSITY AVENUE               ,WEST 183 STREET,,0.0,0.0,0,0,0,0,0,0,Driver Inattention/Distraction,Unspecified,,,,Station Wagon/Sport Utility Vehicle,Sedan,,,,2018-02-06 08:10:00
10176295,4212831,7e29f051-9ba0-45fd-830a-6e206e11da06,OCCUPANT,UNSPECIFIED,,0.0,19104871.0,,,,,,,,,Registrant,,,09/24/2019,10:05,MANHATTAN,10016.0,40.74747,-73.9823,"(40.74747, -73.9823)",,,62        EAST 34 STREET                ,0.0,0.0,0,0,0,0,0,0,Passing or Lane Usage Improper,Passing Too Closely,,,,Sedan,Pick-up Truck,,,,2019-09-24 10:05:00
7333118,3832128,1ab6b155-7fde-4b1c-9240-c415c08dd2ba,OCCUPANT,UNSPECIFIED,M,22.0,17702051.0,Not Ejected,Does Not Apply,Does Not Apply,Driver,Lap Belt,,,Does Not Apply,Driver,,,01/19/2018,14:30,BRONX,10467.0,40.88385,-73.88038,"(40.88385, -73.88038)",,,3544      JEROME AVENUE                 ,0.0,0.0,0,0,0,0,0,0,Failure to Yield Right-of-Way,View Obstructed/Limited,,,,Sedan,Sedan,,,,2018-01-19 14:30:00
12872908,4697771,2ff67e69-ff34-426c-b384-2d9e3be4bcf2,OCCUPANT,UNSPECIFIED,M,41.0,20590901.0,Not Ejected,Does Not Apply,Does Not Apply,Driver,Lap Belt & Harness,,,Does Not Apply,Driver,,,01/24/2024,18:40,MANHATTAN,10002.0,40.71429,-73.99396,"(40.71429, -73.99396)",ELDRIDGE STREET,DIVISION STREET,,1.0,0.0,0,0,1,0,0,0,Traffic Control Disregarded,Unspecified,,,,Sedan,E-Bike,,,,2024-01-24 18:40:00
12254869,4537108,be5931a2-4141-43af-a3c0-4651553a56b5,OCCUPANT,UNSPECIFIED,F,31.0,20238725.0,Not Ejected,Does Not Apply,Does Not Apply,"Front passenger, if two or more persons, including the driver, are in the front seat",Lap Belt & Harness,,,Does Not Apply,Passenger,,,06/12/2022,23:50,STATEN ISLAND,10304.0,40.61979,-74.085915,"(40.61979, -74.085915)",,,801       VANDUZER STREET,2.0,0.0,0,0,0,0,2,0,Unsafe Speed,Unspecified,,,,Sedan,Sedan,,,,2022-06-12 23:50:00
11800273,4411567,17ab3a1b-7c41-4950-87f0-bf3198d849e1,OCCUPANT,UNSPECIFIED,F,17.0,19975103.0,Not Ejected,Does Not Apply,Does Not Apply,"Middle rear seat, or passenger lying across a seat",Lap Belt & Harness,,,Does Not Apply,Passenger,,,04/04/2021,0:10,,,40.844604,-73.90348,"(40.844604, -73.90348)",CROSS BRONX EXPY,,,0.0,0.0,0,0,0,0,0,0,Following Too Closely,Unspecified,,,,Sedan,,,,,2021-04-04 00:10:00
8974694,4081802,9350be87-3e75-461d-8057-ba5264eb621d,OCCUPANT,UNSPECIFIED,M,28.0,18510141.0,Not Ejected,Does Not Apply,Does Not Apply,Driver,Lap Belt,,,Does Not Apply,Driver,,,02/15/2019,0:00,,,,,,WILLIAMSBURG BRIDGE OUTER ROADWA,,,0.0,0.0,0,0,0,0,0,0,Unspecified,Unspecified,,,,Station Wagon/Sport Utility Vehicle,Sedan,,,,2019-02-15 00:00:00
9756104,4115991,d3de1736-5b82-4763-98d8-b8f01dd10d69,OCCUPANT,UNSPECIFIED,,,18895581.0,,,,,,,,,Registrant,,,04/16/2019,15:50,MANHATTAN,10016.0,40.74309,-73.97402,"(40.74309, -73.97402)",EAST 33 STREET                  ,1 AVENUE,,0.0,0.0,0,0,0,0,0,0,Driver Inattention/Distraction,Unspecified,,,,Station Wagon/Sport Utility Vehicle,Station Wagon/Sport Utility Vehicle,,,,2019-04-16 15:50:00
9199484,3973767,7e3b7a51-c2bc-4203-9a45-57bd6fa6c32c,OCCUPANT,UNSPECIFIED,,0.0,18621222.0,,,,,,,,,Registrant,,,09/03/2018,16:30,BROOKLYN,11205.0,40.69007,-73.96275,"(40.69007, -73.96275)",,,379       DE KALB AVENUE                ,1.0,0.0,0,0,1,0,0,0,Unsafe Speed,Unspecified,,,,Bike,Station Wagon/Sport Utility Vehicle,,,,2018-09-03 16:30:00
7025072,3699627,93e387f4-a26c-493b-bceb-8e256ca3cce7,OCCUPANT,UNSPECIFIED,M,23.0,17553334.0,Not Ejected,Does Not Apply,Does Not Apply,Driver,Lap Belt & Harness,,,Does Not Apply,Driver,,,06/25/2017,0:00,QUEENS,11432.0,40.712284,-73.78536,"(40.712284, -73.78536)",HILLSIDE AVENUE                 ,178 STREET,,1.0,0.0,0,0,1,0,0,0,Failure to Yield Right-of-Way,Unspecified,,,,Station Wagon/Sport Utility Vehicle,Bike,,,,2017-06-25 00:00:00
7725275,3763785,68e4cbad-0794-44d3-8a53-621dbad8e5a3,OCCUPANT,UNSPECIFIED,M,24.0,17894412.0,,,,,,,,,Registrant,,,10/04/2017,14:10,BROOKLYN,11217.0,40.684395,-73.97835,"(40.684395, -73.97835)",ATLANTIC AVENUE                 ,4 AVENUE,,1.0,0.0,0,0,0,0,1,0,Following Too Closely,Unspecified,,,,Sedan,Station Wagon/Sport Utility Vehicle,,,,2017-10-04 14:10:00
6495886,3465150,1008485,OCCUPANT,UNSPECIFIED,F,32.0,17299587.0,Not Ejected,Does Not Apply,Does Not Apply,"Left rear passenger, or rear passenger on a bicycle, motorcycle, snowmobile",Lap Belt & Harness,,,Does Not Apply,Passenger,,,06/20/2016,13:50,,,40.65591,-73.89191,"(40.65591, -73.89191)",ALABAMA AVENUE                  ,,,1.0,0.0,0,0,0,0,1,0,Following Too Closely,Unspecified,,,,Station Wagon/Sport Utility Vehicle,4 dr sedan,,,,2016-06-20 13:50:00
9433566,3939355,bf2d49ae-aa88-4e82-ac7c-6d49cb5160a8,OCCUPANT,INJURED,F,40.0,18735995.0,Not Ejected,Conscious,Neck,Driver,Lap Belt & Harness,,,Complaint of Pain or Nausea,Driver,,,07/11/2018,10:30,QUEENS,11413.0,40.66645,-73.75764,"(40.66645, -73.75764)",NORTH CONDUIT AVENUE            ,SPRINGFIELD BOULEVARD,,1.0,0.0,0,0,0,0,1,0,Driver Inattention/Distraction,Unspecified,,,,Station Wagon/Sport Utility Vehicle,Sedan,,,,2018-07-11 10:30:00
6038724,3595653,a90e5a1b-ec9e-4d88-a5d0-da5c0394fad2,OCCUPANT,UNSPECIFIED,,0.0,17082755.0,,,,,,,,,Registrant,,,01/09/2017,9:40,MANHATTAN,10002.0,40.717922,-73.9931,"(40.717922, -73.9931)",GRAND STREET                    ,FORSYTH STREET,,0.0,0.0,0,0,0,0,0,0,Passing Too Closely,Unspecified,,,,Sedan,Station Wagon/Sport Utility Vehicle,,,,2017-01-09 09:40:00
6542923,3574980,2958313,OCCUPANT,UNSPECIFIED,F,33.0,17322024.0,,,,,,,,,Registrant,,,12/07/2016,8:27,,,40.84576,-73.89186,"(40.84576, -73.89186)",EAST TREMONT AVENUE             ,,,0.0,0.0,0,0,0,0,0,0,Passing or Lane Usage Improper,Unspecified,,,,Station Wagon/Sport Utility Vehicle,Taxi,,,,2016-12-07 08:27:00
12116572,4501425,c19e2a6a-92c6-469d-a78f-749059860b99,OCCUPANT,UNSPECIFIED,F,44.0,20159592.0,Not Ejected,Does Not Apply,Does Not Apply,Driver,Lap Belt,,,Does Not Apply,Driver,,,02/09/2022,16:40,,,40.6771,-73.92479,"(40.6771, -73.92479)",ATLANTIC AVENUE,,,0.0,0.0,0,0,0,0,0,0,Driver Inattention/Distraction,Unspecified,,,,Sedan,Sedan,,,,2022-02-09 16:40:00
13478548,4842769,07c3d062-5f69-4569-9fb9-e9c894ad5c99,OCCUPANT,UNSPECIFIED,M,52.0,20937799.0,Not Ejected,Does Not Apply,Does Not Apply,Driver,Lap Belt & Harness,,,Does Not Apply,Driver,,,03/16/2025,15:00,BROOKLYN,11224.0,40.574596,-73.98763,"(40.574596, -73.98763)",SURF AVE,W 21 ST,,1.0,0.0,0,0,0,0,1,0,Unsafe Lane Changing,Unspecified,Unspecified,Unspecified,,Sedan,Sedan,Sedan,Sedan,,2025-03-16 15:00:00
11094760,4310579,dc5f9116-a714-4ca4-a464-57fd3f24b4b4,OCCUPANT,INJURED,F,26.0,19576752.0,Ejected,Conscious,Neck,"Left rear passenger, or rear passenger on a bicycle, motorcycle, snowmobile",Helmet (Motorcycle Only),,,Complaint of Pain or Nausea,Passenger,,,04/25/2020,14:20,,,40.614246,-74.15379,"(40.614246, -74.15379)",MARTIN LUTHER KING JR           ,,,2.0,0.0,0,0,0,0,2,0,Driver Inattention/Distraction,,,,,Motorcycle,,,,,2020-04-25 14:20:00
6613071,3478652,1198424,OCCUPANT,UNSPECIFIED,M,40.0,17355512.0,Not Ejected,Does Not Apply,Does Not Apply,Driver,Unknown,,,Does Not Apply,Driver,,,07/11/2016,18:15,QUEENS,11358.0,40.758152,-73.796745,"(40.758152, -73.796745)",43 AVENUE                       ,170 STREET,,1.0,0.0,0,0,0,0,1,0,Traffic Control Disregarded,Unspecified,,,,Station Wagon/Sport Utility Vehicle,Station Wagon/Sport Utility Vehicle,,,,2016-07-11 18:15:00
9223747,4004329,9353d82a-704c-4066-901a-9754a409a3e4,OCCUPANT,UNSPECIFIED,M,52.0,18633123.0,,,,,,,,,Registrant,,,10/20/2018,16:40,,,40.78614,-73.93929,"(40.78614, -73.93929)",FDR DRIVE                       ,,,0.0,0.0,0,0,0,0,0,0,Brakes Defective,Unspecified,,,,Station Wagon/Sport Utility Vehicle,Station Wagon/Sport Utility Vehicle,,,,2018-10-20 16:40:00
12799818,4678756,e4c687a2-da63-4f56-a40f-8ec9a4130ef7,OCCUPANT,UNSPECIFIED,M,4.0,20549371.0,Not Ejected,Does Not Apply,Does Not Apply,"Left rear passenger, or rear passenger on a bicycle, motorcycle, snowmobile",Child Restraint Only,,,Does Not Apply,Passenger,,,11/12/2023,11:27,BROOKLYN,11201.0,40.70206,-73.99262,"(40.70206, -73.99262)",CADMAN PLAZA WEST,HICKS STREET,,0.0,0.0,0,0,0,0,0,0,Reaction to Uninvolved Vehicle,Following Too Closely,,,,Station Wagon/Sport Utility Vehicle,Station Wagon/Sport Utility Vehicle,,,,2023-11-12 11:27:00
11808978,4417497,098f8acb-a41b-4084-acd5-b54dc7c5d1bb,OCCUPANT,UNSPECIFIED,F,59.0,19980223.0,Not Ejected,Does Not Apply,Does Not Apply,Driver,Lap Belt & Harness,,,Does Not Apply,Driver,,,05/12/2021,15:29,BROOKLYN,11221.0,40.697998,-73.92606,"(40.697998, -73.92606)",MYRTLE AVENUE,CEDAR STREET,,0.0,0.0,0,0,0,0,0,0,Passing Too Closely,Other Vehicular,,,,Station Wagon/Sport Utility Vehicle,Station Wagon/Sport Utility Vehicle,,,,2021-05-12 15:29:00
12704364,4653719,d33a12f7-b83c-4775-b71f-813f24b74f46,OCCUPANT,UNSPECIFIED,M,42.0,20494795.0,Not Ejected,Does Not Apply,Does Not Apply,Driver,Lap Belt & Harness,,,Does Not Apply,Driver,,,08/10/2023,20:44,,,40.83129,-73.92904,"(40.83129, -73.92904)",WEST 162 STREET,,,0.0,0.0,0,0,0,0,0,0,Failure to Yield Right-of-Way,Unspecified,,,,Sedan,Sedan,,,,2023-08-10 20:44:00
9288974,4017802,9c5d21f4-97ee-4164-b462-4e11a86d8797,OCCUPANT,UNSPECIFIED,M,28.0,18665009.0,Not Ejected,Does Not Apply,Does Not Apply,Driver,Lap Belt,,,Does Not Apply,Driver,,,11/09/2018,20:00,,,40.86155,-73.92472,"(40.86155, -73.92472)",NAGLE AVENUE                    ,,,0.0,0.0,0,0,0,0,0,0,Passing Too Closely,Unspecified,,,,Box Truck,Sedan,,,,2018-11-09 20:00:00
6429063,3582469,3088605,OCCUPANT,UNSPECIFIED,M,30.0,17267770.0,Not Ejected,Does Not Apply,Does Not Apply,Driver,Lap Belt & Harness,,,Does Not Apply,Driver,,,12/18/2016,16:10,MANHATTAN,10023.0,40.776016,-73.98724,"(40.776016, -73.98724)",WEST 66 STREET                  ,WEST END AVENUE,,0.0,0.0,0,0,0,0,0,0,Following Too Closely,Unspecified,,,,Sedan,Sedan,,,,2016-12-18 16:10:00
11124208,3684411,a72ce245-18ec-4901-b758-8d1d2c7caf3b,OCCUPANT,INJURED,F,46.0,19592158.0,Not Ejected,Conscious,Elbow-Lower-Arm-Hand,Driver,Lap Belt,,,Complaint of Pain or Nausea,Driver,,,06/04/2017,9:45,,,40.836098,-73.934875,"(40.836098, -73.934875)",HARLEM RIVER DRIVE              ,,,2.0,0.0,0,0,0,0,2,0,Other Vehicular,Other Vehicular,,,,Sedan,Sedan,,,,2017-06-04 09:45:00
9823284,4130816,d9479a8a-9f8a-4118-b2cc-a8aa75cfbe81,OCCUPANT,UNSPECIFIED,F,7.0,18928676.0,Not Ejected,Does Not Apply,Does Not Apply,Right rear passenger or motorcycle sidecar passenger,Lap Belt & Harness,,,Does Not Apply,Passenger,,,05/10/2019,14:58,BROOKLYN,11234.0,40.60981,-73.92251,"(40.60981, -73.92251)",FLATBUSH AVENUE                 ,AVENUE U,,0.0,0.0,0,0,0,0,0,0,Failure to Yield Right-of-Way,Unspecified,,,,Sedan,Sedan,,,,2019-05-10 14:58:00
11433114,4352866,a7df9bff-a169-46c4-9e68-b26233f2feb7,OCCUPANT,UNSPECIFIED,F,25.0,19761257.0,,,,,,,,,Registrant,,,09/28/2020,19:20,BRONX,10457.0,40.852516,-73.90001,"(40.852516, -73.90001)",VALENTINE AVENUE                ,EAST 180 STREET,,0.0,0.0,0,0,0,0,0,0,Unsafe Speed,Unspecified,Unspecified,Unspecified,Unspecified,Station Wagon/Sport Utility Vehicle,Sedan,Station Wagon/Sport Utility Vehicle,Station Wagon/Sport Utility Vehicle,Station Wagon/Sport Utility Vehicle,2020-09-28 19:20:00
11028230,4276750,fdce59aa-4b23-4435-adcd-9af2327028a1,OCCUPANT,UNSPECIFIED,M,31.0,19542281.0,,,,,,,,,Registrant,,,01/21/2020,8:25,,,40.862755,-73.901085,"(40.862755, -73.901085)",EAST FORDHAM ROAD               ,,,0.0,0.0,0,0,0,0,0,0,Passing or Lane Usage Improper,Unspecified,,,,Sedan,Station Wagon/Sport Utility Vehicle,,,,2020-01-21 08:25:00
9703676,3959003,d47f1d71-cd2b-4c59-b33d-25fcf78b5287,OCCUPANT,UNSPECIFIED,,0.0,18869548.0,,,,,,,,,Registrant,,,08/10/2018,9:00,,,40.666637,-73.7646,"(40.666637, -73.7646)",BELT PARKWAY                    ,,,0.0,0.0,0,0,0,0,0,0,Following Too Closely,Following Too Closely,Unspecified,,,Station Wagon/Sport Utility Vehicle,Sedan,Station Wagon/Sport Utility Vehicle,,,2018-08-10 09:00:00
12443613,4586545,3228123b-e882-4a61-a7e7-7ce4932c2fba,OCCUPANT,INJURED,M,,20347046.0,Not Ejected,Conscious,Unknown,Right rear passenger or motorcycle sidecar passenger,Child Restraint Only,,,Unknown,Passenger,,,12/01/2022,15:45,QUEENS,11365.0,40.7491,-73.783554,"(40.7491, -73.783554)",196 STREET,50 AVENUE,,2.0,0.0,0,0,0,0,2,0,Failure to Yield Right-of-Way,Unspecified,,,,Sedan,Sedan,,,,2022-12-01 15:45:00
13019382,4735321,c59bdf43-1626-4ace-a321-8256b564e533,OCCUPANT,UNSPECIFIED,M,54.0,20673581.0,Not Ejected,Does Not Apply,Does Not Apply,Driver,Lap Belt,,,Does Not Apply,Driver,,,06/24/2024,10:30,BROOKLYN,11234.0,40.617065,-73.9157,"(40.617065, -73.9157)",MILL AVENUE,AVENUE T,,1.0,0.0,1,0,0,0,0,0,Failure to Yield Right-of-Way,,,,,Station Wagon/Sport Utility Vehicle,,,,,2024-06-24 10:30:00
10096861,4194505,09eb4583-aaf2-4512-a797-5e08f5fee280,OCCUPANT,UNSPECIFIED,,,19064770.0,,,,,,,,,Registrant,,,08/25/2019,17:56,BROOKLYN,11223.0,40.586205,-73.97035,"(40.586205, -73.97035)",AVENUE Z                        ,WEST 1 STREET,,0.0,0.0,0,0,0,0,0,0,Driver Inattention/Distraction,Unspecified,,,,Sedan,Station Wagon/Sport Utility Vehicle,,,,2019-08-25 17:56:00
7732402,3748166,2d2b0b54-a4bb-4f21-979e-ae1d65c2e25b,OCCUPANT,UNSPECIFIED,M,37.0,17897840.0,,,,,,,,,Registrant,,,09/12/2017,6:00,BROOKLYN,11211.0,40.714066,-73.95163,"(40.714066, -73.95163)",UNION AVENUE                    ,METROPOLITAN AVENUE,,0.0,0.0,0,0,0,0,0,0,Turning Improperly,Unspecified,,,,Dump,Station Wagon/Sport Utility Vehicle,,,,2017-09-12 06:00:00
6000929,3434433,556207,OCCUPANT,UNSPECIFIED,M,58.0,17064896.0,,,,,,,,,Registrant,,,05/03/2016,10:21,MANHATTAN,10075.0,,,,LEXINGTON AVENUE                ,EAST 78 STREET,,0.0,0.0,0,0,0,0,0,0,Backing Unsafely,,,,,JEEP,,,,,2016-05-03 10:21:00
7032879,3638451,5d50fc74-4391-41a8-a56c-58e0296162cd,OCCUPANT,UNSPECIFIED,M,59.0,17557120.0,Not Ejected,Does Not Apply,Does Not Apply,Driver,Lap Belt & Harness,,,Does Not Apply,Driver,,,03/24/2017,17:40,QUEENS,11355.0,40.756264,-73.823524,"(40.756264, -73.823524)",UNION STREET                    ,FRANKLIN AVENUE,,0.0,0.0,0,0,0,0,0,0,Passing Too Closely,Failure to Yield Right-of-Way,,,,Sedan,Station Wagon/Sport Utility Vehicle,,,,2017-03-24 17:40:00
13110257,4758840,1024027e-3048-40f3-b2a1-3454be191d86,OCCUPANT,UNSPECIFIED,M,42.0,20725799.0,,,,,,,,,Registrant,,,09/01/2024,20:10,,,,,,,,2468      PARK AVENUE,0.0,0.0,0,0,0,0,0,0,Driver Inattention/Distraction,Unspecified,Unspecified,,,Station Wagon/Sport Utility Vehicle,Station Wagon/Sport Utility Vehicle,Sedan,,,2024-09-01 20:10:00
7676779,3792081,692a9239-a4c3-4cec-bccd-31cd8c04b95f,OCCUPANT,UNSPECIFIED,M,26.0,17870739.0,Not Ejected,Does Not Apply,Does Not Apply,Driver,Lap Belt & Harness,,,Does Not Apply,Driver,,,11/17/2017,11:30,,,40.663517,-73.957214,"(40.663517, -73.957214)",BEDFORD AVENUE                  ,,,0.0,0.0,0,0,0,0,0,0,Driver Inattention/Distraction,Unspecified,,,,Station Wagon/Sport Utility Vehicle,Station Wagon/Sport Utility Vehicle,,,,2017-11-17 11:30:00
11392262,4342221,da877993-c16b-45ee-b03b-fc2b710457f9,OCCUPANT,INJURED,M,65.0,19737420.0,Not Ejected,Conscious,Neck,Driver,Lap Belt & Harness,,,Whiplash,Driver,,,08/20/2020,7:50,MANHATTAN,10026.0,40.801285,-73.95394,"(40.801285, -73.95394)",WEST 113 STREET                 ,7 AVENUE,,2.0,0.0,0,0,0,0,2,0,Failure to Yield Right-of-Way,Unspecified,,,,Station Wagon/Sport Utility Vehicle,Station Wagon/Sport Utility Vehicle,,,,2020-08-20 07:50:00
7621744,3792888,1707b0cb-4344-4acf-b037-e501548794a3,OCCUPANT,UNSPECIFIED,F,28.0,17843853.0,Not Ejected,Does Not Apply,Does Not Apply,"Left rear passenger, or rear passenger on a bicycle, motorcycle, snowmobile",Lap Belt & Harness,,,Does Not Apply,Passenger,,,11/18/2017,15:18,MANHATTAN,10029.0,40.787064,-73.94194,"(40.787064, -73.94194)",EAST 102 STREET                 ,1 AVENUE,,0.0,0.0,0,0,0,0,0,0,View Obstructed/Limited,Unspecified,,,,Station Wagon/Sport Utility Vehicle,Station Wagon/Sport Utility Vehicle,,,,2017-11-18 15:18:00
8986502,4059029,8e3c5ef1-f520-42b5-9623-a2027341a630,OCCUPANT,UNSPECIFIED,M,0.0,18515964.0,Not Ejected,Does Not Apply,Does Not Apply,Unknown,Lap Belt & Harness,,,Does Not Apply,Passenger,,,01/20/2019,13:30,BROOKLYN,11226.0,40.642372,-73.957466,"(40.642372, -73.957466)",FLATBUSH AVENUE                 ,DORCHESTER ROAD,,0.0,0.0,0,0,0,0,0,0,Driver Inattention/Distraction,Unspecified,,,,Sedan,Carry All,,,,2019-01-20 13:30:00
5789314,3416441,340269,OCCUPANT,UNSPECIFIED,M,76.0,16964890.0,Not Ejected,Does Not Apply,Does Not Apply,Driver,,,,Does Not Apply,Driver,,,04/01/2016,21:30,BROOKLYN,11212.0,,,,RUTLAND ROAD                    ,EAST 96 STREET,,0.0,0.0,0,0,0,0,0,0,Unspecified,,,,,4 dr sedan,,,,,2016-04-01 21:30:00
12438720,4585151,a5f7cf1f-ec1c-4722-b84b-9a4cf5bfd024,OCCUPANT,INJURED,M,33.0,20344234.0,Not Ejected,Conscious,Chest,Driver,Air Bag Deployed/Lap Belt/Harness,,,Complaint of Pain or Nausea,Driver,,,11/27/2022,7:30,,,40.76816,-73.90544,"(40.76816, -73.90544)",GRAND CENTRAL PKWY,,,2.0,0.0,0,0,0,0,2,0,Alcohol Involvement,Unspecified,Unspecified,,,Sedan,Sedan,Sedan,,,2022-11-27 07:30:00
11420916,4349657,fef86d8b-3b8f-4d4a-b4e9-9c75b3b22c6f,OCCUPANT,UNSPECIFIED,M,50.0,19754104.0,,,,,,,,,Registrant,,,09/15/2020,0:53,,,40.66777,-73.94514,"(40.66777, -73.94514)",BROOKLYN AVENUE                 ,,,0.0,0.0,0,0,0,0,0,0,Alcohol Involvement,Unspecified,Unspecified,Unspecified,Unspecified,Station Wagon/Sport Utility Vehicle,Sedan,Sedan,Sedan,Sedan,2020-09-15 00:53:00
13424153,4828193,dc221883-b53e-4efe-9220-172264bb7d54,OCCUPANT,UNSPECIFIED,M,42.0,20906311.0,,,,,,,,,Registrant,,,07/17/2025,0:23,BROOKLYN,11236.0,40.64077,-73.90912,"(40.64077, -73.90912)",GLENWOOD RD,E 88 ST,,3.0,0.0,0,0,0,0,3,0,Traffic Control Disregarded,Unspecified,Unspecified,Unspecified,,Sedan,Sedan,Station Wagon/Sport Utility Vehicle,Sedan,,2025-07-17 00:23:00
6358783,3517927,1896277,OCCUPANT,UNSPECIFIED,M,33.0,17234563.0,Not Ejected,Does Not Apply,Does Not Apply,Driver,Lap Belt & Harness,,,Does Not Apply,Driver,,,09/09/2016,17:40,BROOKLYN,11211.0,40.715717,-73.95999,"(40.715717, -73.95999)",,,245       BEDFORD AVENUE                ,0.0,0.0,0,0,0,0,0,0,Driver Inattention/Distraction,Unspecified,,,,Station Wagon/Sport Utility Vehicle,Station Wagon/Sport Utility Vehicle,,,,2016-09-09 17:40:00
7826854,3777443,e4a89033-a48b-4a5b-ba8f-8545f76654b1,OCCUPANT,UNSPECIFIED,M,6.0,17943763.0,Not Ejected,Does Not Apply,Does Not Apply,"Any person in the rear of a station wagon, pick-up truck, all passengers on a bus, etc",Unknown,,,Does Not Apply,Passenger,,,10/26/2017,15:00,BRONX,10465.0,40.82755,-73.83007,"(40.82755, -73.83007)",,,2750      LAFAYETTE AVENUE              ,0.0,0.0,0,0,0,0,0,0,Unspecified,Unspecified,,,,Bus,Sedan,,,,2017-10-26 15:00:00
7730955,3753517,139a5f18-95d9-44e6-b482-7ea39df9940c,OCCUPANT,UNSPECIFIED,M,28.0,17897098.0,,,,,,,,,Registrant,,,09/19/2017,10:00,BROOKLYN,11230.0,40.615414,-73.96144,"(40.615414, -73.96144)",AVENUE N                        ,EAST 13 STREET,,0.0,0.0,0,0,0,0,0,0,Failure to Yield Right-of-Way,Unspecified,,,,Sedan,Sedan,,,,2017-09-19 10:00:00
6725232,3563653,2759423,OCCUPANT,UNSPECIFIED,M,33.0,17409401.0,Not Ejected,Does Not Apply,Does Not Apply,Driver,Lap Belt,,,Does Not Apply,Driver,,,11/19/2016,15:15,QUEENS,11106.0,40.766064,-73.93089,"(40.766064, -73.93089)",21 STREET                       ,31 DRIVE,,0.0,0.0,0,0,0,0,0,0,Driver Inattention/Distraction,Unspecified,,,,Taxi,Motorcycle,,,,2016-11-19 15:15:00
7181068,4024535,3358d273-a351-45f8-a341-03ec642a5783,OCCUPANT,UNSPECIFIED,F,5.0,17627943.0,Not Ejected,Does Not Apply,Does Not Apply,"Middle front seat, or passenger lying across a seat",Lap Belt,,,Does Not Apply,Passenger,,,07/19/2017,16:37,BROOKLYN,11210.0,40.6168,-73.94885,"(40.6168, -73.94885)",AVENUE N                        ,EAST 26 STREET,,1.0,0.0,0,0,0,0,1,0,Passing or Lane Usage Improper,Passing or Lane Usage Improper,,,,Bus,Sedan,,,,2017-07-19 16:37:00
5793473,3429840,419185,OCCUPANT,UNSPECIFIED,F,48.0,16966927.0,Not Ejected,Conscious,Does Not Apply,Driver,Lap Belt & Harness,,,Does Not Apply,Driver,,,04/18/2016,8:00,STATEN ISLAND,10310.0,,,,RICHMOND TERRACE                ,PELTON PLACE,,1.0,0.0,0,0,1,0,0,0,Unspecified,Unspecified,,,,4 dr sedan,Bike,,,,2016-04-18 08:00:00
9333748,3936237,cfe5aadb-3777-4722-94dd-6efaa01795fb,OCCUPANT,UNSPECIFIED,M,48.0,18687063.0,Not Ejected,Does Not Apply,Does Not Apply,Driver,Lap Belt & Harness,,,Does Not Apply,Driver,,,07/06/2018,14:34,BROOKLYN,11223.0,40.60579,-73.966576,"(40.60579, -73.966576)",,,622       KINGS HIGHWAY                 ,0.0,0.0,0,0,0,0,0,0,Passing or Lane Usage Improper,Unspecified,,,,Sedan,Box Truck,,,,2018-07-06 14:34:00
7701000,3780943,1fc8a2a2-d9e1-44d8-8227-4b3fac756d2e,OCCUPANT,UNSPECIFIED,M,62.0,17882690.0,Not Ejected,Does Not Apply,Does Not Apply,Driver,Lap Belt & Harness,,,Does Not Apply,Driver,,,10/31/2017,18:00,STATEN ISLAND,10314.0,40.621017,-74.13181,"(40.621017, -74.13181)",COLLEGE AVENUE                  ,JEWETT AVENUE,,0.0,0.0,0,0,0,0,0,0,Following Too Closely,Unspecified,,,,Sedan,Sedan,,,,2017-10-31 18:00:00
13112425,4759666,46f39956-7045-4044-bd68-7574317704ee,OCCUPANT,UNSPECIFIED,F,46.0,20727030.0,,,,,,,,,Registrant,,,09/26/2024,14:35,,,,,,TOMPKINS AVENUE,,,0.0,0.0,0,0,0,0,0,0,Driver Inattention/Distraction,Unspecified,,,,Sedan,Pick-up Truck,,,,2024-09-26 14:35:00
7536075,3902436,9e9ac185-0a01-479e-8d4c-cb462705474d,OCCUPANT,UNSPECIFIED,,,17801761.0,,,,,,,,,Registrant,,,05/16/2018,19:30,,,40.742706,-73.984535,"(40.742706, -73.984535)",PARK AVENUE SOUTH               ,,,0.0,0.0,0,0,0,0,0,0,Driver Inattention/Distraction,Driver Inattention/Distraction,,,,Station Wagon/Sport Utility Vehicle,Station Wagon/Sport Utility Vehicle,,,,2018-05-16 19:30:00
11269571,4247601,67a03ac4-6af9-4acf-9464-0c237196fcf7,OCCUPANT,UNSPECIFIED,F,41.0,19667980.0,Not Ejected,Does Not Apply,Does Not Apply,Driver,Lap Belt & Harness,,,Does Not Apply,Driver,,,11/25/2019,19:00,,,40.738728,-73.812164,"(40.738728, -73.812164)",LONG ISLAND EXPRESSWAY          ,,,0.0,0.0,0,0,0,0,0,0,Following Too Closely,Unspecified,,,,Station Wagon/Sport Utility Vehicle,Station Wagon/Sport Utility Vehicle,,,,2019-11-25 19:00:00
10200497,4218495,9513e26f-2ce3-4161-988b-25cadce6e3f5,OCCUPANT,INJURED,F,62.0,19116873.0,Not Ejected,Conscious,Chest,Driver,Lap Belt,,,Complaint of Pain or Nausea,Driver,,,10/06/2019,19:00,BROOKLYN,11214.0,40.60242,-73.99459,"(40.60242, -73.99459)",86 STREET                       ,BAY 29 STREET,,1.0,0.0,0,0,0,0,1,0,Driver Inattention/Distraction,Unspecified,Unspecified,,,Station Wagon/Sport Utility Vehicle,Sedan,Station Wagon/Sport Utility Vehicle,,,2019-10-06 19:00:00
9806775,4120207,3d0345c3-83eb-443f-9a8b-ca6b70b3ab56,OCCUPANT,UNSPECIFIED,F,20.0,18920576.0,Not Ejected,Does Not Apply,Does Not Apply,Driver,Lap Belt & Harness,,,Does Not Apply,Driver,,,04/24/2019,14:45,,,,,,HUTCHINSON RIVER PARKWAY        ,,,0.0,0.0,0,0,0,0,0,0,Unspecified,Unspecified,,,,Station Wagon/Sport Utility Vehicle,Station Wagon/Sport Utility Vehicle,,,,2019-04-24 14:45:00
6907413,3646597,455e3a4c-67d6-4fd7-90bf-60b18a4c134b,OCCUPANT,UNSPECIFIED,,0.0,17496956.0,,,,,,,,,Registrant,,,04/05/2017,10:38,QUEENS,11413.0,40.6802,-73.755264,"(40.6802, -73.755264)",,,186-45    MERRICK BOULEVARD             ,0.0,0.0,0,0,0,0,0,0,Unspecified,Unspecified,,,,Station Wagon/Sport Utility Vehicle,Sedan,,,,2017-04-05 10:38:00
11922269,4450347,931e57e6-0289-4d41-aede-d89ca2df603d,OCCUPANT,UNSPECIFIED,M,55.0,20046844.0,Not Ejected,Does Not Apply,Does Not Apply,Driver,Lap Belt & Harness,,,Does Not Apply,Driver,,,08/20/2021,16:00,BROOKLYN,11223.0,40.586517,-73.967575,"(40.586517, -73.967575)",AVENUE Z,EAST 2 STREET,,0.0,0.0,0,0,0,0,0,0,Driver Inattention/Distraction,Unspecified,,,,Station Wagon/Sport Utility Vehicle,Bus,,,,2021-08-20 16:00:00
9299976,3910928,ae916378-6c9e-4706-9782-682b56094b4d,OCCUPANT,UNSPECIFIED,,0.0,18670424.0,,,,,,,,,Registrant,,,05/29/2018,19:00,BRONX,10460.0,40.837933,-73.87167,"(40.837933, -73.87167)",NOBLE AVENUE                    ,MANSION STREET,,0.0,0.0,0,0,0,0,0,0,Unsafe Lane Changing,Unspecified,,,,Station Wagon/Sport Utility Vehicle,Station Wagon/Sport Utility Vehicle,,,,2018-05-29 19:00:00
7095268,3703705,aad9bcfb-4a0d-4b15-b06c-41fa867d0fea,OCCUPANT,UNSPECIFIED,M,19.0,17586800.0,Not Ejected,Does Not Apply,Does Not Apply,Driver,Lap Belt,,,Does Not Apply,Driver,,,06/30/2017,15:00,QUEENS,11106.0,40.766064,-73.93089,"(40.766064, -73.93089)",21 STREET                       ,31 DRIVE,,0.0,0.0,0,0,0,0,0,0,Passing or Lane Usage Improper,Unsafe Lane Changing,,,,Sedan,Sedan,,,,2017-06-30 15:00:00
11763791,4407900,bb89c405-75aa-429a-8e6d-a28f5bc0b25e,OCCUPANT,UNSPECIFIED,M,36.0,19953922.0,Not Ejected,Does Not Apply,Does Not Apply,Driver,Lap Belt & Harness,,,Does Not Apply,Driver,,,04/16/2021,17:40,BRONX,10474.0,40.815,-73.89402,"(40.815, -73.89402)",GARRISON AVENUE,LONGWOOD AVENUE,,0.0,0.0,0,0,0,0,0,0,Unspecified,Unspecified,,,,Sedan,Sedan,,,,2021-04-16 17:40:00
12597677,4626432,7b7e51ad-5de5-433c-9878-380508a5fbe3,OCCUPANT,UNSPECIFIED,M,33.0,20434480.0,,,,,,,,,Registrant,,,05/05/2023,11:35,,,40.63665,-73.96805,"(40.63665, -73.96805)",CONEY ISLAND AVENUE,DITMAS AVENUE,,1.0,0.0,0,0,0,0,1,0,Driver Inattention/Distraction,Unspecified,,,,Station Wagon/Sport Utility Vehicle,Sedan,,,,2023-05-05 11:35:00
6861777,3655828,fb7e0d13-9475-44c4-b469-d9f2936d0086,OCCUPANT,UNSPECIFIED,F,73.0,17475040.0,,,,,,,,,Registrant,,,04/19/2017,16:25,STATEN ISLAND,10301.0,40.62043,-74.09875,"(40.62043, -74.09875)",,,977       VICTORY BOULEVARD             ,0.0,0.0,0,0,0,0,0,0,Failure to Yield Right-of-Way,Unspecified,,,,Sedan,Motorcycle,,,,2017-04-19 16:25:00
11873110,4437270,1129215d-ac94-4ed6-af0f-de638aeb3ae5,BICYCLIST,INJURED,M,23.0,20018085.0,Ejected,Conscious,Knee-Lower Leg Foot,Driver,Helmet Only (In-Line Skater/Bicyclist),,,Complaint of Pain or Nausea,Driver,,,07/15/2021,21:10,BROOKLYN,11249.0,40.717518,-73.96474,"(40.717518, -73.96474)",KENT AVENUE,METROPOLITAN AVENUE,,1.0,0.0,0,0,1,0,0,0,Failure to Yield Right-of-Way,Unspecified,,,,Station Wagon/Sport Utility Vehicle,Bike,,,,2021-07-15 21:10:00
12450024,4588263,656521b4-c50d-4610-ba01-37403047509a,OCCUPANT,UNSPECIFIED,F,54.0,20350715.0,Not Ejected,Does Not Apply,Does Not Apply,Driver,Lap Belt & Harness,,,Does Not Apply,Driver,,,12/07/2022,16:07,BROOKLYN,11212.0,40.66885,-73.91635,"(40.66885, -73.91635)",PITKIN AVENUE,STRAUSS STREET,,0.0,0.0,0,0,0,0,0,0,Unspecified,Unspecified,,,,Sedan,Bus,,,,2022-12-07 16:07:00
8934912,4061525,d1ad9c2c-d34e-40a0-85c6-897b40b7d4d3,OCCUPANT,UNSPECIFIED,F,53.0,18490260.0,Not Ejected,Does Not Apply,Does Not Apply,"Middle rear seat, or passenger lying across a seat",Lap Belt,,,Does Not Apply,Passenger,,,12/31/2018,20:20,BRONX,10472.0,40.827656,-73.8861,"(40.827656, -73.8861)",WESTCHESTER AVENUE              ,WHITLOCK AVENUE,,0.0,0.0,0,0,0,0,0,0,Unspecified,Unspecified,,,,Station Wagon/Sport Utility Vehicle,Sedan,,,,2018-12-31 20:20:00
11758752,4404069,99d309ef-4387-43f7-958e-125e98daa36f,OCCUPANT,UNSPECIFIED,F,51.0,19951004.0,Not Ejected,Does Not Apply,Does Not Apply,Driver,Lap Belt & Harness,,,Does Not Apply,Driver,,,04/03/2021,10:19,,,40.820137,-73.89029,"(40.820137, -73.89029)",BRUCKNER EXPRESSWAY             ,,,0.0,0.0,0,0,0,0,0,0,Unspecified,Unspecified,,,,Station Wagon/Sport Utility Vehicle,Sedan,,,,2021-04-03 10:19:00
6841103,3657348,4c62b247-1238-469e-b74e-b1cc63ccd1e4,OCCUPANT,UNSPECIFIED,M,50.0,17465027.0,Not Ejected,Does Not Apply,Does Not Apply,Driver,Lap Belt & Harness,,,Does Not Apply,Driver,,,04/25/2017,20:45,BRONX,10463.0,40.878475,-73.90363,"(40.878475, -73.90363)",WEST 231 STREET                 ,ALBANY CRESCENT,,1.0,0.0,1,0,0,0,0,0,Failure to Yield Right-of-Way,,,,,Sedan,,,,,2017-04-25 20:45:00
7157585,3728859,af36be1f-ad10-4c79-8788-434f7bad7cbf,OCCUPANT,UNSPECIFIED,M,55.0,17616687.0,Not Ejected,Does Not Apply,Does Not Apply,Driver,Lap Belt,,,Does Not Apply,Driver,,,08/11/2017,5:40,BROOKLYN,11222.0,40.730736,-73.94865,"(40.730736, -73.94865)",,,278       GREENPOINT AVENUE             ,0.0,0.0,0,0,0,0,0,0,Failure to Yield Right-of-Way,Unspecified,,,,Taxi,Station Wagon/Sport Utility Vehicle,,,,2017-08-11 05:40:00
9339140,3950110,df2d6d51-2015-41f6-9498-b8389d438fec,OCCUPANT,UNSPECIFIED,M,38.0,18689714.0,,,,,,,,,Registrant,,,07/28/2018,15:09,,,40.60023,-73.9956,"(40.60023, -73.9956)",BAY PARKWAY                     ,,,0.0,0.0,0,0,0,0,0,0,Following Too Closely,Unspecified,,,,Station Wagon/Sport Utility Vehicle,Sedan,,,,2018-07-28 15:09:00
11329696,4325789,78cec70b-0fc3-4b83-87b7-597c6badcc75,OCCUPANT,UNSPECIFIED,M,40.0,19701087.0,,,,,,,,,Registrant,,,07/04/2020,18:00,,,40.8047,-73.91243,"(40.8047, -73.91243)",EAST 138 STREET                 ,BRUCKNER BOULEVARD,,3.0,0.0,0,0,0,0,3,0,Other Vehicular,Other Vehicular,,,,Taxi,Station Wagon/Sport Utility Vehicle,,,,2020-07-04 18:00:00
6458650,4022677,925675,OCCUPANT,UNSPECIFIED,F,52.0,,,,,,,,,,Registrant,,,06/08/2016,9:09,,,40.712296,-73.83521,"(40.712296, -73.83521)",,,,0.0,0.0,0,0,0,0,0,0,Following Too Closely,Unspecified,,,,Station Wagon/Sport Utility Vehicle,Station Wagon/Sport Utility Vehicle,,,,2016-06-08 09:09:00
12834423,4687862,a8668462-ec3b-42a0-81ba-f9879a9c8efd,OCCUPANT,UNSPECIFIED,M,21.0,20568934.0,Not Ejected,Does Not Apply,Does Not Apply,"Front passenger, if two or more persons, including the driver, are in the front seat",Unknown,,,Does Not Apply,Passenger,,,12/06/2023,0:05,BROOKLYN,11249.0,40.723076,-73.96024,"(40.723076, -73.96024)",,,26        NORTH 11 STREET,0.0,0.0,0,0,0,0,0,0,Driver Inattention/Distraction,Unspecified,,,,Sedan,Station Wagon/Sport Utility Vehicle,,,,2023-12-06 00:05:00
6828429,3631751,61c0b9ca-1d35-4e54-917e-2bacc30c96c2,OCCUPANT,UNSPECIFIED,F,18.0,17458940.0,Not Ejected,Does Not Apply,Does Not Apply,Driver,Lap Belt & Harness,,,Does Not Apply,Driver,,,03/13/2017,11:15,BRONX,10468.0,40.862778,-73.906166,"(40.862778, -73.906166)",WEST FORDHAM ROAD               ,ANDREWS AVENUE,,0.0,0.0,0,0,0,0,0,0,Passing or Lane Usage Improper,Passing or Lane Usage Improper,,,,Pick-up Truck,Station Wagon/Sport Utility Vehicle,,,,2017-03-13 11:15:00
6579251,3510365,1749895,OCCUPANT,UNSPECIFIED,,0.0,17339310.0,,,,,,,,,Registrant,,,08/28/2016,16:30,MANHATTAN,10019.0,,,,12 AVENUE                       ,WEST 52 STREET,,0.0,0.0,0,0,0,0,0,0,Other Vehicular,Unspecified,,,,Station Wagon/Sport Utility Vehicle,Station Wagon/Sport Utility Vehicle,,,,2016-08-28 16:30:00
12294246,4547408,832e22fe-ae61-4baf-a6d0-584021257432,OCCUPANT,UNSPECIFIED,M,37.0,20261335.0,Not Ejected,Does Not Apply,Does Not Apply,Driver,Lap Belt,,,Does Not Apply,Driver,,,07/18/2022,6:56,MANHATTAN,10027.0,40.80886,-73.95213,"(40.80886, -73.95213)",8 AVENUE,WEST 123 STREET,,0.0,0.0,0,0,0,0,0,0,Driver Inattention/Distraction,Unspecified,,,,Station Wagon/Sport Utility Vehicle,com,,,,2022-07-18 06:56:00
12800296,4678805,706f7246-fc55-4254-a8e1-925371d4b4bf,OCCUPANT,UNSPECIFIED,M,29.0,20549624.0,Not Ejected,Does Not Apply,Does Not Apply,Driver,Lap Belt & Harness,,,Does Not Apply,Driver,,,11/10/2023,8:33,MANHATTAN,10023.0,40.774906,-73.97692,"(40.774906, -73.97692)",CENTRAL PARK WEST,WEST 70 STREET,,1.0,0.0,0,0,1,0,0,0,Driver Inattention/Distraction,Driver Inattention/Distraction,,,,Sedan,Bike,,,,2023-11-10 08:33:00
12437266,4585261,95ad0f69-4c6a-496e-9f05-34f93bd3b9bc,OCCUPANT,UNSPECIFIED,F,22.0,20343390.0,Not Ejected,Does Not Apply,Does Not Apply,"Front passenger, if two or more persons, including the driver, are in the front seat",Unknown,,,Does Not Apply,Passenger,,,11/21/2022,9:30,MANHATTAN,10024.0,40.784355,-73.98117,"(40.784355, -73.98117)",WEST 79 STREET,WEST END AVENUE,,0.0,0.0,0,0,0,0,0,0,Passing or Lane Usage Improper,Unspecified,Unspecified,Unspecified,Unspecified,Taxi,Sedan,Sedan,Sedan,Station Wagon/Sport Utility Vehicle,2022-11-21 09:30:00
12934243,4713498,aa563573-22e4-443e-9376-44b56ab34990,OCCUPANT,INJURED,M,25.0,20625633.0,Not Ejected,Conscious,Shoulder - Upper Arm,Driver,Lap Belt,,,Complaint of Pain or Nausea,Driver,,,03/28/2024,22:41,,,40.741936,-73.97263,"(40.741936, -73.97263)",FDR DRIVE,,,1.0,0.0,0,0,0,0,1,0,Unspecified,Unspecified,,,,Sedan,Sedan,,,,2024-03-28 22:41:00
6275299,3501686,1601214,OCCUPANT,UNSPECIFIED,M,38.0,17195366.0,Not Ejected,Does Not Apply,Does Not Apply,Driver,Lap Belt,,,Does Not Apply,Driver,,,08/16/2016,12:25,BROOKLYN,11235.0,40.57707,-73.96401,"(40.57707, -73.96401)",,,309       BRIGHTON BEACH AVENUE         ,0.0,0.0,0,0,0,0,0,0,Driver Inattention/Distraction,Unspecified,,,,Box Truck,Sedan,,,,2016-08-16 12:25:00
9112398,4102436,74d067d1-7dc3-4751-8c5e-a91466d9b061,OCCUPANT,UNSPECIFIED,M,26.0,18578211.0,Not Ejected,Does Not Apply,Does Not Apply,Driver,Unknown,,,Does Not Apply,Driver,,,03/24/2019,21:30,MANHATTAN,10017.0,40.750763,-73.97446,"(40.750763, -73.97446)",EAST 42 STREET                  ,3 AVENUE,,0.0,0.0,0,0,0,0,0,0,Driver Inattention/Distraction,Unspecified,,,,Taxi,Taxi,,,,2019-03-24 21:30:00
9270871,3968952,5e05e194-a901-4769-b083-5f6d96ba3e8a,OCCUPANT,UNSPECIFIED,F,28.0,18656128.0,Not Ejected,Does Not Apply,Does Not Apply,"Middle front seat, or passenger lying across a seat",Unknown,,,Does Not Apply,Passenger,,,08/27/2018,11:37,BROOKLYN,11213.0,40.666122,-73.93139,"(40.666122, -73.93139)",UTICA AVENUE                    ,CARROLL STREET,,0.0,0.0,0,0,0,0,0,0,Driver Inattention/Distraction,Driver Inexperience,,,,Station Wagon/Sport Utility Vehicle,Station Wagon/Sport Utility Vehicle,,,,2018-08-27 11:37:00
7304037,3829209,93b4a26c-a5b7-46b4-a2e9-9003051526bf,OCCUPANT,UNSPECIFIED,,,,,,,,,,,,Witness,,,01/15/2018,15:50,BROOKLYN,11225.0,40.668865,-73.94896,"(40.668865, -73.94896)",,,1307      UNION STREET                  ,1.0,0.0,1,0,0,0,0,0,Backing Unsafely,,,,,Sedan,,,,,2018-01-15 15:50:00
8944267,4063289,bf8470ec-d5b1-4409-8457-fae01585fc94,OCCUPANT,UNSPECIFIED,M,53.0,18494918.0,,,,,,,,,Registrant,,,01/07/2019,16:00,,,40.658512,-73.953316,"(40.658512, -73.953316)",ROGERS AVENUE                   ,,,0.0,0.0,0,0,0,0,0,0,Backing Unsafely,Unspecified,,,,Sedan,Station Wagon/Sport Utility Vehicle,,,,2019-01-07 16:00:00
6232353,3467122,1042564,OCCUPANT,UNSPECIFIED,M,55.0,17175295.0,Not Ejected,Does Not Apply,Does Not Apply,Driver,Lap Belt & Harness,,,Does Not Apply,Driver,,,06/23/2016,16:30,MANHATTAN,10003.0,40.734684,-73.98273,"(40.734684, -73.98273)",,,303       EAST 18 STREET                ,0.0,0.0,0,0,0,0,0,0,Driver Inattention/Distraction,Unspecified,,,,2 dr sedan,4 dr sedan,,,,2016-06-23 16:30:00
6790917,3632475,c478c4ad-1ef0-4024-b549-0faa809999f3,OCCUPANT,UNSPECIFIED,M,41.0,17440946.0,,,,,,,,,Registrant,,,03/15/2017,9:34,MANHATTAN,10035.0,40.80142,-73.93446,"(40.80142, -73.93446)",EAST 123 STREET                 ,2 AVENUE,,0.0,0.0,0,0,0,0,0,0,Passing or Lane Usage Improper,Following Too Closely,,,,Taxi,Station Wagon/Sport Utility Vehicle,,,,2017-03-15 09:34:00
11982924,4466323,c206b944-97a2-4cf1-a7a3-91ff6c68aefd,OCCUPANT,UNSPECIFIED,M,65.0,20082183.0,,,,,,,,,Registrant,,,10/11/2021,14:46,BROOKLYN,11210.0,40.629593,-73.94753,"(40.6295919, -73.9475338)",,,2266      NOSTRAND AVENUE,0.0,0.0,0,0,0,0,0,0,Unspecified,Unspecified,,,,Sedan,Station Wagon/Sport Utility Vehicle,,,,2021-10-11 14:46:00
7849854,3791466,c234116c-e054-4417-b969-a66ee5e394e7,OCCUPANT,INJURED,F,12.0,17954990.0,Not Ejected,Conscious,Back,"Left rear passenger, or rear passenger on a bicycle, motorcycle, snowmobile",Lap Belt & Harness,,,Complaint of Pain,Passenger,,,11/15/2017,7:45,,,,,,EAST 222 STREET                 ,NEEDHAM AVENUE,,3.0,0.0,0,0,0,0,3,0,Glare,Glare,,,,Station Wagon/Sport Utility Vehicle,Station Wagon/Sport Utility Vehicle,,,,2017-11-15 07:45:00
6566322,3556419,2600691,OCCUPANT,UNSPECIFIED,M,24.0,17333232.0,Not Ejected,Does Not Apply,Does Not Apply,Driver,Lap Belt & Harness,,,Does Not Apply,Driver,,,11/06/2016,22:12,,,,,,CROMWELL AVENUE                 ,JEROME AVENUE,,0.0,0.0,0,0,0,0,0,0,Following Too Closely,Unspecified,,,,Station Wagon/Sport Utility Vehicle,Pick-up Truck,,,,2016-11-06 22:12:00
9171277,3942057,d4f0dcee-660f-4c77-8d8d-69e8bf1b13a9,OCCUPANT,UNSPECIFIED,,0.0,18607285.0,,,,,,,,,Registrant,,,07/11/2018,15:00,,,40.78542,-73.98399,"(40.78542, -73.98399)",HENRY HUDSON PARKWAY            ,,,1.0,0.0,0,0,0,0,1,0,Obstruction/Debris,Unspecified,,,,Taxi,Station Wagon/Sport Utility Vehicle,,,,2018-07-11 15:00:00
7880913,3819624,575af403-128c-4703-8c48-48d68a7c9a63,OCCUPANT,UNSPECIFIED,M,22.0,17970213.0,,,,,,,,,Registrant,,,12/27/2017,23:10,BRONX,10464.0,,,,,,870       SHORE ROAD                    ,0.0,0.0,0,0,0,0,0,0,Animals Action,,,,,Sedan,,,,,2017-12-27 23:10:00
12851460,4692314,95d2724e-d4ce-4401-8f6b-10229812b51e,OCCUPANT,UNSPECIFIED,M,71.0,20578766.0,Not Ejected,Does Not Apply,Does Not Apply,Driver,Lap Belt & Harness,,,Does Not Apply,Driver,,,01/03/2024,12:03,BROOKLYN,11231.0,40.683743,-73.99524,"(40.683743, -73.99524)",COURT STREET,DE GRAW STREET,,1.0,0.0,0,0,1,0,0,0,Following Too Closely,Unspecified,,,,Taxi,Bike,,,,2024-01-03 12:03:00
12400204,4575244,b2217af3-ce0d-4747-80e2-9eae1bff6f39,OCCUPANT,INJURED,M,33.0,20322360.0,Not Ejected,Conscious,Shoulder - Upper Arm,"Front passenger, if two or more persons, including the driver, are in the front seat",Lap Belt & Harness,,,Complaint of Pain or Nausea,Passenger,,,10/23/2022,3:37,MANHATTAN,10027.0,40.810093,-73.95309,"(40.810093, -73.95309)",WEST 124 STREET,SAINT NICHOLAS AVENUE,,2.0,0.0,0,0,0,0,2,0,Reaction to Uninvolved Vehicle,Unspecified,Unspecified,,,Station Wagon/Sport Utility Vehicle,Station Wagon/Sport Utility Vehicle,Sedan,,,2022-10-23 03:37:00
13362652,4812158,a43ae1bf-731c-430e-8665-e717b5d42810,OCCUPANT,UNSPECIFIED,,,20870949.0,,,,,,,,,Registrant,,,05/09/2025,8:08,BRONX,10452.0,40.843987,-73.926414,"(40.843987, -73.926414)",SEDGWICK AVE,MAJOR DEEGAN ENTRANCE NB,,0.0,0.0,0,0,0,0,0,0,Other Vehicular,Unspecified,,,,Bus,,,,,2025-05-09 08:08:00
6194406,3455643,858004,OCCUPANT,UNSPECIFIED,M,33.0,17157595.0,Not Ejected,Does Not Apply,Does Not Apply,"Left rear passenger, or rear passenger on a bicycle, motorcycle, snowmobile",Helmet (Motorcycle Only),,,Does Not Apply,Passenger,,,06/04/2016,15:50,MANHATTAN,10007.0,40.714806,-74.00577,"(40.714806, -74.00577)",,,290       BROADWAY                      ,1.0,0.0,0,0,0,0,1,0,Unsafe Speed,Unspecified,,,,Station Wagon/Sport Utility Vehicle,Motorscooter,,,,2016-06-04 15:50:00
7559060,3888349,73a80cb2-4286-4c10-83ab-f902313407f0,OCCUPANT,INJURED,M,28.0,17813081.0,Not Ejected,Conscious,Chest,Driver,Lap Belt & Harness,,,Complaint of Pain,Driver,,,04/26/2018,22:05,,,,,,SHORE PARKWAY                   ,OCEAN AVENUE,,3.0,0.0,0,0,0,0,3,0,Following Too Closely,Unspecified,,,,Station Wagon/Sport Utility Vehicle,Station Wagon/Sport Utility Vehicle,,,,2018-04-26 22:05:00
12609532,4629446,713cd231-d884-46e6-bb99-edff3a86f0ea,OCCUPANT,INJURED,M,31.0,20441120.0,Not Ejected,Conscious,Shoulder - Upper Arm,Driver,Lap Belt & Harness,,,Whiplash,Driver,,,05/12/2023,5:30,,,40.859444,-73.915985,"(40.859444, -73.915985)",MAJOR DEEGAN EXPRESSWAY,,,1.0,0.0,0,0,0,0,1,0,Passing or Lane Usage Improper,Unspecified,Unspecified,,,Tractor Truck Diesel,Tractor Truck Diesel,Station Wagon/Sport Utility Vehicle,,,2023-05-12 05:30:00
6381000,3488861,1339278,OCCUPANT,UNSPECIFIED,M,25.0,17245119.0,Not Ejected,Does Not Apply,Does Not Apply,"Front passenger, if two or more persons, including the driver, are in the front seat",Lap Belt & Harness,,,Does Not Apply,Passenger,,,07/25/2016,10:30,BROOKLYN,11226.0,40.65487,-73.96191,"(40.65487, -73.96191)",PARKSIDE AVENUE                 ,OCEAN AVENUE,,2.0,0.0,0,0,0,0,2,0,Following Too Closely,Unspecified,Unspecified,,,Sedan,Station Wagon/Sport Utility Vehicle,Station Wagon/Sport Utility Vehicle,,,2016-07-25 10:30:00
10150016,4206827,905457de-84ae-4ff6-b3d9-c5e87c53440d,OCCUPANT,UNSPECIFIED,M,0.0,19091624.0,,,,,,,,,Registrant,,,09/16/2019,11:29,STATEN ISLAND,10308.0,40.560955,-74.15673,"(40.560955, -74.15673)",GURLEY AVENUE                   ,ELVERTON AVENUE,,0.0,0.0,0,0,0,0,0,0,Driver Inattention/Distraction,Unsafe Speed,,,,Sedan,Sedan,,,,2019-09-16 11:29:00
11856919,4429618,f90856e1-dc0f-43d5-99e7-bff457fc7f13,OCCUPANT,UNSPECIFIED,F,24.0,20008630.0,Not Ejected,Does Not Apply,Does Not Apply,Driver,Lap Belt & Harness,,,Does Not Apply,Driver,,,06/21/2021,19:15,QUEENS,11354.0,40.76465,-73.823494,"(40.76465, -73.823494)",NORTHERN BOULEVARD,PARSONS BOULEVARD,,0.0,0.0,0,0,0,0,0,0,Passing or Lane Usage Improper,Passing or Lane Usage Improper,,,,Sedan,Sedan,,,,2021-06-21 19:15:00
11572581,4389787,89bc19f6-1205-4a1c-861b-b3b15069a3dd,OCCUPANT,UNSPECIFIED,,,19842943.0,,,,,,,,,Registrant,,,02/02/2021,11:50,,,40.68777,-73.98701,"(40.68777, -73.98701)",ATLANTIC AVENUE                 ,,,1.0,0.0,0,0,0,0,1,0,Unspecified,Unspecified,Unspecified,,,Taxi,Box Truck,Tractor Truck Diesel,,,2021-02-02 11:50:00
11403151,4345053,ba56a1c2-4e41-4e2c-9abd-03211faeaafc,OCCUPANT,UNSPECIFIED,M,49.0,19743774.0,Not Ejected,Does Not Apply,Does Not Apply,Driver,Lap Belt & Harness,,,Does Not Apply,Driver,,,09/01/2020,6:30,MANHATTAN,10013.0,40.72584,-74.00757,"(40.72584, -74.00757)",HUDSON STREET                   ,SPRING STREET,,0.0,0.0,0,0,0,0,0,0,Failure to Yield Right-of-Way,Unspecified,,,,Station Wagon/Sport Utility Vehicle,Sedan,,,,2020-09-01 06:30:00
11770085,4424493,0608cec3-f775-4df4-bb01-6dbc5cb496f4,OCCUPANT,UNSPECIFIED,F,20.0,19957603.0,Not Ejected,Does Not Apply,Does Not Apply,"Front passenger, if two or more persons, including the driver, are in the front seat",Lap Belt & Harness,,,Does Not Apply,Passenger,,,06/06/2021,2:59,,,40.794243,-73.931145,"(40.794243, -73.931145)",FDR DRIVE,,,0.0,0.0,0,0,0,0,0,0,Unspecified,Unspecified,,,,Sedan,Sedan,,,,2021-06-06 02:59:00
13030764,4738161,738949bb-58a3-4e67-859a-734a7768e4a1,OCCUPANT,UNSPECIFIED,,,20680116.0,,,,,,,,,Registrant,,,07/02/2024,13:17,,,40.617924,-74.155785,"(40.617924, -74.155785)",DEPPE PLACE,,,0.0,0.0,0,0,0,0,0,0,Driver Inattention/Distraction,Unspecified,,,,Station Wagon/Sport Utility Vehicle,Station Wagon/Sport Utility Vehicle,,,,2024-07-02 13:17:00
9886137,4145976,dc1ed238-0df0-4e96-b0d5-f82c1dc22244,OCCUPANT,UNSPECIFIED,M,39.0,18959769.0,,,,,,,,,Registrant,,,06/06/2019,0:01,BROOKLYN,11226.0,40.649868,-73.9619,"(40.649868, -73.9619)",,,1915      CHURCH AVENUE                 ,1.0,0.0,0,0,0,0,1,0,Reaction to Uninvolved Vehicle,Unsafe Lane Changing,,,,Sedan,Sedan,,,,2019-06-06 00:01:00
9959610,4162874,760e321a-9a8e-4da1-9c01-95106dedd944,OCCUPANT,UNSPECIFIED,M,33.0,18996071.0,,,,,,,,,Registrant,,,07/01/2019,22:25,,,40.681503,-73.904106,"(40.681503, -73.904106)",BUSHWICK AVENUE                 ,,,0.0,0.0,0,0,0,0,0,0,Reaction to Uninvolved Vehicle,Following Too Closely,,,,Sedan,Station Wagon/Sport Utility Vehicle,,,,2019-07-01 22:25:00
9121936,4094027,02d7cfff-46f8-45b6-85d3-85789e40397a,OCCUPANT,UNSPECIFIED,M,24.0,18582961.0,Not Ejected,Does Not Apply,Does Not Apply,Driver,Lap Belt & Harness,,,Does Not Apply,Driver,,,03/09/2019,22:30,QUEENS,11436.0,40.668434,-73.80062,"(40.668434, -73.80062)",VANWYCK EXPRESSWAY              ,134 AVENUE,,0.0,0.0,0,0,0,0,0,0,Failure to Yield Right-of-Way,Unspecified,,,,Sedan,Sedan,,,,2019-03-09 22:30:00
12060795,4486556,18d04001-8af2-45ab-a574-0436d5770dbb,OCCUPANT,INJURED,M,51.0,20126914.0,Not Ejected,Conscious,Head,Driver,Lap Belt & Harness,,,Complaint of Pain or Nausea,Driver,,,12/14/2021,17:15,BROOKLYN,11211.0,40.710957,-73.951126,"(40.710957, -73.951126)",GRAND STREET,UNION AVENUE,,1.0,0.0,0,0,0,0,1,0,Passing or Lane Usage Improper,Unspecified,,,,Bus,Station Wagon/Sport Utility Vehicle,,,,2021-12-14 17:15:00
6452754,3537135,2244026,OCCUPANT,UNSPECIFIED,F,36.0,17279026.0,,,,,,,,,Registrant,,,10/07/2016,0:00,BRONX,10469.0,40.86511,-73.83794,"(40.86511, -73.83794)",TIEMANN AVENUE                  ,ALLERTON AVENUE,,0.0,0.0,0,0,0,0,0,0,Unspecified,Unspecified,,,,Sedan,Sedan,,,,2016-10-07 00:00:00
9328710,3909213,9ab76e4d-f123-4b6e-90d2-e3b84dcc77c3,OCCUPANT,UNSPECIFIED,M,0.0,18684613.0,,,,,,,,,Registrant,,,05/27/2018,8:30,QUEENS,11419.0,40.69056,-73.8141,"(40.69056, -73.8141)",132 STREET                      ,LIBERTY AVENUE,,0.0,0.0,0,0,0,0,0,0,Passing Too Closely,Unspecified,,,,Sedan,,,,,2018-05-27 08:30:00
7347294,3830689,3fec3982-6538-429e-afab-1d56777e616e,OCCUPANT,UNSPECIFIED,M,30.0,17709104.0,,,,,,,,,Registrant,,,01/17/2018,12:19,QUEENS,11101.0,40.742874,-73.933945,"(40.742874, -73.933945)",VANDAM STREET                   ,47 AVENUE,,0.0,0.0,0,0,0,0,0,0,Driver Inattention/Distraction,Driver Inattention/Distraction,,,,Station Wagon/Sport Utility Vehicle,Station Wagon/Sport Utility Vehicle,,,,2018-01-17 12:19:00
6182553,3471905,1099249,OCCUPANT,UNSPECIFIED,M,40.0,17152099.0,Not Ejected,Does Not Apply,Does Not Apply,Driver,Lap Belt & Harness,,,Does Not Apply,Driver,,,06/29/2016,16:32,MANHATTAN,10002.0,40.70981,-73.99178,"(40.70981, -73.99178)",PIKE SLIP                       ,SOUTH STREET,,0.0,0.0,0,0,0,0,0,0,Unsafe Lane Changing,Unspecified,,,,Taxi,4 dr sedan,,,,2016-06-29 16:32:00
12280604,4543833,6b3b76c6-c27f-4c86-85fc-15aac5704b3d,OCCUPANT,UNSPECIFIED,M,42.0,20253580.0,,,,,,,,,Registrant,,,06/24/2022,19:00,QUEENS,11375.0,40.72145,-73.851944,"(40.72145, -73.851944)",BURNS STREET,68 AVENUE,,1.0,0.0,0,0,0,0,1,0,Traffic Control Disregarded,Unspecified,,,,Station Wagon/Sport Utility Vehicle,Motorcycle,,,,2022-06-24 19:00:00
11238347,4261012,24423e5d-b044-4523-9e15-c39fd6ab7c23,OCCUPANT,UNSPECIFIED,M,34.0,19651936.0,Not Ejected,Does Not Apply,Does Not Apply,Driver,Lap Belt & Harness,,,Does Not Apply,Driver,,,12/19/2019,10:30,BROOKLYN,11249.0,40.700626,-73.960304,"(40.700626, -73.960304)",,,731       WYTHE AVENUE                  ,0.0,0.0,0,0,0,0,0,0,Driver Inattention/Distraction,Unspecified,,,,Sedan,,,,,2019-12-19 10:30:00
11348564,4330898,1ca0bfb8-06a2-4466-ade0-cb2a98914628,OCCUPANT,UNSPECIFIED,M,57.0,19711985.0,,,,,,,,,Registrant,,,07/22/2020,14:55,MANHATTAN,10027.0,40.807034,-73.94371,"(40.807034, -73.94371)",,,43        WEST 125 STREET               ,0.0,0.0,0,0,0,0,0,0,Driver Inattention/Distraction,Lane Marking Improper/Inadequate,,,,Taxi,Sedan,,,,2020-07-22 14:55:00
7826188,3774415,52c74c14-d256-4704-aa20-3c8704d0341a,OCCUPANT,INJURED,F,39.0,17943433.0,Not Ejected,Conscious,Head,"Front passenger, if two or more persons, including the driver, are in the front seat",Lap Belt & Harness,,,None Visible,Passenger,,,10/20/2017,20:00,MANHATTAN,10019.0,40.766712,-73.98289,"(40.766712, -73.98289)",WEST 57 STREET                  ,8 AVENUE,,3.0,0.0,0,0,0,0,3,0,Other Vehicular,,,,,Sedan,,,,,2017-10-20 20:00:00
12969131,4722488,c18d22f3-2668-49c7-b1f0-48c5362686fe,OCCUPANT,UNSPECIFIED,M,24.0,20645508.0,,,,,,,,,Registrant,,,05/06/2024,0:00,QUEENS,11373.0,40.73713,-73.866035,"(40.73713, -73.866035)",,,56-09     JUNCTION BOULEVARD,0.0,0.0,0,0,0,0,0,0,Unspecified,,,,,Sedan,,,,,2024-05-06 00:00:00
9033469,4074418,26c71f67-24c5-4410-9b58-0d1abfb360f9,OCCUPANT,UNSPECIFIED,M,38.0,18539034.0,,,,,,,,,Registrant,,,02/02/2019,20:52,BRONX,10469.0,40.87485,-73.84935,"(40.87485, -73.84935)",,,3357      FISH AVENUE                   ,0.0,0.0,0,0,0,0,0,0,Driver Inattention/Distraction,Unspecified,,,,Sedan,Sedan,,,,2019-02-02 20:52:00
7146419,3713969,d8327616-c9fb-40d5-ae1c-9317f6db55a7,OCCUPANT,UNSPECIFIED,M,41.0,17611291.0,Not Ejected,Does Not Apply,Does Not Apply,Driver,Lap Belt & Harness,,,Does Not Apply,Driver,,,07/18/2017,18:25,STATEN ISLAND,10304.0,40.62131,-74.074776,"(40.62131, -74.074776)",,,75        VANDERBILT AVENUE             ,0.0,0.0,0,0,0,0,0,0,Oversized Vehicle,Unspecified,Unspecified,,,Sedan,Station Wagon/Sport Utility Vehicle,Sedan,,,2017-07-18 18:25:00
11823393,4410857,8cd1b451-edd2-457c-b10b-94a49b3a281a,OCCUPANT,UNSPECIFIED,M,10.0,19988730.0,Not Ejected,Does Not Apply,Does Not Apply,Right rear passenger or motorcycle sidecar passenger,,,,Does Not Apply,Passenger,,,04/26/2021,16:08,BRONX,10451.0,40.823456,-73.92444,"(40.823456, -73.92444)",GRAND CONCOURSE,EAST 156 STREET,,0.0,0.0,0,0,0,0,0,0,Unsafe Lane Changing,Driver Inattention/Distraction,,,,Bus,Sedan,,,,2021-04-26 16:08:00
13258978,4785052,1e4d49bf-2b3e-47ad-9760-5dc0e98eb5f9,OCCUPANT,INJURED,M,38.0,20811781.0,Not Ejected,Conscious,Neck,Driver,Air Bag Deployed/Lap Belt/Harness,,,Complaint of Pain or Nausea,Driver,,,01/09/2025,8:30,,,40.72539,-73.896614,"(40.72539, -73.896614)",LONG ISLAND EXPRESSWAY,,,6.0,0.0,0,0,0,0,6,0,Other Vehicular,Other Vehicular,Unsafe Lane Changing,,,Taxi,Station Wagon/Sport Utility Vehicle,,,,2025-01-09 08:30:00
13451387,4835544,4a11c725-2ece-417c-8d52-8941516f0cb9,OCCUPANT,UNSPECIFIED,M,52.0,20922153.0,Not Ejected,Does Not Apply,Does Not Apply,"Front passenger, if two or more persons, including the driver, are in the front seat",,,,Does Not Apply,Passenger,,,08/16/2025,21:30,,,40.728394,-74.00313,"(40.728394, -74.00313)",AVENUE OF THE AMERICAS,WEST HOUSTON STREET,,1.0,0.0,0,0,0,0,1,0,Passing Too Closely,Unspecified,,,,Sedan,Station Wagon/Sport Utility Vehicle,,,,2025-08-16 21:30:00
7793671,3767295,fb43a10b-7e00-40cb-8a73-1558352e2314,OCCUPANT,INJURED,F,37.0,17927571.0,Not Ejected,Conscious,Head,Driver,Lap Belt,,,Complaint of Pain,Driver,,,10/02/2017,7:07,,,40.83087,-73.82291,"(40.83087, -73.82291)",LAFAYETTE AVENUE                ,,,1.0,0.0,0,0,0,0,1,0,Unspecified,Unspecified,,,,Sedan,Sedan,,,,2017-10-02 07:07:00
12886214,4693181,ae1c64bf-459e-468b-880c-23a026ca6cca,OCCUPANT,UNSPECIFIED,M,22.0,20598394.0,Not Ejected,Does Not Apply,Does Not Apply,Right rear passenger or motorcycle sidecar passenger,,,,Does Not Apply,Passenger,,,01/05/2024,15:40,BRONX,10470.0,40.895374,-73.86356,"(40.895374, -73.86356)",WEBSTER AVENUE,EAST 233 STREET,,0.0,0.0,0,0,0,0,0,0,Failure to Yield Right-of-Way,Unspecified,,,,Taxi,Station Wagon/Sport Utility Vehicle,,,,2024-01-05 15:40:00
2260819,3243430,1,OCCUPANT,INJURED,,33.0,14753796.0,,,,,,,,,,,,06/18/2015,18:40,BRONX,10451.0,40.813587,-73.931046,"(40.8135889, -73.9310462)",EAST 138 STREET                 ,GERARD AVENUE                   ,,1.0,0.0,0,0,0,0,1,0,Other Electronic Device,Other Vehicular,Other Vehicular,,,VAN,SPORT UTILITY / STATION WAGON,PASSENGER VEHICLE,,,2015-06-18 18:40:00
6776487,3648148,7ea181de-3519-4d96-b700-a7abd73cfafc,OCCUPANT,UNSPECIFIED,,0.0,17434066.0,,,,,,,,,Registrant,,,04/08/2017,21:35,BROOKLYN,11221.0,40.68854,-73.92384,"(40.68854, -73.92384)",RALPH AVENUE                    ,MONROE STREET,,0.0,0.0,0,0,0,0,0,0,Driver Inattention/Distraction,Unspecified,,,,Sedan,Sedan,,,,2017-04-08 21:35:00
2276885,3298452,1,OCCUPANT,INJURED,,28.0,14869375.0,,,,,,,,,,,,09/17/2015,0:35,,,40.693787,-73.81172,"(40.6937879, -73.8117234)",,,,1.0,0.0,0,0,0,0,1,0,Fatigued/Drowsy,Fatigued/Drowsy,Traffic Control Disregarded,,,PASSENGER VEHICLE,VAN,VAN,,,2015-09-17 00:35:00
12131753,4505274,05d8abf0-33b4-4e56-9882-ce41ca38b99b,OCCUPANT,UNSPECIFIED,M,4.0,20168259.0,Not Ejected,Does Not Apply,Does Not Apply,"Any person in the rear of a station wagon, pick-up truck, all passengers on a bus, etc",Lap Belt,,,Does Not Apply,Passenger,,,02/23/2022,14:27,BRONX,10453.0,40.853813,-73.90734,"(40.853813, -73.90734)",JEROME AVENUE,EAST BURNSIDE AVENUE,,0.0,0.0,0,0,0,0,0,0,Driver Inexperience,Unspecified,,,,Bus,Sedan,,,,2022-02-23 14:27:00
7612959,3893892,7f5c37a5-7638-4b10-9dd9-0223e596ed7b,OCCUPANT,UNSPECIFIED,M,58.0,17839561.0,,,,,,,,,Registrant,,,05/04/2018,7:00,,,40.763508,-73.77193,"(40.763508, -73.77193)",41 AVENUE                       ,,,0.0,0.0,0,0,0,0,0,0,Driver Inattention/Distraction,Unspecified,,,,Station Wagon/Sport Utility Vehicle,Station Wagon/Sport Utility Vehicle,,,,2018-05-04 07:00:00
11398750,4343917,f9accb8a-9420-4bac-929f-8ca493404afd,OCCUPANT,UNSPECIFIED,M,61.0,19741234.0,Not Ejected,Does Not Apply,Does Not Apply,Driver,Unknown,,,Does Not Apply,Driver,,,09/01/2020,7:45,,,,,,BRONX WHITESTONE BRIDGE         ,,,0.0,0.0,0,0,0,0,0,0,Passing or Lane Usage Improper,Passing or Lane Usage Improper,,,,Box Truck,Box Truck,,,,2020-09-01 07:45:00
7357338,3836711,a18ede88-8504-4a2b-90cb-ce06c8665881,OCCUPANT,UNSPECIFIED,F,27.0,17714004.0,Not Ejected,Does Not Apply,Does Not Apply,Driver,Lap Belt & Harness,,,Does Not Apply,Driver,,,01/27/2018,16:30,QUEENS,11368.0,40.75713,-73.87042,"(40.75713, -73.87042)",98 STREET                       ,NORTHERN BOULEVARD,,0.0,0.0,0,0,0,0,0,0,Driver Inattention/Distraction,Unspecified,,,,Sedan,Station Wagon/Sport Utility Vehicle,,,,2018-01-27 16:30:00
11954125,4453959,e7df58ed-60bc-4815-b0d5-a570c4cdebb7,OCCUPANT,UNSPECIFIED,M,23.0,20065503.0,Not Ejected,Does Not Apply,Does Not Apply,Driver,Lap Belt,,,Does Not Apply,Driver,,,08/31/2021,16:54,,,40.81339,-73.95627,"(40.81339, -73.95627)",AMSTERDAM AVENUE,,,1.0,0.0,0,0,0,0,1,0,Following Too Closely,Other Vehicular,Unspecified,,,Station Wagon/Sport Utility Vehicle,Sedan,Bus,,,2021-08-31 16:54:00
6717392,3586033,8b73d878-34c9-4605-9ce7-fd6968e021cf,OCCUPANT,UNSPECIFIED,F,9.0,17405579.0,Not Ejected,Does Not Apply,Does Not Apply,Right rear passenger or motorcycle sidecar passenger,Lap Belt & Harness,,,Does Not Apply,Passenger,,,12/24/2016,21:45,,,40.706966,-73.75283,"(40.706966, -73.75283)",205 STREET                      ,HOLLIS AVENUE,,0.0,0.0,0,0,0,0,0,0,Driver Inattention/Distraction,Unspecified,,,,Sedan,Sedan,,,,2016-12-24 21:45:00
9496575,3962785,7e45c935-e653-494f-9a19-f374c78c16b1,OCCUPANT,UNSPECIFIED,F,41.0,18766870.0,Not Ejected,Does Not Apply,Does Not Apply,"Front passenger, if two or more persons, including the driver, are in the front seat",Lap Belt & Harness,,,Does Not Apply,Passenger,,,08/15/2018,15:38,,,40.827076,-73.85171,"(40.827076, -73.85171)",BRUCKNER EXPRESSWAY             ,,,0.0,0.0,0,0,0,0,0,0,Following Too Closely,Unspecified,Unspecified,,,Station Wagon/Sport Utility Vehicle,Station Wagon/Sport Utility Vehicle,Station Wagon/Sport Utility Vehicle,,,2018-08-15 15:38:00
7569172,3762102,4fe977ee-6d1f-438e-96ef-9a791a3427b2,OCCUPANT,UNSPECIFIED,M,39.0,17818063.0,Not Ejected,Does Not Apply,Does Not Apply,Unknown,,,,Does Not Apply,Driver,,,10/02/2017,13:30,,,40.679035,-73.9248,"(40.679035, -73.9248)",FULTON STREET                   ,,,0.0,0.0,0,0,0,0,0,0,Driver Inattention/Distraction,Unspecified,,,,Sedan,,,,,2017-10-02 13:30:00
6412553,3467525,1043936,OCCUPANT,UNSPECIFIED,,,17260012.0,,,,,,,,,Registrant,,,06/23/2016,18:45,,,40.750965,-73.94027,"(40.750965, -73.94027)",QUEENS PLAZA NORTH              ,CRESCENT STREET,,0.0,0.0,0,0,0,0,0,0,Driver Inattention/Distraction,Driver Inattention/Distraction,,,,4 dr sedan,4 dr sedan,,,,2016-06-23 18:45:00
12142250,4508323,e6413eba-b7fc-44af-8a17-9a4a0e0f4ccb,OCCUPANT,UNSPECIFIED,M,31.0,20174383.0,Not Ejected,Does Not Apply,Does Not Apply,Driver,Lap Belt & Harness,,,Does Not Apply,Driver,,,03/07/2022,15:03,MANHATTAN,10002.0,40.71227,-73.99491,"(40.71227, -73.99491)",,,113       MADISON STREET,0.0,0.0,0,0,0,0,0,0,Driver Inattention/Distraction,Unspecified,,,,Station Wagon/Sport Utility Vehicle,Box Truck,,,,2022-03-07 15:03:00
9372878,3962314,091b621a-5eaf-46c5-b07a-4d046cb6b76d,OCCUPANT,UNSPECIFIED,M,0.0,18706304.0,,,,,,,,,Registrant,,,08/16/2018,21:30,,,40.709225,-73.843155,"(40.709225, -73.843155)",UNION TURNPIKE                  ,METROPOLITAN AVENUE,,1.0,0.0,0,0,0,0,1,0,Failure to Yield Right-of-Way,Unspecified,Unspecified,,,Station Wagon/Sport Utility Vehicle,Sedan,Sedan,,,2018-08-16 21:30:00
6747368,3541164,2343756,OCCUPANT,UNSPECIFIED,,0.0,17420071.0,,,,,,,,,Registrant,,,10/16/2016,16:00,QUEENS,11360.0,40.782444,-73.776535,"(40.782444, -73.776535)",23 AVENUE                       ,BELL BOULEVARD,,1.0,0.0,0,0,0,0,1,0,Following Too Closely,Unspecified,,,,Sedan,Sedan,,,,2016-10-16 16:00:00
11196223,4264567,b48e2175-6d3b-48df-a29b-97b195431fed,OCCUPANT,UNSPECIFIED,M,,19630865.0,,,,,,,,,Registrant,,,12/25/2019,14:20,BROOKLYN,11224.0,40.57944,-73.979614,"(40.57944, -73.979614)",WEST 12 STREET                  ,NEPTUNE AVENUE,,1.0,0.0,0,0,0,0,1,0,Driver Inattention/Distraction,Unspecified,,,,Sedan,Sedan,,,,2019-12-25 14:20:00
11870058,4436566,0a2db1aa-f8df-4801-8755-8b1b008b20d3,BICYCLIST,INJURED,M,8.0,20016281.0,Not Ejected,Conscious,Head,Driver,Unknown,,,Minor Bleeding,Driver,,,07/12/2021,18:22,BROOKLYN,11235.0,40.5825,-73.96118,"(40.5825, -73.96118)",BRIGHTON 8 STREET,BRIGHTON 8 COURT,,1.0,0.0,0,0,1,0,0,0,Unsafe Speed,Unspecified,,,,Taxi,Bike,,,,2021-07-12 18:22:00
7197691,3719577,8b538956-53d7-4d94-8e9c-2fd66fb6f32d,OCCUPANT,UNSPECIFIED,M,44.0,17636024.0,,,,,,,,,Registrant,,,07/26/2017,18:55,BRONX,10451.0,40.819057,-73.92923,"(40.819057, -73.92923)",EAST 149 STREET                 ,GERARD AVENUE,,0.0,0.0,0,0,0,0,0,0,Turning Improperly,Unspecified,,,,Bus,Station Wagon/Sport Utility Vehicle,,,,2017-07-26 18:55:00
12759359,4668003,0501af57-dfa7-4fba-b079-60936cdd912c,OCCUPANT,UNSPECIFIED,F,29.0,20526391.0,,,,,,,,,Registrant,,,10/04/2023,22:20,,,40.863705,-73.87207,"(40.863705, -73.87207)",BRONX RIVER PARKWAY,,,4.0,0.0,0,0,0,0,4,0,Unsafe Lane Changing,Unspecified,,,,Sedan,Sedan,,,,2023-10-04 22:20:00
12825366,4685401,33ff0858-fc53-4171-8e10-40457215101c,OCCUPANT,INJURED,F,37.0,20563829.0,Not Ejected,Conscious,Head,"Front passenger, if two or more persons, including the driver, are in the front seat",Lap Belt & Harness,,,Complaint of Pain or Nausea,Passenger,,,12/05/2023,1:00,,,40.669243,-73.80129,"(40.669243, -73.80129)",VAN WYCK EXPWY,,,2.0,0.0,0,0,0,0,2,0,Driver Inattention/Distraction,Unspecified,,,,Station Wagon/Sport Utility Vehicle,Chassis Cab,,,,2023-12-05 01:00:00
12220926,4521699,de01a25b-b203-46cc-99e2-f55d5d1ba3f7,OCCUPANT,INJURED,F,43.0,20219297.0,Not Ejected,Conscious,Hip-Upper Leg,"Front passenger, if two or more persons, including the driver, are in the front seat",Lap Belt & Harness,,,Complaint of Pain or Nausea,Passenger,,,04/24/2022,11:14,,,,,,BELT PARKWAY,,,7.0,0.0,0,0,0,0,7,0,Unsafe Speed,Unspecified,Unspecified,Unspecified,,Station Wagon/Sport Utility Vehicle,Sedan,Station Wagon/Sport Utility Vehicle,Station Wagon/Sport Utility Vehicle,,2022-04-24 11:14:00
11536997,4379392,57995782-910d-44a1-a784-b1fb4fa06043,OCCUPANT,KILLED,M,23.0,19821810.0,Ejected,Unconscious,Head,Driver,,,,Internal,Driver,,,12/27/2020,16:20,,,40.8047,-73.91243,"(40.8047, -73.91243)",BRUCKNER BOULEVARD              ,EAST 138 STREET,,0.0,1.0,0,0,0,0,0,1,Traffic Control Disregarded,Unspecified,,,,Motorscooter,Station Wagon/Sport Utility Vehicle,,,,2020-12-27 16:20:00
9107644,4099336,0ed1cbf1-0521-4935-b190-c9b281478423,OCCUPANT,UNSPECIFIED,M,26.0,18575830.0,Not Ejected,Does Not Apply,Does Not Apply,Driver,Unknown,,,Does Not Apply,Driver,,,03/18/2019,17:43,QUEENS,11368.0,40.750347,-73.87015,"(40.750347, -73.87015)",,,37-68     JUNCTION BOULEVARD            ,0.0,0.0,0,0,0,0,0,0,Driver Inattention/Distraction,Driver Inattention/Distraction,,,,Sedan,Sedan,,,,2019-03-18 17:43:00
12758431,4667827,e39e2629-c497-4834-8de3-1e56092b76bf,OCCUPANT,UNSPECIFIED,F,51.0,20525905.0,Not Ejected,Does Not Apply,Does Not Apply,Driver,Lap Belt & Harness,,,Does Not Apply,Driver,,,10/04/2023,17:00,,,40.685646,-73.80324,"(40.685646, -73.80324)",111 AVENUE,141 STREET,,0.0,0.0,0,0,0,0,0,0,Driver Inexperience,Unspecified,,,,Station Wagon/Sport Utility Vehicle,Sedan,,,,2023-10-04 17:00:00
9711884,4035284,92510bec-f617-4d90-a660-0ab7db115b09,OCCUPANT,UNSPECIFIED,F,43.0,18873676.0,Not Ejected,Does Not Apply,Does Not Apply,"Middle front seat, or passenger lying across a seat",Lap Belt & Harness,,,Does Not Apply,Passenger,,,11/23/2018,4:21,QUEENS,11377.0,40.733017,-73.91886,"(40.733017, -73.91886)",,,51-74     48 STREET                     ,2.0,0.0,0,0,0,0,2,0,Driver Inattention/Distraction,Unspecified,,,,Station Wagon/Sport Utility Vehicle,Station Wagon/Sport Utility Vehicle,,,,2018-11-23 04:21:00
9563572,3995984,79dc7da6-5b43-4dc0-8aca-d22fa4d3237e,OCCUPANT,UNSPECIFIED,M,38.0,18800187.0,,,,,,,,,Registrant,,,10/08/2018,9:30,,,40.61531,-74.131004,"(40.61531, -74.131004)",,,874       JEWETT AVENUE                 ,0.0,0.0,0,0,0,0,0,0,Driver Inattention/Distraction,Unspecified,,,,Station Wagon/Sport Utility Vehicle,Station Wagon/Sport Utility Vehicle,,,,2018-10-08 09:30:00
7500492,3891854,9eba0f24-2214-4197-b1b8-12b832671834,OCCUPANT,UNSPECIFIED,,0.0,17784338.0,,,,,,,,,Registrant,,,04/30/2018,16:06,BRONX,10457.0,40.846657,-73.89619,"(40.846657, -73.89619)",3 AVENUE                        ,EAST TREMONT AVENUE,,0.0,0.0,0,0,0,0,0,0,Passing or Lane Usage Improper,Unspecified,,,,Sedan,,,,,2018-04-30 16:06:00
13372141,4814403,07fd2cd1-404b-4fa8-aa75-4cee7d4f36a2,OCCUPANT,UNSPECIFIED,M,32.0,20876340.0,Not Ejected,Does Not Apply,Does Not Apply,Driver,Unknown,,,Does Not Apply,Driver,,,05/20/2025,15:00,STATEN ISLAND,10301.0,40.643787,-74.082855,"(40.643787, -74.082855)",,,24        CRESCENT AVE,0.0,0.0,0,0,0,0,0,0,Passing Too Closely,Unspecified,,,,Sedan,Bus,,,,2025-05-20 15:00:00
9953531,4162343,82b0b1af-1531-42e4-9525-b774fdb6f961,OCCUPANT,UNSPECIFIED,M,41.0,18993081.0,,,,,,,,,Registrant,,,06/29/2019,22:55,BRONX,10457.0,40.841354,-73.89791,"(40.841354, -73.89791)",,,1699      FULTON AVENUE                 ,0.0,0.0,0,0,0,0,0,0,Backing Unsafely,Unspecified,,,,Station Wagon/Sport Utility Vehicle,Station Wagon/Sport Utility Vehicle,,,,2019-06-29 22:55:00
6053684,3597157,a1cacaa6-7935-4457-afd8-4cec4121f506,OCCUPANT,UNSPECIFIED,,0.0,17089908.0,,,,,,,,,Registrant,,,01/12/2017,14:45,QUEENS,11375.0,40.710625,-73.8519,"(40.710625, -73.8519)",70 DRIVE                        ,METROPOLITAN AVENUE,,0.0,0.0,0,0,0,0,0,0,Passing Too Closely,Unspecified,,,,Sedan,Sedan,,,,2017-01-12 14:45:00
6208914,3484722,1285039,OCCUPANT,UNSPECIFIED,M,34.0,17164403.0,,,,,,,,,Registrant,,,04/19/2016,11:14,BROOKLYN,11207.0,,,,BUSHWICK AVENUE                 ,CONWAY STREET,,0.0,0.0,0,0,0,0,0,0,Following Too Closely,Unspecified,Unspecified,,,2 dr sedan,4 dr sedan,Station Wagon/Sport Utility Vehicle,,,2016-04-19 11:14:00
11808583,4407231,dc0eac52-78fe-4260-a2bb-d6733177a461,OCCUPANT,UNSPECIFIED,M,44.0,19979989.0,Not Ejected,Does Not Apply,Does Not Apply,Driver,Lap Belt & Harness,,,Does Not Apply,Driver,,,04/12/2021,17:11,BRONX,10460.0,40.837585,-73.866394,"(40.837585, -73.866394)",ARCHER STREET                   ,TAYLOR AVENUE,,0.0,0.0,0,0,0,0,0,0,Unsafe Speed,Failure to Yield Right-of-Way,,,,Sedan,MOTOR SCOO,,,,2021-04-12 17:11:00
6075215,3609805,05d8b040-a793-41fd-9b8d-14064451a277,OCCUPANT,UNSPECIFIED,M,49.0,17100327.0,Not Ejected,Does Not Apply,Does Not Apply,Driver,Lap Belt,,,Does Not Apply,Driver,,,02/03/2017,10:25,BRONX,10474.0,40.81253,-73.89481,"(40.81253, -73.89481)",GRINNELL PLACE                  ,BARRY STREET,,0.0,0.0,0,0,0,0,0,0,Unsafe Lane Changing,Unspecified,,,,Tractor Truck Diesel,Sedan,,,,2017-02-03 10:25:00
12340106,4559427,086f85c2-a079-404b-8a6e-5475ee30ce7f,OCCUPANT,UNSPECIFIED,F,37.0,20287843.0,Not Ejected,Does Not Apply,Does Not Apply,"Front passenger, if two or more persons, including the driver, are in the front seat",Lap Belt & Harness,,,Does Not Apply,Passenger,,,08/29/2022,18:22,QUEENS,11419.0,40.690662,-73.81033,"(40.690662, -73.81033)",VANWYCK EXPRESSWAY,105 AVENUE,,1.0,0.0,0,0,0,0,1,0,Driver Inattention/Distraction,Driver Inattention/Distraction,,,,Sedan,Sedan,,,,2022-08-29 18:22:00
11790432,4426054,4a76138b-ec1c-4a55-8983-64a7d0010c17,OCCUPANT,UNSPECIFIED,M,31.0,19969319.0,Not Ejected,Does Not Apply,Does Not Apply,Unknown,,,,Does Not Apply,Driver,,,06/04/2021,0:00,BRONX,10463.0,40.886623,-73.910446,"(40.886623, -73.910446)",,,3590      NETHERLAND AVENUE,0.0,0.0,0,0,0,0,0,0,Driver Inexperience,Unspecified,,,,Station Wagon/Sport Utility Vehicle,,,,,2021-06-04 00:00:00
6279163,3460549,930015,OCCUPANT,UNSPECIFIED,M,22.0,17197136.0,Not Ejected,Does Not Apply,Does Not Apply,Driver,Lap Belt & Harness,,,Does Not Apply,Driver,,,06/07/2016,8:19,BROOKLYN,11212.0,40.66003,-73.92179,"(40.66003, -73.92179)",EAST 95 STREET                  ,CLARKSON AVENUE,,0.0,0.0,0,0,0,0,0,0,Other Vehicular,,,,,Bus,,,,,2016-06-07 08:19:00
6745101,3536200,2253588,OCCUPANT,UNSPECIFIED,,0.0,17418999.0,,,,,,,,,Registrant,,,10/07/2016,20:00,QUEENS,11355.0,40.756714,-73.81339,"(40.756714, -73.81339)",149 STREET                      ,ELM AVENUE,,0.0,0.0,0,0,0,0,0,0,Passing or Lane Usage Improper,Unspecified,,,,Station Wagon/Sport Utility Vehicle,Station Wagon/Sport Utility Vehicle,,,,2016-10-07 20:00:00
11858184,4411513,914f9c63-17ab-46f7-9bad-a9038c5d3c06,OCCUPANT,UNSPECIFIED,F,35.0,20009375.0,,,,,,,,,Registrant,,,04/28/2021,14:35,BROOKLYN,11208.0,40.681114,-73.87765,"(40.681114, -73.87765)",LOGAN STREET,DINSMORE PLACE,,2.0,0.0,0,0,0,0,2,0,Unspecified,,,,,Station Wagon/Sport Utility Vehicle,,,,,2021-04-28 14:35:00
6944264,3666450,0af1759a-d426-48ae-a014-309be198ef30,OCCUPANT,UNSPECIFIED,,0.0,17514515.0,,,,,,,,,Registrant,,,05/09/2017,17:00,,,40.74548,-73.97034,"(40.74548, -73.97034)",FDR DRIVE                       ,,,0.0,0.0,0,0,0,0,0,0,Following Too Closely,Unspecified,,,,Sedan,Sedan,,,,2017-05-09 17:00:00
13411852,4824727,7e144942-3bbb-415a-905f-6e8c24444481,OCCUPANT,UNSPECIFIED,M,68.0,20899087.0,,,,,,,,,Registrant,,,07/02/2025,14:31,BROOKLYN,11208.0,40.669724,-73.86096,"(40.669724, -73.86096)",LINDEN BLVD,DREW ST,,1.0,0.0,0,0,0,0,1,0,Traffic Control Disregarded,Unspecified,,,,Sedan,Sedan,,,,2025-07-02 14:31:00
13467536,4839678,ac75adf2-c9a3-422a-a4ce-caa47310f940,OCCUPANT,UNSPECIFIED,,,20931506.0,,,,,,,,,Registrant,,,09/03/2025,12:30,,,40.625774,-74.134735,"(40.625774, -74.134735)",FOREST AVE,VELTMAN AVE,,1.0,0.0,0,0,0,0,1,0,Turning Improperly,Unspecified,,,,Sedan,Station Wagon/Sport Utility Vehicle,,,,2025-09-03 12:30:00
9062050,4087764,0420e365-f8b0-4607-9cd9-fde091674244,OCCUPANT,UNSPECIFIED,M,34.0,18553223.0,Not Ejected,Does Not Apply,Does Not Apply,Driver,Unknown,,,Does Not Apply,Driver,,,02/27/2019,13:00,BROOKLYN,11214.0,40.601574,-73.99164,"(40.601574, -73.99164)",,,2278      85 STREET                     ,0.0,0.0,0,0,0,0,0,0,Passing or Lane Usage Improper,Unspecified,,,,Sedan,Pick-up Truck,,,,2019-02-27 13:00:00
9368687,3946633,004f68ef-362f-4f6d-956b-ace86375f609,OCCUPANT,UNSPECIFIED,F,52.0,18704262.0,Not Ejected,Does Not Apply,Does Not Apply,"Any person in the rear of a station wagon, pick-up truck, all passengers on a bus, etc",Unknown,,,Does Not Apply,Passenger,,,07/14/2018,12:34,BRONX,10451.0,40.820515,-73.930695,"(40.820515, -73.930695)",EXTERIOR STREET                 ,EAST 150 STREET,,0.0,0.0,0,0,0,0,0,0,Driver Inattention/Distraction,Driver Inattention/Distraction,,,,Station Wagon/Sport Utility Vehicle,,,,,2018-07-14 12:34:00
11747504,4417932,c0ae5f61-007a-4fbf-af39-56b377594998,OTHER MOTORIZED,INJURED,M,36.0,19944580.0,Not Ejected,Conscious,Elbow-Lower-Arm-Hand,Driver,Helmet Only (In-Line Skater/Bicyclist),,,None Visible,Driver,,,05/18/2021,15:51,QUEENS,11692.0,40.593006,-73.7934,"(40.593006, -73.7934)",,,64-11     BEACH CHANNEL DRIVE,1.0,0.0,0,0,0,0,0,0,Failure to Yield Right-of-Way,Unspecified,,,,Station Wagon/Sport Utility Vehicle,E-Bike,,,,2021-05-18 15:51:00
7016413,3671282,dce37c18-77e2-437d-baf2-482c69fb9039,OCCUPANT,UNSPECIFIED,F,44.0,17549203.0,Not Ejected,Does Not Apply,Does Not Apply,Driver,Lap Belt & Harness,,,Does Not Apply,Driver,,,05/15/2017,15:51,STATEN ISLAND,10308.0,40.54307,-74.145164,"(40.54307, -74.145164)",HYLAN BOULEVARD                 ,TARLEE PLACE,,0.0,0.0,0,0,0,0,0,0,Following Too Closely,Unspecified,,,,Station Wagon/Sport Utility Vehicle,Station Wagon/Sport Utility Vehicle,,,,2017-05-15 15:51:00
6087501,3626435,04854412-606c-4715-90c4-ba5b7a0efa2f,OCCUPANT,UNSPECIFIED,F,2.0,17106274.0,Not Ejected,Does Not Apply,Does Not Apply,"Middle rear seat, or passenger lying across a seat",,,,Does Not Apply,Passenger,,,03/04/2017,15:41,MANHATTAN,10037.0,40.818333,-73.9372,"(40.818333, -73.9372)",,,89        WEST 142 STREET               ,0.0,0.0,0,0,0,0,0,0,Passenger Distraction,Failure to Yield Right-of-Way,,,,Station Wagon/Sport Utility Vehicle,Station Wagon/Sport Utility Vehicle,,,,2017-03-04 15:41:00
7846223,3780656,7cb14fd7-587d-474a-a512-930f84215202,OCCUPANT,UNSPECIFIED,M,33.0,17953189.0,,,,,,,,,Registrant,,,10/30/2017,12:00,QUEENS,11385.0,40.700756,-73.89517,"(40.700756, -73.89517)",,,60-85     MYRTLE AVENUE                 ,0.0,0.0,0,0,0,0,0,0,Driver Inattention/Distraction,Unspecified,,,,Station Wagon/Sport Utility Vehicle,Sedan,,,,2017-10-30 12:00:00
12277062,4542938,cddacd95-9894-4c1c-9fea-ce59b8f8f579,OCCUPANT,UNSPECIFIED,M,62.0,20251479.0,,,,,,,,,Registrant,,,07/03/2022,4:29,BROOKLYN,11236.0,40.643158,-73.91796,"(40.643158, -73.91796)",CHASE COURT,EAST 83 STREET,,0.0,0.0,0,0,0,0,0,0,Backing Unsafely,Unspecified,,,,Sedan,Station Wagon/Sport Utility Vehicle,,,,2022-07-03 04:29:00
12816909,4677549,93aa51e1-88ff-4906-a588-03d711d622db,OCCUPANT,UNSPECIFIED,F,30.0,20558983.0,,,,,,,,,Registrant,,,11/08/2023,19:03,QUEENS,11362.0,40.767586,-73.728714,"(40.767586, -73.728714)",LITTLE NECK PARKWAY,52 ROAD,,1.0,0.0,0,0,0,0,1,0,Unspecified,Unspecified,,,,Station Wagon/Sport Utility Vehicle,Station Wagon/Sport Utility Vehicle,,,,2023-11-08 19:03:00
13290849,4793206,5dc9fe49-a3a1-4d36-a15c-5e44f4f1fc64,OCCUPANT,UNSPECIFIED,M,36.0,20830029.0,Not Ejected,Does Not Apply,Does Not Apply,Driver,Lap Belt & Harness,,,Does Not Apply,Driver,,,02/14/2025,14:17,QUEENS,11104.0,40.740177,-73.92692,"(40.740177, -73.92692)",39 ST,48 AVE,,0.0,0.0,0,0,0,0,0,0,Turning Improperly,Unspecified,,,,Sedan,Sedan,,,,2025-02-14 14:17:00
12919615,4709535,0fde1355-6344-4d45-98c8-f3186f964fdf,OCCUPANT,UNSPECIFIED,M,31.0,20617398.0,,,,,,,,,Registrant,,,03/06/2024,18:30,QUEENS,11372.0,40.74763,-73.88394,"(40.74763, -73.88394)",ROOSEVELT AVENUE,82 STREET,,0.0,0.0,0,0,0,0,0,0,Backing Unsafely,Unspecified,,,,Sedan,Station Wagon/Sport Utility Vehicle,,,,2024-03-06 18:30:00
12190779,4520777,13f146bc-ad8d-439a-9561-8a22c4ed5fae,OCCUPANT,UNSPECIFIED,M,27.0,20202128.0,,,,,,,,,Registrant,,,04/19/2022,6:50,BROOKLYN,11210.0,40.638443,-73.95215,"(40.638443, -73.95215)",FOSTER AVENUE,EAST 26 STREET,,0.0,0.0,0,0,0,0,0,0,Traffic Control Disregarded,Unspecified,,,,Sedan,,,,,2022-04-19 06:50:00
13274793,4789122,fb62bec3-6c8e-4cff-9ec1-97010820a4c2,OCCUPANT,UNSPECIFIED,M,56.0,20820845.0,Not Ejected,Does Not Apply,Does Not Apply,Driver,Lap Belt & Harness,,,Does Not Apply,Driver,,,01/29/2025,8:44,BROOKLYN,11230.0,40.63075,-73.97171,"(40.63075, -73.97171)",OCEAN PKWY,PARKVILLE AVE,,1.0,0.0,1,0,0,0,0,0,Failure to Yield Right-of-Way,,,,,Station Wagon/Sport Utility Vehicle,,,,,2025-01-29 08:44:00
12952239,4718145,e41f0f60-d555-4e2d-822b-51ca2cc8ddbb,OCCUPANT,UNSPECIFIED,,,20635913.0,,,,,,,,,Registrant,,,04/15/2024,7:15,QUEENS,11101.0,40.752403,-73.92442,"(40.752403, -73.92442)",NORTHERN BOULEVARD,STEINWAY STREET,,1.0,0.0,0,0,0,0,1,0,Following Too Closely,Unspecified,,,,Motorcycle,,,,,2024-04-15 07:15:00
11412995,4347644,3f1a3b6b-8909-4ee8-8c4b-e2de9adf2699,OCCUPANT,UNSPECIFIED,F,46.0,19749385.0,Not Ejected,Does Not Apply,Does Not Apply,"Front passenger, if two or more persons, including the driver, are in the front seat",Lap Belt & Harness,,,Does Not Apply,Passenger,,,09/08/2020,17:51,BROOKLYN,11207.0,40.660656,-73.885796,"(40.660656, -73.885796)",LINDEN BOULEVARD                ,VAN SICLEN AVENUE,,0.0,0.0,0,0,0,0,0,0,Other Vehicular,Other Vehicular,,,,Station Wagon/Sport Utility Vehicle,Station Wagon/Sport Utility Vehicle,,,,2020-09-08 17:51:00
12296255,4547644,adb15531-f5d6-4745-bd88-838cdeb36ff3,OCCUPANT,INJURED,M,44.0,20262449.0,Not Ejected,Conscious,Knee-Lower Leg Foot,"Front passenger, if two or more persons, including the driver, are in the front seat",Unknown,,,Complaint of Pain or Nausea,Passenger,,,07/19/2022,21:51,BRONX,10468.0,40.862747,-73.90494,"(40.862747, -73.90494)",WEST FORDHAM ROAD,UNIVERSITY AVENUE,,3.0,0.0,0,0,0,0,3,0,Driver Inattention/Distraction,Driver Inattention/Distraction,,,,Taxi,Sedan,,,,2022-07-19 21:51:00
11423216,4350232,ba76135f-df2c-4aa2-a58f-b8363ec65e59,OCCUPANT,UNSPECIFIED,F,39.0,19755451.0,,,,,,,,,Registrant,,,09/20/2020,12:18,,,40.829136,-73.9114,"(40.829136, -73.9114)",WEBSTER AVENUE                  ,,,3.0,0.0,0,0,0,0,3,0,Reaction to Uninvolved Vehicle,Following Too Closely,,,,Station Wagon/Sport Utility Vehicle,Station Wagon/Sport Utility Vehicle,,,,2020-09-20 12:18:00
7363415,3863903,324ca21f-6445-4328-a55f-588511e6fdb4,OCCUPANT,UNSPECIFIED,,0.0,17717016.0,,,,,,,,,Registrant,,,03/15/2018,12:35,,,40.69325,-73.972916,"(40.69325, -73.972916)",MYRTLE AVENUE                   ,CARLTON AVENUE,,0.0,0.0,0,0,0,0,0,0,Unspecified,,,,,Pick-up Truck,,,,,2018-03-15 12:35:00
8996671,4096026,9ff94633-af0b-4fba-9ec5-4b98f7ef2818,OCCUPANT,UNSPECIFIED,M,27.0,18520975.0,Not Ejected,Does Not Apply,Does Not Apply,Driver,Lap Belt & Harness,,,Does Not Apply,Driver,,,03/12/2019,8:25,BROOKLYN,11233.0,40.67887,-73.92165,"(40.67887, -73.92165)",RALPH AVENUE                    ,FULTON STREET,,1.0,0.0,0,0,0,0,1,0,Reaction to Uninvolved Vehicle,Reaction to Uninvolved Vehicle,,,,Sedan,Garbage or Refuse,,,,2019-03-12 08:25:00
9552904,4006196,d3171bac-a356-406c-97ed-a71f9bf305ec,OCCUPANT,INJURED,F,43.0,18794778.0,Not Ejected,Shock,Back,Driver,Lap Belt & Harness,,,Complaint of Pain or Nausea,Driver,,,10/19/2018,18:25,,,,,,NEW ENGLAND THRUWAY             ,,,4.0,0.0,0,0,0,0,4,0,Unspecified,Unspecified,Unspecified,Unspecified,,Tractor Truck Diesel,Station Wagon/Sport Utility Vehicle,Sedan,Sedan,,2018-10-19 18:25:00
9209769,3949460,10466253-a557-4077-8ed3-2cb16f61ef2d,OCCUPANT,UNSPECIFIED,M,32.0,18626315.0,Not Ejected,Does Not Apply,Does Not Apply,Right rear passenger or motorcycle sidecar passenger,Unknown,,,Does Not Apply,Passenger,,,07/27/2018,12:55,BRONX,10455.0,40.811737,-73.90049,"(40.811737, -73.90049)",,,585       BRUCKNER BOULEVARD            ,0.0,0.0,0,0,0,0,0,0,Unspecified,Unspecified,,,,Box Truck,Van,,,,2018-07-27 12:55:00
6677406,3562125,2729490,OCCUPANT,INJURED,M,30.0,17386415.0,Not Ejected,Conscious,Knee-Lower Leg Foot,Driver,Lap Belt,,,Complaint of Pain,Driver,,,11/13/2016,13:09,QUEENS,11434.0,40.68704,-73.780525,"(40.68704, -73.780525)",167 STREET                      ,116 AVENUE,,3.0,0.0,0,0,0,0,3,0,Aggressive Driving/Road Rage,Unspecified,Unspecified,,,Sedan,Sedan,Sedan,,,2016-11-13 13:09:00
6036139,3603874,06fa0171-ef8c-4b8d-b8d9-c17d035a2b70,OCCUPANT,UNSPECIFIED,,0.0,17081488.0,,,,,,,,,Registrant,,,01/24/2017,14:00,QUEENS,11693.0,40.613388,-73.8204,"(40.613388, -73.8204)",,,312       CROSS BAY BOULEVARD           ,0.0,0.0,0,0,0,0,0,0,Unspecified,Unspecified,,,,Sedan,,,,,2017-01-24 14:00:00
11074990,4288623,5ba916a5-a891-4c85-9f02-8b39800317c2,OCCUPANT,UNSPECIFIED,F,58.0,19566475.0,Not Ejected,Does Not Apply,Does Not Apply,Driver,Lap Belt & Harness,,,Does Not Apply,Driver,,,02/14/2020,15:05,QUEENS,11369.0,40.75868,-73.87552,"(40.75868, -73.87552)",93 STREET                       ,32 AVENUE,,0.0,0.0,0,0,0,0,0,0,Backing Unsafely,Unspecified,,,,Bus,Station Wagon/Sport Utility Vehicle,,,,2020-02-14 15:05:00
6483614,3526481,2084466,OCCUPANT,UNSPECIFIED,M,38.0,17293753.0,Not Ejected,Does Not Apply,Does Not Apply,Driver,Lap Belt & Harness,,,Does Not Apply,Driver,,,09/16/2016,8:15,,,40.671585,-73.99843,"(40.671585, -73.99843)",GOWANUS EXPY (BQE)              ,,,0.0,0.0,0,0,0,0,0,0,Unsafe Lane Changing,Unsafe Lane Changing,,,,Station Wagon/Sport Utility Vehicle,Box Truck,,,,2016-09-16 08:15:00
6116504,3618649,881bddd1-55b1-40f5-965c-1860ee3df75a,OCCUPANT,UNSPECIFIED,M,36.0,17120168.0,,,,,,,,,Registrant,,,02/18/2017,1:15,BROOKLYN,11234.0,40.610443,-73.925934,"(40.610443, -73.925934)",AVENUE T                        ,COLEMAN STREET,,0.0,0.0,0,0,0,0,0,0,Driver Inattention/Distraction,Unspecified,Unspecified,,,Sedan,Sedan,Sedan,,,2017-02-18 01:15:00
6245401,3465009,1012729,OCCUPANT,UNSPECIFIED,M,26.0,17181373.0,Not Ejected,Does Not Apply,Does Not Apply,Driver,Lap Belt & Harness,,,Does Not Apply,Driver,,,06/20/2016,15:00,,,40.804993,-73.934875,"(40.804993, -73.934875)",EAST 127 STREET                 ,,,0.0,0.0,0,0,0,0,0,0,Unspecified,Unspecified,,,,Station Wagon/Sport Utility Vehicle,Bus,,,,2016-06-20 15:00:00
11496150,4369371,2115b668-741d-4bcb-a5ed-b90b383bb96a,OCCUPANT,UNSPECIFIED,,,,,,,,,,,,Witness,,,11/20/2020,22:30,BRONX,10451.0,,,,EXTERIOR STREET                 ,EAST 138 STREET,,1.0,0.0,0,0,0,0,1,0,Unspecified,Unspecified,,,,Sedan,Sedan,,,,2020-11-20 22:30:00
11991472,4468475,549a1b96-2da0-4b4e-8732-a7ec1e37482a,OCCUPANT,UNSPECIFIED,F,67.0,20087120.0,Not Ejected,Does Not Apply,Does Not Apply,Driver,Lap Belt & Harness,,,Does Not Apply,Driver,,,10/16/2021,11:20,BROOKLYN,11236.0,40.64715,-73.89496,"(40.6471498, -73.8949618)",,,10410     FLATLANDS AVENUE,0.0,0.0,0,0,0,0,0,0,Unspecified,Unspecified,,,,Sedan,Sedan,,,,2021-10-16 11:20:00
13465004,4839180,5db0733e-8abf-472a-909a-a10eb034db53,OCCUPANT,UNSPECIFIED,F,53.0,20930090.0,Not Ejected,Does Not Apply,Does Not Apply,"Front passenger, if two or more persons, including the driver, are in the front seat",Unknown,,,Does Not Apply,Passenger,,,09/01/2025,21:20,BROOKLYN,11233.0,40.676937,-73.92182,"(40.676937, -73.92182)",RALPH AVE,ATLANTIC AVE,,1.0,0.0,1,0,0,0,0,0,Driver Inattention/Distraction,,,,,Sedan,,,,,2025-09-01 21:20:00
10079871,4190272,d7076d02-3e34-4fa8-a728-460a11741d65,OCCUPANT,UNSPECIFIED,,0.0,19056133.0,,,,,,,,,Registrant,,,08/11/2019,16:30,,,,,,TRIBOROUGH BRIDGE               ,,,0.0,0.0,0,0,0,0,0,0,Driver Inattention/Distraction,Unspecified,Unspecified,,,Station Wagon/Sport Utility Vehicle,Pick-up Truck,Sedan,,,2019-08-11 16:30:00
13001808,4730829,4483bd57-2392-4ab3-b405-74e64f3c18ac,OCCUPANT,UNSPECIFIED,F,4.0,20663653.0,Not Ejected,Does Not Apply,Does Not Apply,Right rear passenger or motorcycle sidecar passenger,Child Restraint Only,,,Does Not Apply,Passenger,,,06/01/2024,10:30,,,,,,VERRAZANO BRIDGE UPPER,,,0.0,0.0,0,0,0,0,0,0,Following Too Closely,Unspecified,,,,Station Wagon/Sport Utility Vehicle,Station Wagon/Sport Utility Vehicle,,,,2024-06-01 10:30:00
13259448,4785263,4667f793-bb10-4830-b6d8-7310beabaa9f,OCCUPANT,UNSPECIFIED,,,20812040.0,,,,,,,,,Registrant,,,01/12/2025,15:45,MANHATTAN,10002.0,40.715954,-73.986725,"(40.715954, -73.986725)",GRAND ST,CLINTON ST,,0.0,0.0,0,0,0,0,0,0,Unspecified,Unspecified,,,,Sedan,Tow Truck / Wrecker,,,,2025-01-12 15:45:00
6135683,3621802,a17190d1-fd40-456c-89cf-4db26b79774d,OCCUPANT,UNSPECIFIED,,0.0,17129557.0,,,,,,,,,Registrant,,,02/25/2017,22:30,MANHATTAN,10001.0,40.750294,-73.99485,"(40.750294, -73.99485)",8 AVENUE                        ,WEST 31 STREET,,0.0,0.0,0,0,0,0,0,0,Driver Inattention/Distraction,Unsafe Speed,,,,Taxi,Sedan,,,,2017-02-25 22:30:00
9627076,4008935,f7bda905-3852-4fb3-874f-83f277f353dd,OCCUPANT,UNSPECIFIED,M,29.0,18831452.0,,,,,,,,,Registrant,,,10/27/2018,13:55,QUEENS,11419.0,40.69458,-73.819435,"(40.69458, -73.819435)",129 STREET                      ,95 AVENUE,,0.0,0.0,0,0,0,0,0,0,Failure to Yield Right-of-Way,Unsafe Speed,,,,Taxi,Taxi,,,,2018-10-27 13:55:00
9027479,4073864,93b49635-b2f0-4d5c-b8e5-1e8ac8a9083d,OCCUPANT,UNSPECIFIED,,0.0,18536119.0,,,,,,,,,Registrant,,,02/03/2019,14:00,STATEN ISLAND,10305.0,40.597343,-74.07097,"(40.597343, -74.07097)",SAND LANE                       ,MCFARLAND AVENUE,,0.0,0.0,0,0,0,0,0,0,Driver Inattention/Distraction,Unspecified,,,,Station Wagon/Sport Utility Vehicle,Station Wagon/Sport Utility Vehicle,,,,2019-02-03 14:00:00
9732418,4044934,42eb24a5-59d3-4739-81e1-79cf5149602c,OCCUPANT,UNSPECIFIED,F,0.0,18884010.0,,,,,,,,,Registrant,,,12/14/2018,19:15,,,40.658577,-73.89063,"(40.658577, -73.89063)",LINDEN BOULEVARD                ,,,0.0,0.0,0,0,0,0,0,0,Other Vehicular,Driver Inattention/Distraction,,,,Sedan,Pick-up Truck,,,,2018-12-14 19:15:00
12259193,4538289,4c4e877c-5cd8-4583-ab69-1e949d17aaaf,OCCUPANT,UNSPECIFIED,M,35.0,20241181.0,,,,,,,,,Registrant,,,06/17/2022,16:00,,,40.66919,-73.77249,"(40.66919, -73.77249)",BREWER BOULEVARD,144 AVENUE,,1.0,0.0,0,0,0,0,1,0,Failure to Yield Right-of-Way,Unspecified,,,,Station Wagon/Sport Utility Vehicle,Station Wagon/Sport Utility Vehicle,,,,2022-06-17 16:00:00
13439953,4832448,cd5a4e30-fc27-49aa-9e63-b73da0f1806c,OCCUPANT,UNSPECIFIED,,,20915599.0,,,,,,,,,Registrant,,,08/02/2025,17:16,BRONX,10457.0,40.852516,-73.8893,"(40.852516, -73.8893)",,,2227      ADAMS PL,0.0,0.0,0,0,0,0,0,0,Backing Unsafely,Unspecified,,,,Sedan,Box Truck,,,,2025-08-02 17:16:00
6504735,3508777,1760294,OCCUPANT,UNSPECIFIED,M,36.0,17303826.0,Not Ejected,Does Not Apply,Does Not Apply,Driver,Lap Belt & Harness,,,Does Not Apply,Driver,,,08/29/2016,5:50,MANHATTAN,10017.0,40.748177,-73.970375,"(40.748177, -73.970375)",1 AVENUE                        ,EAST 41 STREET,,0.0,0.0,0,0,0,0,0,0,Unspecified,,,,,Sedan,,,,,2016-08-29 05:50:00
9114849,3921904,9c343bbb-188c-4f13-a875-fdf8f17f4d6f,OCCUPANT,UNSPECIFIED,M,29.0,18579421.0,Not Ejected,Does Not Apply,Does Not Apply,Driver,Lap Belt,,,Does Not Apply,Driver,,,06/15/2018,14:45,MANHATTAN,10012.0,40.72709,-73.991554,"(40.72709, -73.991554)",EAST 4 STREET                   ,COOPER SQUARE,,1.0,0.0,1,0,0,0,0,0,Unspecified,,,,,Station Wagon/Sport Utility Vehicle,,,,,2018-06-15 14:45:00
7293288,3826861,40f34d09-efd8-4534-9832-50a16b931c0c,OCCUPANT,UNSPECIFIED,,0.0,17682531.0,,,,,,,,,Registrant,,,01/10/2018,11:27,MANHATTAN,10040.0,40.85431,-73.93009,"(40.85431, -73.93009)",WEST 189 STREET                 ,SAINT NICHOLAS AVENUE,,0.0,0.0,0,0,0,0,0,0,Driver Inattention/Distraction,Unspecified,,,,Sedan,Pick-up Truck,,,,2018-01-10 11:27:00
9618587,4042640,8930eb2c-6780-471c-8fa1-4adb5b0e6c97,OCCUPANT,UNSPECIFIED,,,,,,,,,,,,Witness,,,12/10/2018,10:25,BROOKLYN,11230.0,40.6175,-73.96089,"(40.6175, -73.96089)",EAST 14 STREET                  ,ELM AVENUE,,0.0,0.0,0,0,0,0,0,0,Glare,,,,,Sedan,,,,,2018-12-10 10:25:00
10319570,4245551,9fe388b4-b405-4de7-ac33-b50b6dbbcbfc,OCCUPANT,UNSPECIFIED,F,37.0,19176381.0,Not Ejected,Does Not Apply,Does Not Apply,Driver,Lap Belt & Harness,,,Does Not Apply,Driver,,,11/22/2019,10:08,QUEENS,11101.0,40.74044,-73.949936,"(40.74044, -73.949936)",BORDEN AVENUE                   ,21 STREET,,0.0,0.0,0,0,0,0,0,0,Driver Inattention/Distraction,Unspecified,,,,Station Wagon/Sport Utility Vehicle,Sedan,,,,2019-11-22 10:08:00
11238867,4260073,329fcd1d-01be-420e-881a-abdab7707a3c,OCCUPANT,UNSPECIFIED,,,19652214.0,,,,,,,,,Registrant,,,12/17/2019,15:30,MANHATTAN,10019.0,40.767815,-73.98951,"(40.767815, -73.98951)",10 AVENUE                       ,WEST 55 STREET,,0.0,0.0,0,0,0,0,0,0,Unsafe Lane Changing,Other Vehicular,,,,Taxi,Station Wagon/Sport Utility Vehicle,,,,2019-12-17 15:30:00
11800345,4425239,0f2f6292-bdb5-4011-b880-3158e7f6351c,OCCUPANT,UNSPECIFIED,M,25.0,19975154.0,,,,,,,,,Registrant,,,06/09/2021,13:42,BROOKLYN,11217.0,40.687378,-73.98598,"(40.687378, -73.98598)",,,371       ATLANTIC AVENUE,0.0,0.0,0,0,0,0,0,0,Unsafe Lane Changing,Unspecified,,,,Station Wagon/Sport Utility Vehicle,Sedan,,,,2021-06-09 13:42:00
13075903,4749988,ec4f5e03-d825-4eb1-a204-1caffe470c1f,OCCUPANT,INJURED,F,24.0,20706050.0,Not Ejected,Conscious,Neck,Driver,Lap Belt & Harness,,,Whiplash,Driver,,,08/15/2024,11:32,,,40.607815,-74.14082,"(40.607815, -74.14082)",STATEN ISLAND EXPRESSWAY,,,1.0,0.0,0,0,0,0,1,0,Unspecified,,,,,Sedan,,,,,2024-08-15 11:32:00
7510389,3880316,8246439e-4565-4c1c-91ca-6eec40228ee1,OCCUPANT,UNSPECIFIED,M,8.0,17789178.0,Not Ejected,Does Not Apply,Does Not Apply,"Middle rear seat, or passenger lying across a seat",Lap Belt & Harness,,,Does Not Apply,Passenger,,,04/13/2018,12:20,,,40.72293,-73.847336,"(40.72293, -73.847336)",QUEENS BOULEVARD                ,YELLOWSTONE BOULEVARD,,0.0,0.0,0,0,0,0,0,0,Following Too Closely,Unspecified,,,,Sedan,Station Wagon/Sport Utility Vehicle,,,,2018-04-13 12:20:00
10266393,4233373,bfbe118f-dc41-490a-8230-c881b514a07c,OCCUPANT,UNSPECIFIED,F,53.0,19149689.0,Not Ejected,Does Not Apply,Does Not Apply,Driver,Unknown,,,Does Not Apply,Driver,,,10/31/2019,18:15,QUEENS,11434.0,40.673973,-73.768326,"(40.673973, -73.768326)",,,134-47    173 STREET                    ,0.0,0.0,0,0,0,0,0,0,Passing Too Closely,Failure to Keep Right,,,,Station Wagon/Sport Utility Vehicle,Station Wagon/Sport Utility Vehicle,,,,2019-10-31 18:15:00
9580990,4002588,8ee38e6f-236c-4bdc-9451-86c2a252870e,OCCUPANT,UNSPECIFIED,M,53.0,18808830.0,,,,,,,,,Registrant,,,10/18/2018,10:55,BRONX,10454.0,40.807205,-73.91837,"(40.807205, -73.91837)",,,537       EAST 138 STREET               ,0.0,0.0,0,0,0,0,0,0,Turning Improperly,Unspecified,,,,Station Wagon/Sport Utility Vehicle,Station Wagon/Sport Utility Vehicle,,,,2018-10-18 10:55:00
9389247,3990495,4ef4993a-e86a-4e84-b103-157a31b26b7f,OCCUPANT,UNSPECIFIED,M,35.0,18714255.0,,,,,,,,,Registrant,,,09/29/2018,5:06,BRONX,10467.0,40.86778,-73.8615,"(40.86778, -73.8615)",ARNOW AVENUE                    ,BRONXWOOD AVENUE,,0.0,0.0,0,0,0,0,0,0,Driver Inattention/Distraction,Unspecified,,,,Station Wagon/Sport Utility Vehicle,Van,,,,2018-09-29 05:06:00
6016207,3446881,804852,OCCUPANT,UNSPECIFIED,M,,17072034.0,,,,,,,,,Registrant,,,05/29/2016,19:40,,,40.750538,-73.93981,"(40.750538, -73.93981)",Queensboro Bridge               ,,,0.0,0.0,0,0,0,0,0,0,Following Too Closely,Unspecified,,,,4 dr sedan,4 dr sedan,,,,2016-05-29 19:40:00
11210551,4249988,cf503dca-f1a0-4995-9464-9eb01058dee6,OCCUPANT,UNSPECIFIED,M,40.0,19638045.0,Not Ejected,Does Not Apply,Does Not Apply,Driver,Lap Belt & Harness,,,Does Not Apply,Driver,,,11/29/2019,11:50,MANHATTAN,10018.0,40.753887,-73.9885,"(40.753887, -73.9885)",,,533       7 AVENUE                      ,0.0,0.0,0,0,0,0,0,0,Passing or Lane Usage Improper,Unspecified,,,,Taxi,Sedan,,,,2019-11-29 11:50:00
7613457,3826204,0175840e-52b3-4a6e-bc9d-d205dcb6d51b,OCCUPANT,UNSPECIFIED,M,3.0,17839794.0,Not Ejected,Does Not Apply,Does Not Apply,Right rear passenger or motorcycle sidecar passenger,Lap Belt & Harness,,,Does Not Apply,Passenger,,,12/05/2017,18:45,MANHATTAN,10002.0,40.71595,-73.97891,"(40.71595, -73.97891)",DELANCEY STREET                 ,LEWIS STREET,,0.0,0.0,0,0,0,0,0,0,Backing Unsafely,Unspecified,,,,Sedan,Sedan,,,,2017-12-05 18:45:00
7042574,3685908,d6241f57-0264-474f-b13a-2425013f5d8a,OCCUPANT,UNSPECIFIED,F,27.0,17561774.0,Not Ejected,Does Not Apply,Does Not Apply,"Front passenger, if two or more persons, including the driver, are in the front seat",Lap Belt & Harness,,,Does Not Apply,Passenger,,,06/07/2017,14:36,,,40.66615,-73.84161,"(40.66615, -73.84161)",BELT PARKWAY                    ,,,0.0,0.0,0,0,0,0,0,0,Unspecified,Unspecified,,,,Station Wagon/Sport Utility Vehicle,Station Wagon/Sport Utility Vehicle,,,,2017-06-07 14:36:00
9865934,4141468,6b151e56-9e06-404e-8911-d290c31c21ad,OCCUPANT,UNSPECIFIED,M,25.0,18949756.0,Not Ejected,Does Not Apply,Does Not Apply,Driver,Lap Belt & Harness,,,Does Not Apply,Driver,,,05/29/2019,13:25,BRONX,10454.0,40.809105,-73.9229,"(40.809105, -73.9229)",WILLIS AVENUE                   ,EAST 138 STREET,,0.0,0.0,0,0,0,0,0,0,Unspecified,Unspecified,,,,Box Truck,Sedan,,,,2019-05-29 13:25:00
7512067,3896812,f49fc664-f5f0-4b87-b27c-d32485ae8c5d,OCCUPANT,UNSPECIFIED,M,6.0,17790016.0,Not Ejected,Does Not Apply,Does Not Apply,Unknown,,,,Does Not Apply,Passenger,,,05/08/2018,10:40,MANHATTAN,10035.0,40.802753,-73.93358,"(40.802753, -73.93358)",2 AVENUE                        ,EAST 125 STREET,,0.0,0.0,0,0,0,0,0,0,Unspecified,Unspecified,,,,Sedan,Bus,,,,2018-05-08 10:40:00
9134332,4098421,efd4bd1f-1aba-4910-b466-f63a150c14ad,OCCUPANT,UNSPECIFIED,F,33.0,18589052.0,,,,,,,,,Registrant,,,03/15/2019,18:10,,,40.708324,-73.84314,"(40.708324, -73.84314)",JACKIE ROBINSON PKWY            ,,,0.0,0.0,0,0,0,0,0,0,Following Too Closely,Following Too Closely,Unspecified,,,Sedan,Sedan,Station Wagon/Sport Utility Vehicle,,,2019-03-15 18:10:00
11964160,4460988,71103e6d-e1e0-4269-ad84-90d5566a0307,OCCUPANT,UNSPECIFIED,M,,20071400.0,,,,,,,,,Registrant,,,09/13/2021,18:30,QUEENS,11368.0,40.757824,-73.86101,"(40.757824, -73.86101)",NORTHERN BOULEVARD,108 STREET,,1.0,0.0,0,0,0,0,1,0,Driver Inattention/Distraction,Driver Inattention/Distraction,Unspecified,,,Station Wagon/Sport Utility Vehicle,Sedan,Station Wagon/Sport Utility Vehicle,,,2021-09-13 18:30:00
6601818,3583440,3107835,OCCUPANT,UNSPECIFIED,,0.0,17350147.0,,,,,,,,,Registrant,,,12/19/2016,11:10,,,40.804012,-73.93097,"(40.804012, -73.93097)",HARLEM RIVER DRIVE              ,,,0.0,0.0,0,0,0,0,0,0,Following Too Closely,Unspecified,,,,Station Wagon/Sport Utility Vehicle,Station Wagon/Sport Utility Vehicle,,,,2016-12-19 11:10:00
6708429,3586765,3173976,OCCUPANT,UNSPECIFIED,M,32.0,17401238.0,,,,,,,,,Registrant,,,12/21/2016,8:20,,,40.834114,-73.86327,"(40.834114, -73.86327)",CROSS BRONX EXPY                ,,,0.0,0.0,0,0,0,0,0,0,Driver Inattention/Distraction,Unspecified,Unspecified,Unspecified,Unspecified,Sedan,Tractor Truck Diesel,Sedan,Sedan,Sedan,2016-12-21 08:20:00
12502714,4602173,aedea79d-a35e-4f50-88bc-b2e6eb5f6fc1,OCCUPANT,UNSPECIFIED,M,53.0,20380860.0,,,,,,,,,Registrant,,,01/31/2023,20:00,BROOKLYN,11206.0,40.700718,-73.929794,"(40.700718, -73.929794)",CENTRAL AVENUE,JEFFERSON STREET,,0.0,0.0,0,0,0,0,0,0,Driver Inexperience,Unspecified,,,,Sedan,Sedan,,,,2023-01-31 20:00:00
9000186,4078761,d9ab37b0-1bfc-40ed-a591-a08a3a6e6c47,OCCUPANT,UNSPECIFIED,M,41.0,18522703.0,Not Ejected,Does Not Apply,Does Not Apply,Unknown,,,,Does Not Apply,Driver,,,02/11/2019,0:00,MANHATTAN,10035.0,40.799664,-73.93812,"(40.799664, -73.93812)",,,210       EAST 119 STREET               ,0.0,0.0,0,0,0,0,0,0,Unspecified,,,,,Sedan,,,,,2019-02-11 00:00:00
7277377,3818890,0b70c853-3840-4eac-b831-1a556daf51a3,OCCUPANT,UNSPECIFIED,M,24.0,17674554.0,Not Ejected,Does Not Apply,Does Not Apply,Driver,Lap Belt & Harness,,,Does Not Apply,Driver,,,01/01/2018,9:00,,,,,,CROSS BRONX EXPWY SERVICE ROAD  ,WESTCHESTER AVENUE,,0.0,0.0,0,0,0,0,0,0,Backing Unsafely,Unspecified,,,,Sedan,Carry All,,,,2018-01-01 09:00:00
7230001,3721619,4d97d691-0338-449f-9646-452be31d145c,OCCUPANT,UNSPECIFIED,F,8.0,17651546.0,Not Ejected,Does Not Apply,Does Not Apply,"Left rear passenger, or rear passenger on a bicycle, motorcycle, snowmobile",Lap Belt & Harness,,,Does Not Apply,Passenger,,,07/30/2017,13:28,,,40.580616,-74.152534,"(40.580616, -74.152534)",RICHMOND HILL ROAD              ,,,0.0,0.0,0,0,0,0,0,0,Following Too Closely,Unspecified,,,,Sedan,Sedan,,,,2017-07-30 13:28:00
7219855,3741323,e071f4c5-cb61-4d10-93b9-9d651e61d762,OCCUPANT,UNSPECIFIED,F,30.0,17646739.0,Not Ejected,Does Not Apply,Does Not Apply,Driver,Lap Belt & Harness,,,Does Not Apply,Driver,,,09/02/2017,21:20,,,40.645767,-73.95808,"(40.645767, -73.95808)",FLATBUSH AVENUE                 ,,,0.0,0.0,0,0,0,0,0,0,Unspecified,Unspecified,,,,Sedan,Sedan,,,,2017-09-02 21:20:00
6178761,3454591,843508,OCCUPANT,INJURED,F,69.0,17150289.0,Not Ejected,Conscious,Neck,"Front passenger, if two or more persons, including the driver, are in the front seat",Lap Belt & Harness,,,Complaint of Pain,Passenger,,,06/01/2016,22:00,,,40.732136,-73.92556,"(40.732136, -73.92556)",Brooklyn Queens Expy            ,,,2.0,0.0,0,0,0,0,2,0,Following Too Closely,Unspecified,,,,2 dr sedan,4 dr sedan,,,,2016-06-01 22:00:00
6835148,3652509,f72d16a9-055a-4cb6-9653-a7bd635f8bde,OCCUPANT,UNSPECIFIED,F,38.0,17462111.0,,,,,,,,,Registrant,,,04/15/2017,22:30,,,40.847557,-73.91623,"(40.847557, -73.91623)",MACOMBS ROAD                    ,WEST 174 STREET,,0.0,0.0,0,0,0,0,0,0,Driver Inattention/Distraction,Unspecified,,,,Station Wagon/Sport Utility Vehicle,Sedan,,,,2017-04-15 22:30:00
11982522,4446373,0b820a91-2ff0-46eb-8482-20f94e830590,OCCUPANT,UNSPECIFIED,M,40.0,20081945.0,,,,,,,,,Registrant,,,08/08/2021,3:00,BROOKLYN,11221.0,40.68665,-73.92074,"(40.6866487, -73.9207388)",JEFFERSON AVENUE,HOWARD AVENUE,,0.0,0.0,0,0,0,0,0,0,Unspecified,,,,,Station Wagon/Sport Utility Vehicle,,,,,2021-08-08 03:00:00
11332536,4326572,1c147815-57ef-482f-b703-8adf48e97892,OCCUPANT,UNSPECIFIED,,,19702726.0,,,,,,,,,Registrant,,,07/07/2020,20:01,,,40.7605,-73.95699,"(40.7605, -73.95699)",FDR DRIVE                       ,,,0.0,0.0,0,0,0,0,0,0,Driver Inattention/Distraction,Driver Inattention/Distraction,Unspecified,Unspecified,,Sedan,Sedan,Station Wagon/Sport Utility Vehicle,,,2020-07-07 20:01:00
12270412,4541251,b3406d64-ed9a-4cb4-b197-b9ea1d5f734c,OCCUPANT,UNSPECIFIED,M,20.0,20247672.0,,,,,,,,,Registrant,,,06/26/2022,23:50,BROOKLYN,11234.0,40.621357,-73.92714,"(40.621357, -73.92714)",UTICA AVENUE,AVENUE M,,1.0,0.0,0,0,0,0,1,0,Driver Inattention/Distraction,,,,,Sedan,,,,,2022-06-26 23:50:00
12795432,4677496,46825fe8-31f8-447e-b75e-8282d86ed5d0,OCCUPANT,UNSPECIFIED,M,66.0,20546858.0,Not Ejected,Does Not Apply,Does Not Apply,Driver,Lap Belt & Harness,,,Does Not Apply,Driver,,,11/08/2023,13:29,,,40.70128,-73.93952,"(40.70128, -73.93952)",FLUSHING AVENUE,,,1.0,0.0,0,0,0,0,1,0,Passing or Lane Usage Improper,Unspecified,,,,Station Wagon/Sport Utility Vehicle,Moped,,,,2023-11-08 13:29:00
9646621,3938123,81cbee39-76a3-4733-a93a-1b0af48121e3,OCCUPANT,UNSPECIFIED,F,41.0,18841092.0,Not Ejected,Does Not Apply,Does Not Apply,Driver,Lap Belt,,,Does Not Apply,Driver,,,07/02/2018,16:00,QUEENS,11428.0,40.727028,-73.733086,"(40.727028, -73.733086)",92 AVENUE                       ,224 STREET,,0.0,0.0,0,0,0,0,0,0,Driver Inattention/Distraction,Driver Inattention/Distraction,,,,Station Wagon/Sport Utility Vehicle,Sedan,,,,2018-07-02 16:00:00
11070307,4300682,fa8329a5-d011-4fef-ab6f-bc8cba24aa5f,OCCUPANT,UNSPECIFIED,,,,,,,,,,,,Witness,,,03/15/2020,18:05,BROOKLYN,11205.0,40.69312,-73.96882,"(40.69312, -73.96882)",MYRTLE AVENUE                   ,CLINTON AVENUE,,2.0,0.0,1,0,0,0,1,0,Failure to Yield Right-of-Way,,,,,Station Wagon/Sport Utility Vehicle,,,,,2020-03-15 18:05:00
6758026,3567562,2828953,OCCUPANT,UNSPECIFIED,,0.0,17425165.0,,,,,,,,,Registrant,,,11/26/2016,15:30,QUEENS,11356.0,40.786827,-73.84571,"(40.786827, -73.84571)",COLLEGE POINT BOULEVARD         ,13 AVENUE,,0.0,0.0,0,0,0,0,0,0,Unspecified,Unspecified,,,,Station Wagon/Sport Utility Vehicle,Sedan,,,,2016-11-26 15:30:00
9814645,4129180,17fc7d45-d20a-423f-8760-d49f57f9d69e,OCCUPANT,UNSPECIFIED,M,24.0,18924448.0,Not Ejected,Does Not Apply,Does Not Apply,Driver,Lap Belt & Harness,,,Does Not Apply,Driver,,,04/30/2019,0:00,QUEENS,11433.0,40.698505,-73.80086,"(40.698505, -73.80086)",,,155-11    LIBERTY AVENUE                ,1.0,0.0,0,0,0,0,1,0,Driver Inexperience,Failure to Yield Right-of-Way,,,,Sedan,Station Wagon/Sport Utility Vehicle,,,,2019-04-30 00:00:00
9055002,4101095,8a0beaa6-87a0-4cf8-b323-84b472abc356,OCCUPANT,UNSPECIFIED,M,16.0,18549678.0,Not Ejected,Does Not Apply,Does Not Apply,"Any person in the rear of a station wagon, pick-up truck, all passengers on a bus, etc",Lap Belt,,,Does Not Apply,Passenger,,,03/20/2019,8:03,BROOKLYN,11206.0,40.69706,-73.943726,"(40.69706, -73.943726)",,,211       THROOP AVENUE                 ,0.0,0.0,0,0,0,0,0,0,Other Vehicular,Other Vehicular,,,,Bus,Taxi,,,,2019-03-20 08:03:00
9751726,4114671,946040ef-3df7-4cf7-a3df-a273bbf69d81,OCCUPANT,UNSPECIFIED,M,23.0,18893405.0,Not Ejected,Does Not Apply,Does Not Apply,Driver,Lap Belt & Harness,,,Does Not Apply,Driver,,,04/13/2019,13:30,QUEENS,11418.0,40.7011,-73.84157,"(40.7011, -73.84157)",MYRTLE AVENUE                   ,PARK LANE SOUTH,,0.0,0.0,0,0,0,0,0,0,Driver Inattention/Distraction,Driver Inattention/Distraction,,,,Station Wagon/Sport Utility Vehicle,Station Wagon/Sport Utility Vehicle,,,,2019-04-13 13:30:00
10047476,4182629,e3d01179-8f6d-493a-889e-81cca01014f1,OCCUPANT,UNSPECIFIED,,0.0,19039856.0,,,,,,,,,Registrant,,,08/03/2019,21:30,,,40.73226,-73.83522,"(40.73226, -73.83522)",VAN WYCK EXPWY                  ,,,0.0,0.0,0,0,0,0,0,0,Unsafe Lane Changing,Unspecified,,,,Station Wagon/Sport Utility Vehicle,Pick-up Truck,,,,2019-08-03 21:30:00
7627615,3815398,2f51c3f4-46c3-4403-acc7-4f79ca27aa13,OCCUPANT,UNSPECIFIED,M,55.0,17846644.0,Not Ejected,Does Not Apply,Does Not Apply,Driver,Lap Belt,,,Does Not Apply,Driver,,,12/25/2017,21:07,MANHATTAN,10002.0,40.72247,-73.987144,"(40.72247, -73.987144)",EAST HOUSTON STREET             ,LUDLOW STREET,,0.0,0.0,0,0,0,0,0,0,Unspecified,Unspecified,,,,Sedan,Sedan,,,,2017-12-25 21:07:00
9866048,4138047,0cd473e2-6016-4fdb-ac05-f56288fe14ca,OCCUPANT,UNSPECIFIED,M,37.0,18949803.0,Not Ejected,Does Not Apply,Does Not Apply,Driver,Lap Belt & Harness,,,Does Not Apply,Driver,,,05/22/2019,16:00,BRONX,10470.0,40.906384,-73.85167,"(40.906384, -73.85167)",EAST 242 STREET                 ,CARPENTER AVENUE,,0.0,0.0,0,0,0,0,0,0,Driver Inattention/Distraction,Unspecified,,,,Sedan,Sedan,,,,2019-05-22 16:00:00
12791498,4676322,32668b57-00c0-4cc2-8e6a-c93923581b6c,OCCUPANT,UNSPECIFIED,F,,20544588.0,,,,,,,,,Registrant,,,10/25/2023,13:12,,,40.63175,-74.15123,"(40.63175, -74.15123)",WALKER STREET,LAKE AVENUE,,1.0,0.0,0,0,0,0,1,0,Driver Inattention/Distraction,Unspecified,,,,Station Wagon/Sport Utility Vehicle,Station Wagon/Sport Utility Vehicle,,,,2023-10-25 13:12:00
12435858,4584593,a4901466-d179-4f5b-a5ac-ef8e87e821d2,OCCUPANT,UNSPECIFIED,M,55.0,20342618.0,,,,,,,,,Registrant,,,11/25/2022,17:18,,,40.583626,-73.98407,"(40.583626, -73.98407)",BELT PARKWAY,,,0.0,0.0,0,0,0,0,0,0,Unsafe Speed,Unspecified,Unspecified,,,Sedan,Station Wagon/Sport Utility Vehicle,Sedan,,,2022-11-25 17:18:00
7624085,3750687,5737da8b-6132-4e49-8715-05957dfdc55d,OCCUPANT,UNSPECIFIED,F,57.0,17844935.0,Not Ejected,Does Not Apply,Does Not Apply,Driver,Lap Belt & Harness,,,Does Not Apply,Driver,,,08/24/2017,17:00,BROOKLYN,11238.0,40.68175,-73.96748,"(40.68175, -73.96748)",VANDERBILT AVENUE               ,ATLANTIC AVENUE,,0.0,0.0,0,0,0,0,0,0,Unspecified,Unspecified,,,,Taxi,Sedan,,,,2017-08-24 17:00:00
10205537,4219722,015a8a2a-46fa-46ed-9883-c91bfd45e58c,OCCUPANT,UNSPECIFIED,F,26.0,19119442.0,Not Ejected,Does Not Apply,Does Not Apply,Driver,Lap Belt & Harness,,,Does Not Apply,Driver,,,10/05/2019,4:05,BROOKLYN,11236.0,40.63682,-73.89955,"(40.63682, -73.89955)",,,1392      EAST 92 STREET                ,0.0,0.0,0,0,0,0,0,0,Driver Inattention/Distraction,Unspecified,,,,Station Wagon/Sport Utility Vehicle,Sedan,,,,2019-10-05 04:05:00
7258391,3729594,5f5f8282-a401-4e83-9ec1-cee836018d2c,OCCUPANT,UNSPECIFIED,M,45.0,17665303.0,,,,,,,,,Registrant,,,08/12/2017,12:15,,,40.75836,-73.94154,"(40.75836, -73.94154)",38 AVENUE                       ,,,0.0,0.0,0,0,0,0,0,0,Passing Too Closely,Unspecified,,,,Station Wagon/Sport Utility Vehicle,,,,,2017-08-12 12:15:00
7400374,3860306,a3b3c474-7d2e-41cf-ae92-d40be5e73f66,OCCUPANT,UNSPECIFIED,F,12.0,17735123.0,Not Ejected,Does Not Apply,Does Not Apply,"Front passenger, if two or more persons, including the driver, are in the front seat",Lap Belt,,,Does Not Apply,Passenger,,,03/10/2018,12:35,BROOKLYN,11213.0,40.667824,-73.93122,"(40.667824, -73.93122)",UNION STREET                    ,UTICA AVENUE,,0.0,0.0,0,0,0,0,0,0,Driver Inattention/Distraction,Driver Inattention/Distraction,,,,Sedan,Station Wagon/Sport Utility Vehicle,,,,2018-03-10 12:35:00
12228677,4530284,c782e01b-f2a2-4d39-a960-bc7ab4660e92,OCCUPANT,UNSPECIFIED,M,37.0,20223646.0,,,,,,,,,Registrant,,,05/22/2022,0:40,,,40.8464,-73.89338,"(40.8464, -73.89338)",EAST TREMONT AVENUE,ARTHUR AVENUE,,0.0,0.0,0,0,0,0,0,0,Driver Inattention/Distraction,Unspecified,,,,Station Wagon/Sport Utility Vehicle,,,,,2022-05-22 00:40:00
7187010,3732486,be8ab031-edc0-488e-be69-22c58a4846c0,OCCUPANT,UNSPECIFIED,,0.0,17630775.0,,,,,,,,,Registrant,,,08/15/2017,17:30,BROOKLYN,11218.0,40.634888,-73.9728,"(40.634888, -73.9728)",,,550       OCEAN PARKWAY                 ,0.0,0.0,0,0,0,0,0,0,Unspecified,Unspecified,,,,Box Truck,Bus,,,,2017-08-15 17:30:00
9876714,4143806,516fe037-152e-4a57-8a54-650140b01bcc,OCCUPANT,UNSPECIFIED,M,58.0,18955098.0,,,,,,,,,Registrant,,,05/31/2019,17:40,BROOKLYN,11229.0,40.610504,-73.95767,"(40.610504, -73.95767)",AVENUE P                        ,EAST 16 STREET,,0.0,0.0,0,0,0,0,0,0,Unspecified,Unspecified,,,,Sedan,Sedan,,,,2019-05-31 17:40:00
13525686,4855166,37b07739-6ad5-443f-91d0-3cd8a8e84cd3,OCCUPANT,UNSPECIFIED,M,29.0,20964677.0,,,,,,,,,Registrant,,,11/04/2025,15:10,QUEENS,11370.0,40.75479,-73.89544,"(40.75479, -73.89544)",,,32-67     71 ST,1.0,0.0,0,0,0,0,1,0,Following Too Closely,Unspecified,,,,Motorcycle,Sedan,,,,2025-11-04 15:10:00
13276328,4789389,fc815966-9ce9-4c93-b716-da381643d0ac,OCCUPANT,INJURED,F,26.0,20821658.0,Not Ejected,Conscious,Abdomen - Pelvis,"Front passenger, if two or more persons, including the driver, are in the front seat",Lap Belt & Harness,,,Complaint of Pain or Nausea,Passenger,,,01/30/2025,20:15,QUEENS,11375.0,,,,UNION TPKE,71 AVE,,2.0,0.0,0,0,0,0,2,0,Unsafe Speed,,,,,Sedan,,,,,2025-01-30 20:15:00
9415458,3963594,eecb0fff-bcf7-48ed-b1f2-54afae3ae035,OCCUPANT,UNSPECIFIED,M,24.0,18727126.0,,,,,,,,,Registrant,,,08/18/2018,12:10,BROOKLYN,11220.0,40.632446,-74.01272,"(40.632446, -74.01272)",,,6521      8 AVENUE                      ,0.0,0.0,0,0,0,0,0,0,Unspecified,Unspecified,,,,Sedan,Station Wagon/Sport Utility Vehicle,,,,2018-08-18 12:10:00
11239179,3944169,499a93b3-ae7d-4e13-9e8b-cac9e78996a7,OCCUPANT,UNSPECIFIED,F,0.0,19652383.0,,,,,,,,,Registrant,,,07/19/2018,23:00,BROOKLYN,11208.0,40.67412,-73.88081,"(40.67412, -73.88081)",PITKIN AVENUE                   ,SHEPHERD AVENUE,,0.0,0.0,0,0,0,0,0,0,Passing or Lane Usage Improper,Unspecified,Unspecified,Unspecified,Unspecified,Sedan,Sedan,Sedan,Sedan,Sedan,2018-07-19 23:00:00
11470973,4362773,07ad0978-fd80-4459-8201-6229a8bdc9e5,OCCUPANT,UNSPECIFIED,F,5.0,19783193.0,Not Ejected,Does Not Apply,Does Not Apply,"Left rear passenger, or rear passenger on a bicycle, motorcycle, snowmobile",Lap Belt & Harness,,,Does Not Apply,Passenger,,,10/28/2020,21:12,BROOKLYN,11233.0,,,,Thomas s Boyland street         ,Eastern parkway,,1.0,0.0,0,0,0,0,1,0,Traffic Control Device Improper/Non-Working,Traffic Control Device Improper/Non-Working,,,,Sedan,Station Wagon/Sport Utility Vehicle,,,,2020-10-28 21:12:00
9912989,4151466,78ce3081-afd0-4c31-a1bf-1dd6eb2fd3e5,OCCUPANT,UNSPECIFIED,F,37.0,18973047.0,,,,,,,,,Registrant,,,06/14/2019,8:30,QUEENS,11413.0,40.680115,-73.75324,"(40.680115, -73.75324)",MERRICK BOULEVARD               ,SPRINGFIELD BOULEVARD,,0.0,0.0,0,0,0,0,0,0,Unspecified,Unspecified,,,,Station Wagon/Sport Utility Vehicle,Station Wagon/Sport Utility Vehicle,,,,2019-06-14 08:30:00
11316450,4322375,46db2388-1b06-40e3-bf9b-523110bdb700,OCCUPANT,UNSPECIFIED,M,81.0,19693545.0,Not Ejected,Does Not Apply,Does Not Apply,Driver,Lap Belt & Harness,,,Does Not Apply,Driver,,,06/22/2020,11:25,QUEENS,11379.0,40.714622,-73.90117,"(40.714622, -73.90117)",FRESH POND ROAD                 ,ELIOT AVENUE,,0.0,0.0,0,0,0,0,0,0,Unspecified,Unspecified,,,,Sedan,Sedan,,,,2020-06-22 11:25:00
6539558,3577846,2993254,OCCUPANT,UNSPECIFIED,F,35.0,17320421.0,,,,,,,,,Registrant,,,12/08/2016,20:10,BROOKLYN,11222.0,40.72754,-73.95296,"(40.72754, -73.95296)",,,787       MANHATTAN AVENUE              ,0.0,0.0,0,0,0,0,0,0,Passing or Lane Usage Improper,Following Too Closely,,,,Sedan,Station Wagon/Sport Utility Vehicle,,,,2016-12-08 20:10:00
9109088,4110059,89fd564f-83a9-4905-aebf-7b07a26af65a,OCCUPANT,UNSPECIFIED,,0.0,18576527.0,,,,,,,,,Registrant,,,04/05/2019,19:38,MANHATTAN,10036.0,40.760822,-73.99832,"(40.760822, -73.99832)",WEST 42 STREET                  ,11 AVENUE,,0.0,0.0,0,0,0,0,0,0,Passing Too Closely,Passing Too Closely,,,,Station Wagon/Sport Utility Vehicle,Tractor Truck Diesel,,,,2019-04-05 19:38:00
7351032,3835438,6b7e71be-b99a-47a9-b567-cbb210f16477,OCCUPANT,UNSPECIFIED,F,26.0,17710898.0,,,,,,,,,Registrant,,,01/25/2018,18:43,BROOKLYN,11226.0,40.63962,-73.95477,"(40.63962, -73.95477)",FLATBUSH AVENUE                 ,NEWKIRK AVENUE,,0.0,0.0,0,0,0,0,0,0,Unspecified,Unspecified,,,,Van,Sedan,,,,2018-01-25 18:43:00
7901204,3799181,796d05ad-53c1-4700-b0b3-d7b35315143b,OCCUPANT,UNSPECIFIED,M,25.0,17980244.0,Not Ejected,Does Not Apply,Does Not Apply,Driver,Lap Belt & Harness,,,Does Not Apply,Driver,,,11/29/2017,0:15,,,40.728855,-73.92782,"(40.728855, -73.92782)",BROOKLYN QUEENS EXPRESSWAY      ,,,0.0,0.0,0,0,0,0,0,0,Following Too Closely,Unspecified,,,,Sedan,Sedan,,,,2017-11-29 00:15:00
7523989,3791360,0325a414-f792-4691-a673-5954492252f6,OCCUPANT,UNSPECIFIED,F,31.0,17795819.0,Not Ejected,Does Not Apply,Does Not Apply,Driver,Lap Belt & Harness,,,Does Not Apply,Driver,,,11/14/2017,15:54,MANHATTAN,10027.0,40.809284,-73.94811,"(40.809284, -73.94811)",,,2108      7 AVENUE                      ,0.0,0.0,0,0,0,0,0,0,Unspecified,Unspecified,,,,Sedan,Sedan,,,,2017-11-14 15:54:00
12418440,4580242,2ee650a0-3e6c-4f6c-b273-94e7e632000a,BICYCLIST,INJURED,F,40.0,20332801.0,Ejected,Conscious,Knee-Lower Leg Foot,"Left rear passenger, or rear passenger on a bicycle, motorcycle, snowmobile",,,,Complaint of Pain or Nausea,Passenger,,,11/06/2022,17:30,MANHATTAN,10022.0,40.762733,-73.9734,"(40.762733, -73.9734)",,,11        EAST 57 STREET,3.0,0.0,0,0,3,0,0,0,Unsafe Lane Changing,Driver Inattention/Distraction,,,,Taxi,Pedicab,,,,2022-11-06 17:30:00
9699032,4014302,bedd3c58-0fb6-42c1-90c4-43584c31aa3a,OCCUPANT,UNSPECIFIED,M,33.0,18867155.0,Not Ejected,Does Not Apply,Does Not Apply,Driver,Lap Belt,,,Does Not Apply,Driver,,,11/02/2018,20:30,,,40.77077,-73.91727,"(40.77077, -73.91727)",31 STREET                       ,ASTORIA BOULEVARD,,1.0,0.0,0,0,0,0,1,0,Driver Inattention/Distraction,Unspecified,,,,Station Wagon/Sport Utility Vehicle,Station Wagon/Sport Utility Vehicle,,,,2018-11-02 20:30:00
6907333,3649974,bfd92958-9c70-4733-b294-2cf320171a37,OCCUPANT,UNSPECIFIED,,0.0,17496913.0,,,,,,,,,Registrant,,,04/12/2017,14:00,,,40.656708,-74.00537,"(40.656708, -74.00537)",3 AVENUE                        ,,,0.0,0.0,0,0,0,0,0,0,Turning Improperly,Unspecified,,,,Station Wagon/Sport Utility Vehicle,Station Wagon/Sport Utility Vehicle,,,,2017-04-12 14:00:00
6850718,3636328,afe6c35e-bf7a-4c0f-888e-8c1daf44256f,OCCUPANT,UNSPECIFIED,M,30.0,17469631.0,Not Ejected,Does Not Apply,Does Not Apply,Driver,Unknown,,,Does Not Apply,Driver,,,03/20/2017,16:45,,,,,,DRAPER PLACE                    ,RICHMOND AVENUE,,0.0,0.0,0,0,0,0,0,0,Unspecified,Unspecified,,,,Sedan,Sedan,,,,2017-03-20 16:45:00
12696729,4651989,41fb91f1-45b2-4654-98a7-3b6fe3084df6,OCCUPANT,UNSPECIFIED,M,22.0,20490462.0,Not Ejected,Does Not Apply,Does Not Apply,Driver,Lap Belt & Harness,,,Does Not Apply,Driver,,,08/01/2023,16:30,,,40.848118,-73.93089,"(40.848118, -73.93089)",WASHINGTON BRIDGE,,,0.0,0.0,0,0,0,0,0,0,Passing or Lane Usage Improper,View Obstructed/Limited,,,,Sedan,Sedan,,,,2023-08-01 16:30:00
11978129,4465012,f6ec1071-ab50-4ff9-b823-31552039e120,OCCUPANT,UNSPECIFIED,M,29.0,20079427.0,,,,,,,,,Registrant,,,10/06/2021,8:00,,,,,,SANDS STREET,JAY STREET,,0.0,0.0,0,0,0,0,0,0,Passing or Lane Usage Improper,Unspecified,,,,Sedan,Station Wagon/Sport Utility Vehicle,,,,2021-10-06 08:00:00
12186121,4519527,78b4a78e-c236-434a-9ab5-fa0b497fa87c,OCCUPANT,UNSPECIFIED,F,7.0,20199486.0,Not Ejected,Does Not Apply,Does Not Apply,"Left rear passenger, or rear passenger on a bicycle, motorcycle, snowmobile",Unknown,,,Does Not Apply,Passenger,,,04/15/2022,18:05,BROOKLYN,11233.0,40.669476,-73.919975,"(40.669476, -73.919975)",HOWARD AVENUE,EASTERN PARKWAY,,2.0,0.0,0,0,0,0,2,0,Driver Inattention/Distraction,Unspecified,Unspecified,,,Station Wagon/Sport Utility Vehicle,Sedan,Station Wagon/Sport Utility Vehicle,,,2022-04-15 18:05:00
9039642,4093399,0466f71d-6019-4a2d-a234-75f293c8bc06,OCCUPANT,UNSPECIFIED,F,61.0,18542035.0,Not Ejected,Does Not Apply,Does Not Apply,Driver,Lap Belt & Harness,,,Does Not Apply,Driver,,,03/08/2019,16:10,,,40.623886,-73.89559,"(40.623886, -73.89559)",BELT PARKWAY                    ,,,0.0,0.0,0,0,0,0,0,0,Following Too Closely,Unspecified,Unspecified,,,Sedan,Sedan,Sedan,,,2019-03-08 16:10:00
12606707,4628754,23949ab8-4851-45b5-bc72-dd284d0a6a11,OCCUPANT,UNSPECIFIED,,,,,,,,,,,,Witness,,,05/13/2023,0:50,BRONX,10451.0,40.826134,-73.92947,"(40.826134, -73.92947)",,,71        EAST 153 STREET,0.0,0.0,0,0,0,0,0,0,Alcohol Involvement,Unspecified,,,,Pick-up Truck,Sedan,,,,2023-05-13 00:50:00
12464322,4591789,3a8b44fa-c754-4619-a419-db85d202187f,OCCUPANT,INJURED,M,43.0,20358740.0,Not Ejected,Conscious,Abdomen - Pelvis,Driver,Lap Belt & Harness,,,None Visible,Driver,,,12/15/2022,14:20,BROOKLYN,11207.0,40.666878,-73.901276,"(40.666878, -73.901276)",BLAKE AVENUE,VAN SIDERIN AVENUE,,2.0,0.0,0,0,0,0,2,0,Failure to Yield Right-of-Way,Other Vehicular,,,,Station Wagon/Sport Utility Vehicle,Sedan,,,,2022-12-15 14:20:00
9263137,3915123,7d9d3036-5bf4-45a5-a938-d5778ca45732,OCCUPANT,UNSPECIFIED,M,-518.0,18652318.0,,,,,,,,,Registrant,,,06/05/2018,18:40,BROOKLYN,11218.0,40.638897,-73.96982,"(40.638897, -73.96982)",CORTELYOU ROAD                  ,EAST 9 STREET,,0.0,0.0,0,0,0,0,0,0,Unspecified,Unspecified,,,,Sedan,Station Wagon/Sport Utility Vehicle,,,,2018-06-05 18:40:00
9640491,4034797,d5f460b8-bd26-447a-8050-98724fbf11b5,OCCUPANT,UNSPECIFIED,M,0.0,18838065.0,,,,,,,,,Registrant,,,11/29/2018,8:34,BROOKLYN,11203.0,40.636345,-73.93264,"(40.636345, -73.93264)",,,1011      EAST 46 STREET                ,0.0,0.0,0,0,0,0,0,0,Passing Too Closely,Unspecified,,,,Bus,Pick-up Truck,,,,2018-11-29 08:34:00
7201825,3721809,7e96812d-3fec-4db5-ba81-f18ed2a49ece,OCCUPANT,UNSPECIFIED,,0.0,17638017.0,,,,,,,,,Registrant,,,07/31/2017,1:30,BRONX,10454.0,40.811653,-73.91685,"(40.811653, -73.91685)",BROOK AVENUE                    ,EAST 144 STREET,,3.0,0.0,0,0,0,0,3,0,Traffic Control Disregarded,Unspecified,,,,Sedan,Sedan,,,,2017-07-31 01:30:00
9953640,4163057,64a4a704-4ef9-4c72-9e0a-eaf713deb80a,OCCUPANT,UNSPECIFIED,M,49.0,18993133.0,Not Ejected,Does Not Apply,Does Not Apply,Driver,Lap Belt,,,Does Not Apply,Driver,,,07/01/2019,20:20,BRONX,10457.0,40.838665,-73.90502,"(40.838665, -73.90502)",,,1525      BROOK AVENUE                  ,0.0,0.0,0,0,0,0,0,0,Backing Unsafely,Unspecified,,,,Sedan,Pick-up Truck,,,,2019-07-01 20:20:00
9142283,3923686,938c8294-0c64-42f7-843a-e3ad548d551f,OCCUPANT,UNSPECIFIED,F,38.0,18592962.0,,,,,,,,,Registrant,,,06/18/2018,10:38,MANHATTAN,10040.0,40.857124,-73.93241,"(40.857124, -73.93241)",,,4470      BROADWAY                      ,0.0,0.0,0,0,0,0,0,0,Unsafe Lane Changing,Unspecified,,,,Bus,Station Wagon/Sport Utility Vehicle,,,,2018-06-18 10:38:00
9189085,3922794,55f1df06-6ad4-4fc5-82db-bf00d7329c0a,OCCUPANT,UNSPECIFIED,M,48.0,18616127.0,Not Ejected,Does Not Apply,Does Not Apply,Driver,Lap Belt,,,Does Not Apply,Driver,,,06/13/2018,11:34,BROOKLYN,11221.0,40.687504,-73.91465,"(40.687504, -73.91465)",BUSHWICK AVENUE                 ,WEIRFIELD STREET,,0.0,0.0,0,0,0,0,0,0,Driver Inattention/Distraction,Unspecified,,,,Station Wagon/Sport Utility Vehicle,Station Wagon/Sport Utility Vehicle,,,,2018-06-13 11:34:00
11827873,4434690,ff4999fb-c26c-4841-88f3-775419abd868,OCCUPANT,UNSPECIFIED,M,48.0,19991384.0,Not Ejected,Does Not Apply,Does Not Apply,Driver,Lap Belt & Harness,,,Does Not Apply,Driver,,,07/06/2021,12:10,,,40.67357,-73.95294,"(40.67357, -73.95294)",ROGERS AVENUE,,,0.0,0.0,0,0,0,0,0,0,Driver Inattention/Distraction,Following Too Closely,Following Too Closely,Following Too Closely,,Station Wagon/Sport Utility Vehicle,Sedan,Sedan,Station Wagon/Sport Utility Vehicle,,2021-07-06 12:10:00
7179187,3711467,0434cbdb-7bf1-4789-857e-11a34aad9613,OCCUPANT,UNSPECIFIED,M,19.0,17627066.0,Not Ejected,Does Not Apply,Does Not Apply,Driver,Lap Belt & Harness,,,Does Not Apply,Driver,,,07/13/2017,13:07,,,40.634575,-74.14584,"(40.634575, -74.14584)",MORNINGSTAR ROAD                ,INNIS STREET,,1.0,0.0,0,0,0,0,1,0,Driver Inattention/Distraction,Backing Unsafely,Unspecified,,,TRUCK,Sedan,Sedan,,,2017-07-13 13:07:00
9756839,4115537,140e772d-62b9-4933-9087-b9ba525104a0,OCCUPANT,UNSPECIFIED,,0.0,18895949.0,,,,,,,,,Registrant,,,04/15/2019,17:00,BRONX,10473.0,40.82138,-73.852264,"(40.82138, -73.852264)",,,2097      HOMER AVENUE                  ,1.0,0.0,0,0,0,0,1,0,Unspecified,Unspecified,,,,Sedan,Sedan,,,,2019-04-15 17:00:00
12522291,4607197,22ad89f5-9bbd-452d-affb-bb5152ba305a,OCCUPANT,UNSPECIFIED,,,20391899.0,,,,,,,,,Registrant,,,02/17/2023,21:33,,,40.76363,-73.9533,"(40.76363, -73.9533)",FDR DRIVE,,,0.0,0.0,0,0,0,0,0,0,Driver Inattention/Distraction,Unspecified,,,,LIMO,Sedan,,,,2023-02-17 21:33:00
11561036,4385757,85bda76c-5cb3-4916-8055-401db8ce26e8,OCCUPANT,UNSPECIFIED,,,19835787.0,,,,,,,,,Registrant,,,01/19/2021,22:14,,,40.766098,-73.951096,"(40.766098, -73.951096)",FDR DRIVE                       ,,,2.0,0.0,0,0,0,0,2,0,Driver Inattention/Distraction,Driver Inattention/Distraction,Driver Inattention/Distraction,Driver Inattention/Distraction,,Station Wagon/Sport Utility Vehicle,Sedan,Station Wagon/Sport Utility Vehicle,Sedan,,2021-01-19 22:14:00
9315983,3910081,70845f36-ac5e-4d11-b656-65e7b3f11245,BICYCLIST,INJURED,M,18.0,18678341.0,Not Ejected,Conscious,Knee-Lower Leg Foot,Driver,,,,Complaint of Pain or Nausea,Driver,,,05/28/2018,21:11,BRONX,10467.0,40.875328,-73.869225,"(40.875328, -73.869225)",MAGENTA STREET                  ,BARKER AVENUE,,1.0,0.0,0,0,1,0,0,0,Unspecified,Unspecified,,,,Sedan,Bike,,,,2018-05-28 21:11:00
13197447,4768945,8bb82b40-870d-4bea-85a3-38c83a26b450,OCCUPANT,UNSPECIFIED,,,20777070.0,,,,,,,,,Registrant,,,11/01/2024,14:53,QUEENS,11691.0,,,"(0.0, 0.0)",,,22-91     NAMEOKE AVE,0.0,0.0,0,0,0,0,0,0,Passing Too Closely,Unspecified,,,,Bus,Sedan,,,,2024-11-01 14:53:00
6209865,3486316,1318720,OCCUPANT,UNSPECIFIED,M,33.0,17164844.0,,,,,,,,,Registrant,,,07/24/2016,23:50,MANHATTAN,10014.0,40.731415,-74.00118,"(40.731415, -74.00118)",,,333       AVENUE OF THE AMERICAS        ,0.0,0.0,0,0,0,0,0,0,Passing Too Closely,Unspecified,,,,Taxi,Taxi,,,,2016-07-24 23:50:00
12699114,4652412,826a19d2-8707-4f1e-ae44-8c62dd613cfa,OCCUPANT,UNSPECIFIED,,,20491855.0,,,,,,,,,Registrant,,,08/05/2023,21:20,,,,,,FORT INDEPENDENCE STREET,SEDGWICK AVENUE,,0.0,0.0,0,0,0,0,0,0,Driver Inattention/Distraction,Unspecified,,,,Sedan,Bus,,,,2023-08-05 21:20:00
6146492,3625021,a3bcbc4f-d1ac-4669-b561-2ba2d63e49ba,OCCUPANT,UNSPECIFIED,F,26.0,17134835.0,Not Ejected,Does Not Apply,Does Not Apply,Driver,Lap Belt & Harness,,,Does Not Apply,Driver,,,03/02/2017,8:00,,,40.62506,-74.13582,"(40.62506, -74.13582)",FOREST AVENUE                   ,BARRETT AVENUE,,0.0,0.0,0,0,0,0,0,0,Unspecified,Unspecified,,,,Sedan,Station Wagon/Sport Utility Vehicle,,,,2017-03-02 08:00:00
8968774,4093015,afd52926-8a7b-42d1-83d1-87bc0b408f88,OCCUPANT,UNSPECIFIED,F,62.0,18507166.0,,,,,,,,,Registrant,,,03/07/2019,18:37,,,40.586315,-73.80653,"(40.586315, -73.80653)",SHORE FRONT PARKWAY             ,,,1.0,0.0,0,0,0,0,1,0,Following Too Closely,Unspecified,,,,Sedan,Station Wagon/Sport Utility Vehicle,,,,2019-03-07 18:37:00
11231083,4248789,8ec16587-38ef-4564-9d0e-3398782dc5ea,OCCUPANT,UNSPECIFIED,M,37.0,19648291.0,,,,,,,,,Registrant,,,11/28/2019,0:01,,,40.83767,-73.91921,"(40.83767, -73.91921)",GERARD AVENUE                   ,,,0.0,0.0,0,0,0,0,0,0,Reaction to Uninvolved Vehicle,Unspecified,,,,Sedan,Station Wagon/Sport Utility Vehicle,,,,2019-11-28 00:01:00
13376925,4815720,d0d646b2-b23d-4143-8c5e-87ed5cc96363,OCCUPANT,UNSPECIFIED,,,20879035.0,,,,,,,,,Registrant,,,05/24/2025,16:38,,,,,,BQE WB ENTRANCE MEEKER AVE,BROOKLYN QUEENS EXPY EB EXIT 3,,0.0,0.0,0,0,0,0,0,0,Alcohol Involvement,Unspecified,,,,Station Wagon/Sport Utility Vehicle,Station Wagon/Sport Utility Vehicle,,,,2025-05-24 16:38:00
7703317,3784231,c34c74d3-9b4a-491e-8f40-ec9bb5f2020d,OCCUPANT,UNSPECIFIED,M,27.0,17883803.0,Not Ejected,Does Not Apply,Does Not Apply,Driver,Lap Belt & Harness,,,Does Not Apply,Driver,,,11/05/2017,19:47,,,40.85482,-73.9112,"(40.85482, -73.9112)",UNIVERSITY AVENUE               ,,,0.0,0.0,0,0,0,0,0,0,Failure to Yield Right-of-Way,Unspecified,,,,Sedan,Station Wagon/Sport Utility Vehicle,,,,2017-11-05 19:47:00
12040639,4481342,0fd026bd-42ba-4aae-b942-bf127d1f133d,OCCUPANT,UNSPECIFIED,M,39.0,20115185.0,,,,,,,,,Registrant,,,11/27/2021,2:11,BROOKLYN,11214.0,40.595375,-73.98628,"(40.595375, -73.98628)",,,8664      26 AVENUE,1.0,0.0,0,0,0,0,1,0,Other Vehicular,Unspecified,,,,Station Wagon/Sport Utility Vehicle,Station Wagon/Sport Utility Vehicle,,,,2021-11-27 02:11:00
6688215,3558578,2647354,OCCUPANT,UNSPECIFIED,M,31.0,17391571.0,Not Ejected,Does Not Apply,Does Not Apply,Driver,Unknown,,,Does Not Apply,Driver,,,11/10/2016,15:30,,,40.603443,-74.06834,"(40.603443, -74.06834)",STATEN ISLAND EXPRESSWAY RAMP   ,,,0.0,0.0,0,0,0,0,0,0,Following Too Closely,Unspecified,,,,Station Wagon/Sport Utility Vehicle,Sedan,,,,2016-11-10 15:30:00
12561515,4617122,7fbce076-7c13-4572-b15a-f8dcd95e90de,OCCUPANT,INJURED,M,63.0,20414143.0,Not Ejected,Conscious,Back,Driver,Lap Belt & Harness,,,Internal,Driver,,,03/28/2023,10:30,,,40.788956,-73.823555,"(40.788956, -73.823555)",WHITESTONE EXPRESSWAY,,,1.0,0.0,0,0,0,0,1,0,Unsafe Lane Changing,Unspecified,,,,Sedan,Pick-up Truck,,,,2023-03-28 10:30:00
9734456,4009138,5942df82-d766-4fa8-992f-5f06277a5128,OCCUPANT,UNSPECIFIED,M,32.0,18885060.0,,,,,,,,,Registrant,,,10/28/2018,12:05,,,40.793972,-73.7975,"(40.793972, -73.7975)",POWELLS COVE BOULEVARD          ,,,0.0,0.0,0,0,0,0,0,0,Unspecified,Unspecified,,,,Sedan,,,,,2018-10-28 12:05:00
6866819,3642880,9fabfcb5-8e62-4303-adb5-c7fe78570885,OCCUPANT,UNSPECIFIED,,0.0,17477504.0,,,,,,,,,Registrant,,,04/01/2017,11:00,BROOKLYN,11209.0,40.6306,-74.02814,"(40.6306, -74.02814)",,,7609      3 AVENUE                      ,0.0,0.0,0,0,0,0,0,0,Failure to Yield Right-of-Way,Unspecified,,,,Sedan,Sedan,,,,2017-04-01 11:00:00
6887351,3646229,537bc560-6fbf-4f39-b2ac-00532b81b53b,OCCUPANT,UNSPECIFIED,,0.0,17487291.0,,,,,,,,,Registrant,,,04/03/2017,12:05,BROOKLYN,11210.0,40.62875,-73.95111,"(40.62875, -73.95111)",EAST 26 STREET                  ,AVENUE I,,0.0,0.0,0,0,0,0,0,0,Passenger Distraction,Unspecified,,,,Station Wagon/Sport Utility Vehicle,Sedan,,,,2017-04-03 12:05:00
11258467,4260805,bdc4a247-45a4-4877-96ac-083dd690bb6e,OCCUPANT,UNSPECIFIED,M,26.0,19662251.0,Not Ejected,Does Not Apply,Does Not Apply,Driver,Unknown,,,Does Not Apply,Driver,,,12/18/2019,12:00,QUEENS,11419.0,40.686028,-73.82506,"(40.686028, -73.82506)",LIBERTY AVENUE                  ,118 STREET,,0.0,0.0,0,0,0,0,0,0,Backing Unsafely,Unspecified,,,,Sedan,Pick-up Truck,,,,2019-12-18 12:00:00
11996943,4469944,2d4518c8-225a-403a-98fd-7df3095ed72a,OCCUPANT,UNSPECIFIED,M,25.0,20090228.0,Not Ejected,Does Not Apply,Does Not Apply,"Front passenger, if two or more persons, including the driver, are in the front seat",Lap Belt & Harness,,,Does Not Apply,Passenger,,,10/23/2021,2:33,QUEENS,11363.0,40.76226,-73.75698,"(40.76226, -73.7569828)",NORTHERN BOULEVARD,CROSS ISLAND PARKWAY,,0.0,0.0,0,0,0,0,0,0,Unsafe Speed,,,,,Sedan,,,,,2021-10-23 02:33:00
9174247,4101324,41c8feb3-9f8e-4f32-a1d8-e3c8365192c2,OCCUPANT,INJURED,F,66.0,18608782.0,Not Ejected,Conscious,Chest,Driver,Lap Belt & Harness,,,Complaint of Pain or Nausea,Driver,,,03/22/2019,0:00,QUEENS,11432.0,40.713715,-73.8005,"(40.713715, -73.8005)",,,165-15    CHAPIN COURT                  ,1.0,0.0,0,0,0,0,1,0,Unsafe Speed,Unspecified,,,,Sedan,Station Wagon/Sport Utility Vehicle,,,,2019-03-22 00:00:00
12734586,4661531,e80741c1-d33b-483c-b552-ffba17c84dfa,OCCUPANT,INJURED,F,31.0,20512323.0,Not Ejected,Conscious,Knee-Lower Leg Foot,"Front passenger, if two or more persons, including the driver, are in the front seat",Unknown,,,None Visible,Passenger,,,09/11/2023,20:57,BROOKLYN,11224.0,40.574867,-74.00069,"(40.574867, -74.00069)",MERMAID AVENUE,WEST 35 STREET,,2.0,0.0,0,0,0,0,2,0,Pavement Slippery,Pavement Slippery,,,,Sedan,Station Wagon/Sport Utility Vehicle,,,,2023-09-11 20:57:00
11530180,4378554,0c2fd2bf-df23-48c8-adcf-f5cb5477cb0c,OCCUPANT,UNSPECIFIED,F,35.0,19817816.0,Not Ejected,Does Not Apply,Does Not Apply,Driver,Lap Belt & Harness,,,Does Not Apply,Driver,,,12/23/2020,11:17,QUEENS,11358.0,40.75595,-73.78546,"(40.75595, -73.78546)",45 AVENUE                       ,196 STREET,,0.0,0.0,0,0,0,0,0,0,Failure to Yield Right-of-Way,Unspecified,Unspecified,,,Sedan,Sedan,Sedan,,,2020-12-23 11:17:00
12031922,4479076,044c6c48-8c18-4d4e-9cfb-000ea08ef629,OCCUPANT,UNSPECIFIED,M,11.0,20110181.0,Not Ejected,Does Not Apply,Does Not Apply,"Any person in the rear of a station wagon, pick-up truck, all passengers on a bus, etc",Lap Belt,,,Does Not Apply,Passenger,,,11/19/2021,14:43,BROOKLYN,11223.0,40.586502,-73.97443,"(40.586502, -73.97443)",SHELL ROAD,DANK COURT,,0.0,0.0,0,0,0,0,0,0,Backing Unsafely,Unspecified,,,,Sedan,Bus,,,,2021-11-19 14:43:00
7610919,3894191,c8b5a43a-87a2-4379-ae3b-803613c9d67e,BICYCLIST,INJURED,M,34.0,17838575.0,Ejected,Conscious,Elbow-Lower-Arm-Hand,Driver,,,,Severe Bleeding,Driver,,,04/30/2018,7:10,,,40.702335,-73.901375,"(40.702335, -73.901375)",WOODWARD AVENUE                 ,,,1.0,0.0,0,0,1,0,0,0,Following Too Closely,,,,,Bike,,,,,2018-04-30 07:10:00
11019235,4274745,123e5dc6-a5de-44f6-ab77-97c062915fe5,OCCUPANT,UNSPECIFIED,M,17.0,19537665.0,Not Ejected,Does Not Apply,Does Not Apply,"Front passenger, if two or more persons, including the driver, are in the front seat",Other,,,Does Not Apply,Passenger,,,01/17/2020,12:30,BROOKLYN,11229.0,40.613636,-73.94826,"(40.613636, -73.94826)",KINGS HIGHWAY                   ,EAST 26 STREET,,1.0,0.0,0,0,0,0,1,0,Driver Inexperience,Unspecified,,,,Sedan,Sedan,,,,2020-01-17 12:30:00
11307513,4319820,fa1ca4a3-e786-4338-9bf3-8fa6ccbe19eb,OCCUPANT,UNSPECIFIED,M,42.0,19688375.0,Not Ejected,Does Not Apply,Does Not Apply,Driver,Lap Belt & Harness,,,Does Not Apply,Driver,,,06/13/2020,22:00,,,40.7324,-73.76561,"(40.7324, -73.76561)",CLEARVIEW EXPRESSWAY            ,,,0.0,0.0,0,0,0,0,0,0,Unsafe Lane Changing,Unspecified,,,,Sedan,Sedan,,,,2020-06-13 22:00:00
9228866,3990116,98dc7106-fae9-4491-8cb5-501c4ddff13d,OCCUPANT,UNSPECIFIED,M,35.0,18635640.0,,,,,,,,,Registrant,,,09/28/2018,17:40,,,40.684006,-74.001656,"(40.684006, -74.001656)",HICKS STREET                    ,UNION STREET,,0.0,0.0,0,0,0,0,0,0,Unspecified,Unspecified,Unspecified,,,Flat Bed,Taxi,Sedan,,,2018-09-28 17:40:00
11449651,4357384,4457b9f2-c6fc-4296-9794-f288838b64d3,OCCUPANT,UNSPECIFIED,F,32.0,19770859.0,,,,,,,,,Registrant,,,10/13/2020,15:41,MANHATTAN,10013.0,,,,,,187       WORTH STREET                  ,0.0,0.0,0,0,0,0,0,0,Pavement Defective,,,,,Sedan,,,,,2020-10-13 15:41:00
6448509,3489790,1350642,OCCUPANT,UNSPECIFIED,,,,,,,,,,,,Witness,,,07/26/2016,23:20,QUEENS,11358.0,40.751434,-73.78567,"(40.751434, -73.78567)",,,47-48     195 STREET                    ,0.0,0.0,0,0,0,0,0,0,Driver Inattention/Distraction,Unspecified,,,,Station Wagon/Sport Utility Vehicle,Station Wagon/Sport Utility Vehicle,,,,2016-07-26 23:20:00
11045176,4286092,7b304e0e-c378-46d8-94dc-a8d86b621180,OCCUPANT,UNSPECIFIED,M,55.0,19551065.0,Not Ejected,Does Not Apply,Does Not Apply,Driver,Unknown,,,Does Not Apply,Driver,,,02/07/2020,16:30,,,40.884144,-73.91502,"(40.884144, -73.91502)",HENRY HUDSON PARKWAY            ,,,0.0,0.0,0,0,0,0,0,0,Oversized Vehicle,,,,,Box Truck,,,,,2020-02-07 16:30:00
11099459,4305626,97335c98-a819-4b34-97e4-292d2718c880,OCCUPANT,UNSPECIFIED,F,58.0,19579207.0,Not Ejected,Does Not Apply,Does Not Apply,Driver,Lap Belt & Harness,,,Does Not Apply,Driver,,,03/06/2020,8:13,BROOKLYN,11210.0,40.622955,-73.93723,"(40.622955, -73.93723)",FLATBUSH AVENUE                 ,AVENUE L,,0.0,0.0,0,0,0,0,0,0,Unspecified,Unspecified,,,,Box Truck,Sedan,,,,2020-03-06 08:13:00
9365885,3914466,eeaaab26-e4f4-42c8-a14b-86f250e61d2e,OCCUPANT,UNSPECIFIED,M,31.0,18702887.0,,,,,,,,,Registrant,,,06/04/2018,17:00,,,40.717014,-73.7994,"(40.717014, -73.7994)",GRAND CENTRAL PKWY              ,,,0.0,0.0,0,0,0,0,0,0,Driver Inattention/Distraction,Unspecified,,,,Station Wagon/Sport Utility Vehicle,Station Wagon/Sport Utility Vehicle,,,,2018-06-04 17:00:00
6458044,3523438,1999676,OCCUPANT,UNSPECIFIED,M,0.0,17281553.0,,,,,,,,,Registrant,,,09/18/2016,4:25,BROOKLYN,11214.0,40.615707,-74.00146,"(40.615707, -74.00146)",16 AVENUE                       ,76 STREET,,2.0,0.0,0,0,0,0,2,0,Traffic Control Disregarded,Unspecified,Unspecified,Unspecified,Unspecified,Sedan,Taxi,Sedan,Sedan,Station Wagon/Sport Utility Vehicle,2016-09-18 04:25:00
11102044,4295049,b47af252-54a4-4552-bc2c-92b6aa2ad63d,OCCUPANT,UNSPECIFIED,M,59.0,19580523.0,Not Ejected,Does Not Apply,Does Not Apply,Driver,Lap Belt & Harness,,,Does Not Apply,Driver,,,02/28/2020,13:45,QUEENS,11377.0,40.75185,-73.89704,"(40.75185, -73.89704)",,,34-19     69 STREET                     ,0.0,0.0,0,0,0,0,0,0,Other Vehicular,Unsafe Lane Changing,Unspecified,Unspecified,,Pick-up Truck,Sedan,Sedan,Station Wagon/Sport Utility Vehicle,,2020-02-28 13:45:00
13341639,4806163,74d09356-f0a6-4563-99bd-cb1cc90b1140,OCCUPANT,UNSPECIFIED,M,29.0,20858971.0,Not Ejected,Does Not Apply,Does Not Apply,Driver,Lap Belt,,,Does Not Apply,Driver,,,04/16/2025,13:09,BROOKLYN,11226.0,40.647243,-73.96047,"(40.647243, -73.96047)",OCEAN AVE,ALBEMARLE RD,,0.0,0.0,0,0,0,0,0,0,Following Too Closely,Unspecified,,,,Station Wagon/Sport Utility Vehicle,Station Wagon/Sport Utility Vehicle,,,,2025-04-16 13:09:00
12127407,4504411,d858a9a6-bae9-41f1-9408-157a37deb5a4,OCCUPANT,UNSPECIFIED,F,57.0,20165672.0,,,,,,,,,Registrant,,,02/20/2022,3:50,QUEENS,11691.0,40.595257,-73.74851,"(40.595257, -73.74851)",,,14-30     SEAGIRT BOULEVARD,0.0,0.0,0,0,0,0,0,0,Fell Asleep,Unspecified,Unspecified,Unspecified,Unspecified,Sedan,Station Wagon/Sport Utility Vehicle,Station Wagon/Sport Utility Vehicle,Station Wagon/Sport Utility Vehicle,Station Wagon/Sport Utility Vehicle,2022-02-20 03:50:00
9986497,4168600,fbc4670b-8300-480d-9e43-de1c6617ab09,OCCUPANT,UNSPECIFIED,M,19.0,19009393.0,Not Ejected,Does Not Apply,Does Not Apply,Driver,Lap Belt & Harness,,,Does Not Apply,Driver,,,07/11/2019,22:30,,,,,,MEEKER AVENUE                   ,MC GUINNESS BLVD SOUTH,,0.0,0.0,0,0,0,0,0,0,Driver Inattention/Distraction,Unspecified,,,,Station Wagon/Sport Utility Vehicle,,,,,2019-07-11 22:30:00
7165268,3709218,401a4d53-2b1d-42dc-99ba-b5b33f39bf2e,OCCUPANT,UNSPECIFIED,F,45.0,17620424.0,Not Ejected,Does Not Apply,Does Not Apply,Driver,Lap Belt,,,Does Not Apply,Driver,,,07/11/2017,20:24,MANHATTAN,10016.0,40.74433,-73.980736,"(40.74433, -73.980736)",,,142       EAST 31 STREET                ,0.0,0.0,0,0,0,0,0,0,Failure to Yield Right-of-Way,Failure to Yield Right-of-Way,,,,Station Wagon/Sport Utility Vehicle,Sedan,,,,2017-07-11 20:24:00
7389924,3846445,b706d35e-fdf4-4ff9-91c8-2cadeb4a763d,OCCUPANT,UNSPECIFIED,F,67.0,17730094.0,,,,,,,,,Registrant,,,02/13/2018,16:00,BROOKLYN,11220.0,40.638145,-74.02801,"(40.638145, -74.02801)",RIDGE BOULEVARD                 ,SENATOR STREET,,0.0,0.0,0,0,0,0,0,0,Unspecified,Unspecified,,,,Sedan,Sedan,,,,2018-02-13 16:00:00
13303979,4796528,6b284212-6f32-4cbb-93ee-0c9ddb54252a,OCCUPANT,UNSPECIFIED,M,58.0,20837351.0,Not Ejected,Does Not Apply,Does Not Apply,Driver,Lap Belt & Harness,,,Does Not Apply,Driver,,,03/05/2025,7:56,BRONX,10466.0,40.880623,-73.84046,"(40.880623, -73.84046)",BOSTON RD,GRACE AVE,,1.0,0.0,0,0,0,0,1,0,Following Too Closely,Unspecified,,,,Sedan,Tractor Truck Diesel,,,,2025-03-05 07:56:00
9277209,3916590,5ed871f5-de6b-4837-b322-43840b42a702,OCCUPANT,UNSPECIFIED,M,64.0,18659235.0,,,,,,,,,Registrant,,,06/07/2018,14:39,BROOKLYN,11232.0,40.65711,-74.00152,"(40.65711, -74.00152)",4 AVENUE                        ,31 STREET,,2.0,0.0,0,0,0,0,2,0,Unspecified,Unspecified,,,,Station Wagon/Sport Utility Vehicle,Sedan,,,,2018-06-07 14:39:00
11072563,4307714,c4d912d5-a060-4423-a20f-5877a020f379,OCCUPANT,UNSPECIFIED,F,35.0,19565199.0,Not Ejected,Does Not Apply,Does Not Apply,Driver,Lap Belt,,,Does Not Apply,Driver,,,04/03/2020,18:50,,,,,,FLATBUSH AVENUE                 ,,,0.0,0.0,0,0,0,0,0,0,Unsafe Lane Changing,Unspecified,,,,Station Wagon/Sport Utility Vehicle,Sedan,,,,2020-04-03 18:50:00
10101417,4195205,2e087de2-81b3-4ed9-9f3c-7a18561ae7ec,OCCUPANT,UNSPECIFIED,F,21.0,19067043.0,Not Ejected,Does Not Apply,Does Not Apply,"Middle front seat, or passenger lying across a seat",Lap Belt & Harness,,,Does Not Apply,Passenger,,,08/26/2019,23:40,,,40.666714,-73.75156,"(40.666714, -73.75156)",143 AVENUE                      ,,,0.0,0.0,0,0,0,0,0,0,Unspecified,Unspecified,,,,Station Wagon/Sport Utility Vehicle,Station Wagon/Sport Utility Vehicle,,,,2019-08-26 23:40:00
7064897,3698431,a66e52e5-964a-4ead-8be6-988b4ad0521b,OCCUPANT,UNSPECIFIED,M,43.0,17572352.0,,,,,,,,,Registrant,,,06/20/2017,21:44,BROOKLYN,11203.0,40.650948,-73.94668,"(40.650948, -73.94668)",NEW YORK AVENUE                 ,CHURCH AVENUE,,1.0,0.0,0,0,0,0,1,0,Failure to Yield Right-of-Way,Unspecified,,,,Station Wagon/Sport Utility Vehicle,Motorcycle,,,,2017-06-20 21:44:00
7597553,3882648,5df721c1-e2d4-412f-b713-6ecb87c956c7,OCCUPANT,UNSPECIFIED,M,19.0,17831988.0,Not Ejected,Does Not Apply,Does Not Apply,Driver,Lap Belt & Harness,,,Does Not Apply,Driver,,,04/17/2018,16:55,QUEENS,11427.0,40.722576,-73.76095,"(40.722576, -73.76095)",,,87-50     FRANCIS LEWIS BOULEVARD       ,0.0,0.0,0,0,0,0,0,0,Driver Inexperience,Unspecified,,,,Sedan,Sedan,,,,2018-04-17 16:55:00
12194617,4521782,2a0e96b0-c971-4bab-9607-9cd81df0c354,OCCUPANT,UNSPECIFIED,F,75.0,20204358.0,Not Ejected,Does Not Apply,Does Not Apply,Driver,Lap Belt & Harness,,,Does Not Apply,Driver,,,04/24/2022,11:45,,,40.585342,-73.94157,"(40.585342, -73.94157)",BELT PARKWAY,,,0.0,0.0,0,0,0,0,0,0,Driver Inattention/Distraction,Unspecified,,,,Sedan,,,,,2022-04-24 11:45:00
11210414,4264103,33594ff7-3668-4418-bec2-7a423fcfa6fc,OCCUPANT,UNSPECIFIED,F,25.0,19637969.0,Not Ejected,Does Not Apply,Does Not Apply,"Front passenger, if two or more persons, including the driver, are in the front seat",Lap Belt & Harness,,,Does Not Apply,Passenger,,,12/24/2019,16:15,STATEN ISLAND,10308.0,40.56025,-74.16412,"(40.56025, -74.16412)",,,680       ARTHUR KILL ROAD              ,1.0,0.0,0,0,0,0,1,0,Failure to Yield Right-of-Way,Unspecified,,,,Station Wagon/Sport Utility Vehicle,Station Wagon/Sport Utility Vehicle,,,,2019-12-24 16:15:00
6460675,3578085,2988307,OCCUPANT,UNSPECIFIED,M,0.0,17282785.0,,,,,,,,,Registrant,,,12/09/2016,12:00,,,40.879456,-73.91678,"(40.879456, -73.91678)",KAPPOCK STREET                  ,KNOLLS CRESCENT,,1.0,0.0,0,0,0,0,1,0,Driver Inattention/Distraction,Unspecified,,,,Sedan,Station Wagon/Sport Utility Vehicle,,,,2016-12-09 12:00:00
12780112,4673568,303dcf89-e990-48fd-a0b0-e42e8d79f06b,OCCUPANT,UNSPECIFIED,M,29.0,20538220.0,Not Ejected,Does Not Apply,Does Not Apply,Driver,Lap Belt & Harness,,,Does Not Apply,Driver,,,10/21/2023,10:35,QUEENS,11105.0,40.775734,-73.89584,"(40.775734, -73.89584)",19 AVENUE,46 STREET,,0.0,0.0,0,0,0,0,0,0,Passing or Lane Usage Improper,Unspecified,,,,Sedan,Sedan,,,,2023-10-21 10:35:00
13172500,4753123,01617553-5a38-457e-acfc-8b67686d872d,OCCUPANT,UNSPECIFIED,M,14.0,20762699.0,Not Ejected,Does Not Apply,Does Not Apply,"Front passenger, if two or more persons, including the driver, are in the front seat",Lap Belt & Harness,,,Does Not Apply,Passenger,,,08/31/2024,10:10,QUEENS,11370.0,40.766785,-73.893105,"(40.766785, -73.893105)",76 STREET,ASTORIA BOULEVARD,,0.0,0.0,0,0,0,0,0,0,Turning Improperly,Unspecified,,,,Sedan,Pick-up Truck,,,,2024-08-31 10:10:00
7285165,3821771,fa412dc5-4e3d-4adb-aff5-7be8fb504a9c,OCCUPANT,UNSPECIFIED,M,32.0,17678432.0,Not Ejected,Does Not Apply,Does Not Apply,Driver,Lap Belt & Harness,,,Does Not Apply,Driver,,,01/04/2018,0:45,BROOKLYN,11214.0,40.602535,-73.99321,"(40.602535, -73.99321)",BAY PARKWAY                     ,85 STREET,,0.0,0.0,0,0,0,0,0,0,Driver Inattention/Distraction,Unspecified,,,,Station Wagon/Sport Utility Vehicle,Sedan,,,,2018-01-04 00:45:00
7298240,3827096,aa54109a-a0ea-4a50-8954-e9a4ef3ed337,OCCUPANT,UNSPECIFIED,F,53.0,17684947.0,Not Ejected,Does Not Apply,Does Not Apply,"Middle rear seat, or passenger lying across a seat",Lap Belt & Harness,,,Does Not Apply,Passenger,,,01/11/2018,12:00,,,40.837894,-73.88138,"(40.837894, -73.88138)",CROSS BRONX EXPY                ,,,0.0,0.0,0,0,0,0,0,0,Other Vehicular,Unspecified,,,,Sedan,Tractor Truck Diesel,,,,2018-01-11 12:00:00
9747967,4113865,e1bf6c4d-f11c-4993-b527-eef8ea8cbbf3,OCCUPANT,UNSPECIFIED,F,52.0,18891591.0,Not Ejected,Does Not Apply,Does Not Apply,Right rear passenger or motorcycle sidecar passenger,Lap Belt & Harness,,,Does Not Apply,Passenger,,,04/11/2019,14:06,,,,,,QUEENS MIDTOWN TUNNEL           ,,,0.0,0.0,0,0,0,0,0,0,Traffic Control Disregarded,Unspecified,,,,Station Wagon/Sport Utility Vehicle,Pick-up Truck,,,,2019-04-11 14:06:00
9047950,3939970,7492c1d2-646e-474c-b47e-b4dffa796535,OCCUPANT,UNSPECIFIED,,,,,,,,,,,,Notified Person,,,07/11/2018,14:31,QUEENS,11692.0,40.589134,-73.80098,"(40.589134, -73.80098)",BEACH 73 STREET                 ,ROCKAWAY BEACH BOULEVARD,,0.0,1.0,0,1,0,0,0,0,Failure to Yield Right-of-Way,,,,,Station Wagon/Sport Utility Vehicle,,,,,2018-07-11 14:31:00
12142380,4508070,52717863-cdde-45dc-9049-35b7cd4bde31,OCCUPANT,UNSPECIFIED,M,53.0,20174447.0,,,,,,,,,Registrant,,,03/06/2022,18:30,MANHATTAN,10013.0,40.719467,-74.00438,"(40.719467, -74.00438)",CHURCH STREET,WALKER STREET,,0.0,0.0,0,0,0,0,0,0,Driver Inattention/Distraction,Unspecified,,,,Sedan,Sedan,,,,2022-03-06 18:30:00
6031985,3593134,f0e613c6-a666-4f40-a43d-3e4d7ae93540,OCCUPANT,UNSPECIFIED,M,41.0,17079471.0,,,,,,,,,Registrant,,,01/06/2017,10:33,MANHATTAN,10017.0,40.752117,-73.97556,"(40.752117, -73.97556)",EAST 43 STREET                  ,LEXINGTON AVENUE,,0.0,0.0,0,0,0,0,0,0,Passenger Distraction,Unspecified,,,,Station Wagon/Sport Utility Vehicle,Taxi,,,,2017-01-06 10:33:00
6601974,3500834,1593001,OCCUPANT,UNSPECIFIED,F,29.0,17350226.0,Not Ejected,Does Not Apply,Does Not Apply,"Front passenger, if two or more persons, including the driver, are in the front seat",Lap Belt & Harness,,,Does Not Apply,Passenger,,,08/15/2016,22:33,MANHATTAN,10022.0,40.762177,-73.96613,"(40.762177, -73.96613)",3 AVENUE                        ,EAST 60 STREET,,0.0,0.0,0,0,0,0,0,0,Passing or Lane Usage Improper,Unspecified,,,,Sedan,Sedan,,,,2016-08-15 22:33:00
7332974,3831089,e9bea6ac-21b1-4121-8035-7a9a9a1aa3c5,OCCUPANT,UNSPECIFIED,M,55.0,17701983.0,Not Ejected,Does Not Apply,Does Not Apply,Unknown,Unknown,,,Does Not Apply,Driver,,,01/17/2018,21:00,,,40.608036,-74.159996,"(40.608036, -74.159996)",,,74        GARY COURT                    ,0.0,0.0,0,0,0,0,0,0,Unspecified,,,,,Station Wagon/Sport Utility Vehicle,,,,,2018-01-17 21:00:00
6388552,3492835,1424130,OCCUPANT,UNSPECIFIED,M,47.0,17248680.0,,,,,,,,,Registrant,,,08/01/2016,9:50,BROOKLYN,11229.0,40.59938,-73.95141,"(40.59938, -73.95141)",OCEAN AVENUE                    ,AVENUE U,,0.0,0.0,0,0,0,0,0,0,Failure to Yield Right-of-Way,Unspecified,,,,Station Wagon/Sport Utility Vehicle,Station Wagon/Sport Utility Vehicle,,,,2016-08-01 09:50:00
6664176,3551357,2523196,OCCUPANT,UNSPECIFIED,F,47.0,17380050.0,Not Ejected,Does Not Apply,Does Not Apply,"Middle front seat, or passenger lying across a seat",Lap Belt & Harness,,,Does Not Apply,Passenger,,,10/31/2016,16:00,,,40.74119,-73.79279,"(40.74119, -73.79279)",UTOPIA PARKWAY                  ,58 AVENUE,,0.0,0.0,0,0,0,0,0,0,Driver Inattention/Distraction,Unspecified,,,,Sedan,Station Wagon/Sport Utility Vehicle,,,,2016-10-31 16:00:00
6285519,3465373,1015130,OCCUPANT,UNSPECIFIED,M,28.0,17200108.0,Not Ejected,Does Not Apply,Does Not Apply,Driver,Lap Belt & Harness,,,Does Not Apply,Driver,,,06/18/2016,23:15,,,,,,LONG ISLAND EXPRESSWAY          ,,,0.0,0.0,0,0,0,0,0,0,Driver Inattention/Distraction,Unspecified,,,,Station Wagon/Sport Utility Vehicle,Station Wagon/Sport Utility Vehicle,,,,2016-06-18 23:15:00
7848924,3774148,d210e83d-7aa8-407f-b26e-0274cda291f9,OCCUPANT,UNSPECIFIED,M,42.0,17954504.0,,,,,,,,,Registrant,,,10/22/2017,3:50,,,40.608776,-74.09113,"(40.608776, -74.09113)",RICHMOND ROAD                   ,CLOVE ROAD,,2.0,0.0,0,0,0,0,2,0,Driver Inattention/Distraction,Driver Inattention/Distraction,,,,Station Wagon/Sport Utility Vehicle,Sedan,,,,2017-10-22 03:50:00
6920013,3643034,881512e4-fd45-4d7c-9121-af8b0a1830f7,OCCUPANT,UNSPECIFIED,M,51.0,17502982.0,,,,,,,,,Registrant,,,04/01/2017,9:51,QUEENS,11361.0,,,,NORTHERN BOULEVARD              ,207 STREET,,0.0,0.0,0,0,0,0,0,0,Failure to Yield Right-of-Way,Unspecified,,,,Station Wagon/Sport Utility Vehicle,Sedan,,,,2017-04-01 09:51:00
6782108,3629968,66bc8bb1-18f3-4ce8-b14a-eed86ceeadc4,PEDESTRIAN,INJURED,F,30.0,,,Conscious,Elbow-Lower-Arm-Hand,,,Unknown,Unknown,Contusion - Bruise,Pedestrian,Unspecified,Unspecified,03/10/2017,8:20,,,40.89224,-73.912,"(40.89224, -73.912)",INDEPENDENCE AVENUE             ,,,1.0,0.0,1,0,0,0,0,0,Failure to Yield Right-of-Way,,,,,Sedan,,,,,2017-03-10 08:20:00
12118409,4501734,00363b6f-7b87-459e-9ce4-b5304f2ab528,OCCUPANT,UNSPECIFIED,M,67.0,20160599.0,Not Ejected,Does Not Apply,Does Not Apply,Driver,Lap Belt & Harness,,,Does Not Apply,Driver,,,02/09/2022,14:15,MANHATTAN,10019.0,40.769493,-73.98949,"(40.769493, -73.98949)",,,524       WEST 57 STREET,1.0,0.0,0,0,0,0,1,0,Unspecified,Unspecified,Unspecified,,,Station Wagon/Sport Utility Vehicle,Station Wagon/Sport Utility Vehicle,Motorcycle,,,2022-02-09 14:15:00
12949146,4717340,7f222f37-cfa7-4b23-b6ff-553ec499db7e,OCCUPANT,UNSPECIFIED,M,34.0,20634195.0,Not Ejected,Does Not Apply,Does Not Apply,Driver,Lap Belt,,,Does Not Apply,Driver,,,04/15/2024,9:35,MANHATTAN,10012.0,40.72249,-73.99926,"(40.72249, -73.99926)",,,512       BROADWAY,0.0,0.0,0,0,0,0,0,0,Driver Inattention/Distraction,Following Too Closely,,,,Sedan,Sedan,,,,2024-04-15 09:35:00
10003516,4172810,bb2ae906-3445-4baa-8e72-f3c2f2d2b26f,OCCUPANT,UNSPECIFIED,F,0.0,19017829.0,,,,,,,,,Registrant,,,07/18/2019,14:20,MANHATTAN,10036.0,40.758755,-73.995346,"(40.758755, -73.995346)",,,475       WEST 41 STREET                ,0.0,0.0,0,0,0,0,0,0,Following Too Closely,Unspecified,,,,Station Wagon/Sport Utility Vehicle,Station Wagon/Sport Utility Vehicle,,,,2019-07-18 14:20:00
8994484,4078614,eae5fc55-8855-4c8a-a578-a6aaf654044b,OCCUPANT,UNSPECIFIED,F,57.0,18519916.0,,,,,,,,,Registrant,,,02/06/2019,18:38,MANHATTAN,10002.0,40.718143,-73.993835,"(40.718143, -73.993835)",CHRYSTIE STREET                 ,GRAND STREET,,1.0,0.0,0,0,1,0,0,0,Driver Inattention/Distraction,Driver Inattention/Distraction,,,,Station Wagon/Sport Utility Vehicle,Bike,,,,2019-02-06 18:38:00
13130981,4744453,b9ca385a-f7f7-48e1-b2ec-6efe4b406dc3,OCCUPANT,UNSPECIFIED,M,29.0,20737548.0,Not Ejected,Does Not Apply,Does Not Apply,Driver,Unknown,,,Does Not Apply,Driver,,,07/26/2024,15:50,MANHATTAN,10029.0,40.787804,-73.943756,"(40.787804, -73.943756)",,,304       EAST 102 STREET,1.0,0.0,0,0,1,0,0,0,Unspecified,Unspecified,,,,Sedan,E-Bike,,,,2024-07-26 15:50:00
9490650,3942985,01f56631-d27e-461e-8bfb-d1a4d1754bcd,OCCUPANT,UNSPECIFIED,,,,,,,,,,,,Witness,,,07/17/2018,10:05,,,40.76023,-73.961525,"(40.76023, -73.961525)",1 AVENUE                        ,,,0.0,0.0,0,0,0,0,0,0,Traffic Control Disregarded,Unspecified,,,,Station Wagon/Sport Utility Vehicle,Taxi,,,,2018-07-17 10:05:00
5800639,3425689,251670,OCCUPANT,INJURED,F,27.0,16970428.0,Not Ejected,Conscious,Neck,"Middle front seat, or passenger lying across a seat",Lap Belt & Harness,,,Complaint of Pain,Driver,,,04/03/2016,11:20,,,40.744167,-73.91248,"(40.744167, -73.91248)",,,52 STREET                               ,4.0,0.0,0,0,0,0,4,0,Traffic Control Device Improper/Non-Working,Traffic Control Device Improper/Non-Working,,,,4 dr sedan,4 dr sedan,,,,2016-04-03 11:20:00
9003492,4093126,90962405-7940-4e0b-8f66-1d3e25d8dca5,OCCUPANT,UNSPECIFIED,M,0.0,18524281.0,,,,,,,,,Registrant,,,03/07/2019,17:50,,,40.79157,-73.94469,"(40.79157, -73.94469)",3 AVENUE                        ,,,0.0,0.0,0,0,0,0,0,0,Backing Unsafely,Unspecified,,,,Sedan,Sedan,,,,2019-03-07 17:50:00
12784405,4674873,9ddd1eff-7e77-41a9-9ff1-26dfe5394133,OCCUPANT,UNSPECIFIED,M,18.0,20540640.0,,,,,,,,,Registrant,,,10/22/2023,22:00,,,40.806644,-73.92495,"(40.806644, -73.92495)",EAST 134 STREET,WILLIS AVENUE,,1.0,0.0,0,0,0,0,1,0,Unspecified,Unspecified,,,,Tractor Truck Diesel,Sedan,,,,2023-10-22 22:00:00
6657209,3525260,2057668,OCCUPANT,UNSPECIFIED,M,50.0,17376666.0,Not Ejected,Does Not Apply,Does Not Apply,Driver,Lap Belt & Harness,,,Does Not Apply,Driver,,,09/22/2016,16:20,,,40.75009,-73.9083,"(40.75009, -73.9083)",38 AVENUE                       ,,,0.0,0.0,0,0,0,0,0,0,Traffic Control Disregarded,Unspecified,,,,Station Wagon/Sport Utility Vehicle,Sedan,,,,2016-09-22 16:20:00
6724214,3584419,3132275,OCCUPANT,UNSPECIFIED,F,25.0,17408906.0,,,,,,,,,Registrant,,,12/21/2016,8:45,STATEN ISLAND,10306.0,40.566494,-74.11377,"(40.566494, -74.11377)",HYLAN BOULEVARD                 ,EBBITTS STREET,,0.0,0.0,0,0,0,0,0,0,Following Too Closely,Unspecified,,,,Station Wagon/Sport Utility Vehicle,Sedan,,,,2016-12-21 08:45:00
9021792,4058446,c4f52543-51fa-4716-99c6-8f337a8731af,OCCUPANT,UNSPECIFIED,M,58.0,18533245.0,Not Ejected,Does Not Apply,Does Not Apply,Driver,Unknown,,,Does Not Apply,Driver,,,01/19/2019,12:59,BROOKLYN,11207.0,40.657753,-73.89612,"(40.657753, -73.89612)",LINDEN BOULEVARD                ,WILLIAMS AVENUE,,0.0,0.0,0,0,0,0,0,0,Passing or Lane Usage Improper,Unspecified,,,,Sedan,Sedan,,,,2019-01-19 12:59:00
6364685,3522858,2012754,OCCUPANT,UNSPECIFIED,,0.0,17237400.0,,,,,,,,,Registrant,,,09/18/2016,15:34,BROOKLYN,11221.0,40.693283,-73.92068,"(40.693283, -73.92068)",,,102       GROVE STREET                  ,0.0,0.0,0,0,0,0,0,0,Passing Too Closely,Unspecified,Unspecified,,,Station Wagon/Sport Utility Vehicle,Station Wagon/Sport Utility Vehicle,,,,2016-09-18 15:34:00
7837775,3777311,4a1c6914-7caf-4dc1-8365-2406168ac921,OCCUPANT,UNSPECIFIED,M,41.0,17949105.0,Not Ejected,Does Not Apply,Does Not Apply,Driver,Lap Belt & Harness,,,Does Not Apply,Driver,,,10/26/2017,9:00,,,,,"(40.665226, -32.768513)",NASSAU EXPRESSWAY               ,,,0.0,0.0,0,0,0,0,0,0,Unspecified,Unspecified,,,,Station Wagon/Sport Utility Vehicle,Station Wagon/Sport Utility Vehicle,,,,2017-10-26 09:00:00
11778232,4412357,6d5002f0-5b46-4e6e-91d7-280122814474,OCCUPANT,UNSPECIFIED,M,72.0,19962307.0,,,,,,,,,Registrant,,,04/29/2021,21:00,BRONX,10467.0,40.861275,-73.86366,"(40.861275, -73.86366)",WARING AVENUE,BARNES AVENUE,,2.0,0.0,0,0,0,0,2,0,Traffic Control Disregarded,Unspecified,,,,Station Wagon/Sport Utility Vehicle,Sedan,,,,2021-04-29 21:00:00
7742877,3773344,1e92f437-d418-4612-82c9-c42514da65c1,OCCUPANT,UNSPECIFIED,,0.0,17902877.0,,,,,,,,,Registrant,,,10/20/2017,13:10,BROOKLYN,11201.0,40.689243,-73.98873,"(40.689243, -73.98873)",STATE STREET                    ,SMITH STREET,,0.0,0.0,0,0,0,0,0,0,Turning Improperly,Unspecified,,,,Station Wagon/Sport Utility Vehicle,Station Wagon/Sport Utility Vehicle,,,,2017-10-20 13:10:00
12654296,4640864,97e225f2-91c6-4cab-a7b6-f5f8846f3dca,OCCUPANT,UNSPECIFIED,M,71.0,20466316.0,,,,,,,,,Registrant,,,06/24/2023,6:18,BROOKLYN,11210.0,40.629677,-73.94151,"(40.629677, -73.94151)",BROOKLYN AVENUE,AVENUE I,,1.0,0.0,0,0,0,0,1,0,Other Vehicular,Traffic Control Disregarded,,,,Station Wagon/Sport Utility Vehicle,Station Wagon/Sport Utility Vehicle,,,,2023-06-24 06:18:00
9675722,4036791,30466446-b700-4bdb-b1bc-86954c15bb81,OCCUPANT,UNSPECIFIED,,0.0,18855644.0,,,,,,,,,Registrant,,,11/30/2018,5:21,,,40.61132,-74.114716,"(40.61132, -74.114716)",STATEN ISLAND EXPRESSWAY        ,,,0.0,0.0,0,0,0,0,0,0,Driver Inattention/Distraction,Unspecified,,,,Sedan,Sedan,,,,2018-11-30 05:21:00
11351816,4331526,3310a300-a545-4126-a6dd-14de086088f7,OCCUPANT,UNSPECIFIED,F,45.0,19713846.0,Not Ejected,Does Not Apply,Does Not Apply,Driver,Unknown,,,Does Not Apply,Driver,,,07/23/2020,16:00,,,,,,SHORE PARKWAY                   ,OCEAN PARKWAY,,0.0,0.0,0,0,0,0,0,0,Driver Inattention/Distraction,Unspecified,,,,Station Wagon/Sport Utility Vehicle,Station Wagon/Sport Utility Vehicle,,,,2020-07-23 16:00:00
9805287,4126799,33bb2b19-980d-4cac-b0db-391114f3338b,OCCUPANT,UNSPECIFIED,M,54.0,18919842.0,Not Ejected,Does Not Apply,Does Not Apply,Driver,Lap Belt & Harness,,,Does Not Apply,Driver,,,05/06/2019,18:00,,,40.749283,-73.756645,"(40.749283, -73.756645)",LONG ISLAND EXPRESSWAY          ,,,0.0,0.0,0,0,0,0,0,0,Following Too Closely,Unspecified,,,,Station Wagon/Sport Utility Vehicle,Station Wagon/Sport Utility Vehicle,,,,2019-05-06 18:00:00
7928079,3790721,9f193d4c-f4c4-4ed8-9acf-16145f993a14,OCCUPANT,UNSPECIFIED,M,0.0,17993432.0,,,,,,,,,Registrant,,,11/15/2017,14:08,,,,,,PETERCA PLACE                   ,20 AVENUE,,0.0,0.0,0,0,0,0,0,0,Unspecified,,,,,Station Wagon/Sport Utility Vehicle,,,,,2017-11-15 14:08:00
11965656,4461659,bc238828-d9d8-47a3-bacc-2f79cf26372d,OCCUPANT,UNSPECIFIED,M,34.0,20072260.0,,,,,,,,,Registrant,,,09/26/2021,14:50,BROOKLYN,11215.0,40.66079,-73.99401,"(40.66079, -73.99401)",5 AVENUE,22 STREET,,1.0,0.0,0,0,0,0,1,0,Driver Inattention/Distraction,Unspecified,,,,E scooter,Sedan,,,,2021-09-26 14:50:00
7017887,3690632,101f2a3f-66ef-4c46-9a92-d689bea799dd,OCCUPANT,UNSPECIFIED,M,31.0,17549897.0,Not Ejected,Does Not Apply,Does Not Apply,"Front passenger, if two or more persons, including the driver, are in the front seat",Lap Belt & Harness,,,Does Not Apply,Passenger,,,06/14/2017,22:30,,,40.7606,-73.96434,"(40.7606, -73.96434)",EAST 59 STREET                  ,,,0.0,0.0,0,0,0,0,0,0,Driver Inattention/Distraction,Driver Inattention/Distraction,,,,Sedan,Box Truck,,,,2017-06-14 22:30:00
12678670,4646830,adce4fd2-88e3-4067-8a16-4269e20afd4b,OCCUPANT,INJURED,F,76.0,20480126.0,Not Ejected,Conscious,Neck,Driver,Lap Belt & Harness,,,None Visible,Driver,,,07/16/2023,10:30,QUEENS,11004.0,40.74709,-73.71185,"(40.74709, -73.71185)",260 STREET,UNION TURNPIKE,,2.0,0.0,0,0,0,0,2,0,Unspecified,Unspecified,,,,Sedan,Station Wagon/Sport Utility Vehicle,,,,2023-07-16 10:30:00
2251171,3212168,1,OCCUPANT,INJURED,,78.0,14677755.0,,,,,,,,,,,,04/28/2015,10:00,,,40.730915,-73.91545,"(40.7309158, -73.9154491)",,,,1.0,0.0,0,0,0,0,1,0,Fell Asleep,Unspecified,,,,PASSENGER VEHICLE,SPORT UTILITY / STATION WAGON,,,,2015-04-28 10:00:00
6728603,3513682,1839212,OCCUPANT,UNSPECIFIED,M,50.0,17411029.0,,,,,,,,,Registrant,,,09/04/2016,2:00,,,40.742935,-73.82773,"(40.742935, -73.82773)",HORACE HARDING EXPRESSWAY       ,138 STREET,,0.0,0.0,0,0,0,0,0,0,Passing Too Closely,Passing Too Closely,,,,Station Wagon/Sport Utility Vehicle,Station Wagon/Sport Utility Vehicle,,,,2016-09-04 02:00:00
7471943,3862331,e7ec8c21-de82-47b4-a2af-f8b9d5cd4e55,OCCUPANT,UNSPECIFIED,F,55.0,17770196.0,Not Ejected,Does Not Apply,Does Not Apply,Driver,,,,Does Not Apply,Driver,,,03/13/2018,18:30,BROOKLYN,11220.0,40.6402,-74.00825,"(40.6402, -74.00825)",54 STREET                       ,7 AVENUE,,1.0,0.0,1,0,0,0,0,0,Unspecified,,,,,Station Wagon/Sport Utility Vehicle,,,,,2018-03-13 18:30:00
7839130,3769666,30368071-5d5c-4379-8216-fd82e42ee05d,OCCUPANT,UNSPECIFIED,M,34.0,17949776.0,Not Ejected,Does Not Apply,Does Not Apply,Driver,Lap Belt & Harness,,,Does Not Apply,Driver,,,10/14/2017,14:00,STATEN ISLAND,10306.0,40.572502,-74.11358,"(40.572502, -74.11358)",NEW DORP LANE                   ,EDISON STREET,,0.0,0.0,0,0,0,0,0,0,Driver Inattention/Distraction,Unspecified,,,,Sedan,Sedan,,,,2017-10-14 14:00:00
9797611,4125373,9dacf371-3d9c-4080-ade4-d6d4b91592df,OCCUPANT,UNSPECIFIED,M,27.0,18916076.0,,,,,,,,,Registrant,,,05/04/2019,0:15,,,40.7132,-73.97723,"(40.7132, -73.97723)",FDR DRIVE                       ,,,0.0,0.0,0,0,0,0,0,0,Other Vehicular,Following Too Closely,,,,Taxi,Sedan,,,,2019-05-04 00:15:00
9419638,4046423,41e7b416-1fa3-49a9-8a6e-3f4e2e186184,OCCUPANT,UNSPECIFIED,F,42.0,18729183.0,,,,,,,,,Registrant,,,12/17/2018,7:30,BROOKLYN,11236.0,40.64077,-73.90913,"(40.64077, -73.90913)",GLENWOOD ROAD                   ,EAST 88 STREET,,2.0,0.0,0,0,0,0,2,0,Driver Inattention/Distraction,Unspecified,,,,Station Wagon/Sport Utility Vehicle,Station Wagon/Sport Utility Vehicle,,,,2018-12-17 07:30:00
6913870,3646340,f9a129a2-34dd-4761-88e4-4d7b038b8339,OCCUPANT,INJURED,M,19.0,17500032.0,Not Ejected,Semiconscious,Neck,Driver,Lap Belt & Harness,,,Internal,Driver,,,04/06/2017,20:44,QUEENS,11417.0,40.674862,-73.85744,"(40.674862, -73.85744)",SUTTER AVENUE                   ,79 STREET,,1.0,0.0,0,0,0,0,1,0,Passing Too Closely,Unspecified,,,,Sedan,Sedan,,,,2017-04-06 20:44:00
9287895,3907703,d309615d-612e-43a5-902d-59f88f42b186,OCCUPANT,UNSPECIFIED,M,45.0,18664480.0,Not Ejected,Does Not Apply,Does Not Apply,Driver,Lap Belt & Harness,,,Does Not Apply,Driver,,,05/25/2018,10:42,BRONX,10473.0,40.82463,-73.85566,"(40.82463, -73.85566)",STORY AVENUE                    ,PUGSLEY AVENUE,,0.0,0.0,0,0,0,0,0,0,Turning Improperly,Unspecified,,,,Sedan,Sedan,,,,2018-05-25 10:42:00
11149779,4302113,a8074f53-1b78-4c92-b7f2-0a352b25a217,OCCUPANT,UNSPECIFIED,M,43.0,19606068.0,Not Ejected,Does Not Apply,Does Not Apply,Driver,Lap Belt & Harness,,,Does Not Apply,Driver,,,03/13/2020,19:45,,,40.76132,-73.9171,"(40.76132, -73.9171)",STEINWAY STREET                 ,,,2.0,0.0,0,0,0,0,2,0,Driver Inattention/Distraction,Unspecified,,,,Station Wagon/Sport Utility Vehicle,Box Truck,,,,2020-03-13 19:45:00
11066259,4287717,9487c33d-8054-43a3-889e-09434222e4fb,OCCUPANT,UNSPECIFIED,F,43.0,19561881.0,,,,,,,,,Registrant,,,02/12/2020,17:08,BRONX,10458.0,40.861828,-73.89286,"(40.861828, -73.89286)",EAST FORDHAM ROAD               ,MARION AVENUE,,0.0,0.0,0,0,0,0,0,0,Other Vehicular,Other Vehicular,,,,Bus,Sedan,,,,2020-02-12 17:08:00
6077177,3603665,aa108f84-bc65-49b6-9614-1db3b32e3169,OCCUPANT,UNSPECIFIED,M,58.0,17101301.0,,,,,,,,,Registrant,,,01/24/2017,8:20,,,40.61847,-73.89746,"(40.61847, -73.89746)",BELT PARKWAY                    ,,,0.0,0.0,0,0,0,0,0,0,Driver Inattention/Distraction,Unspecified,Unspecified,,,Sedan,Station Wagon/Sport Utility Vehicle,Station Wagon/Sport Utility Vehicle,,,2017-01-24 08:20:00
13413030,4825164,3d1fda7a-b6be-4bb5-b024-b2f5a1aebf19,OCCUPANT,UNSPECIFIED,F,68.0,20899769.0,,,,,,,,,Registrant,,,07/02/2025,13:05,STATEN ISLAND,10305.0,40.59075,-74.08836,"(40.59075, -74.08836)",HYLAN BLVD,BURGHER AVE,,0.0,0.0,0,0,0,0,0,0,Driver Inattention/Distraction,Unspecified,,,,Station Wagon/Sport Utility Vehicle,Station Wagon/Sport Utility Vehicle,,,,2025-07-02 13:05:00
11259652,4264182,8b85e32f-16aa-4c7a-bfbe-cd01750b831e,OCCUPANT,INJURED,M,40.0,19662824.0,Not Ejected,Conscious,Entire Body,Driver,Lap Belt & Harness,,,Complaint of Pain or Nausea,Driver,,,12/24/2019,17:00,QUEENS,11420.0,40.665615,-73.81757,"(40.665615, -73.81757)",NORTH CONDUIT AVENUE            ,123 STREET,,2.0,0.0,0,0,0,0,2,0,Unsafe Lane Changing,Unspecified,,,,Sedan,Taxi,,,,2019-12-24 17:00:00
11343334,4329313,dc3dbcab-615c-4ef9-9050-e9e9a2c1c267,OCCUPANT,UNSPECIFIED,M,30.0,19708949.0,Not Ejected,Does Not Apply,Does Not Apply,Driver,Lap Belt & Harness,,,Does Not Apply,Driver,,,07/15/2020,18:00,,,40.762093,-73.75691,"(40.762093, -73.75691)",CROSS ISLAND PARKWAY            ,,,0.0,0.0,0,0,0,0,0,0,Driver Inattention/Distraction,Unspecified,,,,Station Wagon/Sport Utility Vehicle,Sedan,,,,2020-07-15 18:00:00
12084932,4492889,a786dc41-3fc5-4877-95a7-06ed63089b3e,OCCUPANT,UNSPECIFIED,M,53.0,20140907.0,,,,,,,,,Registrant,,,01/06/2022,16:30,BROOKLYN,11229.0,40.599922,-73.93985,"(40.599922, -73.93985)",,,2126      BROWN STREET,0.0,0.0,0,0,0,0,0,0,Unspecified,,,,,Sedan,,,,,2022-01-06 16:30:00
9467870,3965118,fa274076-89a7-4bbe-bb81-ebccf4cb9da5,OCCUPANT,UNSPECIFIED,F,42.0,18752878.0,Not Ejected,Does Not Apply,Does Not Apply,Driver,Lap Belt & Harness,,,Does Not Apply,Driver,,,08/16/2018,9:20,,,40.624958,-74.145775,"(40.624958, -74.145775)",FOREST AVENUE                   ,WILLOW ROAD EAST,,0.0,0.0,0,0,0,0,0,0,View Obstructed/Limited,,,,,Station Wagon/Sport Utility Vehicle,Sedan,,,,2018-08-16 09:20:00
12037230,4480004,140db173-fc59-4ff1-a294-a2e5f8d52c58,OCCUPANT,UNSPECIFIED,F,37.0,20113237.0,Not Ejected,Does Not Apply,Does Not Apply,Driver,Lap Belt & Harness,,,Does Not Apply,Driver,,,11/22/2021,16:00,QUEENS,11377.0,40.734997,-73.90992,"(40.734997, -73.90992)",58 STREET,52 ROAD,,1.0,0.0,0,0,0,0,1,0,Glare,Unspecified,,,,Taxi,Sedan,,,,2021-11-22 16:00:00
11123661,4310242,a258d8fe-b3f8-44cf-ac0a-8e9a35f862e1,OCCUPANT,UNSPECIFIED,M,7.0,19591855.0,Not Ejected,Does Not Apply,Does Not Apply,"Left rear passenger, or rear passenger on a bicycle, motorcycle, snowmobile",Lap Belt & Harness,,,Does Not Apply,Passenger,,,04/24/2020,21:20,,,,,,WASHINGTON BRIDGE               ,HARLEM RIVER,,1.0,0.0,0,0,0,0,1,0,Unspecified,Unspecified,,,,Station Wagon/Sport Utility Vehicle,Sedan,,,,2020-04-24 21:20:00
11367787,4335672,44c95eab-28ef-4fc1-9ef8-203b422ceb0e,OCCUPANT,UNSPECIFIED,F,43.0,19723251.0,Not Ejected,Does Not Apply,Does Not Apply,Driver,Lap Belt & Harness,,,Does Not Apply,Driver,,,08/06/2020,8:00,,,40.828114,-73.93107,"(40.828114, -73.93107)",MAJOR DEEGAN EXPRESSWAY         ,,,0.0,0.0,0,0,0,0,0,0,View Obstructed/Limited,View Obstructed/Limited,,,,Station Wagon/Sport Utility Vehicle,Station Wagon/Sport Utility Vehicle,,,,2020-08-06 08:00:00
11755109,4418008,b1bb969a-4c99-4f3a-9324-2d73f7479e59,OCCUPANT,UNSPECIFIED,,,19948870.0,,,,,,,,,Registrant,,,05/18/2021,16:08,BROOKLYN,11231.0,40.672615,-74.0006,"(40.672615, -74.0006)",LORRAINE STREET,COURT STREET,,1.0,0.0,0,0,0,0,1,0,Failure to Yield Right-of-Way,Unspecified,,,,Sedan,Sedan,,,,2021-05-18 16:08:00
9917616,4153103,f76c2b1f-194f-4113-8d12-6c4ad793f425,OCCUPANT,UNSPECIFIED,,,,,,,,,,,,Witness,,,06/16/2019,16:00,BRONX,10454.0,40.81099,-73.914856,"(40.81099, -73.914856)",SAINT ANNS AVENUE               ,EAST 144 STREET,,0.0,0.0,0,0,0,0,0,0,Driver Inattention/Distraction,Unspecified,,,,Sedan,Sedan,,,,2019-06-16 16:00:00
6317125,3555823,2602510,OCCUPANT,UNSPECIFIED,F,58.0,17214963.0,,,,,,,,,Registrant,,,11/07/2016,3:10,,,,,,TEASDALE PLACE                  ,TRINITY AVENUE,,0.0,0.0,0,0,0,0,0,0,Unspecified,Unspecified,Unspecified,,,Sedan,Sedan,Sedan,,,2016-11-07 03:10:00
6970413,3706982,17a4929d-375e-4d68-8d99-039a263224c2,OCCUPANT,UNSPECIFIED,,0.0,17527076.0,,,,,,,,,Registrant,,,06/21/2017,18:45,,,40.74137,-73.97252,"(40.74137, -73.97252)",FDR DRIVE                       ,,,0.0,0.0,0,0,0,0,0,0,Following Too Closely,Unspecified,,,,Station Wagon/Sport Utility Vehicle,Station Wagon/Sport Utility Vehicle,,,,2017-06-21 18:45:00
11169595,3905731,e66b1bfb-4633-444f-8a1e-022ddc9e6127,OCCUPANT,UNSPECIFIED,F,38.0,19616936.0,Not Ejected,Does Not Apply,Does Not Apply,Driver,Lap Belt & Harness,,,Does Not Apply,Driver,,,05/22/2018,12:45,BROOKLYN,11209.0,40.61705,-74.033676,"(40.61705, -74.033676)",,,9517      3 AVENUE                      ,0.0,0.0,0,0,0,0,0,0,Driver Inexperience,Unspecified,,,,Station Wagon/Sport Utility Vehicle,Station Wagon/Sport Utility Vehicle,,,,2018-05-22 12:45:00
6667109,3570391,2865638,OCCUPANT,UNSPECIFIED,M,43.0,17381498.0,,,,,,,,,Registrant,,,11/29/2016,17:15,,,40.71279,-73.9693,"(40.71279, -73.9693)",WILLIAMSBURG BRIDGE INNER ROADWA,,,0.0,0.0,0,0,0,0,0,0,Pavement Slippery,Unspecified,,,,Station Wagon/Sport Utility Vehicle,Station Wagon/Sport Utility Vehicle,,,,2016-11-29 17:15:00
6798994,3664471,176e7cfe-9112-4b25-92c3-8a0c95fb517f,OCCUPANT,UNSPECIFIED,M,26.0,17444840.0,,,,,,,,,Registrant,,,05/07/2017,3:00,BRONX,10460.0,40.833546,-73.88688,"(40.833546, -73.88688)",,,1533      BRYANT AVENUE                 ,0.0,0.0,0,0,0,0,0,0,Driver Inattention/Distraction,Unspecified,,,,Taxi,Station Wagon/Sport Utility Vehicle,,,,2017-05-07 03:00:00
6368636,3555759,2646900,OCCUPANT,UNSPECIFIED,M,52.0,17239273.0,,,,,,,,,Registrant,,,11/07/2016,17:00,MANHATTAN,10024.0,40.786366,-73.97598,"(40.786366, -73.97598)",AMSTERDAM AVENUE                ,WEST 84 STREET,,1.0,0.0,0,0,0,0,1,0,Turning Improperly,Unspecified,,,,Sedan,Sedan,,,,2016-11-07 17:00:00
6479868,3551456,2529871,OCCUPANT,UNSPECIFIED,F,50.0,17291948.0,,,,,,,,,Registrant,,,10/29/2016,23:40,MANHATTAN,10038.0,40.713444,-73.99854,"(40.713444, -73.99854)",MOTT STREET                     ,WORTH STREET,,0.0,0.0,0,0,0,0,0,0,Driver Inattention/Distraction,Unspecified,,,,Station Wagon/Sport Utility Vehicle,Sedan,,,,2016-10-29 23:40:00
12926401,4711398,8791347a-3253-4ab4-88be-81cca77b53c3,OCCUPANT,INJURED,M,40.0,20621216.0,Not Ejected,Unknown,Unknown,Driver,Unknown,,,Unknown,Driver,,,03/13/2024,22:17,BRONX,10468.0,40.865345,-73.90849,"(40.865345, -73.90849)",BAILEY AVENUE,SEDGWICK AVENUE,,1.0,0.0,0,0,0,0,1,0,Turning Improperly,Alcohol Involvement,,,,Sedan,Sedan,,,,2024-03-13 22:17:00
12183658,4518828,9f5fbe0e-b91e-4cd7-83d9-2cac53bee052,OCCUPANT,UNSPECIFIED,F,27.0,20198120.0,,,,,,,,,Registrant,,,04/13/2022,16:55,QUEENS,11412.0,40.69447,-73.76204,"(40.69447, -73.76204)",FARMERS BOULEVARD,TIOGA DRIVE,,0.0,0.0,0,0,0,0,0,0,Failure to Yield Right-of-Way,Unspecified,,,,Sedan,,,,,2022-04-13 16:55:00
7594994,3872779,5fe9dcd2-3339-473f-9b86-6e8d6728c98f,OCCUPANT,UNSPECIFIED,M,53.0,17830711.0,Not Ejected,Does Not Apply,Does Not Apply,Driver,Unknown,,,Does Not Apply,Driver,,,03/31/2018,17:54,QUEENS,11377.0,40.75411,-73.898705,"(40.75411, -73.898705)",NORTHERN BOULEVARD              ,BROOKLYN QUEENS EXPRESSWAY,,0.0,0.0,0,0,0,0,0,0,Driver Inattention/Distraction,Unspecified,,,,Station Wagon/Sport Utility Vehicle,Station Wagon/Sport Utility Vehicle,,,,2018-03-31 17:54:00
6136818,3626826,27e741a7-175d-432f-bad6-71068a6abe6b,OCCUPANT,UNSPECIFIED,M,21.0,17130113.0,Not Ejected,Does Not Apply,Does Not Apply,Driver,Lap Belt & Harness,,,Does Not Apply,Driver,,,03/04/2017,11:50,BRONX,10469.0,40.8608,-73.838066,"(40.8608, -73.838066)",WARING AVENUE                   ,TIEMANN AVENUE,,1.0,0.0,0,0,0,0,1,0,Traffic Control Disregarded,Unspecified,,,,Sedan,Sedan,,,,2017-03-04 11:50:00
7475563,3893614,9efabdfc-234e-4ef9-9d01-b9e2282e0c62,OCCUPANT,UNSPECIFIED,M,62.0,17771977.0,,,,,,,,,Registrant,,,05/03/2018,9:45,BROOKLYN,11236.0,40.634544,-73.89052,"(40.634544, -73.89052)",,,1979      ROCKAWAY PARKWAY              ,0.0,0.0,0,0,0,0,0,0,Passing or Lane Usage Improper,Unspecified,,,,Sedan,Sedan,,,,2018-05-03 09:45:00
6961655,3671920,ce1c03de-9621-467b-a6e0-4caffceae6c9,OCCUPANT,UNSPECIFIED,,0.0,17522824.0,,,,,,,,,Registrant,,,05/17/2017,5:40,BROOKLYN,11228.0,40.618862,-74.00536,"(40.618862, -74.00536)",,,7506      14 AVENUE                     ,0.0,0.0,0,0,0,0,0,0,Alcohol Involvement,Unspecified,Unspecified,,,Sedan,Station Wagon/Sport Utility Vehicle,Station Wagon/Sport Utility Vehicle,,,2017-05-17 05:40:00
13412924,4825126,8d04be1d-ee41-48b0-828d-50c0f84abee1,OCCUPANT,UNSPECIFIED,M,56.0,20899704.0,,,,,,,,,Registrant,,,07/03/2025,10:25,BRONX,10460.0,40.84355,-73.8703,"(40.84355, -73.8703)",MORRIS PARK AVE,TAYLOR AVE,,1.0,0.0,0,0,0,0,1,0,Unspecified,Unspecified,,,,Sedan,Station Wagon/Sport Utility Vehicle,,,,2025-07-03 10:25:00
9903645,4149508,a7774d22-ef71-459d-827c-b8e5f273d88d,OCCUPANT,UNSPECIFIED,,0.0,18968429.0,,,,,,,,,Registrant,,,06/08/2019,14:52,,,,,,VERRAZANO BRIDGE UPPER          ,,,0.0,0.0,0,0,0,0,0,0,Driver Inattention/Distraction,Unspecified,Unspecified,Unspecified,,Sedan,Pick-up Truck,Sedan,Sedan,,2019-06-08 14:52:00
10174462,4212323,4efc3d56-d800-4d9d-88bd-5048582569d5,OCCUPANT,UNSPECIFIED,M,47.0,19103944.0,,,,,,,,,Registrant,,,09/25/2019,12:30,,,40.78515,-73.94063,"(40.78515, -73.94063)",FDR DRIVE                       ,,,0.0,0.0,0,0,0,0,0,0,Driver Inattention/Distraction,Unspecified,,,,Station Wagon/Sport Utility Vehicle,Station Wagon/Sport Utility Vehicle,,,,2019-09-25 12:30:00
9423303,3954845,a2fe772a-0415-4a97-88b4-0f3c6e21db9b,OCCUPANT,UNSPECIFIED,,0.0,18731011.0,,,,,,,,,Registrant,,,08/05/2018,2:57,,,,,,HUTCHINSON RIVER PARKWAY        ,,,0.0,0.0,0,0,0,0,0,0,Unspecified,Unspecified,,,,Station Wagon/Sport Utility Vehicle,Station Wagon/Sport Utility Vehicle,,,,2018-08-05 02:57:00
5772368,3407708,242372,OCCUPANT,UNSPECIFIED,,,16956524.0,,,,,,,,,Registrant,,,04/02/2016,9:00,MANHATTAN,10022.0,40.75649,-73.96427,"(40.75649, -73.96427)",,,987       1st Ave                       ,1.0,0.0,1,0,0,0,0,0,Failure to Yield Right-of-Way,,,,,,,,,,2016-04-02 09:00:00
10047107,4182992,f243a18c-c305-45b6-9379-a14b91d3b5b3,OCCUPANT,UNSPECIFIED,M,51.0,19039677.0,,,,,,,,,Registrant,,,08/01/2019,7:45,BROOKLYN,11206.0,40.70544,-73.94799,"(40.70544, -73.94799)",LORIMER STREET                  ,BOERUM STREET,,0.0,0.0,0,0,0,0,0,0,Driver Inexperience,Unspecified,,,,Sedan,,,,,2019-08-01 07:45:00
12835283,4685892,05f7d7de-afeb-4bd6-ba0b-8d3e1c827f16,OCCUPANT,UNSPECIFIED,M,,20569418.0,,,,,,,,,Registrant,,,12/10/2023,5:00,QUEENS,11433.0,40.69753,-73.77176,"(40.69753, -73.77176)",180 STREET,112 AVENUE,,0.0,0.0,0,0,0,0,0,0,Traffic Control Disregarded,Unspecified,Unspecified,,,Pick-up Truck,Sedan,Sedan,,,2023-12-10 05:00:00
13183925,4765394,17be26f5-13a5-4bfb-b7a6-7162bafb7301,OCCUPANT,UNSPECIFIED,F,64.0,20769309.0,Not Ejected,Does Not Apply,Does Not Apply,Driver,Lap Belt & Harness,,,Does Not Apply,Driver,,,10/11/2024,9:07,BRONX,10463.0,40.882866,-73.90223,"(40.882866, -73.90223)",,,5731      BROADWAY,1.0,0.0,0,0,0,0,1,0,Unspecified,Unspecified,,,,Station Wagon/Sport Utility Vehicle,Station Wagon/Sport Utility Vehicle,,,,2024-10-11 09:07:00
7767888,3786625,9da62752-91bf-4ce5-a9dd-cef3b83a66cc,OCCUPANT,UNSPECIFIED,M,25.0,17915014.0,Not Ejected,Does Not Apply,Does Not Apply,Driver,Lap Belt & Harness,,,Does Not Apply,Driver,,,11/08/2017,20:20,QUEENS,11429.0,40.71307,-73.75362,"(40.71307, -73.75362)",FRANCIS LEWIS BOULEVARD         ,99 AVENUE,,0.0,0.0,0,0,0,0,0,0,Turning Improperly,Unspecified,,,,Pick-up Truck,Sedan,,,,2017-11-08 20:20:00
6338274,3510788,1789398,OCCUPANT,UNSPECIFIED,F,66.0,17224893.0,Not Ejected,Does Not Apply,Does Not Apply,Driver,Lap Belt & Harness,,,Does Not Apply,Driver,,,08/31/2016,13:00,,,40.72597,-73.94074,"(40.72597, -73.94074)",SUTTON STREET                   ,,,0.0,0.0,0,0,0,0,0,0,Failure to Yield Right-of-Way,Unspecified,,,,Station Wagon/Sport Utility Vehicle,Sedan,,,,2016-08-31 13:00:00
7274745,3745970,7353e5bb-5b33-4ce6-90d1-1ebf6783e18f,OCCUPANT,UNSPECIFIED,,0.0,17673248.0,,,,,,,,,Registrant,,,09/08/2017,14:30,,,,,,ROCKAWAY BOULEVARD              ,BROOKVILLE BOULEVARD,,0.0,0.0,0,0,0,0,0,0,Following Too Closely,Unspecified,,,,Station Wagon/Sport Utility Vehicle,,,,,2017-09-08 14:30:00
13178660,4763968,0797b91c-6288-4d66-a0a3-5372b2241ea1,OCCUPANT,UNSPECIFIED,,,20766354.0,Not Ejected,Does Not Apply,Does Not Apply,Unknown,Unknown,,,Does Not Apply,Driver,,,10/13/2024,0:20,QUEENS,11411.0,40.696148,-73.743355,"(40.696148, -73.743355)",,,216-07    LINDEN BOULEVARD,0.0,0.0,0,0,0,0,0,0,Failure to Yield Right-of-Way,Unspecified,,,,Sedan,Sedan,,,,2024-10-13 00:20:00
7149842,3709284,0058fd29-d1c8-47a8-b563-7dd472056648,OCCUPANT,UNSPECIFIED,M,47.0,17612947.0,Not Ejected,Does Not Apply,Does Not Apply,Driver,Lap Belt & Harness,,,Does Not Apply,Driver,,,07/08/2017,21:30,BROOKLYN,11234.0,40.608204,-73.920715,"(40.608204, -73.920715)",FLATBUSH AVENUE                 ,AVENUE V,,0.0,0.0,0,0,0,0,0,0,Turning Improperly,Unspecified,,,,Sedan,Sedan,,,,2017-07-08 21:30:00
9750909,4114280,bb267a9a-1762-4ef9-b53e-2381c1e7d6f0,OCCUPANT,UNSPECIFIED,,,,,,,,,,,,Witness,,,04/13/2019,18:30,BROOKLYN,11230.0,40.6337,-73.96719,"(40.6337, -73.96719)",CONEY ISLAND AVENUE             ,NEWKIRK AVENUE,,1.0,0.0,0,0,0,0,1,0,Pavement Defective,,,,,Motorcycle,,,,,2019-04-13 18:30:00
6662253,3584791,3136970,OCCUPANT,UNSPECIFIED,M,24.0,17379128.0,Not Ejected,Does Not Apply,Does Not Apply,Driver,Lap Belt & Harness,,,Does Not Apply,Driver,,,12/21/2016,16:40,BRONX,10475.0,40.86879,-73.83168,"(40.86879, -73.83168)",BAYCHESTER AVENUE               ,BARTOW AVENUE,,0.0,0.0,0,0,0,0,0,0,Unspecified,Unspecified,,,,Sedan,Station Wagon/Sport Utility Vehicle,,,,2016-12-21 16:40:00
12557018,4615889,de947883-34a4-4c97-b9d8-2b1c9531c635,OCCUPANT,UNSPECIFIED,M,48.0,20411615.0,,,,,,,,,Registrant,,,03/11/2023,16:00,BROOKLYN,11235.0,40.587624,-73.934654,"(40.587624, -73.934654)",,,2650      COYLE STREET,0.0,0.0,0,0,0,0,0,0,Unspecified,,,,,Sedan,,,,,2023-03-11 16:00:00
9498058,3994483,ff401869-55e2-4e08-ad18-020f87f5db61,OCCUPANT,UNSPECIFIED,F,43.0,18767617.0,,,,,,,,,Registrant,,,10/06/2018,4:00,MANHATTAN,10022.0,40.760708,-73.96656,"(40.760708, -73.96656)",,,210       EAST 58 STREET                ,0.0,0.0,0,0,0,0,0,0,Unspecified,,,,,Station Wagon/Sport Utility Vehicle,,,,,2018-10-06 04:00:00
12233850,4531638,b8ece9ab-fc6b-4e09-95df-836b9c988b24,OCCUPANT,UNSPECIFIED,,,20226599.0,,,,,,,,,Registrant,,,05/27/2022,1:23,BRONX,10465.0,40.813866,-73.82105,"(40.813866, -73.82105)",,,2733      SCHURZ AVENUE,2.0,0.0,0,0,0,0,2,0,Fell Asleep,Unspecified,,,,Pick-up Truck,Station Wagon/Sport Utility Vehicle,,,,2022-05-27 01:23:00
13274849,4789064,acb4aac6-4a8d-4837-8aba-e1914ff3e389,OCCUPANT,UNSPECIFIED,M,52.0,20820884.0,Not Ejected,Does Not Apply,Does Not Apply,Driver,Lap Belt & Harness,,,Does Not Apply,Driver,,,01/28/2025,22:24,BRONX,10466.0,40.88527,-73.8551,"(40.88527, -73.8551)",E 224 ST,BRONXWOOD AVE,,1.0,0.0,1,0,0,0,0,0,Failure to Yield Right-of-Way,,,,,Station Wagon/Sport Utility Vehicle,,,,,2025-01-28 22:24:00
9076583,4087318,9036472c-187f-4952-a4d1-6dd957d470c9,OCCUPANT,UNSPECIFIED,M,65.0,18560452.0,,,,,,,,,Registrant,,,02/26/2019,14:45,BROOKLYN,11210.0,40.636448,-73.94513,"(40.636448, -73.94513)",FARRAGUT ROAD                   ,NEW YORK AVENUE,,2.0,0.0,0,0,0,0,2,0,Traffic Control Disregarded,Unspecified,,,,Station Wagon/Sport Utility Vehicle,Sedan,,,,2019-02-26 14:45:00
11357916,4332884,2188930e-0da9-4d52-9a09-0d1d2fc63b3b,OCCUPANT,UNSPECIFIED,M,26.0,19717458.0,,,,,,,,,Registrant,,,07/28/2020,11:11,BRONX,10470.0,40.904957,-73.85371,"(40.904957, -73.85371)",BRONX BOULEVARD                 ,EAST 241 STREET,,1.0,0.0,0,0,0,0,1,0,Unsafe Speed,Unsafe Speed,Unspecified,Unspecified,,Sedan,Station Wagon/Sport Utility Vehicle,Sedan,Sedan,,2020-07-28 11:11:00
9357038,3957872,57a2d72c-344a-4c9c-b1f8-24b583311e34,OCCUPANT,UNSPECIFIED,M,31.0,18698594.0,,,,,,,,,Registrant,,,08/09/2018,8:00,,,40.73303,-73.8542,"(40.73303, -73.8542)",102 STREET                      ,63 ROAD,,0.0,0.0,0,0,0,0,0,0,Unspecified,,,,,Sedan,,,,,2018-08-09 08:00:00
13515238,4852444,c51c06c2-fc5a-4f61-95a1-9e6579060925,OCCUPANT,UNSPECIFIED,M,27.0,20958829.0,Not Ejected,Does Not Apply,Does Not Apply,Driver,Lap Belt,,,Does Not Apply,Driver,,,10/26/2025,0:25,,,40.586117,-73.93604,"(40.586117, -73.93604)",BELT PARKWAY,,,0.0,0.0,0,0,0,0,0,0,Driver Inattention/Distraction,Unspecified,,,,Station Wagon/Sport Utility Vehicle,Station Wagon/Sport Utility Vehicle,,,,2025-10-26 00:25:00
11271316,4250164,a7f7cd7b-70f9-49c0-bec3-67c75c40b426,OCCUPANT,UNSPECIFIED,,,19668842.0,,,,,,,,,Registrant,,,12/01/2019,12:00,QUEENS,11411.0,40.690407,-73.73047,"(40.690407, -73.73047)",232 STREET                      ,118 AVENUE,,2.0,0.0,0,0,0,0,2,0,Following Too Closely,Unspecified,,,,Station Wagon/Sport Utility Vehicle,Sedan,,,,2019-12-01 12:00:00
9645399,4032560,123029ee-0d4d-47a6-a7fb-9071eec972e8,OCCUPANT,UNSPECIFIED,F,30.0,18840462.0,,,,,,,,,Registrant,,,11/25/2018,19:15,,,40.614246,-74.15379,"(40.614246, -74.15379)",MARTIN LUTHER KING JR           ,,,2.0,0.0,0,0,0,0,2,0,Following Too Closely,Unspecified,Unspecified,,,Sedan,Sedan,Station Wagon/Sport Utility Vehicle,,,2018-11-25 19:15:00
13351746,4809065,4945832a-2e60-424d-8831-e49ea118ae47,OCCUPANT,INJURED,F,74.0,20864716.0,Not Ejected,Conscious,Entire Body,Driver,Lap Belt & Harness,,,Complaint of Pain or Nausea,Driver,,,04/28/2025,13:07,STATEN ISLAND,10305.0,40.586754,-74.0894,"(40.586754, -74.0894)",CROMWELL AVE,LACONIA AVE,,1.0,0.0,0,0,0,0,1,0,Driver Inattention/Distraction,Unspecified,Unspecified,,,Station Wagon/Sport Utility Vehicle,Station Wagon/Sport Utility Vehicle,Sedan,,,2025-04-28 13:07:00
11441099,4353485,e1e3463c-561f-4641-8e4d-7015e237e291,OCCUPANT,UNSPECIFIED,F,67.0,19765940.0,Not Ejected,Does Not Apply,Does Not Apply,Driver,Lap Belt & Harness,,,Does Not Apply,Driver,,,09/30/2020,22:20,QUEENS,11377.0,40.734848,-73.90002,"(40.734848, -73.90002)",65 PLACE                        ,MAURICE AVENUE,,0.0,0.0,0,0,0,0,0,0,Passing Too Closely,Unspecified,,,,Sedan,Station Wagon/Sport Utility Vehicle,,,,2020-09-30 22:20:00
9956382,4162215,2c8b7080-7985-47fd-9727-e23c3fada7f6,OCCUPANT,UNSPECIFIED,M,55.0,18994484.0,Not Ejected,Does Not Apply,Does Not Apply,"Front passenger, if two or more persons, including the driver, are in the front seat",Lap Belt,,,Does Not Apply,Passenger,,,06/28/2019,16:55,BROOKLYN,11224.0,40.581146,-73.98233,"(40.581146, -73.98233)",,,2702      STILLWELL AVENUE              ,1.0,0.0,0,0,1,0,0,0,Passing or Lane Usage Improper,Unspecified,,,,Station Wagon/Sport Utility Vehicle,Bike,,,,2019-06-28 16:55:00
10197048,4217580,64c1f705-51cf-45bb-8b54-15bc7c1d9f90,OCCUPANT,UNSPECIFIED,,,19115166.0,,,,,,,,,Registrant,,,10/03/2019,10:05,BROOKLYN,11201.0,40.69365,-73.98333,"(40.69365, -73.98333)",FLATBUSH AVENUE EXTENSION       ,MYRTLE AVENUE,,0.0,0.0,0,0,0,0,0,0,Passing Too Closely,Oversized Vehicle,,,,Sedan,Carry All,,,,2019-10-03 10:05:00
9806927,4127156,e29d0a19-4472-4915-8bb5-9695c946587f,OCCUPANT,UNSPECIFIED,F,27.0,18920647.0,Not Ejected,Does Not Apply,Does Not Apply,Driver,Lap Belt & Harness,,,Does Not Apply,Driver,,,05/06/2019,10:13,,,,,,VERRAZANO BRIDGE UPPER          ,,,0.0,0.0,0,0,0,0,0,0,Following Too Closely,Unspecified,,,,Sedan,Sedan,,,,2019-05-06 10:13:00
9013010,4056563,eeafbc2c-813c-4771-b80e-3b9f68b92d24,OCCUPANT,UNSPECIFIED,M,49.0,18528936.0,Not Ejected,Does Not Apply,Does Not Apply,Driver,Unknown,,,Does Not Apply,Driver,,,01/17/2019,13:20,,,40.677498,-73.87149,"(40.677498, -73.87149)",CONDUIT BOULEVARD               ,,,1.0,0.0,0,0,0,0,1,0,Unspecified,Unspecified,,,,Station Wagon/Sport Utility Vehicle,Sedan,,,,2019-01-17 13:20:00
12602059,4627629,cc77f871-22b4-4cbd-b62f-80b9920d7670,OCCUPANT,UNSPECIFIED,M,53.0,20436981.0,,,,,,,,,Registrant,,,05/10/2023,12:37,MANHATTAN,10039.0,40.83102,-73.93587,"(40.83102, -73.93587)",,,2967      8 AVENUE,1.0,0.0,0,0,0,0,1,0,Driver Inattention/Distraction,Unspecified,,,,Taxi,Sedan,,,,2023-05-10 12:37:00
7848295,3799824,42212482-e5d0-474e-aab1-381ec4419593,OCCUPANT,UNSPECIFIED,M,57.0,17954199.0,,,,,,,,,Registrant,,,11/28/2017,19:15,QUEENS,11419.0,40.69238,-73.82719,"(40.69238, -73.82719)",95 AVENUE                       ,LEFFERTS BOULEVARD,,0.0,0.0,0,0,0,0,0,0,Unsafe Speed,Failure to Yield Right-of-Way,Unspecified,,,Sedan,Station Wagon/Sport Utility Vehicle,Sedan,,,2017-11-28 19:15:00
12620913,4632007,ada41ae0-84e9-4565-9067-6b50205484fa,OCCUPANT,UNSPECIFIED,,,20447461.0,,,,,,,,,Registrant,,,05/21/2023,0:05,BRONX,10457.0,,,,,,442       EAST 176 STREET,0.0,0.0,0,0,0,0,0,0,Turning Improperly,Unspecified,,,,Station Wagon/Sport Utility Vehicle,Sedan,,,,2023-05-21 00:05:00
11273570,4258119,37e4ff10-5d34-4cfb-8465-6f2fc498b889,OCCUPANT,UNSPECIFIED,F,67.0,19669982.0,Not Ejected,Does Not Apply,Does Not Apply,Driver,Unknown,,,Does Not Apply,Driver,,,12/14/2019,12:00,QUEENS,11427.0,40.724693,-73.7541,"(40.724693, -73.7541)",212 STREET                      ,HILLSIDE AVENUE,,0.0,0.0,0,0,0,0,0,0,Unspecified,Unspecified,,,,Sedan,Sedan,,,,2019-12-14 12:00:00
6629191,3561272,2960821,OCCUPANT,UNSPECIFIED,F,34.0,17363241.0,,,,,,,,,Registrant,,,11/13/2016,19:30,BRONX,10451.0,40.817894,-73.930565,"(40.817894, -73.930565)",MAJOR DEEGAN EXPRESSWAY         ,EAST 146 STREET,,0.0,0.0,0,0,0,0,0,0,Driver Inattention/Distraction,Unspecified,,,,Station Wagon/Sport Utility Vehicle,Sedan,,,,2016-11-13 19:30:00
6667733,3530679,2133672,OCCUPANT,UNSPECIFIED,M,72.0,17381792.0,,,,,,,,,Registrant,,,09/28/2016,14:35,QUEENS,11377.0,40.74119,-73.90156,"(40.74119, -73.90156)",QUEENS BOULEVARD                ,64 STREET,,1.0,0.0,0,0,0,0,1,0,Driver Inattention/Distraction,Unspecified,Unspecified,Unspecified,Unspecified,Sedan,Pick-up Truck,Sedan,Sedan,Sedan,2016-09-28 14:35:00
11253114,4257989,b7396c08-c25e-4f29-9096-22e53fd3bb7c,OCCUPANT,UNSPECIFIED,M,46.0,19659480.0,Not Ejected,Does Not Apply,Does Not Apply,Driver,Lap Belt & Harness,,,Does Not Apply,Driver,,,12/15/2019,2:20,QUEENS,11385.0,40.69335,-73.90041,"(40.69335, -73.90041)",COOPER AVENUE                   ,WYCKOFF AVENUE,,0.0,0.0,0,0,0,0,0,0,Unspecified,Unspecified,,,,Station Wagon/Sport Utility Vehicle,Station Wagon/Sport Utility Vehicle,,,,2019-12-15 02:20:00
12484134,4596954,425f5f08-3ee6-498b-85ad-decbaf4d9beb,OCCUPANT,UNSPECIFIED,,,20370179.0,,,,,,,,,Owner,,,12/02/2022,7:23,,,,,,EASTERN PARKWAY,SACKMAN STREET,,0.0,0.0,0,0,0,0,0,0,Unspecified,,,,,Sedan,,,,,2022-12-02 07:23:00
6903216,3653979,9af0a0f7-aad8-4da1-8f06-a1e87a359f6b,OCCUPANT,UNSPECIFIED,M,48.0,17494920.0,,,,,,,,,Registrant,,,04/19/2017,0:00,MANHATTAN,10018.0,40.753906,-73.99357,"(40.753906, -73.99357)",,,330       WEST 36 STREET                ,0.0,0.0,0,0,0,0,0,0,Failure to Yield Right-of-Way,Unspecified,,,,Sedan,Pick-up Truck,,,,2017-04-19 00:00:00
13501558,4848895,8431f08d-bdd2-4bce-9e60-62187e1fb6d8,PEDESTRIAN,INJURED,F,13.0,,,Shock,Knee-Lower Leg Foot,,,Pedestrian/Bicyclist/Other Pedestrian at Intersection,Crossing With Signal,Complaint of Pain or Nausea,Pedestrian,Pedestrian/Bicyclist/Other Pedestrian Error/Confusion,Unspecified,10/10/2025,7:36,BROOKLYN,11233.0,40.681694,-73.93779,"(40.681694, -73.93779)",MARCUS GARVEY BLVD,MAC DONOUGH ST,,1.0,0.0,1,0,0,0,0,0,Driver Inattention/Distraction,,,,,Sedan,,,,,2025-10-10 07:36:00
12894680,4703144,38d1da95-95fa-48d0-8b6b-a5632981d685,OCCUPANT,UNSPECIFIED,F,38.0,20603157.0,Not Ejected,Does Not Apply,Does Not Apply,Driver,Lap Belt & Harness,,,Does Not Apply,Driver,,,02/16/2024,21:45,QUEENS,11362.0,40.756893,-73.738884,"(40.756893, -73.738884)",,,242-20    HORACE HARDING EXPRESSWAY,0.0,0.0,0,0,0,0,0,0,Driver Inattention/Distraction,Unspecified,,,,Sedan,Station Wagon/Sport Utility Vehicle,,,,2024-02-16 21:45:00
12629192,4634443,ea0a7975-441f-484c-a5f5-7badd6a2adb5,OCCUPANT,INJURED,F,72.0,20452121.0,Not Ejected,Conscious,Elbow-Lower-Arm-Hand,"Middle front seat, or passenger lying across a seat",Unknown,,,Complaint of Pain or Nausea,Passenger,,,06/02/2023,13:39,MANHATTAN,10027.0,40.81218,-73.955246,"(40.81218, -73.955246)",,,430       WEST 125 STREET,5.0,0.0,0,0,0,0,5,0,Unsafe Lane Changing,Unspecified,,,,Bus,Sedan,,,,2023-06-02 13:39:00
10021936,4176984,18dce664-922d-4aed-8bfa-b04180e68d91,OCCUPANT,INJURED,M,0.0,19027186.0,Not Ejected,Conscious,Unknown,"Left rear passenger, or rear passenger on a bicycle, motorcycle, snowmobile",Child Restraint Only,,,Unknown,Passenger,,,07/25/2019,16:25,,,40.610214,-73.94371,"(40.610214, -73.94371)",NOSTRAND AVENUE                 ,QUENTIN ROAD,,2.0,0.0,0,0,0,0,2,0,Failure to Yield Right-of-Way,Unspecified,,,,Station Wagon/Sport Utility Vehicle,Sedan,,,,2019-07-25 16:25:00
11116267,4304074,5eea7949-b1b2-4f1d-821f-6d4d83ba02e6,OCCUPANT,UNSPECIFIED,F,35.0,19587877.0,,,,,,,,,Registrant,,,03/26/2020,17:00,BROOKLYN,11237.0,40.69285,-73.90355,"(40.69285, -73.90355)",IRVING AVENUE                   ,DECATUR STREET,,1.0,0.0,0,0,0,0,1,0,Failure to Yield Right-of-Way,Unspecified,,,,Sedan,Sedan,,,,2020-03-26 17:00:00
6997719,3679972,0bfeaf81-1282-4f11-a9a4-a8f95889b6d7,OCCUPANT,UNSPECIFIED,M,46.0,17540170.0,,,,,,,,,Registrant,,,05/27/2017,22:05,QUEENS,11373.0,40.746143,-73.87152,"(40.746143, -73.87152)",,,94-03     41 ROAD                       ,0.0,0.0,0,0,0,0,0,0,Driver Inattention/Distraction,Unspecified,,,,Station Wagon/Sport Utility Vehicle,Sedan,,,,2017-05-27 22:05:00
6768207,3672875,88d6f69c-e016-4e80-834d-25f95bf56256,OCCUPANT,UNSPECIFIED,M,46.0,17430095.0,,,,,,,,,Registrant,,,05/17/2017,15:30,QUEENS,11694.0,40.581917,-73.82978,"(40.581917, -73.82978)",ROCKAWAY BEACH BOULEVARD        ,BEACH 108 STREET,,0.0,0.0,0,0,0,0,0,0,Driver Inexperience,Unspecified,,,,Sedan,Station Wagon/Sport Utility Vehicle,,,,2017-05-17 15:30:00
9715452,4045442,92c4c97c-a57b-49dc-aaff-ab61ca45a16d,OCCUPANT,UNSPECIFIED,M,32.0,18875499.0,Not Ejected,Does Not Apply,Does Not Apply,Driver,Lap Belt & Harness,,,Does Not Apply,Driver,,,12/15/2018,14:15,,,40.76573,-73.926445,"(40.76573, -73.926445)",CRESCENT STREET                 ,,,0.0,0.0,0,0,0,0,0,0,Unsafe Lane Changing,Unspecified,,,,Station Wagon/Sport Utility Vehicle,Sedan,,,,2018-12-15 14:15:00
10223117,4224411,472e4de9-78eb-4982-9d51-71d29043202c,OCCUPANT,UNSPECIFIED,M,31.0,19128283.0,Not Ejected,Does Not Apply,Does Not Apply,Driver,Unknown,,,Does Not Apply,Driver,,,10/16/2019,22:15,MANHATTAN,10003.0,40.726925,-73.9916,"(40.726925, -73.9916)",,,361       BOWERY                        ,0.0,0.0,0,0,0,0,0,0,Driver Inattention/Distraction,Driver Inattention/Distraction,,,,Sedan,Pick-up Truck,,,,2019-10-16 22:15:00
6891738,3648929,932707f2-36df-4a68-849a-56c396cdd86d,OCCUPANT,UNSPECIFIED,M,0.0,17489375.0,,,,,,,,,Registrant,,,04/07/2017,17:45,,,40.86732,-73.82254,"(40.86732, -73.82254)",HUTCHINSON RIVER PARKWAY        ,,,0.0,0.0,0,0,0,0,0,0,Unspecified,Unspecified,,,,Taxi,Pick-up Truck,,,,2017-04-07 17:45:00
11355133,4332204,b5cdeb6b-63b7-4c37-8032-f7db96aa1c66,OCCUPANT,UNSPECIFIED,M,31.0,19715804.0,,,,,,,,,Registrant,,,07/12/2020,23:09,QUEENS,11106.0,40.760475,-73.9222,"(40.760475, -73.9222)",35 STREET                       ,BROADWAY,,0.0,0.0,0,0,0,0,0,0,Turning Improperly,Driver Inattention/Distraction,,,,Motorcycle,Station Wagon/Sport Utility Vehicle,,,,2020-07-12 23:09:00
9375649,4026491,ab5c3ff7-9983-478a-b44f-ca02ec7e2ab3,OCCUPANT,UNSPECIFIED,M,98.0,18707647.0,Not Ejected,Does Not Apply,Does Not Apply,Driver,Lap Belt,,,Does Not Apply,Driver,,,10/31/2018,20:35,,,,,,MAJOR DEEGAN EXPRESSWAY RAMP    ,,,0.0,0.0,0,0,0,0,0,0,Unspecified,Unspecified,,,,Station Wagon/Sport Utility Vehicle,Sedan,,,,2018-10-31 20:35:00
11822576,4426035,a21033f8-dbba-418d-9785-5bedfd2ddcb3,OCCUPANT,UNSPECIFIED,M,20.0,19988229.0,Not Ejected,Does Not Apply,Does Not Apply,"Middle front seat, or passenger lying across a seat",Lap Belt & Harness,,,Does Not Apply,Passenger,,,06/10/2021,13:00,BROOKLYN,11219.0,40.637157,-73.99111,"(40.637157, -73.99111)",,,1273      46 STREET,0.0,0.0,0,0,0,0,0,0,Driver Inattention/Distraction,Unspecified,,,,Sedan,Van,,,,2021-06-10 13:00:00
11608446,4399085,faea025c-45cc-413c-bbf4-42fe18118987,OCCUPANT,UNSPECIFIED,,,,,,,,,,,,Witness,,,03/14/2021,11:22,,,,,,CROSS BRONX EXPY RAMP           ,,,1.0,0.0,0,0,0,0,1,0,Failure to Yield Right-of-Way,Unspecified,,,,Sedan,Sedan,,,,2021-03-14 11:22:00
7183469,3727650,2a1e088b-2fe7-4332-b669-32e63943e428,OCCUPANT,UNSPECIFIED,,0.0,17629068.0,,,,,,,,,Registrant,,,08/09/2017,8:20,BROOKLYN,11201.0,40.7031,-73.98666,"(40.7031, -73.98666)",WATER STREET                    ,JAY STREET,,0.0,0.0,0,0,0,0,0,0,Passing Too Closely,Unspecified,,,,Sedan,Pick-up Truck,,,,2017-08-09 08:20:00
12477454,4592866,8ba3b31a-3ce7-4cc6-acbf-d7e59f2a5a1e,OCCUPANT,UNSPECIFIED,,,20366321.0,,,,,,,,,Registrant,,,12/24/2022,2:23,,,,,,S/B BOWERY,DOYERS STREET,,0.0,0.0,0,0,0,0,0,0,Backing Unsafely,Unspecified,,,,Station Wagon/Sport Utility Vehicle,Sedan,,,,2022-12-24 02:23:00
12013855,4474269,91b50e7e-c941-4e95-96a1-80db86129828,OCCUPANT,UNSPECIFIED,M,27.0,20099875.0,Not Ejected,Does Not Apply,Does Not Apply,Driver,Lap Belt & Harness,,,Does Not Apply,Driver,,,11/04/2021,16:55,MANHATTAN,10026.0,40.79864,-73.9534,"(40.79864, -73.9534)",,,111       WEST 110 STREET,1.0,0.0,0,0,0,0,0,0,View Obstructed/Limited,Driver Inattention/Distraction,,,,Taxi,E-Scooter,,,,2021-11-04 16:55:00
9383882,3930738,4bf47355-9f03-4a6a-9235-4495b14f1a56,OCCUPANT,UNSPECIFIED,M,33.0,18711608.0,Not Ejected,Does Not Apply,Does Not Apply,Driver,Lap Belt,,,Does Not Apply,Driver,,,06/28/2018,20:30,MANHATTAN,10019.0,40.76465,-73.978004,"(40.76465, -73.978004)",,,118       WEST 57 STREET                ,0.0,0.0,0,0,0,0,0,0,Unsafe Lane Changing,Unspecified,,,,Tractor Truck Diesel,Taxi,,,,2018-06-28 20:30:00
7789007,3779074,7e23a6ab-28ea-4ed7-b870-cbe365202f00,OCCUPANT,UNSPECIFIED,M,26.0,17925299.0,Not Ejected,Does Not Apply,Does Not Apply,Driver,Lap Belt & Harness,,,Does Not Apply,Driver,,,10/29/2017,16:45,MANHATTAN,10018.0,,,,,,15        W 38th St                     ,0.0,0.0,0,0,0,0,0,0,Driver Inattention/Distraction,Driver Inattention/Distraction,,,,Station Wagon/Sport Utility Vehicle,Taxi,,,,2017-10-29 16:45:00
12492406,4599332,d61f1893-b89d-4b46-b132-c4e9099968b1,OCCUPANT,UNSPECIFIED,M,57.0,20374888.0,Not Ejected,Does Not Apply,Does Not Apply,Unknown,Unknown,,,Does Not Apply,Driver,,,01/14/2023,23:05,MANHATTAN,10036.0,40.758022,-73.981804,"(40.758022, -73.981804)",WEST 47 STREET,AVENUE OF THE AMERICAS,,0.0,0.0,0,0,0,0,0,0,Unspecified,Unspecified,,,,Sedan,Sedan,,,,2023-01-14 23:05:00
6518409,3501954,1610600,OCCUPANT,UNSPECIFIED,M,0.0,17310352.0,,,,,,,,,Registrant,,,08/15/2016,23:20,QUEENS,11420.0,40.670376,-73.81126,"(40.670376, -73.81126)",,,133-43    128 STREET                    ,0.0,0.0,0,0,0,0,0,0,Failure to Keep Right,Unspecified,,,,Sedan,Pick-up Truck,,,,2016-08-15 23:20:00
9923172,4153659,291b495a-6afc-4042-829b-32fd7d70ed8b,OCCUPANT,UNSPECIFIED,M,43.0,18977998.0,,,,,,,,,Registrant,,,06/16/2019,22:41,BROOKLYN,11226.0,40.639984,-73.94842,"(40.639984, -73.94842)",NEWKIRK AVENUE                  ,NOSTRAND AVENUE,,0.0,0.0,0,0,0,0,0,0,Unspecified,Unspecified,,,,Sedan,Sedan,,,,2019-06-16 22:41:00
11337872,4328065,b6c469f5-f1e8-402e-9a06-3d0308dee323,OCCUPANT,UNSPECIFIED,M,67.0,19705743.0,Not Ejected,Does Not Apply,Does Not Apply,Driver,Lap Belt,,,Does Not Apply,Driver,,,07/09/2020,13:10,BROOKLYN,11233.0,40.684998,-73.9287,"(40.684998, -73.9287)",,,655       HANCOCK STREET                ,1.0,0.0,0,0,0,0,1,0,Following Too Closely,Unspecified,,,,Station Wagon/Sport Utility Vehicle,Station Wagon/Sport Utility Vehicle,,,,2020-07-09 13:10:00
7306273,3823865,53973e9a-0401-4f93-a647-fe89cba02240,OCCUPANT,UNSPECIFIED,F,47.0,17688874.0,,,,,,,,,Registrant,,,01/06/2018,10:30,BROOKLYN,11207.0,40.662342,-73.88191,"(40.662342, -73.88191)",,,2197      LINDEN BOULEVARD              ,0.0,0.0,0,0,0,0,0,0,Unspecified,,,,,Sedan,,,,,2018-01-06 10:30:00
6150986,3615947,55f92202-eb4d-4e8c-92cf-02fa6e5dca64,OCCUPANT,UNSPECIFIED,,0.0,17136977.0,,,,,,,,,Registrant,,,02/14/2017,18:30,MANHATTAN,10021.0,40.76649,-73.95696,"(40.76649, -73.95696)",EAST 70 STREET                  ,1 AVENUE,,0.0,0.0,0,0,0,0,0,0,Driver Inexperience,Driver Inexperience,,,,Station Wagon/Sport Utility Vehicle,Taxi,,,,2017-02-14 18:30:00
10230300,4225331,c9a64eef-6066-47e9-baf2-858aa5c1fbdb,OCCUPANT,UNSPECIFIED,M,15.0,19131838.0,Not Ejected,Does Not Apply,Does Not Apply,"Middle rear seat, or passenger lying across a seat",Lap Belt & Harness,,,Does Not Apply,Passenger,,,10/18/2019,14:50,QUEENS,11422.0,40.65492,-73.726395,"(40.65492, -73.726395)",HOOK CREEK BOULEVARD            ,148 AVENUE,,0.0,0.0,0,0,0,0,0,0,Reaction to Uninvolved Vehicle,Unspecified,,,,Station Wagon/Sport Utility Vehicle,Station Wagon/Sport Utility Vehicle,,,,2019-10-18 14:50:00
7382586,3842811,eda06d00-c17c-474f-bd0e-268c33e0620e,OCCUPANT,UNSPECIFIED,,0.0,17726530.0,,,,,,,,,Registrant,,,02/02/2018,16:40,,,40.687084,-73.8361,"(40.687084, -73.8361)",101 AVENUE                      ,107 STREET,,0.0,0.0,0,0,0,0,0,0,Driver Inattention/Distraction,Unspecified,,,,Station Wagon/Sport Utility Vehicle,Station Wagon/Sport Utility Vehicle,,,,2018-02-02 16:40:00
11934181,4452168,e9ab90b6-1d5b-4c53-9603-068a62a4aa75,OCCUPANT,UNSPECIFIED,F,53.0,20053845.0,Not Ejected,Does Not Apply,Does Not Apply,Driver,Other,,,Does Not Apply,Driver,,,08/30/2021,17:30,MANHATTAN,10027.0,40.811203,-73.96158,"(40.811203, -73.96158)",BROADWAY,WEST 121 STREET,,0.0,0.0,0,0,0,0,0,0,Unspecified,Unspecified,,,,Box Truck,Sedan,,,,2021-08-30 17:30:00
11363868,4334781,f1bb2fe6-f09b-458d-8c75-146a05f11f2a,OCCUPANT,UNSPECIFIED,M,56.0,19720936.0,,,,,,,,,Registrant,,,08/02/2020,18:00,QUEENS,11412.0,40.69802,-73.7623,"(40.69802, -73.7623)",FARMERS BOULEVARD               ,MURDOCK AVENUE,,0.0,0.0,0,0,0,0,0,0,Driver Inattention/Distraction,Unspecified,,,,Multi-Wheeled Vehicle,Pick-up Truck,,,,2020-08-02 18:00:00
6090250,3600862,3b11dfb2-67be-4df1-af6e-4714bab356dc,OCCUPANT,UNSPECIFIED,F,22.0,17107592.0,Not Ejected,Does Not Apply,Does Not Apply,Driver,Lap Belt & Harness,,,Does Not Apply,Driver,,,01/19/2017,17:25,,,40.760857,-73.961075,"(40.760857, -73.961075)",1 AVENUE                        ,,,0.0,0.0,0,0,0,0,0,0,Driver Inexperience,Driver Inexperience,,,,Station Wagon/Sport Utility Vehicle,PK,,,,2017-01-19 17:25:00
11202941,3992858,8669afda-3b77-4b93-b148-fbbe2148b423,OCCUPANT,UNSPECIFIED,F,67.0,19634211.0,,,,,,,,,Registrant,,,10/02/2018,17:33,BROOKLYN,11204.0,40.61455,-73.99024,"(40.61455, -73.99024)",,,1929      70 STREET                     ,0.0,0.0,0,0,0,0,0,0,Unspecified,,,,,Sedan,,,,,2018-10-02 17:33:00
12356471,4563859,14277457-8381-45b4-8064-0e67e781b6ba,OCCUPANT,UNSPECIFIED,M,34.0,20297269.0,,,,,,,,,Registrant,,,09/13/2022,17:37,BRONX,10467.0,40.884388,-73.87997,"(40.884388, -73.87997)",JEROME AVENUE,EAST 212 STREET,,1.0,0.0,0,0,0,0,1,0,Passing or Lane Usage Improper,Unspecified,,,,Station Wagon/Sport Utility Vehicle,Sedan,,,,2022-09-13 17:37:00
2285208,3327012,1,OCCUPANT,INJURED,,56.0,14926290.0,,,,,,,,,,,,11/02/2015,18:30,QUEENS,11420.0,40.678757,-73.81346,"(40.678757, -73.8134615)",115 AVENUE                      ,126 STREET                      ,,3.0,0.0,0,0,0,0,3,0,Unspecified,Unspecified,,,,SPORT UTILITY / STATION WAGON,PASSENGER VEHICLE,,,,2015-11-02 18:30:00
12130470,4494490,5ddeffd9-2287-45fd-8885-affa122e1789,OCCUPANT,UNSPECIFIED,M,,20167506.0,,,,,,,,,Registrant,,,01/14/2022,7:25,,,40.738476,-73.7991,"(40.738476, -73.7991)",170 STREET,HORACE HARDING EXPRESSWAY,,0.0,0.0,0,0,0,0,0,0,Driver Inattention/Distraction,Unspecified,,,,Sedan,Sedan,,,,2022-01-14 07:25:00
11405438,4345448,6ec83c83-87c2-4c9c-9e23-8289ec926601,OCCUPANT,UNSPECIFIED,M,65.0,19745045.0,,,,,,,,,Registrant,,,08/27/2020,9:16,BROOKLYN,11203.0,40.641747,-73.92931,"(40.641747, -73.92931)",,,1251      UTICA AVENUE                  ,1.0,0.0,0,0,0,0,1,0,Driver Inattention/Distraction,Unspecified,,,,Sedan,Sedan,,,,2020-08-27 09:16:00
6043015,3594542,f8196728-439d-4e87-b555-ead4e4322482,OCCUPANT,UNSPECIFIED,,0.0,17084809.0,,,,,,,,,Registrant,,,01/08/2017,20:00,BROOKLYN,11201.0,40.700768,-73.990944,"(40.700768, -73.990944)",PROSPECT STREET                 ,FULTON STREET,,0.0,0.0,0,0,0,0,0,0,Following Too Closely,Unspecified,,,,Sedan,Sedan,,,,2017-01-08 20:00:00
9905085,4150365,2c069f5e-3822-4215-b114-e987e1d81746,OCCUPANT,UNSPECIFIED,,0.0,18969103.0,,,,,,,,,Registrant,,,06/12/2019,18:18,MANHATTAN,10002.0,40.71913,-73.976364,"(40.71913, -73.976364)",EAST HOUSTON STREET             ,BARUCH PLACE,,0.0,0.0,0,0,0,0,0,0,Driver Inexperience,Unspecified,,,,Station Wagon/Sport Utility Vehicle,Sedan,,,,2019-06-12 18:18:00
9282816,3964993,5dc51e4b-44ef-4759-8756-185871ede878,OCCUPANT,UNSPECIFIED,,0.0,18661972.0,,,,,,,,,Registrant,,,08/20/2018,6:45,MANHATTAN,10010.0,40.737885,-73.98091,"(40.737885, -73.98091)",EAST 23 STREET                  ,2 AVENUE,,0.0,0.0,0,0,0,0,0,0,Driver Inattention/Distraction,Unspecified,,,,Station Wagon/Sport Utility Vehicle,Flat Bed,,,,2018-08-20 06:45:00
12393850,4573525,5e6cc22f-bf91-477c-9727-fb8d1eae6ca5,OCCUPANT,UNSPECIFIED,M,61.0,20318839.0,Not Ejected,Does Not Apply,Does Not Apply,Driver,Lap Belt,,,Does Not Apply,Driver,,,10/07/2022,6:09,BRONX,10455.0,40.812897,-73.90145,"(40.812897, -73.90145)",SOUTHERN BOULEVARD,SAINT JOHN AVENUE,,1.0,0.0,0,0,1,0,0,0,Unspecified,Unspecified,,,,Station Wagon/Sport Utility Vehicle,E-Bike,,,,2022-10-07 06:09:00
7260146,3745476,bdf5fce8-1fc9-4ec4-97da-1e2903db2e97,OCCUPANT,INJURED,M,60.0,17666199.0,Not Ejected,Conscious,Back,Driver,Lap Belt & Harness,,,Complaint of Pain,Driver,,,09/07/2017,18:30,MANHATTAN,10075.0,40.774956,-73.96102,"(40.774956, -73.96102)",PARK AVENUE                     ,EAST 78 STREET,,1.0,0.0,0,0,0,0,1,0,Driver Inattention/Distraction,Unspecified,,,,Taxi,Sedan,,,,2017-09-07 18:30:00
9988187,4169009,a6e52a92-51b3-47d5-8f0b-1927f2d7872a,OCCUPANT,UNSPECIFIED,F,28.0,19010219.0,,,,,,,,,Registrant,,,06/30/2019,23:31,BROOKLYN,11207.0,40.651688,-73.88877,"(40.651688, -73.88877)",FLATLANDS AVENUE                ,ALABAMA AVENUE,,0.0,0.0,0,0,0,0,0,0,Unspecified,Unspecified,,,,Sedan,Pick-up Truck,,,,2019-06-30 23:31:00
6264556,3460907,934446,OCCUPANT,UNSPECIFIED,,,,,,,,,,,,Witness,,,06/12/2016,16:30,QUEENS,11368.0,,,,,,flushing mflushing meadow park          ,1.0,0.0,1,0,0,0,0,0,,,,,,,,,,,2016-06-12 16:30:00
5955047,3433815,664140,OCCUPANT,UNSPECIFIED,M,,17043415.0,Not Ejected,Does Not Apply,Does Not Apply,"Front passenger, if two or more persons, including the driver, are in the front seat",Lap Belt & Harness,,,Does Not Apply,Passenger,,,04/30/2016,3:00,,,,,,6 AVENUE                        ,65 STREET,,0.0,0.0,0,0,0,0,0,0,Unspecified,Unspecified,,,,4 dr sedan,4 dr sedan,,,,2016-04-30 03:00:00
8527758,4060421,4d8b3779-c51c-4d85-8d75-afcee2fedf0c,OCCUPANT,UNSPECIFIED,M,31.0,18288860.0,Not Ejected,Does Not Apply,Does Not Apply,Driver,Lap Belt & Harness,,,Does Not Apply,Driver,,,01/01/2019,0:00,,,40.731983,-73.91912,"(40.731983, -73.91912)",LONG ISLAND EXPRESSWAY          ,,,0.0,0.0,0,0,0,0,0,0,Following Too Closely,Unspecified,,,,Sedan,Station Wagon/Sport Utility Vehicle,,,,2019-01-01 00:00:00
6582594,3565600,2782839,OCCUPANT,UNSPECIFIED,M,0.0,17340923.0,,,,,,,,,Registrant,,,11/19/2016,0:24,,,40.844063,-73.921,"(40.844063, -73.921)",NELSON AVENUE                   ,,,0.0,0.0,0,0,0,0,0,0,Passing Too Closely,Unspecified,,,,Station Wagon/Sport Utility Vehicle,Tractor Truck Gasoline,,,,2016-11-19 00:24:00
12273481,4541940,06f91efd-fbe1-472b-ac27-67c2c4b334f3,OCCUPANT,UNSPECIFIED,M,57.0,20249430.0,,,,,,,,,Registrant,,,06/29/2022,13:35,QUEENS,11354.0,40.77022,-73.83055,"(40.77022, -73.83055)",138 STREET,31 ROAD,,1.0,0.0,0,0,1,0,0,0,Turning Improperly,Unspecified,,,,Sedan,Bike,,,,2022-06-29 13:35:00
7041634,3664531,c3fdcc43-1dd3-45d4-a82f-a1ac041888e1,OCCUPANT,UNSPECIFIED,M,20.0,17561334.0,Not Ejected,Does Not Apply,Does Not Apply,Driver,Lap Belt,,,Does Not Apply,Driver,,,05/05/2017,22:20,,,40.760567,-73.9155,"(40.760567, -73.9155)",42 STREET                       ,,,0.0,0.0,0,0,0,0,0,0,Driver Inattention/Distraction,Unspecified,,,,Sedan,Station Wagon/Sport Utility Vehicle,,,,2017-05-05 22:20:00
10290297,4238452,45a239ac-18b4-437a-a64c-22f8cf2fccfa,OCCUPANT,UNSPECIFIED,,,19161676.0,,,,,,,,,Registrant,,,11/08/2019,15:40,BROOKLYN,11207.0,40.668213,-73.89493,"(40.668213, -73.89493)",,,381       PENNSYLVANIA AVENUE           ,2.0,0.0,0,0,0,0,2,0,Driver Inattention/Distraction,Unspecified,,,,Taxi,Station Wagon/Sport Utility Vehicle,,,,2019-11-08 15:40:00
13195734,4768418,df27c2ba-476e-4f49-bf3b-0b5205ce65e9,OCCUPANT,INJURED,M,61.0,20776076.0,Not Ejected,Conscious,Neck,Driver,Lap Belt & Harness,,,Complaint of Pain or Nausea,Driver,,,11/01/2024,16:39,BRONX,10475.0,40.883556,-73.834755,"(40.883556, -73.834755)",BOSTON RD,NEEDHAM AVE,,4.0,0.0,0,0,0,0,4,0,Driver Inattention/Distraction,Driver Inattention/Distraction,Following Too Closely,,,Station Wagon/Sport Utility Vehicle,Station Wagon/Sport Utility Vehicle,Station Wagon/Sport Utility Vehicle,,,2024-11-01 16:39:00
9167247,4102256,7fe6004c-3134-46d4-8b85-bca38d6d2bff,OCCUPANT,UNSPECIFIED,,,,,,,,,,,,Witness,,,03/24/2019,12:20,MANHATTAN,10021.0,40.770424,-73.96222,"(40.770424, -73.96222)",EAST 72 STREET                  ,LEXINGTON AVENUE,,1.0,0.0,1,0,0,0,0,0,Failure to Yield Right-of-Way,,,,,Station Wagon/Sport Utility Vehicle,,,,,2019-03-24 12:20:00
10122302,4200186,8f9eff71-38f5-4891-b976-90af131aad81,OCCUPANT,UNSPECIFIED,,0.0,19077554.0,,,,,,,,,Registrant,,,09/03/2019,15:45,,,,,,THROGS NECK BRIDGE              ,,,0.0,0.0,0,0,0,0,0,0,Following Too Closely,Unspecified,Unspecified,,,Sedan,Sedan,Sedan,,,2019-09-03 15:45:00
6305589,3464276,991469,OCCUPANT,UNSPECIFIED,F,27.0,17209602.0,Not Ejected,Does Not Apply,Does Not Apply,Driver,Lap Belt & Harness,,,Does Not Apply,Driver,,,06/18/2016,16:24,,,,,,NEW ENGLAND THRUWAY             ,,,0.0,0.0,0,0,0,0,0,0,Following Too Closely,Unspecified,,,,Station Wagon/Sport Utility Vehicle,Station Wagon/Sport Utility Vehicle,,,,2016-06-18 16:24:00
9383472,3988061,785c9f86-cca2-4b23-974c-3aab8ef14d75,OCCUPANT,UNSPECIFIED,,0.0,18711407.0,,,,,,,,,Registrant,,,09/25/2018,20:01,,,,,,PELHAM PARKWAY NORTH            ,BOSTON ROAD,,2.0,0.0,0,0,0,0,2,0,Driver Inattention/Distraction,Driver Inattention/Distraction,,,,Taxi,Sedan,,,,2018-09-25 20:01:00
6830000,3659741,4e79c65b-e3f1-4b62-8732-02fbbcd81002,OCCUPANT,UNSPECIFIED,F,69.0,17459687.0,Partially Ejected,Does Not Apply,Does Not Apply,"Front passenger, if two or more persons, including the driver, are in the front seat",Lap Belt & Harness,,,Does Not Apply,Passenger,,,04/28/2017,20:15,BROOKLYN,11216.0,40.675354,-73.952774,"(40.675354, -73.952774)",SAINT MARKS AVENUE              ,ROGERS AVENUE,,0.0,0.0,0,0,0,0,0,0,Driver Inattention/Distraction,Unspecified,,,,Sedan,Taxi,,,,2017-04-28 20:15:00
9810732,4127977,edeba2a2-6853-4d47-9325-114d7492f0b1,OCCUPANT,UNSPECIFIED,M,30.0,18922476.0,Not Ejected,Does Not Apply,Does Not Apply,Driver,Lap Belt & Harness,,,Does Not Apply,Driver,,,05/07/2019,20:00,,,40.74331,-73.87451,"(40.74331, -73.87451)",43 AVENUE                       ,,,1.0,0.0,1,0,0,0,0,0,Failure to Yield Right-of-Way,,,,,Station Wagon/Sport Utility Vehicle,,,,,2019-05-07 20:00:00
9118963,3912713,9c0fa29e-0669-4f38-b15e-2ebff0cdbc35,OCCUPANT,UNSPECIFIED,F,20.0,18581509.0,Not Ejected,Does Not Apply,Does Not Apply,"Front passenger, if two or more persons, including the driver, are in the front seat",Lap Belt & Harness,,,Does Not Apply,Passenger,,,06/02/2018,12:40,,,40.68742,-73.999725,"(40.68742, -73.999725)",BROOKLYN QUEENS EXPRESSWAY      ,,,4.0,0.0,0,0,0,0,4,0,Following Too Closely,Unspecified,Unspecified,,,Sedan,Sedan,Sedan,,,2018-06-02 12:40:00
7372960,3839771,07c7c99b-dac2-4c24-8c3c-3a4a66d56a25,OCCUPANT,UNSPECIFIED,M,19.0,17721767.0,Not Ejected,Does Not Apply,Does Not Apply,Driver,Lap Belt & Harness,,,Does Not Apply,Driver,,,02/03/2018,21:48,BROOKLYN,11220.0,40.643875,-74.01887,"(40.643875, -74.01887)",3 AVENUE                        ,57 STREET,,0.0,0.0,0,0,0,0,0,0,Unspecified,Unspecified,,,,Sedan,Sedan,,,,2018-02-03 21:48:00
12247507,4535288,873ea022-8817-4ba7-a7a7-6fae3dcc5762,OCCUPANT,UNSPECIFIED,M,52.0,20234499.0,,,,,,,,,Registrant,,,06/04/2022,12:48,,,40.871193,-73.9141,"(40.871193, -73.9141)",WEST 218 STREET,,,0.0,0.0,0,0,0,0,0,0,Driver Inattention/Distraction,Unspecified,,,,Sedan,Taxi,,,,2022-06-04 12:48:00
6268600,3465754,1021788,OCCUPANT,UNSPECIFIED,M,24.0,17192259.0,Not Ejected,Does Not Apply,Does Not Apply,"Front passenger, if two or more persons, including the driver, are in the front seat",Lap Belt & Harness,,,Does Not Apply,Passenger,,,06/21/2016,16:10,,,,,,HUTCHINSON RIVER PARKWAY        ,,,0.0,0.0,0,0,0,0,0,0,Driver Inattention/Distraction,Driver Inattention/Distraction,,,,4 dr sedan,Station Wagon/Sport Utility Vehicle,,,,2016-06-21 16:10:00
6839265,3653566,a9ec5111-cf96-4943-a1e1-4a2659c0e0be,OCCUPANT,UNSPECIFIED,M,39.0,17464105.0,Not Ejected,Does Not Apply,Does Not Apply,Driver,Harness,,,Does Not Apply,Driver,,,04/18/2017,15:17,,,,,,WEST TREMONT AVENUE             ,SEDGWICK AVENUE,,0.0,0.0,0,0,0,0,0,0,Other Vehicular,Driver Inattention/Distraction,,,,Sedan,Sedan,,,,2017-04-18 15:17:00
6240551,4022835,931256,OCCUPANT,UNSPECIFIED,M,30.0,17179093.0,Not Ejected,Does Not Apply,Does Not Apply,"Front passenger, if two or more persons, including the driver, are in the front seat",Lap Belt & Harness,,,Does Not Apply,Passenger,,,06/10/2016,13:00,MANHATTAN,10018.0,40.75834,-73.996414,"(40.75834, -73.996414)",WEST 40 STREET                  ,10 AVENUE,,0.0,0.0,0,0,0,0,0,0,Unsafe Lane Changing,Unspecified,,,,Box Truck,Van,,,,2016-06-10 13:00:00
6571084,3584600,3124056,OCCUPANT,UNSPECIFIED,F,26.0,17335424.0,Not Ejected,Does Not Apply,Does Not Apply,Driver,Lap Belt & Harness,,,Does Not Apply,Driver,,,12/21/2016,9:55,BRONX,10462.0,40.85232,-73.86301,"(40.85232, -73.86301)",BRADY AVENUE                    ,MATTHEWS AVENUE,,0.0,0.0,0,0,0,0,0,0,Failure to Yield Right-of-Way,Unspecified,,,,Taxi,Sedan,,,,2016-12-21 09:55:00
6336120,3478850,1211766,OCCUPANT,UNSPECIFIED,M,45.0,17223886.0,,,,,,,,,Registrant,,,07/11/2016,19:50,,,40.750294,-73.99485,"(40.750294, -73.99485)",WEST 31 STREET                  ,,,0.0,0.0,0,0,0,0,0,0,Driver Inattention/Distraction,Unspecified,,,,Station Wagon/Sport Utility Vehicle,Taxi,,,,2016-07-11 19:50:00
9791716,4124028,4026b464-6eb2-4960-b3ae-c1fab9f062c1,OCCUPANT,UNSPECIFIED,F,66.0,18913225.0,Not Ejected,Does Not Apply,Does Not Apply,Driver,Lap Belt,,,Does Not Apply,Driver,,,05/01/2019,18:35,,,40.862755,-73.901085,"(40.862755, -73.901085)",EAST FORDHAM ROAD               ,,,0.0,0.0,0,0,0,0,0,0,Unsafe Lane Changing,Unspecified,,,,Station Wagon/Sport Utility Vehicle,Station Wagon/Sport Utility Vehicle,,,,2019-05-01 18:35:00
6856753,3632884,d94ba73b-ccdf-4dc6-b545-76a1fd1936c2,OCCUPANT,UNSPECIFIED,M,27.0,17472596.0,Not Ejected,Does Not Apply,Does Not Apply,Driver,Lap Belt & Harness,,,Does Not Apply,Driver,,,03/16/2017,0:00,QUEENS,11417.0,40.678787,-73.84427,"(40.678787, -73.84427)",CROSS BAY BOULEVARD             ,107 AVENUE,,0.0,0.0,0,0,0,0,0,0,Following Too Closely,Unspecified,,,,Station Wagon/Sport Utility Vehicle,Taxi,,,,2017-03-16 00:00:00
8965179,4065568,284d663e-98f4-4647-8ad7-b4b3f9d21ae6,OCCUPANT,UNSPECIFIED,M,0.0,18505322.0,,,,,,,,,Registrant,,,01/12/2019,12:12,STATEN ISLAND,10306.0,40.56763,-74.11263,"(40.56763, -74.11263)",HYLAN BOULEVARD                 ,BEACH AVENUE,,0.0,0.0,0,0,0,0,0,0,Unsafe Lane Changing,Unspecified,,,,Station Wagon/Sport Utility Vehicle,Station Wagon/Sport Utility Vehicle,,,,2019-01-12 12:12:00
12421703,4580957,4291d38b-65a9-4f78-a132-3a3f8ce19220,OCCUPANT,UNSPECIFIED,M,31.0,20334650.0,Not Ejected,Does Not Apply,Does Not Apply,Unknown,Unknown,,,Does Not Apply,Driver,,,11/11/2022,3:15,BROOKLYN,11229.0,40.60913,-73.95741,"(40.60913, -73.95741)",EAST 16 STREET,KINGS HIGHWAY,,0.0,0.0,0,0,0,0,0,0,Unspecified,Unspecified,,,,Sedan,Station Wagon/Sport Utility Vehicle,,,,2022-11-11 03:15:00
5767409,3420794,242878,OCCUPANT,UNSPECIFIED,M,40.0,16954100.0,,,,,,,,,Registrant,,,04/01/2016,20:30,BROOKLYN,11217.0,,,,ATLANTIC AVENUE                 ,NEVINS STREET,,0.0,0.0,0,0,0,0,0,0,Unsafe Lane Changing,Unspecified,,,,Station Wagon/Sport Utility Vehicle,2 dr sedan,,,,2016-04-01 20:30:00
6660506,3583903,3118651,OCCUPANT,UNSPECIFIED,F,43.0,17378295.0,Not Ejected,Does Not Apply,Does Not Apply,Driver,Lap Belt & Harness,,,Does Not Apply,Driver,,,12/20/2016,18:30,BRONX,10465.0,40.842697,-73.82519,"(40.842697, -73.82519)",COUNTRY CLUB ROAD               ,MACDONOUGH PLACE,,0.0,0.0,0,0,0,0,0,0,Unspecified,Unspecified,,,,Sedan,Sedan,,,,2016-12-20 18:30:00
6836357,3648913,8f6de164-6d51-4750-be04-110c03d0165f,OCCUPANT,UNSPECIFIED,F,22.0,17462708.0,Not Ejected,Does Not Apply,Does Not Apply,"Front passenger, if two or more persons, including the driver, are in the front seat",Unknown,,,Does Not Apply,Passenger,,,04/10/2017,4:30,,,40.79522,-73.921524,"(40.79522, -73.921524)",TRIBOROUGH BRIDGE               ,,,0.0,0.0,0,0,0,0,0,0,Alcohol Involvement,Unspecified,,,,Sedan,Sedan,,,,2017-04-10 04:30:00
11471457,4363232,bc502fe9-30a9-4c0a-81d3-5cd769006eaa,OCCUPANT,UNSPECIFIED,F,62.0,19783449.0,,,,,,,,,Registrant,,,11/01/2020,8:50,BROOKLYN,11221.0,40.69362,-73.93418,"(40.69362, -73.93418)",,,67        STUYVESANT AVENUE             ,0.0,0.0,0,0,0,0,0,0,Passing or Lane Usage Improper,Unspecified,,,,Sedan,,,,,2020-11-01 08:50:00
8998089,4029580,5642507c-6fac-4f07-a1a9-029e15f34424,OCCUPANT,UNSPECIFIED,F,40.0,18521710.0,,,,,,,,,Registrant,,,11/19/2018,15:30,MANHATTAN,10000.0,40.76871,-73.969986,"(40.76871, -73.969986)",,,1         TRANSVERSE ROAD NUMBER ONE    ,2.0,0.0,0,0,0,0,2,0,Driver Inattention/Distraction,Driver Inattention/Distraction,,,,Sedan,Sedan,,,,2018-11-19 15:30:00
11751592,4413516,e6d9fe5e-55cb-41f5-b67b-251634866491,BICYCLIST,INJURED,M,44.0,19946867.0,Not Ejected,Conscious,Knee-Lower Leg Foot,Driver,Unknown,,,Contusion - Bruise,Driver,,,05/04/2021,17:45,MANHATTAN,10030.0,40.82403,-73.94476,"(40.82403, -73.94476)",WEST 145 STREET,SAINT NICHOLAS AVENUE,,1.0,0.0,0,0,1,0,0,0,Driver Inattention/Distraction,Unspecified,,,,Bike,Station Wagon/Sport Utility Vehicle,,,,2021-05-04 17:45:00
9509755,4013524,d6e0c44f-26e1-4f01-89bf-971e1f40ee85,OCCUPANT,UNSPECIFIED,F,38.0,18773411.0,,,,,,,,,Registrant,,,11/02/2018,17:30,,,,,,JEWEL AVENUE                    ,GRAND CENTRAL PARKWAY,,0.0,0.0,0,0,0,0,0,0,Passing or Lane Usage Improper,Unspecified,,,,Station Wagon/Sport Utility Vehicle,Sedan,,,,2018-11-02 17:30:00
9504944,3989722,b66fcd01-24c2-45f5-99d7-04e5d60f2760,OCCUPANT,UNSPECIFIED,M,21.0,18771057.0,Not Ejected,Does Not Apply,Does Not Apply,Driver,Lap Belt & Harness,,,Does Not Apply,Driver,,,09/28/2018,14:30,BROOKLYN,11210.0,40.62684,-73.9546,"(40.62684, -73.9546)",,,1041      EAST 22 STREET                ,0.0,0.0,0,0,0,0,0,0,Unspecified,Unspecified,,,,Station Wagon/Sport Utility Vehicle,Station Wagon/Sport Utility Vehicle,,,,2018-09-28 14:30:00
7389100,3843491,e9319d97-945c-4968-9ed1-1276254373a0,OCCUPANT,UNSPECIFIED,,0.0,17729679.0,,,,,,,,,Registrant,,,02/08/2018,11:20,BROOKLYN,11220.0,40.636242,-74.01237,"(40.636242, -74.01237)",7 AVENUE                        ,61 STREET,,0.0,0.0,0,0,0,0,0,0,Unspecified,Unspecified,,,,Station Wagon/Sport Utility Vehicle,Station Wagon/Sport Utility Vehicle,,,,2018-02-08 11:20:00
12355939,4563831,4d94740b-2da4-4d59-8ed9-b3eb8901c22d,OCCUPANT,UNSPECIFIED,M,30.0,20296987.0,Not Ejected,Does Not Apply,Does Not Apply,Driver,Lap Belt & Harness,,,Does Not Apply,Driver,,,09/13/2022,15:21,,,40.691807,-73.98821,"(40.691807, -73.98821)",RED HOOK LANE,,,0.0,0.0,0,0,0,0,0,0,Unspecified,Unspecified,,,,Box Truck,Sedan,,,,2022-09-13 15:21:00
11182438,4310785,662ac6ab-b63f-48f1-8485-977a0d059fce,OCCUPANT,UNSPECIFIED,M,39.0,19623692.0,,,,,,,,,Registrant,,,04/28/2020,17:00,QUEENS,11434.0,40.66675,-73.779945,"(40.66675, -73.779945)",ROCKAWAY BOULEVARD              ,SOUTH CONDUIT AVENUE,,0.0,0.0,0,0,0,0,0,0,Traffic Control Disregarded,Unspecified,,,,Station Wagon/Sport Utility Vehicle,Sedan,,,,2020-04-28 17:00:00
6097054,3607086,14c58161-ad01-4b07-8051-c930bd4bf38a,OCCUPANT,UNSPECIFIED,,0.0,17110857.0,,,,,,,,,Registrant,,,01/30/2017,8:05,MANHATTAN,10016.0,40.746403,-73.97973,"(40.746403, -73.97973)",EAST 34 STREET                  ,LEXINGTON AVENUE,,0.0,0.0,0,0,0,0,0,0,Backing Unsafely,Unspecified,,,,Station Wagon/Sport Utility Vehicle,Van,,,,2017-01-30 08:05:00
5772447,3414092,394915,OCCUPANT,UNSPECIFIED,M,59.0,16956564.0,,,,,,,,,Registrant,,,04/13/2016,21:20,BRONX,10468.0,,,,WEBB AVENUE                     ,WEST KINGSBRIDGE ROAD,,0.0,0.0,0,0,0,0,0,0,Unspecified,Unspecified,,,,Station Wagon/Sport Utility Vehicle,4 dr sedan,,,,2016-04-13 21:20:00
7691417,3769015,30a42686-f940-4cfc-b115-d1e841c68a58,OCCUPANT,UNSPECIFIED,M,0.0,17877976.0,,,,,,,,,Registrant,,,10/14/2017,5:40,,,40.716194,-73.996086,"(40.716194, -73.996086)",CANAL STREET                    ,BOWERY,,0.0,0.0,0,0,0,0,0,0,Unspecified,Unspecified,,,,Box Truck,Sedan,,,,2017-10-14 05:40:00
6965946,3666568,85be383e-a3cf-4ffd-926d-82635d09305b,OCCUPANT,UNSPECIFIED,M,61.0,17524902.0,,,,,,,,,Registrant,,,05/09/2017,17:30,,,,,,3 AVENUE                        ,HAMILTON AVENUE,,0.0,0.0,0,0,0,0,0,0,Unspecified,Unspecified,,,,Sedan,Station Wagon/Sport Utility Vehicle,,,,2017-05-09 17:30:00
6975963,3669759,1a895992-6a1a-4e2f-b6b4-94514784058f,OCCUPANT,UNSPECIFIED,M,30.0,17529797.0,Not Ejected,Does Not Apply,Does Not Apply,Driver,Lap Belt & Harness,,,Does Not Apply,Driver,,,05/13/2017,17:30,,,40.588066,-73.95342,"(40.588066, -73.95342)",AVENUE Z                        ,,,0.0,0.0,0,0,0,0,0,0,Failure to Yield Right-of-Way,,,,,Sedan,,,,,2017-05-13 17:30:00
12300567,4548977,5c44a61a-f8de-42c0-96d8-8e07c8bd7ec0,OCCUPANT,UNSPECIFIED,,,20264927.0,,,,,,,,,Registrant,,,07/24/2022,7:20,QUEENS,11419.0,40.689644,-73.81907,"(40.689644, -73.81907)",103 AVENUE,126 STREET,,2.0,0.0,0,0,0,0,2,0,Traffic Control Disregarded,Unspecified,Unspecified,Unspecified,Unspecified,Sedan,Sedan,Sedan,Sedan,Pick-up Truck,2022-07-24 07:20:00
9044933,4074114,8499234e-bcdc-40d5-a235-815ff79af7da,OCCUPANT,UNSPECIFIED,F,52.0,18544653.0,,,,,,,,,Registrant,,,02/02/2019,11:02,,,40.76464,-73.916595,"(40.76464, -73.916595)",30 AVENUE                       ,,,0.0,0.0,0,0,0,0,0,0,Passing or Lane Usage Improper,Unspecified,,,,Station Wagon/Sport Utility Vehicle,Sedan,,,,2019-02-02 11:02:00
13333949,4804464,96eb48c9-9729-4d1d-8482-b920583e49d7,OCCUPANT,UNSPECIFIED,M,37.0,20854557.0,,,,,,,,,Registrant,,,04/02/2025,14:02,QUEENS,11355.0,40.75466,-73.83311,"(40.75466, -73.83311)",COLLEGE POINT BLVD,SANFORD AVE,,0.0,0.0,0,0,0,0,0,0,Unspecified,Unspecified,,,,Sedan,Station Wagon/Sport Utility Vehicle,,,,2025-04-02 14:02:00
7012069,3633612,8630107b-0b83-4cb4-8d9d-fa0e93d5df67,OCCUPANT,UNSPECIFIED,,0.0,17547090.0,,,,,,,,,Registrant,,,03/17/2017,13:30,QUEENS,11354.0,40.761547,-73.83113,"(40.761547, -73.83113)",37 AVENUE                       ,MAIN STREET,,0.0,0.0,0,0,0,0,0,0,Turning Improperly,Unspecified,,,,Sedan,Station Wagon/Sport Utility Vehicle,,,,2017-03-17 13:30:00
11305583,4319481,7102fc8e-718b-44e4-9cb4-e4220ac5210f,OCCUPANT,UNSPECIFIED,M,29.0,19687281.0,Not Ejected,Does Not Apply,Does Not Apply,Driver,Unknown,,,Does Not Apply,Driver,,,06/09/2020,12:36,,,40.577213,-73.96329,"(40.577213, -73.96329)",BRIGHTON BEACH AVENUE           ,,,1.0,0.0,1,0,0,0,0,0,Driver Inattention/Distraction,,,,,Pick-up Truck,,,,,2020-06-09 12:36:00
12669287,4644785,e9ad1ae6-9321-4cbc-847a-f7beca93eb18,OCCUPANT,UNSPECIFIED,,,20474751.0,,,,,,,,,Registrant,,,06/26/2023,12:52,,,,,,WEST SHORE EXPRESSWAY,,,0.0,0.0,0,0,0,0,0,0,Passing or Lane Usage Improper,Unspecified,,,,Sedan,,,,,2023-06-26 12:52:00
6356242,3491182,1369129,BICYCLIST,INJURED,M,66.0,17233367.0,Ejected,Conscious,Hip-Upper Leg,Driver,Stoppers Only (In-Line Skater/Bicyclist),,,Complaint of Pain,Driver,,,07/28/2016,17:00,BROOKLYN,11219.0,40.625984,-74.001526,"(40.625984, -74.001526)",13 AVENUE                       ,65 STREET,,1.0,0.0,0,0,1,0,0,0,Failure to Yield Right-of-Way,Unspecified,,,,Sedan,Bike,,,,2016-07-28 17:00:00
9185648,3918579,efaf0b19-99b1-4d82-b8ad-19f89d6457f6,OCCUPANT,UNSPECIFIED,M,46.0,18614421.0,,,,,,,,,Registrant,,,06/08/2018,0:00,BROOKLYN,11205.0,40.696674,-73.957535,"(40.696674, -73.957535)",SKILLMAN STREET                 ,PARK AVENUE,,0.0,0.0,0,0,0,0,0,0,Driver Inattention/Distraction,Unspecified,,,,Station Wagon/Sport Utility Vehicle,Station Wagon/Sport Utility Vehicle,,,,2018-06-08 00:00:00
12901701,4704888,47d0572d-8117-411c-aa2d-971409176085,OCCUPANT,UNSPECIFIED,M,29.0,20607224.0,Not Ejected,Does Not Apply,Does Not Apply,"Middle rear seat, or passenger lying across a seat",Lap Belt & Harness,,,Does Not Apply,Passenger,,,02/25/2024,2:00,,,40.74006,-73.87864,"(40.74006, -73.87864)",BROADWAY,SAINT JAMES AVENUE,,1.0,0.0,0,0,1,0,0,0,Unspecified,Unspecified,,,,E-Bike,Station Wagon/Sport Utility Vehicle,,,,2024-02-25 02:00:00
10010748,4174349,32aae879-d796-4cc4-bdf2-6a4181e4fdd2,OCCUPANT,UNSPECIFIED,M,20.0,19021447.0,Not Ejected,Does Not Apply,Does Not Apply,"Any person in the rear of a station wagon, pick-up truck, all passengers on a bus, etc",Lap Belt & Harness,,,Does Not Apply,Passenger,,,07/21/2019,17:00,STATEN ISLAND,10308.0,40.550766,-74.15017,"(40.550766, -74.15017)",AMBOY ROAD                      ,GIFFORDS LANE,,0.0,0.0,0,0,0,0,0,0,Passing Too Closely,Failure to Keep Right,,,,Ambulance,Station Wagon/Sport Utility Vehicle,,,,2019-07-21 17:00:00
10074131,4189208,3b12230f-1c08-4054-9af0-380d34b5c8f3,OCCUPANT,UNSPECIFIED,F,35.0,19053274.0,Not Ejected,Does Not Apply,Does Not Apply,Right rear passenger or motorcycle sidecar passenger,Lap Belt & Harness,,,Does Not Apply,Passenger,,,08/11/2019,13:32,,,40.668648,-73.92835,"(40.668648, -73.92835)",EASTERN PARKWAY                 ,,,1.0,0.0,0,0,0,0,1,0,Unspecified,Unspecified,,,,Sedan,Sedan,,,,2019-08-11 13:32:00
7588150,3882703,01c9205a-3c3a-4e7e-b3ff-1805b99e1a96,OCCUPANT,UNSPECIFIED,M,54.0,17827351.0,,,,,,,,,Registrant,,,04/17/2018,14:50,,,40.68636,-73.810036,"(40.68636, -73.810036)",109 AVENUE                      ,,,0.0,0.0,0,0,0,0,0,0,Unspecified,Unspecified,,,,Sedan,Station Wagon/Sport Utility Vehicle,,,,2018-04-17 14:50:00
9938525,4157935,120ce2bb-5ca8-463d-a8ba-a233af0c2bbf,OCCUPANT,UNSPECIFIED,M,79.0,18985591.0,,,,,,,,,Registrant,,,06/24/2019,16:57,BRONX,10459.0,40.82498,-73.89132,"(40.82498, -73.89132)",WEST FARMS ROAD                 ,WESTCHESTER AVENUE,,0.0,0.0,0,0,0,0,0,0,Unspecified,Unspecified,,,,Sedan,Sedan,,,,2019-06-24 16:57:00
7596826,3760306,88f797aa-504d-4abd-b289-629361422c6b,PEDESTRIAN,INJURED,M,58.0,,,Conscious,Hip-Upper Leg,,,Pedestrian/Bicyclist/Other Pedestrian Not at Intersection,Working in Roadway,Complaint of Pain,Pedestrian,Pedestrian/Bicyclist/Other Pedestrian Error/Confusion,Unspecified,09/30/2017,13:20,BRONX,10460.0,40.83504,-73.88685,"(40.83504, -73.88685)",,,960       EAST 173 STREET               ,1.0,0.0,1,0,0,0,0,0,Passing Too Closely,,,,,,,,,,2017-09-30 13:20:00
7919925,3769178,c2ec4d41-b8fd-4e47-ab40-f48b467e793e,OCCUPANT,UNSPECIFIED,M,45.0,17989452.0,,,,,,,,,Registrant,,,10/14/2017,2:30,,,,,,LONG ISLAND EXPRESSWAY          ,COLLEGE POINT BOULEVARD,,1.0,0.0,0,0,0,0,1,0,Traffic Control Disregarded,Unspecified,,,,Dump,Station Wagon/Sport Utility Vehicle,,,,2017-10-14 02:30:00
6350182,3480444,1262976,OCCUPANT,UNSPECIFIED,M,27.0,17230500.0,Not Ejected,Does Not Apply,Does Not Apply,Driver,Lap Belt & Harness,,,Does Not Apply,Driver,,,07/14/2016,15:01,BROOKLYN,11226.0,40.653404,-73.95942,"(40.653404, -73.95942)",,,789       FLATBUSH AVENUE               ,0.0,0.0,0,0,0,0,0,0,Unspecified,Unspecified,Unspecified,Unspecified,,PK,Station Wagon/Sport Utility Vehicle,Station Wagon/Sport Utility Vehicle,4 dr sedan,,2016-07-14 15:01:00
7452109,3855896,83de23e1-f3a7-46fa-9d18-ba071fb11007,OCCUPANT,UNSPECIFIED,M,37.0,17760493.0,Not Ejected,Does Not Apply,Does Not Apply,Driver,Lap Belt & Harness,,,Does Not Apply,Driver,,,03/02/2018,22:15,,,40.75603,-73.979034,"(40.75603, -73.979034)",5 AVENUE                        ,,,0.0,0.0,0,0,0,0,0,0,Following Too Closely,Following Too Closely,,,,Sedan,Station Wagon/Sport Utility Vehicle,,,,2018-03-02 22:15:00
12879831,4699445,7c2b3149-4dce-44c0-8c73-24092993f73f,OCCUPANT,INJURED,M,39.0,20594786.0,Not Ejected,Conscious,Neck,Driver,Lap Belt,,,Whiplash,Driver,,,02/01/2024,8:10,STATEN ISLAND,10312.0,40.55336,-74.20217,"(40.55336, -74.20217)",HUGUENOT AVENUE,LOMBARD COURT,,1.0,0.0,0,0,0,0,1,0,Unspecified,Unspecified,,,,Pick-up Truck,Sedan,,,,2024-02-01 08:10:00
11747470,4417541,cb283486-4847-451d-a09e-b72f0f753b70,OCCUPANT,UNSPECIFIED,,,19944559.0,,,,,,,,,Registrant,,,05/09/2021,22:25,,,40.78542,-73.98399,"(40.78542, -73.98399)",HENRY HUDSON PARKWAY,,,0.0,0.0,0,0,0,0,0,0,Driver Inattention/Distraction,Unspecified,,,,Station Wagon/Sport Utility Vehicle,,,,,2021-05-09 22:25:00
6844453,3662590,81a5e861-d4ed-4ab1-8d7f-b73397767afb,OCCUPANT,UNSPECIFIED,M,82.0,17466604.0,,,,,,,,,Registrant,,,05/03/2017,12:30,BROOKLYN,11225.0,40.663727,-73.95386,"(40.663727, -73.95386)",ROGERS AVENUE                   ,EMPIRE BOULEVARD,,0.0,0.0,0,0,0,0,0,0,Failure to Yield Right-of-Way,Other Vehicular,,,,Station Wagon/Sport Utility Vehicle,Sedan,,,,2017-05-03 12:30:00
11102557,4297928,6798fdf0-1532-4352-a684-af1cf1124d13,OCCUPANT,UNSPECIFIED,M,40.0,19580779.0,,,,,,,,,Registrant,,,03/04/2020,14:30,,,40.635025,-73.99213,"(40.635025, -73.99213)",49 STREET                       ,,,0.0,0.0,0,0,0,0,0,0,Unspecified,Unspecified,,,,Station Wagon/Sport Utility Vehicle,Station Wagon/Sport Utility Vehicle,,,,2020-03-04 14:30:00
6648096,3563394,2757110,OCCUPANT,UNSPECIFIED,,,,,,,,,,,,Witness,,,11/18/2016,19:24,,,40.60855,-74.13216,"(40.60855, -74.13216)",BRADLEY AVENUE                  ,NORTH GANNON AVENUE,,1.0,0.0,1,0,0,0,0,0,Driver Inattention/Distraction,,,,,Station Wagon/Sport Utility Vehicle,,,,,2016-11-18 19:24:00
12240510,4533583,f866c54e-de90-4f9a-a39b-b80c6723664b,OCCUPANT,UNSPECIFIED,F,72.0,20230444.0,Not Ejected,Does Not Apply,Does Not Apply,Driver,Unknown,,,Does Not Apply,Driver,,,05/31/2022,13:30,MANHATTAN,10011.0,40.745842,-73.99982,"(40.745842, -73.99982)",,,344       WEST 23 STREET,0.0,0.0,0,0,0,0,0,0,Driver Inattention/Distraction,Unspecified,,,,Station Wagon/Sport Utility Vehicle,Garbage or Refuse,,,,2022-05-31 13:30:00
9767139,4118097,63224ab7-f58f-44e9-b9e6-5da65f6732af,OCCUPANT,UNSPECIFIED,F,33.0,18901035.0,,,,,,,,,Registrant,,,04/20/2019,19:45,,,,,,,,1776      marconi street                ,0.0,0.0,0,0,0,0,0,0,Passing Too Closely,Unspecified,,,,Sedan,Pick-up Truck,,,,2019-04-20 19:45:00
9542492,4036850,17fbeabf-b81d-4e8d-bdaa-031b818df8db,OCCUPANT,INJURED,M,38.0,18789629.0,Not Ejected,Conscious,Back,Driver,Lap Belt & Harness,,,Complaint of Pain or Nausea,Driver,,,12/02/2018,19:44,BROOKLYN,11234.0,40.626457,-73.918,"(40.626457, -73.918)",AVENUE K                        ,RALPH AVENUE,,1.0,0.0,0,0,0,0,1,0,Failure to Yield Right-of-Way,Unspecified,,,,Station Wagon/Sport Utility Vehicle,Station Wagon/Sport Utility Vehicle,,,,2018-12-02 19:44:00
12080407,4491782,94fe2828-8c2e-4db1-a8d8-f8948d710a91,OCCUPANT,UNSPECIFIED,F,31.0,20138305.0,Not Ejected,Does Not Apply,Does Not Apply,Driver,Lap Belt & Harness,,,Does Not Apply,Driver,,,01/03/2022,18:38,BROOKLYN,11231.0,40.684814,-73.999084,"(40.684814, -73.999084)",DE GRAW STREET,HENRY STREET,,1.0,0.0,0,0,0,0,1,0,Unspecified,Unspecified,,,,Station Wagon/Sport Utility Vehicle,Station Wagon/Sport Utility Vehicle,,,,2022-01-03 18:38:00
9207659,3962856,1aec93c1-47c3-4459-b507-8a08aa918be1,OCCUPANT,UNSPECIFIED,M,28.0,18625251.0,,,,,,,,,Registrant,,,08/16/2018,11:45,STATEN ISLAND,10312.0,40.54653,-74.180435,"(40.54653, -74.180435)",DRUMGOOLE ROAD EAST             ,ARDEN AVENUE,,0.0,0.0,0,0,0,0,0,0,Following Too Closely,Unspecified,,,,Station Wagon/Sport Utility Vehicle,Sedan,,,,2018-08-16 11:45:00
11544267,4382286,d5ea1453-e829-4326-b4bf-6cfb3fc7d9f5,BICYCLIST,INJURED,M,28.0,19826010.0,Ejected,Conscious,Head,Driver,,,,Contusion - Bruise,Driver,,,01/07/2021,15:00,BROOKLYN,11237.0,40.70732,-73.93216,"(40.70732, -73.93216)",,,100       MORGAN AVENUE                 ,1.0,0.0,0,0,1,0,0,0,Passing or Lane Usage Improper,Unspecified,,,,Station Wagon/Sport Utility Vehicle,Bike,,,,2021-01-07 15:00:00
7675132,3756084,8b34aa2c-33f5-47c7-8399-654ccbe47c99,OCCUPANT,INJURED,M,82.0,17869959.0,Not Ejected,Conscious,Shoulder - Upper Arm,Driver,Lap Belt & Harness,,,Complaint of Pain,Driver,,,09/23/2017,16:41,MANHATTAN,10038.0,40.713444,-73.99854,"(40.713444, -73.99854)",PARK ROW                        ,WORTH STREET,,2.0,0.0,0,0,0,0,2,0,Glare,,,,,Sedan,,,,,2017-09-23 16:41:00
9522333,4003139,07735280-06c7-4731-b3fb-cd7be73d2e1f,OCCUPANT,UNSPECIFIED,M,52.0,18779640.0,Not Ejected,Does Not Apply,Does Not Apply,Driver,Lap Belt & Harness,,,Does Not Apply,Driver,,,10/19/2018,2:50,MANHATTAN,10022.0,40.75463,-73.9687,"(40.75463, -73.9687)",,,936       2 AVENUE                      ,0.0,0.0,0,0,0,0,0,0,Driver Inattention/Distraction,Unspecified,,,,Station Wagon/Sport Utility Vehicle,Pick-up Truck,,,,2018-10-19 02:50:00
9761875,4116980,88fb605f-9754-4d27-8df9-113398f00b75,OCCUPANT,UNSPECIFIED,M,40.0,18898374.0,Not Ejected,Does Not Apply,Does Not Apply,Driver,Lap Belt & Harness,,,Does Not Apply,Driver,,,04/13/2019,14:40,BROOKLYN,11217.0,40.684395,-73.97835,"(40.684395, -73.97835)",ATLANTIC AVENUE                 ,4 AVENUE,,0.0,0.0,0,0,0,0,0,0,Outside Car Distraction,Outside Car Distraction,,,,Bus,Sedan,,,,2019-04-13 14:40:00
9677239,4039071,b8df049c-0689-4770-8bab-efad071fec11,OCCUPANT,UNSPECIFIED,M,,18856397.0,,,,,,,,,Registrant,,,12/02/2018,1:15,MANHATTAN,10036.0,40.763374,-73.99647,"(40.763374, -73.99647)",WEST 46 STREET                  ,11 AVENUE,,0.0,0.0,0,0,0,0,0,0,Following Too Closely,Unspecified,,,,Sedan,Tractor Truck Diesel,,,,2018-12-02 01:15:00
9180722,3927898,f14bbb89-abe7-4822-9dfa-d57d217a7087,OCCUPANT,UNSPECIFIED,M,43.0,18611932.0,Not Ejected,Does Not Apply,Does Not Apply,Driver,Lap Belt & Harness,,,Does Not Apply,Driver,,,06/23/2018,23:55,BROOKLYN,11215.0,40.672222,-73.97383,"(40.672222, -73.97383)",8 AVENUE                        ,CARROLL STREET,,0.0,0.0,0,0,0,0,0,0,Driver Inattention/Distraction,Unspecified,,,,Sedan,Station Wagon/Sport Utility Vehicle,,,,2018-06-23 23:55:00
6619247,3534813,2231863,OCCUPANT,UNSPECIFIED,F,21.0,17358460.0,Not Ejected,Does Not Apply,Does Not Apply,Driver,Lap Belt & Harness,,,Does Not Apply,Driver,,,10/06/2016,20:00,,,40.75727,-73.74765,"(40.75727, -73.74765)",CROSS ISLAND PARKWAY            ,,,0.0,0.0,0,0,0,0,0,0,Unspecified,Unspecified,,,,Sedan,Sedan,,,,2016-10-06 20:00:00
12691407,4650281,28efaad9-bbf6-4969-a14e-5b6253df6560,OCCUPANT,INJURED,M,20.0,20487401.0,Ejected,Conscious,Face,Driver,,,,Minor Bleeding,Driver,,,07/31/2023,19:50,QUEENS,11420.0,40.671677,-73.80891,"(40.671677, -73.80891)",,,130-18    130 STREET,1.0,0.0,0,0,0,0,1,0,Driver Inattention/Distraction,Unspecified,,,,Station Wagon/Sport Utility Vehicle,Moped,,,,2023-07-31 19:50:00
5993870,3440279,641164,OCCUPANT,UNSPECIFIED,,,17061472.0,,,,,,,,,Registrant,,,05/12/2016,12:15,QUEENS,11361.0,40.760105,-73.7751,"(40.760105, -73.7751)",,,209-07    43 AVENUE                     ,0.0,0.0,0,0,0,0,0,0,Passing Too Closely,Unspecified,Unspecified,,,Tractor Truck Diesel,Station Wagon/Sport Utility Vehicle,2 dr sedan,,,2016-05-12 12:15:00
12535068,4606810,32f6fa51-273e-4366-9317-0e79698a7d8e,OCCUPANT,UNSPECIFIED,M,38.0,20399253.0,Not Ejected,Does Not Apply,Does Not Apply,Driver,Lap Belt & Harness,,,Does Not Apply,Driver,,,02/16/2023,15:58,,,40.877106,-73.90616,"(40.877106, -73.90616)",WEST 230 STREET,BROADWAY,,0.0,0.0,0,0,0,0,0,0,Traffic Control Disregarded,Unspecified,,,,Station Wagon/Sport Utility Vehicle,Station Wagon/Sport Utility Vehicle,,,,2023-02-16 15:58:00
13380144,4816486,85e3ada5-2da4-427f-8e84-d630279fdffd,OCCUPANT,UNSPECIFIED,M,33.0,20880862.0,Not Ejected,Does Not Apply,Does Not Apply,Driver,Lap Belt & Harness,,,Does Not Apply,Driver,,,05/29/2025,20:45,,,40.655617,-73.727104,"(40.655617, -73.727104)",FRANCIS LEWIS BLVD,147 DR,,0.0,0.0,0,0,0,0,0,0,Failure to Yield Right-of-Way,Unspecified,,,,Pick-up Truck,Sedan,,,,2025-05-29 20:45:00
12817556,4683348,0a442ba6-55c2-4ff5-8ca7-4c0ba811ff5a,OCCUPANT,UNSPECIFIED,M,53.0,20559362.0,,,,,,,,,Registrant,,,11/29/2023,6:52,MANHATTAN,10011.0,40.74369,-73.99596,"(40.74369, -73.99596)",,,214       7 AVENUE,0.0,0.0,0,0,0,0,0,0,Following Too Closely,Unspecified,,,,Station Wagon/Sport Utility Vehicle,E-Scooter,,,,2023-11-29 06:52:00
12206421,4524664,514eb546-7674-449e-845f-ee486f3a9665,OCCUPANT,INJURED,F,25.0,20211136.0,Not Ejected,Conscious,Back,Driver,Lap Belt & Harness,,,Complaint of Pain or Nausea,Driver,,,05/03/2022,10:55,,,40.638695,-73.87859,"(40.638695, -73.87859)",BELT PARKWAY,,,1.0,0.0,0,0,0,0,1,0,Unspecified,Unspecified,Unspecified,,,Sedan,Sedan,Sedan,,,2022-05-03 10:55:00
13197415,4768997,6b972019-6440-4727-b02d-ef12be100216,OCCUPANT,UNSPECIFIED,M,31.0,20777054.0,,,,,,,,,Registrant,,,11/04/2024,8:23,MANHATTAN,10027.0,40.80621,-73.95193,"(40.80621, -73.95193)",,,212       W 120 ST,0.0,0.0,0,0,0,0,0,0,Driver Inattention/Distraction,Unspecified,,,,Station Wagon/Sport Utility Vehicle,Station Wagon/Sport Utility Vehicle,,,,2024-11-04 08:23:00
13516595,4852814,cd62db19-61db-4627-a9ef-e640314c4775,OCCUPANT,UNSPECIFIED,M,21.0,20959599.0,Not Ejected,Does Not Apply,Does Not Apply,Driver,Other,,,Does Not Apply,Driver,,,10/26/2025,19:30,QUEENS,11385.0,40.692318,-73.882675,"(40.692318, -73.882675)",CYPRESS HILLS ST,CYPRESS AVE,,2.0,0.0,0,0,0,0,2,0,Driver Inattention/Distraction,Unspecified,,,,Sedan,,,,,2025-10-26 19:30:00
9321288,4049318,fcb5ed59-f125-4f2f-80fa-661f8beed892,OCCUPANT,UNSPECIFIED,F,46.0,18680914.0,Not Ejected,Does Not Apply,Does Not Apply,Driver,Lap Belt & Harness,,,Does Not Apply,Driver,,,12/20/2018,21:35,,,40.841187,-73.93215,"(40.841187, -73.93215)",HARLEM RIVER DRIVE              ,,,0.0,0.0,0,0,0,0,0,0,Driver Inattention/Distraction,Unspecified,Unspecified,,,Sedan,Station Wagon/Sport Utility Vehicle,Sedan,,,2018-12-20 21:35:00
10037656,4180651,23a9c86b-1ddc-4c62-bf34-ef6d79648950,OCCUPANT,UNSPECIFIED,F,51.0,19034972.0,Not Ejected,Does Not Apply,Does Not Apply,"Front passenger, if two or more persons, including the driver, are in the front seat",Lap Belt & Harness,,,Does Not Apply,Passenger,,,07/31/2019,17:41,,,,,,MAJOR DEEGAN EXPRESSWAY RAMP    ,,,0.0,0.0,0,0,0,0,0,0,Driver Inattention/Distraction,Following Too Closely,,,,Station Wagon/Sport Utility Vehicle,Sedan,,,,2019-07-31 17:41:00
12677227,4646760,2486de81-f34c-4f1d-a6ba-117ba4a446eb,OCCUPANT,UNSPECIFIED,F,63.0,20479317.0,,,,,,,,,Registrant,,,07/19/2023,4:30,BROOKLYN,11228.0,40.61356,-74.01308,"(40.61356, -74.01308)",,,1333      86 STREET,0.0,0.0,0,0,0,0,0,0,Unsafe Speed,Unspecified,Unspecified,,,Station Wagon/Sport Utility Vehicle,Sedan,,,,2023-07-19 04:30:00
7871458,3778508,fb889d7a-48dc-4def-8b3b-eaeb288dbe83,OCCUPANT,UNSPECIFIED,F,64.0,17965534.0,Not Ejected,Does Not Apply,Does Not Apply,Driver,Lap Belt & Harness,,,Does Not Apply,Driver,,,10/28/2017,15:40,QUEENS,11366.0,40.71995,-73.8089,"(40.71995, -73.8089)",,,158-02    UNION TURNPIKE                ,0.0,0.0,0,0,0,0,0,0,Unspecified,Unspecified,,,,Sedan,Station Wagon/Sport Utility Vehicle,,,,2017-10-28 15:40:00
6698408,3576383,2976440,OCCUPANT,UNSPECIFIED,M,0.0,17396455.0,,,,,,,,,Registrant,,,12/08/2016,13:30,BRONX,10462.0,40.83921,-73.85888,"(40.83921, -73.85888)",,,1501      METROPOLITAN AVENUE           ,0.0,0.0,0,0,0,0,0,0,Driver Inattention/Distraction,Unspecified,,,,Box Truck,Sedan,,,,2016-12-08 13:30:00
12860554,4694489,2eeef53b-b8a9-4fcf-81d3-f3506f6c4016,OCCUPANT,UNSPECIFIED,F,10.0,20583864.0,Not Ejected,Does Not Apply,Does Not Apply,"Any person in the rear of a station wagon, pick-up truck, all passengers on a bus, etc",Lap Belt & Harness,,,Does Not Apply,Passenger,,,01/12/2024,8:15,BRONX,10451.0,40.821003,-73.92462,"(40.821003, -73.92462)",CONCOURSE VILLAGE WEST,EAST 153 STREET,,0.0,0.0,0,0,0,0,0,0,Driver Inattention/Distraction,Driver Inattention/Distraction,,,,Bus,Bus,,,,2024-01-12 08:15:00
9850552,4125430,b00eb30f-b425-4681-af0f-abc911a3bbc5,OCCUPANT,UNSPECIFIED,F,34.0,18942154.0,Not Ejected,Does Not Apply,Does Not Apply,"Front passenger, if two or more persons, including the driver, are in the front seat",Lap Belt & Harness,,,Does Not Apply,Passenger,,,05/04/2019,22:50,,,40.681557,-73.966545,"(40.681557, -73.966545)",ATLANTIC AVENUE                 ,,,0.0,0.0,0,0,0,0,0,0,Unspecified,Unspecified,,,,Sedan,Station Wagon/Sport Utility Vehicle,,,,2019-05-04 22:50:00
9141225,4013445,2d5faaf1-0dda-4685-b7c0-da8790688be6,OCCUPANT,UNSPECIFIED,M,39.0,18592442.0,Not Ejected,Does Not Apply,Does Not Apply,Driver,Lap Belt & Harness,,,Does Not Apply,Driver,,,11/03/2018,2:30,,,40.804188,-73.95273,"(40.804188, -73.95273)",WEST 117 STREET                 ,,,0.0,0.0,0,0,0,0,0,0,Driver Inattention/Distraction,Unspecified,,,,Taxi,Sedan,,,,2018-11-03 02:30:00
11234014,4265318,0fc793c1-9dd8-4d34-bc44-49d445daa7a7,OCCUPANT,UNSPECIFIED,F,34.0,19649766.0,Not Ejected,Does Not Apply,Does Not Apply,"Front passenger, if two or more persons, including the driver, are in the front seat",Lap Belt & Harness,,,Does Not Apply,Passenger,,,12/25/2019,23:50,QUEENS,11418.0,40.697243,-73.813324,"(40.697243, -73.813324)",VANWYCK EXPRESSWAY              ,94 AVENUE,,4.0,0.0,0,0,0,0,4,0,Alcohol Involvement,Unspecified,,,,Station Wagon/Sport Utility Vehicle,Sedan,,,,2019-12-25 23:50:00
7644542,3880128,d0a04537-69bd-4514-af18-7df2ff36610b,OCCUPANT,UNSPECIFIED,F,0.0,17854871.0,,,,,,,,,Registrant,,,04/12/2018,21:00,BROOKLYN,11207.0,40.660656,-73.885796,"(40.660656, -73.885796)",LINDEN BOULEVARD                ,VAN SICLEN AVENUE,,0.0,0.0,0,0,0,0,0,0,Unspecified,Unspecified,,,,Station Wagon/Sport Utility Vehicle,Station Wagon/Sport Utility Vehicle,,,,2018-04-12 21:00:00
13324876,4802164,c4c5434c-a7a2-4ba3-bad0-c2f2a8e84301,OCCUPANT,UNSPECIFIED,F,73.0,20849386.0,,,,,,,,,Registrant,,,03/30/2025,8:00,BRONX,10469.0,40.85934,-73.83103,"(40.85934, -73.83103)",STILLWELL AVE,VANCE ST,,0.0,0.0,0,0,0,0,0,0,Unspecified,Unspecified,,,,Sedan,,,,,2025-03-30 08:00:00
7276833,3819737,e6994168-f5de-4d20-8f41-182636b137fa,OCCUPANT,UNSPECIFIED,M,21.0,17674274.0,Not Ejected,Does Not Apply,Does Not Apply,Driver,Lap Belt & Harness,,,Does Not Apply,Driver,,,12/31/2017,23:30,,,40.65935,-73.99918,"(40.65935, -73.99918)",4 AVENUE                        ,,,1.0,0.0,0,0,0,0,1,0,Unspecified,Unspecified,,,,Sedan,Station Wagon/Sport Utility Vehicle,,,,2017-12-31 23:30:00
12568651,4619080,94fa8525-df4c-40b5-940b-47a0d847bde0,OCCUPANT,UNSPECIFIED,M,33.0,20418252.0,,,,,,,,,Registrant,,,04/04/2023,18:00,QUEENS,11102.0,40.773865,-73.91762,"(40.773865, -73.91762)",,,27-09     24 AVENUE,0.0,0.0,0,0,0,0,0,0,Unspecified,,,,,Sedan,,,,,2023-04-04 18:00:00
6199408,3465170,989271,OCCUPANT,UNSPECIFIED,M,,17159984.0,,,,,,,,,Registrant,,,06/18/2016,13:30,BROOKLYN,11213.0,40.677296,-73.93589,"(40.677296, -73.93589)",,,65        TROY AVENUE                   ,0.0,0.0,0,0,0,0,0,0,Backing Unsafely,Following Too Closely,,,,4 dr sedan,Station Wagon/Sport Utility Vehicle,,,,2016-06-18 13:30:00
12582614,4622552,bec3781f-8471-43e9-8200-c7dfe4b2f3c5,OCCUPANT,UNSPECIFIED,F,48.0,20426007.0,,,,,,,,,Registrant,,,04/22/2023,21:05,QUEENS,11364.0,40.736267,-73.772865,"(40.736267, -73.772865)",FRANCIS LEWIS BOULEVARD,73 AVENUE,,1.0,0.0,0,0,0,0,1,0,Driver Inattention/Distraction,Driver Inattention/Distraction,,,,Station Wagon/Sport Utility Vehicle,Sedan,,,,2023-04-22 21:05:00
6298620,3541050,2343849,OCCUPANT,UNSPECIFIED,M,49.0,17206315.0,Not Ejected,Does Not Apply,Does Not Apply,Driver,Lap Belt & Harness,,,Does Not Apply,Driver,,,10/16/2016,17:00,MANHATTAN,10002.0,40.719933,-73.97876,"(40.719933, -73.97876)",EAST HOUSTON STREET             ,AVENUE D,,0.0,0.0,0,0,0,0,0,0,Unsafe Speed,Unspecified,,,,Sedan,Station Wagon/Sport Utility Vehicle,,,,2016-10-16 17:00:00
7439949,3872614,d21e7325-bafd-42e7-acd0-62ed6566bd6c,OCCUPANT,UNSPECIFIED,F,38.0,17754462.0,Not Ejected,Does Not Apply,Does Not Apply,Driver,Lap Belt & Harness,,,Does Not Apply,Driver,,,03/27/2018,18:30,,,40.844105,-73.898,"(40.844105, -73.898)",CROSS BRONX EXPY                ,,,0.0,0.0,0,0,0,0,0,0,Driver Inattention/Distraction,Unspecified,,,,Station Wagon/Sport Utility Vehicle,Sedan,,,,2018-03-27 18:30:00
13304893,4796805,1b77d001-ed6e-4406-8882-3592710b4646,OCCUPANT,UNSPECIFIED,M,47.0,20837868.0,Not Ejected,Does Not Apply,Does Not Apply,Driver,Unknown,,,Does Not Apply,Driver,,,03/05/2025,14:00,,,40.702446,-73.816864,"(40.702446, -73.816864)",JAMAICA AVENUE,I 678,,1.0,0.0,0,0,0,0,1,0,Driver Inattention/Distraction,Unspecified,,,,Station Wagon/Sport Utility Vehicle,Sedan,,,,2025-03-05 14:00:00
13516983,4852994,65da506a-32be-4b28-b339-f31388db7c42,OCCUPANT,UNSPECIFIED,M,,20959828.0,Not Ejected,Does Not Apply,Does Not Apply,Unknown,,,,Does Not Apply,Driver,,,10/26/2025,9:10,BROOKLYN,11224.0,40.58022,-74.00256,"(40.58022, -74.00256)",,,2675      W 36 ST,0.0,0.0,0,0,0,0,0,0,Unspecified,,,,,Sedan,,,,,2025-10-26 09:10:00
13525398,4855183,bd7cda40-0a83-42ce-b9c2-6e4fc839ed1f,OCCUPANT,UNSPECIFIED,,,,,,,,,,,,Notified Person,,,11/05/2025,18:18,BROOKLYN,11230.0,40.62224,-73.9649,"(40.62224, -73.9649)",,,1444      CONEY ISLAND AVE,1.0,0.0,0,0,0,0,0,0,Unspecified,Unspecified,,,,Standing S,Sedan,,,,2025-11-05 18:18:00
9667944,4046991,47189134-fcea-4bf3-a813-cbb308991ac2,OCCUPANT,UNSPECIFIED,M,41.0,18851748.0,,,,,,,,,Registrant,,,12/17/2018,19:00,,,,,,STATEN ISLAND EXPRESSWAY        ,,,0.0,0.0,0,0,0,0,0,0,Following Too Closely,Unspecified,,,,Station Wagon/Sport Utility Vehicle,Station Wagon/Sport Utility Vehicle,,,,2018-12-17 19:00:00
6309414,3498144,1528484,OCCUPANT,UNSPECIFIED,M,26.0,17211346.0,,,,,,,,,Registrant,,,08/10/2016,16:27,,,40.675106,-73.90438,"(40.675106, -73.90438)",,,EAST NEW YORK AVENUE                    ,0.0,0.0,0,0,0,0,0,0,Unspecified,Unspecified,,,,Sedan,Chassis Cab,,,,2016-08-10 16:27:00
10060791,4185611,0a0bbc65-db25-4d11-9cca-a048dc35b668,OCCUPANT,UNSPECIFIED,M,17.0,19046532.0,Not Ejected,Does Not Apply,Does Not Apply,Driver,Lap Belt & Harness,,,Does Not Apply,Driver,,,08/08/2019,15:15,,,40.71445,-73.9306,"(40.71445, -73.9306)",GRAND STREET                    ,,,0.0,0.0,0,0,0,0,0,0,Following Too Closely,Unspecified,,,,Sedan,Sedan,,,,2019-08-08 15:15:00
10028115,4178513,b9c04e69-41fa-4db9-bdd2-f11e52ee38ca,OCCUPANT,UNSPECIFIED,,,19030198.0,,,,,,,,,Registrant,,,07/27/2019,1:00,,,40.747894,-73.989174,"(40.747894, -73.989174)",AVENUE OF THE AMERICAS          ,,,0.0,0.0,0,0,0,0,0,0,Driver Inattention/Distraction,Driver Inattention/Distraction,,,,Station Wagon/Sport Utility Vehicle,Station Wagon/Sport Utility Vehicle,,,,2019-07-27 01:00:00
11487584,4309430,28bf8f83-a45a-4a06-9167-c5c465eab3ea,OCCUPANT,UNSPECIFIED,M,21.0,19792774.0,,,,,,,,,Registrant,,,04/15/2020,0:13,BROOKLYN,11207.0,40.67601,-73.88567,"(40.67601, -73.88567)",ASHFORD STREET                  ,LIBERTY AVENUE,,2.0,0.0,0,0,0,0,2,0,Traffic Control Disregarded,Unspecified,Unspecified,,,Station Wagon/Sport Utility Vehicle,Sedan,Sedan,,,2020-04-15 00:13:00
9133995,4030424,daa346c8-dd1e-4fee-a2fd-98238f3608f0,OCCUPANT,UNSPECIFIED,M,35.0,18588877.0,,,,,,,,,Registrant,,,11/21/2018,12:30,,,40.811203,-73.96158,"(40.811203, -73.96158)",BROADWAY                        ,,,0.0,0.0,0,0,0,0,0,0,Unsafe Lane Changing,Aggressive Driving/Road Rage,,,,Box Truck,Station Wagon/Sport Utility Vehicle,,,,2018-11-21 12:30:00
7488052,3867333,9947fd24-98e8-4796-8bff-96d3220806b5,OCCUPANT,UNSPECIFIED,,0.0,17778175.0,,,,,,,,,Registrant,,,03/22/2018,11:35,BROOKLYN,11230.0,40.62874,-73.956985,"(40.62874, -73.956985)",,,1374      OCEAN AVENUE                  ,0.0,0.0,0,0,0,0,0,0,Driver Inattention/Distraction,Unspecified,,,,Station Wagon/Sport Utility Vehicle,Station Wagon/Sport Utility Vehicle,,,,2018-03-22 11:35:00
7594756,3902011,014a7108-17ee-4b23-ac02-a0db5c348092,OCCUPANT,UNSPECIFIED,F,0.0,17830595.0,,,,,,,,,Registrant,,,05/01/2018,13:30,BROOKLYN,11235.0,40.58207,-73.950066,"(40.58207, -73.950066)",SHORE BOULEVARD                 ,DOVER STREET,,0.0,0.0,0,0,0,0,0,0,Failure to Yield Right-of-Way,Unspecified,,,,Sedan,Sedan,,,,2018-05-01 13:30:00
7286382,3822259,cd12ba81-6bb5-4e71-a2b3-c58f56b1b1fc,OCCUPANT,UNSPECIFIED,,0.0,17679051.0,,,,,,,,,Registrant,,,01/04/2018,10:20,BRONX,10452.0,40.843204,-73.91196,"(40.843204, -73.91196)",GRAND CONCOURSE                 ,EAST MOUNT EDEN AVENUE,,1.0,0.0,0,0,0,0,1,0,Pavement Slippery,Unspecified,,,,Station Wagon/Sport Utility Vehicle,Sedan,,,,2018-01-04 10:20:00
6636018,3534613,2215901,OCCUPANT,UNSPECIFIED,F,52.0,17366472.0,,,,,,,,,Registrant,,,10/05/2016,16:45,QUEENS,11366.0,40.734818,-73.77777,"(40.734818, -73.77777)",73 AVENUE                       ,195 STREET,,0.0,0.0,0,0,0,0,0,0,Driver Inattention/Distraction,Unspecified,,,,Sedan,Sedan,,,,2016-10-05 16:45:00
10179065,4213736,c44abb67-34c1-4152-a9ae-ca8fd5500498,OCCUPANT,UNSPECIFIED,M,64.0,19106214.0,,,,,,,,,Registrant,,,09/27/2019,13:48,,,40.75895,-73.96849,"(40.75895, -73.96849)",EAST 55 STREET                  ,,,1.0,0.0,0,0,1,0,0,0,Driver Inattention/Distraction,Driver Inattention/Distraction,,,,Station Wagon/Sport Utility Vehicle,Bike,,,,2019-09-27 13:48:00
9099780,3911965,ce223516-0968-4c70-9e33-e5265e98ba38,OCCUPANT,UNSPECIFIED,,0.0,18571918.0,,,,,,,,,Registrant,,,05/29/2018,16:35,MANHATTAN,10009.0,40.724083,-73.98634,"(40.724083, -73.98634)",,,126       EAST 3 STREET                 ,0.0,0.0,0,0,0,0,0,0,Unspecified,Unspecified,,,,Station Wagon/Sport Utility Vehicle,Dump,,,,2018-05-29 16:35:00
12972183,4723306,1aa6700f-adb5-415d-8e3c-263ac5be1a30,OCCUPANT,UNSPECIFIED,F,35.0,20647240.0,Not Ejected,Does Not Apply,Does Not Apply,Driver,Lap Belt & Harness,,,Does Not Apply,Driver,,,05/08/2024,8:10,,,40.707737,-73.7632,"(40.707737, -73.7632)",195 STREET,,,0.0,0.0,0,0,0,0,0,0,Traffic Control Disregarded,Unspecified,,,,Station Wagon/Sport Utility Vehicle,E-Bike,,,,2024-05-08 08:10:00
13333181,4804373,8c7fdfc4-9071-4892-a84f-f8e1408a54ef,OCCUPANT,UNSPECIFIED,M,30.0,20854122.0,Not Ejected,Does Not Apply,Does Not Apply,Driver,Lap Belt & Harness,,,Does Not Apply,Driver,,,03/29/2025,21:50,MANHATTAN,10013.0,40.719456,-73.9944,"(40.719456, -73.9944)",BROOME ST,BOWERY,,0.0,0.0,0,0,0,0,0,0,Unspecified,Unspecified,,,,Sedan,Sedan,,,,2025-03-29 21:50:00
12679878,4647324,c34e3731-9dec-4e85-a876-8d4deae8f366,OCCUPANT,UNSPECIFIED,M,4.0,20480832.0,Not Ejected,Does Not Apply,Does Not Apply,"Left rear passenger, or rear passenger on a bicycle, motorcycle, snowmobile",,,,Does Not Apply,Passenger,,,07/20/2023,7:58,BRONX,10460.0,40.84034,-73.88186,"(40.84034, -73.88186)",,,1950      BRYANT AVENUE,0.0,0.0,0,0,0,0,0,0,Passing Too Closely,Unspecified,,,,Box Truck,Sedan,,,,2023-07-20 07:58:00
11191803,4260296,45babf41-8dfc-4288-93fc-57906afef371,OCCUPANT,UNSPECIFIED,M,34.0,19628590.0,Not Ejected,Does Not Apply,Does Not Apply,Driver,Lap Belt & Harness,,,Does Not Apply,Driver,,,12/17/2019,7:11,MANHATTAN,10013.0,40.718018,-73.99996,"(40.718018, -73.99996)",CANAL STREET                    ,CENTRE STREET,,0.0,0.0,0,0,0,0,0,0,Aggressive Driving/Road Rage,Unspecified,Unspecified,,,Sedan,Sedan,Tractor Truck Diesel,,,2019-12-17 07:11:00
9287240,3919317,617510c7-4183-4dc1-aaf3-a09661d6650c,OCCUPANT,UNSPECIFIED,,,18664175.0,,,,,,,,,Registrant,,,06/12/2018,15:45,,,40.65823,-74.00035,"(40.65823, -74.00035)",4 AVENUE                        ,,,0.0,0.0,0,0,0,0,0,0,Following Too Closely,Unspecified,,,,Station Wagon/Sport Utility Vehicle,Sedan,,,,2018-06-12 15:45:00
12172974,4516286,4a568926-7afd-4b08-ad62-acf662452252,OCCUPANT,UNSPECIFIED,,,20191986.0,,,,,,,,,Registrant,,,03/31/2022,8:30,QUEENS,11691.0,40.595768,-73.77389,"(40.595768, -73.77389)",BEACH CHANNEL DRIVE,BEACH 42 STREET,,0.0,0.0,0,0,0,0,0,0,Failure to Yield Right-of-Way,Unspecified,,,,Station Wagon/Sport Utility Vehicle,Sedan,,,,2022-03-31 08:30:00
6080621,3621767,712a21da-1733-4e2a-9e2f-a8cefbc0debb,OCCUPANT,UNSPECIFIED,F,38.0,17102932.0,,,,,,,,,Registrant,,,02/15/2017,13:50,,,40.844524,-73.902725,"(40.844524, -73.902725)",WEBSTER AVENUE                  ,,,0.0,0.0,0,0,0,0,0,0,Unspecified,Unspecified,,,,Station Wagon/Sport Utility Vehicle,Sedan,,,,2017-02-15 13:50:00
6985899,3629716,fca9f2b0-4efc-43fb-8887-1c32ebae1f68,OCCUPANT,UNSPECIFIED,M,52.0,17534590.0,Not Ejected,Does Not Apply,Does Not Apply,Driver,Lap Belt & Harness,,,Does Not Apply,Driver,,,03/10/2017,19:08,QUEENS,11360.0,40.77878,-73.782875,"(40.77878, -73.782875)",KENNEDY STREET                  ,23 AVENUE,,0.0,0.0,0,0,0,0,0,0,Passing Too Closely,Turning Improperly,,,,Sedan,Sedan,,,,2017-03-10 19:08:00
7064542,3703899,fb6a6234-eb7e-4026-97d8-3318d5220558,OCCUPANT,UNSPECIFIED,M,74.0,17572165.0,Not Ejected,Does Not Apply,Does Not Apply,Driver,Lap Belt & Harness,,,Does Not Apply,Driver,,,07/01/2017,11:25,BRONX,10455.0,40.810383,-73.90936,"(40.810383, -73.90936)",,,745       EAST 145 STREET               ,0.0,0.0,0,0,0,0,0,0,Driver Inattention/Distraction,Unspecified,,,,Sedan,Station Wagon/Sport Utility Vehicle,,,,2017-07-01 11:25:00
7823657,3801262,af7d6daa-4f9f-4f65-b2cf-442f82d14400,OCCUPANT,UNSPECIFIED,M,63.0,17942157.0,Not Ejected,Does Not Apply,Does Not Apply,Driver,Lap Belt & Harness,,,Does Not Apply,Driver,,,11/30/2017,11:40,BROOKLYN,11210.0,40.62573,-73.9564,"(40.62573, -73.9564)",OCEAN AVENUE                    ,AVENUE J,,0.0,0.0,0,0,0,0,0,0,Driver Inattention/Distraction,Unspecified,,,,Station Wagon/Sport Utility Vehicle,Station Wagon/Sport Utility Vehicle,,,,2017-11-30 11:40:00
12993374,4728611,21b27d3f-342c-4e29-8033-9fa7a6c15e3d,PEDESTRIAN,INJURED,F,39.0,,,Conscious,Abdomen - Pelvis,,,Pedestrian/Bicyclist/Other Pedestrian at Intersection,Crossing With Signal,None Visible,Pedestrian,Unspecified,Unspecified,05/04/2024,19:00,MANHATTAN,10018.0,40.754177,-73.984604,"(40.754177, -73.984604)",WEST 41 STREET,AVENUE OF THE AMERICAS,,2.0,0.0,2,0,0,0,0,0,Failure to Yield Right-of-Way,,,,,Bike,,,,,2024-05-04 19:00:00
13239891,4779953,2e5def49-e34d-4b66-a85e-a98eac9caaf7,OCCUPANT,UNSPECIFIED,F,5.0,20800878.0,Not Ejected,Does Not Apply,Does Not Apply,"Any person in the rear of a station wagon, pick-up truck, all passengers on a bus, etc",,,,Does Not Apply,Passenger,,,12/13/2024,16:33,BRONX,10467.0,40.876354,-73.86374,"(40.876354, -73.86374)",,,760       E GUN HILL RD,0.0,0.0,0,0,0,0,0,0,Following Too Closely,Backing Unsafely,,,,Bus,Sedan,,,,2024-12-13 16:33:00
9897339,4147675,fc1768d9-b27b-471a-a9d1-03ed1df8af32,OCCUPANT,UNSPECIFIED,M,30.0,18965289.0,Not Ejected,Does Not Apply,Does Not Apply,Driver,Lap Belt & Harness,,,Does Not Apply,Driver,,,06/07/2019,15:00,BRONX,10451.0,40.82712,-73.93116,"(40.82712, -73.93116)",EAST 157 STREET                 ,MAJOR DEEGAN EXPRESSWAY,,0.0,0.0,0,0,0,0,0,0,Driver Inattention/Distraction,Unspecified,,,,Sedan,Pick-up Truck,,,,2019-06-07 15:00:00
11342907,4329314,86428ac2-874c-4cc4-8629-c0fde4f58fc5,OCCUPANT,UNSPECIFIED,,,19708726.0,,,,,,,,,Owner,,,07/17/2020,11:34,QUEENS,11691.0,40.605274,-73.75516,"(40.605274, -73.75516)",,,21-41     MOTT AVENUE                   ,0.0,0.0,0,0,0,0,0,0,Driver Inattention/Distraction,,,,,Sedan,,,,,2020-07-17 11:34:00
5773963,3430520,210350,OCCUPANT,INJURED,M,59.0,16957321.0,Not Ejected,Conscious,Elbow-Lower-Arm-Hand,Driver,Lap Belt & Harness,,,Complaint of Pain,Driver,,,03/29/2016,15:10,,,40.58574,-74.09035,"(40.58574, -74.09035)",,,SEAVIEW AVENUE                          ,1.0,0.0,0,0,0,0,1,0,Following Too Closely,Following Too Closely,Unspecified,,,4 dr sedan,Station Wagon/Sport Utility Vehicle,Station Wagon/Sport Utility Vehicle,,,2016-03-29 15:10:00
9874844,4142927,855fc640-2c18-4496-ba6a-b28b347a7484,OCCUPANT,INJURED,M,42.0,18954186.0,Not Ejected,Conscious,Knee-Lower Leg Foot,Riding/Hanging on Outside,,,,Complaint of Pain or Nausea,Passenger,,,05/31/2019,19:00,QUEENS,11691.0,40.604782,-73.754005,"(40.604782, -73.754005)",BEACH 22 STREET                 ,MOTT AVENUE,,1.0,0.0,0,0,0,0,1,0,Driver Inattention/Distraction,,,,,Sedan,,,,,2019-05-31 19:00:00
7736778,3751480,a99b8287-4d56-41af-8fb2-c6ced6779244,OCCUPANT,UNSPECIFIED,,0.0,17899992.0,,,,,,,,,Registrant,,,09/15/2017,14:58,MANHATTAN,10016.0,40.743942,-73.983635,"(40.743942, -73.983635)",PARK AVENUE SOUTH               ,EAST 29 STREET,,0.0,0.0,0,0,0,0,0,0,Unspecified,Unspecified,,,,Sedan,Van,,,,2017-09-15 14:58:00
13159582,4758549,39cc08a3-aa6c-4096-b1bc-c6fb656cd3c9,OCCUPANT,UNSPECIFIED,M,57.0,20754776.0,Not Ejected,Does Not Apply,Does Not Apply,Driver,Lap Belt & Harness,,,Does Not Apply,Driver,,,09/24/2024,12:40,BROOKLYN,11214.0,40.606144,-74.00384,"(40.606144, -74.00384)",,,8666      18 AVENUE,2.0,0.0,0,0,0,0,2,0,Failure to Yield Right-of-Way,Unspecified,,,,Sedan,Sedan,,,,2024-09-24 12:40:00
9168175,3951568,95b31e9a-c0ff-4526-8177-2f1cca91c1dd,OCCUPANT,UNSPECIFIED,M,48.0,18605724.0,Not Ejected,Does Not Apply,Does Not Apply,Driver,Lap Belt,,,Does Not Apply,Driver,,,07/30/2018,9:45,BROOKLYN,11205.0,40.690346,-73.9603,"(40.690346, -73.9603)",DE KALB AVENUE                  ,CLASSON AVENUE,,0.0,0.0,0,0,0,0,0,0,Driver Inattention/Distraction,Unspecified,Unspecified,,,Sedan,Bus,Station Wagon/Sport Utility Vehicle,,,2018-07-30 09:45:00
6884555,3688236,05b16842-6809-41c5-984f-a1ced143c1be,OCCUPANT,UNSPECIFIED,F,66.0,17485986.0,,,,,,,,,Registrant,,,06/09/2017,0:00,BROOKLYN,11235.0,40.577824,-73.96041,"(40.577824, -73.96041)",,,708       BRIGHTON BEACH AVENUE         ,0.0,0.0,0,0,0,0,0,0,View Obstructed/Limited,Unspecified,,,,Station Wagon/Sport Utility Vehicle,Sedan,,,,2017-06-09 00:00:00
12981648,4725665,8d8e4ca4-002a-46e5-b626-27332254661c,OCCUPANT,UNSPECIFIED,,,20652468.0,,,,,,,,,Registrant,,,05/12/2024,14:40,,,40.676445,-73.92762,"(40.676445, -73.92762)",PACIFIC STREET,,,4.0,0.0,0,0,0,0,4,0,Driver Inattention/Distraction,Other Vehicular,Other Vehicular,,,Station Wagon/Sport Utility Vehicle,Sedan,Sedan,,,2024-05-12 14:40:00
11219904,4263027,47d6a959-8722-4ce2-89ff-0fc76338be55,OCCUPANT,UNSPECIFIED,,,19642669.0,,,,,,,,,Registrant,,,12/23/2019,2:10,,,,,,EAST 57 STREET                  ,QUEENSBORO BRIDGE,,0.0,0.0,0,0,0,0,0,0,Turning Improperly,Unspecified,,,,Sedan,Sedan,,,,2019-12-23 02:10:00
13402789,4822370,0e1de6a8-bab4-4405-b719-e3249475f45d,OCCUPANT,UNSPECIFIED,M,66.0,20893745.0,,,,,,,,,Registrant,,,06/18/2025,18:09,QUEENS,11103.0,40.76601,-73.913506,"(40.76601, -73.913506)",,,25-84     STEINWAY ST,1.0,0.0,0,0,0,0,1,0,Failure to Yield Right-of-Way,Unspecified,,,,Box Truck,Sedan,,,,2025-06-18 18:09:00
9206383,3929704,00e1d354-7aef-41f3-a1dc-8899787124a3,OCCUPANT,UNSPECIFIED,M,60.0,18624650.0,Not Ejected,Does Not Apply,Does Not Apply,Driver,Lap Belt,,,Does Not Apply,Driver,,,06/25/2018,18:23,BROOKLYN,11216.0,40.684,-73.95031,"(40.684, -73.95031)",PUTNAM AVENUE                   ,NOSTRAND AVENUE,,1.0,0.0,0,0,0,0,1,0,Unspecified,Unspecified,,,,Station Wagon/Sport Utility Vehicle,Sedan,,,,2018-06-25 18:23:00
11331600,4326044,f6a948e0-f16f-493a-9d0b-315b4a2d783e,OCCUPANT,UNSPECIFIED,M,36.0,19702189.0,,,,,,,,,Registrant,,,07/05/2020,8:25,QUEENS,11411.0,40.701824,-73.7363,"(40.701824, -73.7363)",221 STREET                      ,114 AVENUE,,0.0,0.0,0,0,0,0,0,0,Unspecified,,,,,Sedan,,,,,2020-07-05 08:25:00
12207050,4524756,89cc7d74-94f6-4b5c-8f2c-21e292f0147e,OCCUPANT,UNSPECIFIED,M,27.0,20211471.0,Not Ejected,Does Not Apply,Does Not Apply,Driver,Lap Belt & Harness,,,Does Not Apply,Driver,,,04/29/2022,20:16,,,,,,BRONX WHITESTONE BRIDGE,,,0.0,0.0,0,0,0,0,0,0,Following Too Closely,Unspecified,Unspecified,,,Station Wagon/Sport Utility Vehicle,Station Wagon/Sport Utility Vehicle,Sedan,,,2022-04-29 20:16:00
6745811,3538487,2292580,OCCUPANT,UNSPECIFIED,M,56.0,17419343.0,Not Ejected,Does Not Apply,Does Not Apply,Driver,Lap Belt,,,Does Not Apply,Driver,,,10/11/2016,14:00,QUEENS,11354.0,40.76055,-73.82623,"(40.76055, -73.82623)",,,142-07    ROOSEVELT AVENUE              ,0.0,0.0,0,0,0,0,0,0,Following Too Closely,Backing Unsafely,,,,Sedan,Sedan,,,,2016-10-11 14:00:00
9710878,4035705,08232e91-ed11-4311-a169-d5b7bfe8653a,OCCUPANT,UNSPECIFIED,M,48.0,18873144.0,Not Ejected,Does Not Apply,Does Not Apply,Driver,Lap Belt & Harness,,,Does Not Apply,Driver,,,11/30/2018,17:40,QUEENS,11101.0,40.753353,-73.9412,"(40.753353, -73.9412)",,,22-19     41 AVENUE                     ,0.0,0.0,0,0,0,0,0,0,Failure to Yield Right-of-Way,Unspecified,,,,Sedan,Sedan,,,,2018-11-30 17:40:00
9913219,4151877,f7dd7f69-9453-4e74-b5fc-75aa4768129d,OCCUPANT,UNSPECIFIED,,0.0,18973157.0,,,,,,,,,Registrant,,,06/14/2019,19:10,BROOKLYN,11238.0,40.68175,-73.96748,"(40.68175, -73.96748)",ATLANTIC AVENUE                 ,VANDERBILT AVENUE,,0.0,0.0,0,0,0,0,0,0,Unsafe Lane Changing,Unspecified,,,,Sedan,Sedan,,,,2019-06-14 19:10:00
12240268,4533110,5e6d71b7-ff2c-46c9-b682-af61d14422e9,OCCUPANT,UNSPECIFIED,F,22.0,20230297.0,,,,,,,,,Registrant,,,05/31/2022,2:10,QUEENS,11102.0,40.76943,-73.917114,"(40.76943, -73.917114)",,,25-75     33 STREET,1.0,0.0,0,0,0,0,1,0,Reaction to Uninvolved Vehicle,Unspecified,,,,Station Wagon/Sport Utility Vehicle,Station Wagon/Sport Utility Vehicle,,,,2022-05-31 02:10:00
11602080,4397528,43228e74-28df-4e4a-aa43-a35c3d4959bb,OCCUPANT,UNSPECIFIED,M,46.0,19860331.0,Not Ejected,Does Not Apply,Does Not Apply,Driver,Lap Belt & Harness,,,Does Not Apply,Driver,,,03/09/2021,1:30,,,40.65711,-73.91335,"(40.65711, -73.91335)",LOTT AVENUE                     ,,,3.0,0.0,0,0,0,0,3,0,Failure to Yield Right-of-Way,Unspecified,,,,Station Wagon/Sport Utility Vehicle,Station Wagon/Sport Utility Vehicle,,,,2021-03-09 01:30:00
7714644,3759477,bb815b65-f80b-41cb-9e6f-4b6accf9543a,BICYCLIST,INJURED,M,22.0,17889289.0,Not Ejected,Conscious,Knee-Lower Leg Foot,Riding/Hanging on Outside,Helmet Only (In-Line Skater/Bicyclist),,,Abrasion,Driver,,,09/28/2017,23:00,BROOKLYN,11219.0,40.630127,-73.99005,"(40.630127, -73.99005)",15 AVENUE                       ,53 STREET,,1.0,0.0,0,0,1,0,0,0,Unspecified,,,,,Bike,,,,,2017-09-28 23:00:00
9954152,4163582,8635d9db-0726-455a-a9f2-36e9faec6e02,OCCUPANT,UNSPECIFIED,,0.0,18993372.0,,,,,,,,,Registrant,,,07/02/2019,12:30,BROOKLYN,11238.0,40.676655,-73.9721,"(40.676655, -73.9721)",,,330       FLATBUSH AVENUE               ,3.0,0.0,0,0,0,0,3,0,Driver Inattention/Distraction,Unspecified,,,,Sedan,,,,,2019-07-02 12:30:00
6589515,3519111,1948550,OCCUPANT,UNSPECIFIED,M,65.0,17344256.0,,,,,,,,,Registrant,,,09/14/2016,1:00,,,40.724686,-73.77241,"(40.724686, -73.77241)",GRAND CENTRAL PKWY              ,,,1.0,0.0,0,0,0,0,1,0,Unsafe Speed,Unspecified,Unspecified,,,Taxi,tow t,Sedan,,,2016-09-14 01:00:00
6819051,3691261,9688082a-2169-4c0e-b399-a2f1eb438885,OCCUPANT,UNSPECIFIED,,0.0,17454439.0,,,,,,,,,Registrant,,,06/13/2017,0:00,BROOKLYN,11221.0,40.690018,-73.937035,"(40.690018, -73.937035)",,,790       GREENE AVENUE                 ,0.0,0.0,0,0,0,0,0,0,Passing Too Closely,Unspecified,,,,Garbage or Refuse,Sedan,,,,2017-06-13 00:00:00
12669993,4644460,ba5e29cb-87d3-410a-bebb-86b50b45e0da,OCCUPANT,UNSPECIFIED,,56.0,20475151.0,Not Ejected,Does Not Apply,Does Not Apply,"Any person in the rear of a station wagon, pick-up truck, all passengers on a bus, etc",Unknown,,,Does Not Apply,Passenger,,,07/10/2023,17:46,,,,,,VERRAZANO BRIDGE UPPER,,,0.0,0.0,0,0,0,0,0,0,Unsafe Speed,Unspecified,Unspecified,Unspecified,,Sedan,Sedan,Station Wagon/Sport Utility Vehicle,Sedan,,2023-07-10 17:46:00
5788586,3413917,370087,OCCUPANT,UNSPECIFIED,M,28.0,16964542.0,,,,,,,,,Registrant,,,04/14/2016,14:55,BRONX,10469.0,,,,BOUCK AVENUE                    ,ARNOW AVENUE,,1.0,0.0,1,0,0,0,0,0,Unspecified,,,,,Station Wagon/Sport Utility Vehicle,,,,,2016-04-14 14:55:00
11833822,4415398,71497c74-7b7b-4983-8c44-490d7825c98a,OCCUPANT,UNSPECIFIED,M,38.0,19994856.0,,,,,,,,,Registrant,,,05/06/2021,22:17,QUEENS,11413.0,40.683376,-73.76043,"(40.683376, -73.76043)",MONTAUK STREET,FARMERS BOULEVARD,,0.0,0.0,0,0,0,0,0,0,Steering Failure,Unspecified,Unspecified,Unspecified,,Sedan,Sedan,Sedan,,,2021-05-06 22:17:00
11058774,4290157,e223a916-e5fe-4d90-bc36-87e12a3471be,OCCUPANT,UNSPECIFIED,F,36.0,19558038.0,Not Ejected,Does Not Apply,Does Not Apply,"Middle front seat, or passenger lying across a seat",Lap Belt & Harness,,,Does Not Apply,Passenger,,,02/17/2020,15:57,,,40.90123,-73.88782,"(40.90123, -73.88782)",MOSHOLU PARKWAY                 ,,,0.0,0.0,0,0,0,0,0,0,Unspecified,Unspecified,,,,Station Wagon/Sport Utility Vehicle,,,,,2020-02-17 15:57:00
13445818,4833912,7024322b-1eb0-4636-aefc-f8323002f0fb,OCCUPANT,UNSPECIFIED,M,64.0,20918947.0,Not Ejected,Does Not Apply,Does Not Apply,Driver,Lap Belt,,,Does Not Apply,Driver,,,08/09/2025,11:00,BROOKLYN,11216.0,40.685844,-73.94731,"(40.685844, -73.94731)",MARCY AVE,MONROE ST,,1.0,0.0,1,0,0,0,0,0,Driver Inattention/Distraction,,,,,Sedan,,,,,2025-08-09 11:00:00
9162264,3917956,7ff6e131-995d-46eb-b600-2e97aee6ee2c,OCCUPANT,UNSPECIFIED,M,21.0,18602784.0,Not Ejected,Does Not Apply,Does Not Apply,Driver,Lap Belt & Harness,,,Does Not Apply,Driver,,,06/08/2018,10:50,,,40.646328,-73.91276,"(40.646328, -73.91276)",AVENUE D                        ,REMSEN AVENUE,,0.0,0.0,0,0,0,0,0,0,Driver Inattention/Distraction,Unspecified,,,,Pick-up Truck,Station Wagon/Sport Utility Vehicle,,,,2018-06-08 10:50:00
9927348,4154845,885313b9-e638-4ba2-a7d1-aec4a85097e4,OCCUPANT,UNSPECIFIED,,0.0,18980083.0,,,,,,,,,Registrant,,,06/19/2019,20:00,QUEENS,11004.0,40.736553,-73.71194,"(40.736553, -73.71194)",256 STREET                      ,HILLSIDE AVENUE,,0.0,0.0,0,0,0,0,0,0,Passing Too Closely,Unspecified,,,,Sedan,Station Wagon/Sport Utility Vehicle,,,,2019-06-19 20:00:00
9001559,4069715,49ea1299-3f0d-4342-9004-e4dbc91d9555,OCCUPANT,UNSPECIFIED,M,31.0,18523350.0,Not Ejected,Does Not Apply,Does Not Apply,"Left rear passenger, or rear passenger on a bicycle, motorcycle, snowmobile",Unknown,,,Does Not Apply,Passenger,,,01/27/2019,17:30,MANHATTAN,10022.0,40.75943,-73.97542,"(40.75943, -73.97542)",,,21        EAST 52 STREET                ,0.0,0.0,0,0,0,0,0,0,Driver Inattention/Distraction,Unspecified,,,,Sedan,Station Wagon/Sport Utility Vehicle,,,,2019-01-27 17:30:00
11038209,4281099,9d79aeb0-0757-48e6-ad0f-53b73e45f6b4,OCCUPANT,UNSPECIFIED,M,30.0,19547495.0,Not Ejected,Does Not Apply,Does Not Apply,Driver,Lap Belt & Harness,,,Does Not Apply,Driver,,,01/30/2020,8:10,BROOKLYN,11230.0,40.619484,-73.95742,"(40.619484, -73.95742)",,,1280      EAST 18 STREET                ,0.0,0.0,0,0,0,0,0,0,Backing Unsafely,Unspecified,,,,Bus,Sedan,,,,2020-01-30 08:10:00
6872629,3648113,f693f481-bad0-4c24-a9bd-b05759a6cb15,OCCUPANT,UNSPECIFIED,M,35.0,17480300.0,,,,,,,,,Registrant,,,04/04/2017,19:45,MANHATTAN,10036.0,40.755352,-73.98374,"(40.755352, -73.98374)",,,1114      AVENUE OF THE AMERICAS        ,0.0,0.0,0,0,0,0,0,0,Driver Inexperience,Unspecified,,,,Taxi,Taxi,,,,2017-04-04 19:45:00
10209658,4221196,95876c67-b03a-4a4a-821f-b4a235833131,OCCUPANT,UNSPECIFIED,M,41.0,19121563.0,,,,,,,,,Registrant,,,10/10/2019,14:30,QUEENS,11694.0,40.5815,-73.844154,"(40.5815, -73.844154)",BEACH CHANNEL DRIVE             ,BEACH 122 STREET,,0.0,0.0,0,0,0,0,0,0,Glare,Unspecified,,,,Flat Bed,Sedan,,,,2019-10-10 14:30:00
11802042,4427629,2f497fe1-392c-41ac-92c7-c6e0d97999aa,OCCUPANT,UNSPECIFIED,F,57.0,19976180.0,,,,,,,,,Registrant,,,06/09/2021,12:19,BRONX,10456.0,40.82748,-73.910866,"(40.82748, -73.910866)",,,422       EAST 165 STREET,0.0,0.0,0,0,0,0,0,0,Unsafe Lane Changing,Driver Inattention/Distraction,,,,Sedan,Station Wagon/Sport Utility Vehicle,,,,2021-06-09 12:19:00
5941525,3445008,725604,OCCUPANT,UNSPECIFIED,,,17037053.0,,,,,,,,,Registrant,,,05/21/2016,1:15,MANHATTAN,10037.0,40.814873,-73.940315,"(40.814873, -73.940315)",,,521       LENOX AVENUE                  ,0.0,0.0,0,0,0,0,0,0,Driver Inattention/Distraction,Unspecified,,,,Station Wagon/Sport Utility Vehicle,Box Truck,,,,2016-05-21 01:15:00
9312406,3937859,523f395c-3541-40b7-964e-ad0f624e5fe3,OCCUPANT,INJURED,F,28.0,18676559.0,Not Ejected,Conscious,Face,"Left rear passenger, or rear passenger on a bicycle, motorcycle, snowmobile",Lap Belt & Harness,,,Complaint of Pain or Nausea,Passenger,,,07/10/2018,0:32,,,40.709076,-74.01209,"(40.709076, -74.01209)",TRINITY PLACE                   ,THAMES STREET,,3.0,0.0,0,0,0,0,3,0,Driver Inattention/Distraction,Unspecified,,,,Taxi,Sedan,,,,2018-07-10 00:32:00
9201520,3921249,2c94bbea-75d2-4071-bd04-6f4fb6f147fe,OCCUPANT,UNSPECIFIED,M,44.0,18622227.0,Not Ejected,Does Not Apply,Does Not Apply,Driver,Lap Belt,,,Does Not Apply,Driver,,,06/13/2018,14:35,,,40.84009,-73.88036,"(40.84009, -73.88036)",EAST TREMONT AVENUE             ,,,0.0,0.0,0,0,0,0,0,0,Unspecified,Unspecified,,,,Station Wagon/Sport Utility Vehicle,Station Wagon/Sport Utility Vehicle,,,,2018-06-13 14:35:00
5803896,3429495,380101,OCCUPANT,UNSPECIFIED,F,22.0,16971994.0,Not Ejected,Conscious,Does Not Apply,Driver,Lap Belt,,,Does Not Apply,Driver,,,04/15/2016,16:20,,,,,,,,,0.0,0.0,0,0,0,0,0,0,Unspecified,Unspecified,,,,4 dr sedan,4 dr sedan,,,,2016-04-15 16:20:00
7288252,3822841,f96cb8c5-78b7-4b39-ae81-891edd86fbfb,OCCUPANT,UNSPECIFIED,M,50.0,17679960.0,Not Ejected,Does Not Apply,Does Not Apply,Driver,Lap Belt & Harness,,,Does Not Apply,Driver,,,01/05/2018,9:45,BRONX,10473.0,40.82299,-73.86777,"(40.82299, -73.86777)",STORY AVENUE                    ,SOUND VIEW AVENUE,,0.0,0.0,0,0,0,0,0,0,Following Too Closely,Unspecified,,,,Sedan,Taxi,,,,2018-01-05 09:45:00
6266261,3467302,1040236,OCCUPANT,UNSPECIFIED,M,47.0,17191184.0,Not Ejected,Does Not Apply,Does Not Apply,"Front passenger, if two or more persons, including the driver, are in the front seat",Lap Belt & Harness,,,Does Not Apply,Passenger,,,06/19/2016,15:54,BROOKLYN,11218.0,40.64412,-73.98907,"(40.64412, -73.98907)",37 STREET                       ,FORT HAMILTON PARKWAY,,0.0,0.0,0,0,0,0,0,0,Reaction to Uninvolved Vehicle,Unspecified,,,,Station Wagon/Sport Utility Vehicle,4 dr sedan,,,,2016-06-19 15:54:00
9558123,3980894,8b1db51e-2702-4f80-af21-0b835fe92ca0,OCCUPANT,UNSPECIFIED,,,18797436.0,,,,,,,,,Registrant,,,09/14/2018,17:05,MANHATTAN,10019.0,40.761414,-73.976295,"(40.761414, -73.976295)",,,20        WEST 54 STREET                ,0.0,0.0,0,0,0,0,0,0,Driver Inattention/Distraction,Unspecified,,,,Taxi,Bike,,,,2018-09-14 17:05:00
9395787,3949160,c5392f54-52c9-47b5-a50b-00ff10fe4146,OCCUPANT,UNSPECIFIED,M,55.0,18717470.0,Not Ejected,Does Not Apply,Does Not Apply,Driver,Lap Belt & Harness,,,Does Not Apply,Driver,,,07/25/2018,22:30,QUEENS,11372.0,40.749084,-73.87025,"(40.749084, -73.87025)",,,95-47     ROOSEVELT AVENUE              ,0.0,0.0,0,0,0,0,0,0,Driver Inattention/Distraction,Unspecified,,,,Sedan,Station Wagon/Sport Utility Vehicle,,,,2018-07-25 22:30:00
12535332,4610639,c95e0a38-c427-4c73-93bf-a76bc34aa297,OCCUPANT,UNSPECIFIED,M,44.0,20399405.0,,,,,,,,,Registrant,,,03/01/2023,5:53,,,40.72656,-73.83802,"(40.72656, -73.83802)",GRAND CENTRAL PKWY,,,0.0,0.0,0,0,0,0,0,0,Passing or Lane Usage Improper,Unspecified,,,,Station Wagon/Sport Utility Vehicle,Taxi,,,,2023-03-01 05:53:00
6769604,3628417,2ae955f9-3809-48fa-b3bd-327647ff731e,OCCUPANT,UNSPECIFIED,,0.0,17430758.0,,,,,,,,,Registrant,,,03/07/2017,16:15,,,40.774227,-73.98112,"(40.774227, -73.98112)",,,COLUMBUS AVENUE                         ,0.0,0.0,0,0,0,0,0,0,Unsafe Lane Changing,Unspecified,,,,Taxi,Sedan,,,,2017-03-07 16:15:00
13312778,4799249,84cf7986-8c98-458d-ab82-a61d4fdd59dd,OCCUPANT,UNSPECIFIED,M,49.0,20842403.0,,,,,,,,,Registrant,,,03/12/2025,13:22,,,40.7217,-73.835976,"(40.7217, -73.835976)",G.C.P. / JEWEL (CDR),,,0.0,0.0,0,0,0,0,0,0,Driver Inattention/Distraction,Unspecified,,,,Station Wagon/Sport Utility Vehicle,Sedan,,,,2025-03-12 13:22:00
6189039,3474229,1145390,OCCUPANT,UNSPECIFIED,,,17155092.0,,,,,,,,,Registrant,,,07/04/2016,16:30,,,,,,RIVERSIDE DRIVE                 ,RIVERSIDE DRIVE WEST,,0.0,0.0,0,0,0,0,0,0,Driver Inattention/Distraction,Driver Inattention/Distraction,,,,4 dr sedan,Station Wagon/Sport Utility Vehicle,,,,2016-07-04 16:30:00
13029528,4737783,70fc3e3f-9e32-4149-a522-38903b091396,OCCUPANT,INJURED,M,27.0,20679419.0,Not Ejected,Conscious,Shoulder - Upper Arm,Driver,Lap Belt & Harness,,,Complaint of Pain or Nausea,Driver,,,07/02/2024,23:27,QUEENS,11419.0,40.685837,-73.82686,"(40.685837, -73.82686)",116 STREET,LIBERTY AVENUE,,1.0,0.0,0,0,0,0,1,0,Driver Inattention/Distraction,Unspecified,,,,Sedan,Station Wagon/Sport Utility Vehicle,,,,2024-07-02 23:27:00
9972681,4164394,4a913620-dd5d-4936-9e31-e11d272fa73e,OCCUPANT,UNSPECIFIED,,0.0,19002521.0,,,,,,,,,Registrant,,,07/03/2019,8:00,,,40.68446,-73.806404,"(40.68446, -73.806404)",VAN WYCK EXPWY                  ,,,0.0,0.0,0,0,0,0,0,0,Unspecified,Unspecified,,,,Station Wagon/Sport Utility Vehicle,Taxi,,,,2019-07-03 08:00:00
13015173,4729713,8cf6fc8b-d677-47bc-a1a4-cbbc0e206162,OCCUPANT,INJURED,M,12.0,20671152.0,Not Ejected,Conscious,Entire Body,"Front passenger, if two or more persons, including the driver, are in the front seat",Lap Belt & Harness,,,Complaint of Pain or Nausea,Passenger,,,05/31/2024,9:37,,,40.697903,-73.7271,"(40.697903, -73.7271)",CROSS ISLAND PARKWAY,,,3.0,0.0,0,0,0,0,3,0,Unsafe Speed,Unspecified,,,,Station Wagon/Sport Utility Vehicle,Station Wagon/Sport Utility Vehicle,,,,2024-05-31 09:37:00
7133275,3730946,c538cffc-8568-487a-8717-db09666f39f6,OCCUPANT,UNSPECIFIED,F,22.0,17604991.0,Not Ejected,Does Not Apply,Does Not Apply,"Middle front seat, or passenger lying across a seat",Lap Belt,,,Does Not Apply,Passenger,,,08/14/2017,11:20,MANHATTAN,10034.0,40.869034,-73.91728,"(40.869034, -73.91728)",,,5030      BROADWAY                      ,0.0,0.0,0,0,0,0,0,0,Passing Too Closely,Unspecified,,,,Station Wagon/Sport Utility Vehicle,Station Wagon/Sport Utility Vehicle,,,,2017-08-14 11:20:00
11065070,3864645,c70a5954-23d6-4ac1-8db9-d62d6b30a59d,OCCUPANT,UNSPECIFIED,,0.0,19561297.0,,,,,,,,,Registrant,,,03/17/2018,13:15,,,40.714527,-73.97481,"(40.714527, -73.97481)",WILLIAMSBURG BRIDGE OUTER ROADWA,,,0.0,0.0,0,0,0,0,0,0,Driver Inattention/Distraction,Unsafe Lane Changing,,,,Sedan,Sedan,,,,2018-03-17 13:15:00
6614981,3526385,2078371,OCCUPANT,UNSPECIFIED,M,28.0,17356416.0,,,,,,,,,Registrant,,,09/24/2016,18:10,QUEENS,11365.0,40.739616,-73.78612,"(40.739616, -73.78612)",,,61-26     188 STREET                    ,0.0,0.0,0,0,0,0,0,0,Unspecified,Unspecified,,,,Sedan,Sedan,,,,2016-09-24 18:10:00
10308857,4243103,eb22e226-b4b0-4fdb-a361-7cec31bdb55a,OCCUPANT,UNSPECIFIED,M,52.0,19171048.0,Not Ejected,Does Not Apply,Does Not Apply,Driver,Lap Belt,,,Does Not Apply,Driver,,,11/15/2019,19:45,QUEENS,11377.0,40.75428,-73.89751,"(40.75428, -73.89751)",NORTHERN BOULEVARD              ,69 STREET,,0.0,0.0,0,0,0,0,0,0,Driver Inattention/Distraction,Driver Inattention/Distraction,,,,Station Wagon/Sport Utility Vehicle,Taxi,,,,2019-11-15 19:45:00
7195946,3726014,273d631c-308d-4751-89c7-5f5f890eb75b,OCCUPANT,UNSPECIFIED,M,35.0,17635164.0,Not Ejected,Does Not Apply,Does Not Apply,Driver,Lap Belt & Harness,,,Does Not Apply,Driver,,,08/04/2017,13:59,BROOKLYN,11229.0,40.61191,-73.94493,"(40.61191, -73.94493)",,,2901      AVENUE P                      ,1.0,0.0,0,0,1,0,0,0,Unspecified,Unspecified,,,,Station Wagon/Sport Utility Vehicle,Bike,,,,2017-08-04 13:59:00
9817830,4130785,f9e68c36-d0e5-407f-8d29-5efb177565dd,OCCUPANT,UNSPECIFIED,F,54.0,18926003.0,Not Ejected,Does Not Apply,Does Not Apply,Driver,Lap Belt & Harness,,,Does Not Apply,Driver,,,05/09/2019,14:30,,,40.807095,-73.945984,"(40.807095, -73.945984)",WEST 124 STREET                 ,,,0.0,0.0,0,0,0,0,0,0,Driver Inattention/Distraction,Driver Inattention/Distraction,,,,Station Wagon/Sport Utility Vehicle,Bus,,,,2019-05-09 14:30:00
12747184,4664901,9e805005-137d-405d-94ba-b7b119dd00ba,OCCUPANT,UNSPECIFIED,,,20519544.0,,,,,,,,,Registrant,,,09/23/2023,13:22,BROOKLYN,11223.0,40.596745,-73.982376,"(40.596745, -73.982376)",,,2072      WEST 11 STREET,0.0,0.0,0,0,0,0,0,0,Unspecified,,,,,Sedan,,,,,2023-09-23 13:22:00
6888516,3689133,fb6fc8d5-15e3-4eb2-a28b-26bd533f0627,OCCUPANT,UNSPECIFIED,M,37.0,17487841.0,Not Ejected,Does Not Apply,Does Not Apply,Right rear passenger or motorcycle sidecar passenger,,,,Does Not Apply,Passenger,,,06/12/2017,11:08,,,40.820145,-73.890656,"(40.820145, -73.890656)",BRUCKNER EXPRESSWAY             ,,,0.0,0.0,0,0,0,0,0,0,Following Too Closely,Unspecified,,,,Station Wagon/Sport Utility Vehicle,Station Wagon/Sport Utility Vehicle,,,,2017-06-12 11:08:00
6915885,3655080,e628509f-805e-47a5-90aa-c432b56ee743,OCCUPANT,UNSPECIFIED,M,38.0,17500984.0,Not Ejected,Does Not Apply,Does Not Apply,Driver,Lap Belt & Harness,,,Does Not Apply,Driver,,,04/21/2017,11:00,,,40.60701,-74.163956,"(40.60701, -74.163956)",,,3130      VICTORY BOULEVARD             ,0.0,0.0,0,0,0,0,0,0,Driver Inattention/Distraction,Unspecified,Unspecified,Unspecified,,Sedan,Station Wagon/Sport Utility Vehicle,Station Wagon/Sport Utility Vehicle,Bus,,2017-04-21 11:00:00
10155753,4208459,3a74d62e-5a25-4d3b-89d1-d8ddbc0d2c21,OCCUPANT,UNSPECIFIED,M,18.0,19094491.0,Not Ejected,Does Not Apply,Does Not Apply,"Front passenger, if two or more persons, including the driver, are in the front seat",Lap Belt & Harness,,,Does Not Apply,Passenger,,,09/18/2019,19:01,,,,,,99 STREET                       ,HARDING EXPRESSWAY,,0.0,0.0,0,0,0,0,0,0,Passing Too Closely,Unspecified,,,,Sedan,Pick-up Truck,,,,2019-09-18 19:01:00
13173518,4749538,ddc024a6-10bf-4786-baf6-01bff7ccff92,OCCUPANT,UNSPECIFIED,M,32.0,20763331.0,Not Ejected,Does Not Apply,Does Not Apply,Driver,Lap Belt & Harness,,,Does Not Apply,Driver,,,08/20/2024,16:52,QUEENS,11358.0,40.760094,-73.79837,"(40.760094, -73.79837)",168 STREET,41 AVENUE,,0.0,0.0,0,0,0,0,0,0,Failure to Yield Right-of-Way,Unspecified,Unspecified,,,Station Wagon/Sport Utility Vehicle,Station Wagon/Sport Utility Vehicle,Sedan,,,2024-08-20 16:52:00
6990816,3674242,0d3c0a59-7ed5-471a-98bc-396e30d55960,OCCUPANT,UNSPECIFIED,F,35.0,17536925.0,,,,,,,,,Registrant,,,05/20/2017,11:40,,,40.58407,-73.92344,"(40.58407, -73.92344)",BELT PARKWAY                    ,,,0.0,0.0,0,0,0,0,0,0,Driver Inattention/Distraction,Unspecified,,,,Sedan,Station Wagon/Sport Utility Vehicle,,,,2017-05-20 11:40:00
9070342,3941562,80c57a21-c953-453c-ba20-a484ff7da6c8,OCCUPANT,UNSPECIFIED,M,29.0,18557350.0,Not Ejected,Does Not Apply,Does Not Apply,Driver,Lap Belt,,,Does Not Apply,Driver,,,07/13/2018,10:15,MANHATTAN,10026.0,40.80601,-73.955124,"(40.80601, -73.955124)",,,318       WEST 118 STREET               ,0.0,0.0,0,0,0,0,0,0,Passing Too Closely,Unspecified,,,,Carry All,Pick-up Truck,,,,2018-07-13 10:15:00
9445727,3941912,6b693859-d4ca-4955-8f1e-d1fdb78cc071,OCCUPANT,UNSPECIFIED,M,76.0,18741904.0,Not Ejected,Does Not Apply,Does Not Apply,Driver,Lap Belt & Harness,,,Does Not Apply,Driver,,,07/15/2018,17:30,,,40.75548,-73.74173,"(40.75548, -73.74173)",LONG ISLAND EXPRESSWAY          ,,,0.0,0.0,0,0,0,0,0,0,Following Too Closely,Unspecified,,,,Station Wagon/Sport Utility Vehicle,Sedan,,,,2018-07-15 17:30:00
7285063,3824541,d2370dfc-2ab5-4987-a3ab-d2d0ba8078bb,OCCUPANT,UNSPECIFIED,,0.0,17678384.0,,,,,,,,,Registrant,,,01/08/2018,9:50,,,40.788883,-73.97786,"(40.788883, -73.97786)",WEST 86 STREET                  ,,,0.0,0.0,0,0,0,0,0,0,Unsafe Lane Changing,Unspecified,,,,Taxi,Van,,,,2018-01-08 09:50:00
9222406,3910096,475cc6eb-48d5-4b90-a0f8-c12426ddb886,OCCUPANT,UNSPECIFIED,M,67.0,18632439.0,Not Ejected,Does Not Apply,Does Not Apply,Driver,Lap Belt,,,Does Not Apply,Driver,,,05/29/2018,13:45,BROOKLYN,11204.0,40.607765,-73.98255,"(40.607765, -73.98255)",AVENUE P                        ,WEST 9 STREET,,0.0,0.0,0,0,0,0,0,0,Driver Inattention/Distraction,Unspecified,,,,Sedan,Station Wagon/Sport Utility Vehicle,,,,2018-05-29 13:45:00
10072388,4180301,0765ec73-129a-4b2d-8850-fa814009d08d,OCCUPANT,UNSPECIFIED,M,31.0,19052367.0,,,,,,,,,Registrant,,,07/30/2019,17:00,,,40.640274,-73.99025,"(40.640274, -73.99025)",,,12 AVENUE                               ,0.0,0.0,0,0,0,0,0,0,Accelerator Defective,Unspecified,,,,Sedan,Sedan,,,,2019-07-30 17:00:00
11064789,4299083,bf0e2a98-2741-4dc8-a452-18d8b334c846,OCCUPANT,UNSPECIFIED,F,43.0,19561152.0,Not Ejected,Does Not Apply,Does Not Apply,"Front passenger, if two or more persons, including the driver, are in the front seat",Lap Belt & Harness,,,Does Not Apply,Passenger,,,03/09/2020,11:29,STATEN ISLAND,10310.0,40.633858,-74.12596,"(40.633858, -74.12596)",CASTLETON AVENUE                ,CLOVE ROAD,,1.0,0.0,0,0,0,0,1,0,Backing Unsafely,Unspecified,,,,Sedan,Sedan,,,,2020-03-09 11:29:00
12458593,4590314,3fc16475-7bc2-4d45-a214-87e60981e066,OCCUPANT,UNSPECIFIED,F,49.0,20355537.0,Not Ejected,Does Not Apply,Does Not Apply,Driver,Unknown,,,Does Not Apply,Driver,,,12/16/2022,2:35,,,40.68949,-73.92207,"(40.68949, -73.92207)",GATES AVENUE,,,0.0,0.0,0,0,0,0,0,0,Passing or Lane Usage Improper,Other Vehicular,,,,Station Wagon/Sport Utility Vehicle,Station Wagon/Sport Utility Vehicle,,,,2022-12-16 02:35:00
13371900,4814368,60cbe612-4874-46bb-a1c9-d6f7220914e6,OCCUPANT,UNSPECIFIED,M,37.0,20876210.0,Not Ejected,Does Not Apply,Does Not Apply,Driver,Unknown,,,Does Not Apply,Driver,,,05/21/2025,8:08,MANHATTAN,10016.0,40.738167,-73.97541,"(40.738167, -73.97541)",,,435       E 26 ST,0.0,0.0,0,0,0,0,0,0,Unspecified,Unspecified,,,,,,,,,2025-05-21 08:08:00
9736576,4014861,e2109fb1-d7c7-46c4-8841-f2314325a85c,OCCUPANT,UNSPECIFIED,F,78.0,18886079.0,,,,,,,,,Registrant,,,11/05/2018,12:00,QUEENS,11354.0,40.765266,-73.81517,"(40.765266, -73.81517)",150 STREET                      ,NORTHERN BOULEVARD,,0.0,0.0,0,0,0,0,0,0,Following Too Closely,Unspecified,,,,Convertible,Station Wagon/Sport Utility Vehicle,,,,2018-11-05 12:00:00
7136088,3736797,0bea1363-396b-40d6-b2d9-97fd2312c3d2,OCCUPANT,UNSPECIFIED,M,11.0,17606360.0,Not Ejected,Does Not Apply,Does Not Apply,"Left rear passenger, or rear passenger on a bicycle, motorcycle, snowmobile",Lap Belt,,,Does Not Apply,Passenger,,,08/24/2017,13:00,BRONX,10459.0,40.82244,-73.8859,"(40.82244, -73.8859)",BRUCKNER BOULEVARD              ,WHITTIER STREET,,1.0,0.0,0,0,0,0,1,0,Unspecified,Unspecified,,,,Sedan,Taxi,,,,2017-08-24 13:00:00
7360671,3844034,7ca93e93-e62f-454c-9bea-872eeea21f69,OCCUPANT,UNSPECIFIED,F,25.0,17715627.0,Not Ejected,Does Not Apply,Does Not Apply,"Front passenger, if two or more persons, including the driver, are in the front seat",Lap Belt & Harness,,,Does Not Apply,Passenger,,,02/11/2018,21:25,,,40.695004,-73.9525,"(40.695004, -73.9525)",MYRTLE AVENUE                   ,,,1.0,0.0,0,0,0,0,1,0,Driver Inattention/Distraction,Unspecified,,,,Sedan,Sedan,,,,2018-02-11 21:25:00
6504676,3514995,1860979,OCCUPANT,UNSPECIFIED,M,33.0,17303800.0,Not Ejected,Does Not Apply,Does Not Apply,Driver,Lap Belt & Harness,,,Does Not Apply,Driver,,,09/06/2016,23:30,QUEENS,11375.0,40.738335,-73.84991,"(40.738335, -73.84991)",HORACE HARDING EXPRESSWAY       ,WALDRON STREET,,1.0,0.0,0,0,0,0,1,0,Other Vehicular,Passing or Lane Usage Improper,,,,Sedan,Station Wagon/Sport Utility Vehicle,,,,2016-09-06 23:30:00
12985878,4726777,f5f74910-7d3e-4e8e-9f83-1d876239bb42,OCCUPANT,UNSPECIFIED,M,60.0,20654827.0,Not Ejected,Does Not Apply,Does Not Apply,Driver,Lap Belt,,,Does Not Apply,Driver,,,05/21/2024,7:08,BRONX,10454.0,40.81009,-73.925224,"(40.81009, -73.925224)",,,295       EAST 138 STREET,1.0,0.0,0,0,1,0,0,0,Unspecified,Unspecified,,,,Station Wagon/Sport Utility Vehicle,Bike,,,,2024-05-21 07:08:00
8981190,4069623,2d8e432b-c293-4172-bb7e-1c46a7c6804a,OCCUPANT,UNSPECIFIED,,,18513344.0,,,,,,,,,Registrant,,,01/23/2019,11:49,MANHATTAN,10010.0,40.738903,-73.98731,"(40.738903, -73.98731)",PARK AVENUE SOUTH               ,EAST 21 STREET,,0.0,0.0,0,0,0,0,0,0,Following Too Closely,Unspecified,,,,Convertible,Taxi,,,,2019-01-23 11:49:00
7172010,3712126,17ff1367-01be-4975-ac62-8ced59a5db33,OCCUPANT,UNSPECIFIED,M,24.0,17623642.0,Not Ejected,Does Not Apply,Does Not Apply,Driver,Lap Belt & Harness,,,Does Not Apply,Driver,,,07/14/2017,18:30,,,,,,ROOSEVELT AVENUE                ,GRAND CENTRAL PARKWAY,,0.0,0.0,0,0,0,0,0,0,Driver Inattention/Distraction,Driver Inattention/Distraction,,,,Sedan,Sedan,,,,2017-07-14 18:30:00
13292988,4793880,3ed03f07-0fb1-4c12-9b12-92e60586a465,OCCUPANT,UNSPECIFIED,M,,20831252.0,,,,,,,,,Registrant,,,02/18/2025,16:28,QUEENS,11385.0,40.69546,-73.90333,"(40.69546, -73.90333)",,,1035      WYCKOFF AVE,0.0,0.0,0,0,0,0,0,0,Unspecified,,,,,Station Wagon/Sport Utility Vehicle,,,,,2025-02-18 16:28:00
12831986,4687106,95b57043-ea2a-4863-ae70-652c060ec594,OCCUPANT,UNSPECIFIED,M,40.0,20567601.0,Not Ejected,Does Not Apply,Does Not Apply,Driver,Lap Belt & Harness,,,Does Not Apply,Driver,,,12/14/2023,9:51,BROOKLYN,11234.0,40.607876,-73.92554,"(40.607876, -73.92554)",AVENUE U,RYDER STREET,,0.0,0.0,0,0,0,0,0,0,Driver Inattention/Distraction,Driver Inattention/Distraction,,,,Station Wagon/Sport Utility Vehicle,Station Wagon/Sport Utility Vehicle,,,,2023-12-14 09:51:00
6132498,3620991,c4fc493c-0848-45df-9a54-291fd4ce058c,OCCUPANT,UNSPECIFIED,F,5.0,17127990.0,Not Ejected,Does Not Apply,Does Not Apply,"Left rear passenger, or rear passenger on a bicycle, motorcycle, snowmobile",Lap Belt & Harness,,,Does Not Apply,Passenger,,,02/18/2017,15:10,QUEENS,11368.0,40.75482,-73.84499,"(40.75482, -73.84499)",,,123-01    ROOSEVELT AVENUE              ,0.0,0.0,0,0,0,0,0,0,Turning Improperly,Unspecified,,,,Station Wagon/Sport Utility Vehicle,Station Wagon/Sport Utility Vehicle,,,,2017-02-18 15:10:00
12649117,4639607,ee059bfd-1e2d-4148-8072-f4aa63128089,OCCUPANT,UNSPECIFIED,M,,20463439.0,,,,,,,,,Registrant,,,06/20/2023,12:30,,,40.692024,-73.9818,"(40.692024, -73.9818)",WILLOUGHBY STREET,,,0.0,0.0,0,0,0,0,0,0,Passing or Lane Usage Improper,Unspecified,,,,Sedan,Station Wagon/Sport Utility Vehicle,,,,2023-06-20 12:30:00
10187744,4215529,04dfb60c-1659-44a7-ba65-480b5af6c2e0,OCCUPANT,UNSPECIFIED,M,53.0,19110529.0,Not Ejected,Does Not Apply,Does Not Apply,Driver,Unknown,,,Does Not Apply,Driver,,,09/30/2019,16:38,,,40.75896,-73.82985,"(40.75896, -73.82985)",40 ROAD                         ,,,0.0,0.0,0,0,0,0,0,0,Passing Too Closely,Failure to Yield Right-of-Way,,,,Sedan,Box Truck,,,,2019-09-30 16:38:00
10105073,4196169,55223b97-4b69-4a93-9fa0-b2da909cc346,OCCUPANT,UNSPECIFIED,M,89.0,19068878.0,Not Ejected,Does Not Apply,Does Not Apply,Driver,Lap Belt & Harness,,,Does Not Apply,Driver,,,08/28/2019,11:34,BRONX,10465.0,40.816402,-73.81409,"(40.816402, -73.81409)",HOLLYWOOD AVENUE                ,HARDING AVENUE,,2.0,0.0,0,0,0,0,2,0,Unspecified,Unspecified,,,,Sedan,Sedan,,,,2019-08-28 11:34:00
7589245,3894968,2ed17f5c-ea61-41b8-b6e4-fdf69b222e5a,OCCUPANT,UNSPECIFIED,M,51.0,17827894.0,,,,,,,,,Registrant,,,05/05/2018,21:05,QUEENS,11372.0,40.75208,-73.881905,"(40.75208, -73.881905)",35 AVENUE                       ,85 STREET,,1.0,0.0,0,0,0,0,1,0,Driver Inattention/Distraction,Unspecified,,,,Bus,Sedan,,,,2018-05-05 21:05:00
7861318,3820697,b18d3d65-b355-48e9-9cef-6a97cb5594a5,OCCUPANT,UNSPECIFIED,F,33.0,17960597.0,Not Ejected,Does Not Apply,Does Not Apply,"Left rear passenger, or rear passenger on a bicycle, motorcycle, snowmobile",Lap Belt,,,Does Not Apply,Passenger,,,12/30/2017,18:55,BROOKLYN,11206.0,40.71147,-73.9439,"(40.71147, -73.9439)",,,265       GRAHAM AVENUE                 ,0.0,0.0,0,0,0,0,0,0,View Obstructed/Limited,Unspecified,,,,Station Wagon/Sport Utility Vehicle,Pick-up Truck,,,,2017-12-30 18:55:00
9799561,4125811,943182cf-5a7f-4aaf-b612-865c417a948b,OCCUPANT,UNSPECIFIED,F,15.0,18917025.0,Not Ejected,Does Not Apply,Does Not Apply,"Left rear passenger, or rear passenger on a bicycle, motorcycle, snowmobile",Lap Belt & Harness,,,Does Not Apply,Passenger,,,05/04/2019,22:00,BROOKLYN,11233.0,40.676647,-73.91647,"(40.676647, -73.91647)",SARATOGA AVENUE                 ,ATLANTIC AVENUE,,0.0,0.0,0,0,0,0,0,0,Turning Improperly,Unspecified,,,,Sedan,Sedan,,,,2019-05-04 22:00:00
11144936,4306090,a32980b6-2c2e-44df-b6b1-2e5a9204e1a4,OCCUPANT,UNSPECIFIED,F,32.0,19603463.0,Not Ejected,Does Not Apply,Does Not Apply,Driver,Lap Belt & Harness,,,Does Not Apply,Driver,,,03/08/2020,13:30,,,40.770428,-73.92364,"(40.770428, -73.92364)",CRESCENT STREET                 ,,,0.0,0.0,0,0,0,0,0,0,Backing Unsafely,Driver Inattention/Distraction,,,,Station Wagon/Sport Utility Vehicle,Sedan,,,,2020-03-08 13:30:00
11171852,3906541,9000f704-c033-4f88-a4ac-8b02bba077d1,OCCUPANT,UNSPECIFIED,M,54.0,19618142.0,,,,,,,,,Registrant,,,05/23/2018,10:50,BROOKLYN,11235.0,40.590633,-73.94976,"(40.590633, -73.94976)",OCEAN AVENUE                    ,AVENUE Y,,0.0,0.0,0,0,0,0,0,0,Reaction to Uninvolved Vehicle,Unspecified,,,,Station Wagon/Sport Utility Vehicle,Sedan,,,,2018-05-23 10:50:00
5770779,3419356,359786,OCCUPANT,UNSPECIFIED,M,44.0,16955754.0,,,,,,,,,Registrant,,,04/13/2016,15:00,,,,,,BROOKLYN QUEENS EXPRESSWAY      ,,,0.0,0.0,0,0,0,0,0,0,Unspecified,Unspecified,,,,Station Wagon/Sport Utility Vehicle,2 dr sedan,,,,2016-04-13 15:00:00
9462189,3946278,e60017bd-cabe-42af-9b6d-bf3873671078,OCCUPANT,UNSPECIFIED,F,24.0,18750047.0,Not Ejected,Does Not Apply,Does Not Apply,"Front passenger, if two or more persons, including the driver, are in the front seat",Lap Belt & Harness,,,Does Not Apply,Passenger,,,07/22/2018,14:00,,,40.66645,-73.75764,"(40.66645, -73.75764)",SPRINGFIELD BOULEVARD           ,,,0.0,0.0,0,0,0,0,0,0,Other Vehicular,Unspecified,,,,Sedan,Sedan,,,,2018-07-22 14:00:00
12208776,4525186,60ef7983-e265-4fd9-ae25-ddff87b27f9d,OCCUPANT,UNSPECIFIED,M,30.0,20212440.0,,,,,,,,,Registrant,,,05/06/2022,8:39,MANHATTAN,10065.0,40.763363,-73.95925,"(40.763363, -73.95925)",EAST 65 STREET,1 AVENUE,,0.0,0.0,0,0,0,0,0,0,Passing or Lane Usage Improper,Unspecified,Unspecified,,,Taxi,Sedan,Sedan,,,2022-05-06 08:39:00
9938939,4158025,99f33e08-601c-4aa3-899e-df58ae847f2d,OCCUPANT,UNSPECIFIED,M,32.0,18985781.0,Not Ejected,Does Not Apply,Does Not Apply,Right rear passenger or motorcycle sidecar passenger,Lap Belt & Harness,,,Does Not Apply,Passenger,,,06/24/2019,15:50,BRONX,10457.0,40.84869,-73.90329,"(40.84869, -73.90329)",EAST TREMONT AVENUE             ,ANTHONY AVENUE,,0.0,0.0,0,0,0,0,0,0,Unspecified,Unspecified,,,,Station Wagon/Sport Utility Vehicle,Station Wagon/Sport Utility Vehicle,,,,2019-06-24 15:50:00
12128176,4504329,600ff561-5dfd-4b7f-8cae-6d1ba47b1903,OCCUPANT,UNSPECIFIED,M,70.0,20166159.0,,,,,,,,,Registrant,,,02/18/2022,21:06,QUEENS,11420.0,40.672394,-73.811615,"(40.672394, -73.811615)",,,130-36    127 STREET,0.0,0.0,0,0,0,0,0,0,Failure to Yield Right-of-Way,Unspecified,,,,Sedan,Station Wagon/Sport Utility Vehicle,,,,2022-02-18 21:06:00
11074319,4287959,80f4da23-1abe-41f1-a261-4911c331295f,OCCUPANT,UNSPECIFIED,F,48.0,19566135.0,,,,,,,,,Registrant,,,02/13/2020,14:00,,,40.603096,-73.938545,"(40.603096, -73.938545)",AVENUE T                        ,,,2.0,0.0,0,0,0,0,2,0,Unspecified,Unspecified,,,,Station Wagon/Sport Utility Vehicle,Station Wagon/Sport Utility Vehicle,,,,2020-02-13 14:00:00
9775769,4119906,868d3def-a0e9-442e-94c9-0d258ca8494a,OCCUPANT,UNSPECIFIED,M,0.0,18905315.0,,,,,,,,,Registrant,,,04/23/2019,17:30,BRONX,10475.0,40.877476,-73.83661,"(40.877476, -73.83661)",BAYCHESTER AVENUE               ,GIVAN AVENUE,,0.0,0.0,0,0,0,0,0,0,Unspecified,Unspecified,,,,Sedan,Sedan,,,,2019-04-23 17:30:00
7496207,3857907,4af0585c-ab1f-40e1-b1e0-d130dfe0f849,OCCUPANT,UNSPECIFIED,M,61.0,17782213.0,Not Ejected,Does Not Apply,Does Not Apply,Driver,Lap Belt & Harness,,,Does Not Apply,Driver,,,03/06/2018,20:53,,,40.66691,-73.839066,"(40.66691, -73.839066)",BELT PARKWAY                    ,,,0.0,0.0,0,0,0,0,0,0,Unsafe Lane Changing,Unspecified,,,,Sedan,Sedan,,,,2018-03-06 20:53:00
9934497,4156521,743cb7a5-98f2-4928-a786-e18c27243db7,OCCUPANT,UNSPECIFIED,M,36.0,18983585.0,Not Ejected,Does Not Apply,Does Not Apply,Driver,Lap Belt & Harness,,,Does Not Apply,Driver,,,06/22/2019,23:30,QUEENS,11422.0,40.665257,-73.735344,"(40.665257, -73.735344)",SOUTH CONDUIT AVENUE            ,FRANCIS LEWIS BOULEVARD,,0.0,0.0,0,0,0,0,0,0,Driver Inattention/Distraction,Driver Inattention/Distraction,,,,Sedan,Sedan,,,,2019-06-22 23:30:00
9391605,3948097,4da30bba-d57c-42e6-8e26-a07f29ab35ef,OCCUPANT,UNSPECIFIED,M,27.0,18715421.0,Not Ejected,Does Not Apply,Does Not Apply,"Front passenger, if two or more persons, including the driver, are in the front seat",Lap Belt,,,Does Not Apply,Passenger,,,07/23/2018,21:30,QUEENS,11372.0,40.74662,-73.89359,"(40.74662, -73.89359)",ROOSEVELT AVENUE                ,72 STREET,,0.0,0.0,0,0,0,0,0,0,Driver Inattention/Distraction,Passing Too Closely,,,,Station Wagon/Sport Utility Vehicle,Station Wagon/Sport Utility Vehicle,,,,2018-07-23 21:30:00
5921716,3454145,820003,OCCUPANT,UNSPECIFIED,,,17027837.0,,,,,,,,,Registrant,,,05/28/2016,16:20,,,,,,grand central parkway           ,,,0.0,0.0,0,0,0,0,0,0,Driver Inattention/Distraction,Unspecified,,,,Station Wagon/Sport Utility Vehicle,Station Wagon/Sport Utility Vehicle,,,,2016-05-28 16:20:00
6312417,3476822,1181683,OCCUPANT,UNSPECIFIED,F,30.0,17212810.0,,,,,,,,,Registrant,,,07/09/2016,14:50,QUEENS,11374.0,40.73018,-73.86246,"(40.73018, -73.86246)",,,96-05     QUEENS BOULEVARD              ,0.0,0.0,0,0,0,0,0,0,Failure to Yield Right-of-Way,Failure to Yield Right-of-Way,,,,Station Wagon/Sport Utility Vehicle,4 dr sedan,,,,2016-07-09 14:50:00
12320467,4554376,3e3df373-bdca-485f-b3e9-fe2e516cfa50,OCCUPANT,UNSPECIFIED,M,29.0,20276481.0,Not Ejected,Does Not Apply,Does Not Apply,Driver,Lap Belt,,,Does Not Apply,Driver,,,08/05/2022,21:49,MANHATTAN,10032.0,40.84394,-73.93903,"(40.84394, -73.93903)",WEST 172 STREET,BROADWAY,,0.0,0.0,0,0,0,0,0,0,Unspecified,,,,,Sedan,,,,,2022-08-05 21:49:00
9951147,4164618,3243d9a3-09b2-4848-8319-b56d10becb5c,OCCUPANT,UNSPECIFIED,F,41.0,18991910.0,Not Ejected,Does Not Apply,Does Not Apply,"Left rear passenger, or rear passenger on a bicycle, motorcycle, snowmobile",Lap Belt,,,Does Not Apply,Passenger,,,07/03/2019,20:55,QUEENS,11691.0,40.595932,-73.75963,"(40.595932, -73.75963)",SEAGIRT BOULEVARD               ,BEACH 26 STREET,,0.0,0.0,0,0,0,0,0,0,Failure to Yield Right-of-Way,Unspecified,,,,Motorcycle,Sedan,,,,2019-07-03 20:55:00
13438280,4831959,d602374b-0362-4a31-8564-19267bc697cf,OCCUPANT,UNSPECIFIED,F,47.0,20914597.0,,,,,,,,,Registrant,,,07/30/2025,19:23,QUEENS,11385.0,40.706715,-73.855995,"(40.706715, -73.855995)",,,89-89     UNION TPKE,3.0,0.0,0,0,0,0,3,0,Driver Inattention/Distraction,Other Vehicular,,,,Sedan,Sedan,,,,2025-07-30 19:23:00
8956280,4057268,007c1d7e-ccf3-4d6d-bc94-3a22fb93b1b3,BICYCLIST,INJURED,M,17.0,18500796.0,Partially Ejected,Conscious,Knee-Lower Leg Foot,Driver,,,,Complaint of Pain or Nausea,Driver,,,01/18/2019,21:12,BROOKLYN,11205.0,40.691643,-73.96754,"(40.691643, -73.96754)",WAVERLY AVENUE                  ,WILLOUGHBY AVENUE,,1.0,0.0,0,0,1,0,0,0,Failure to Yield Right-of-Way,Unspecified,,,,Station Wagon/Sport Utility Vehicle,Bike,,,,2019-01-18 21:12:00
11386500,4341062,7e86f2af-0090-4d9a-86a1-ecf8b8c95e34,OCCUPANT,UNSPECIFIED,M,21.0,19734057.0,Not Ejected,Does Not Apply,Does Not Apply,Driver,Unknown,,,Does Not Apply,Driver,,,08/20/2020,19:29,,,40.812813,-73.94181,"(40.812813, -73.94181)",LENOX AVENUE                    ,,,0.0,0.0,0,0,0,0,0,0,Other Vehicular,Unsafe Speed,,,,Sedan,E-Bike,,,,2020-08-20 19:29:00
6470477,3516993,1907184,OCCUPANT,UNSPECIFIED,M,33.0,17287428.0,Not Ejected,Does Not Apply,Does Not Apply,Driver,Lap Belt & Harness,,,Does Not Apply,Driver,,,09/10/2016,22:15,,,40.63562,-74.01135,"(40.63562, -74.01135)",61 STREET                       ,,,0.0,0.0,0,0,0,0,0,0,Unspecified,Unspecified,,,,Station Wagon/Sport Utility Vehicle,Station Wagon/Sport Utility Vehicle,,,,2016-09-10 22:15:00
7484353,3850715,2fc2c162-e04d-40ae-b9aa-1ad49b443b4f,OCCUPANT,UNSPECIFIED,M,42.0,17776336.0,Not Ejected,Does Not Apply,Does Not Apply,Driver,Lap Belt & Harness,,,Does Not Apply,Driver,,,02/21/2018,20:45,QUEENS,11101.0,40.739998,-73.94761,"(40.739998, -73.94761)",BORDEN AVENUE                   ,23 STREET,,0.0,0.0,0,0,0,0,0,0,Driver Inattention/Distraction,Unspecified,,,,Station Wagon/Sport Utility Vehicle,Tractor Truck Diesel,,,,2018-02-21 20:45:00
9923970,4153885,c6b70ccd-46d9-46cc-ba6a-02813e8edf40,OCCUPANT,UNSPECIFIED,M,30.0,18978394.0,Not Ejected,Does Not Apply,Does Not Apply,Driver,Harness,,,Does Not Apply,Driver,,,06/17/2019,12:00,,,40.677834,-73.88509,"(40.677834, -73.88509)",ATLANTIC AVENUE                 ,CLEVELAND STREET,,0.0,0.0,0,0,0,0,0,0,Oversized Vehicle,Unspecified,,,,Station Wagon/Sport Utility Vehicle,Station Wagon/Sport Utility Vehicle,,,,2019-06-17 12:00:00
13402434,4822301,0d20f9be-1288-48a1-8b14-e10ae76e91bd,OCCUPANT,INJURED,F,42.0,20893509.0,Not Ejected,Conscious,Neck,Driver,Lap Belt,,,Complaint of Pain or Nausea,Driver,,,06/20/2025,13:17,BRONX,10466.0,40.894314,-73.86026,"(40.894314, -73.86026)",E 233 ST,CARPENTER AVE,,1.0,0.0,0,0,0,0,1,0,Traffic Control Disregarded,Unspecified,,,,AMBULANCE,Station Wagon/Sport Utility Vehicle,,,,2025-06-20 13:17:00
5830242,3426593,365708,OCCUPANT,UNSPECIFIED,M,45.0,16984937.0,,,,,,,,,Registrant,,,04/14/2016,11:55,QUEENS,11355.0,,,,41 AVENUE                       ,UNION STREET,,0.0,0.0,0,0,0,0,0,0,Passing Too Closely,Unspecified,,,,Station Wagon/Sport Utility Vehicle,Box Truck,,,,2016-04-14 11:55:00
13031987,4738365,f19bdf93-931e-4b17-8f60-12c01eb45766,OCCUPANT,UNSPECIFIED,M,64.0,20680846.0,Not Ejected,Does Not Apply,Does Not Apply,Driver,Lap Belt & Harness,,,Does Not Apply,Driver,,,07/03/2024,14:47,,,40.74285,-73.830284,"(40.74285, -73.830284)",LONG ISLAND EXPRESSWAY,,,3.0,0.0,0,0,0,0,3,0,Following Too Closely,Unspecified,,,,Station Wagon/Sport Utility Vehicle,Tractor Truck Diesel,,,,2024-07-03 14:47:00
7778350,3765352,30ee5822-a546-4419-9d6d-bc27e9ef17b4,OCCUPANT,UNSPECIFIED,M,59.0,17920073.0,,,,,,,,,Registrant,,,10/07/2017,5:03,,,40.809048,-73.92856,"(40.809048, -73.92856)",EAST 135 STREET                 ,,,0.0,0.0,0,0,0,0,0,0,Driver Inattention/Distraction,Unspecified,,,,Sedan,Sedan,,,,2017-10-07 05:03:00
9131615,3927246,33481c3f-f880-4148-9903-98bbb492877c,OCCUPANT,UNSPECIFIED,F,31.0,18587702.0,Not Ejected,Does Not Apply,Does Not Apply,Driver,Lap Belt & Harness,,,Does Not Apply,Driver,,,06/23/2018,19:50,BROOKLYN,11205.0,40.693966,-73.96151,"(40.693966, -73.96151)",,,569       MYRTLE AVENUE                 ,0.0,0.0,0,0,0,0,0,0,View Obstructed/Limited,,,,,Box Truck,,,,,2018-06-23 19:50:00
11047098,4286116,2266ca73-dbed-46a4-be37-100938f71d6c,OCCUPANT,UNSPECIFIED,M,48.0,19552056.0,Not Ejected,Does Not Apply,Does Not Apply,Driver,Lap Belt & Harness,,,Does Not Apply,Driver,,,02/10/2020,1:10,MANHATTAN,10020.0,40.75927,-73.980896,"(40.75927, -73.980896)",AVENUE OF THE AMERICAS          ,WEST 49 STREET,,0.0,0.0,0,0,0,0,0,0,Driver Inattention/Distraction,Driver Inattention/Distraction,,,,Taxi,Taxi,,,,2020-02-10 01:10:00
6268132,3544316,2390889,OCCUPANT,UNSPECIFIED,F,37.0,17192057.0,,,,,,,,,Registrant,,,10/20/2016,8:24,BROOKLYN,11233.0,40.684032,-73.91742,"(40.684032, -73.91742)",SARATOGA AVENUE                 ,MACDONOUGH STREET,,0.0,0.0,0,0,0,0,0,0,Failure to Yield Right-of-Way,Failure to Yield Right-of-Way,,,,Sedan,Sedan,,,,2016-10-20 08:24:00
9899285,4148114,8dec165f-9c58-4ddb-bfe0-9d8bcd55fb93,OCCUPANT,UNSPECIFIED,,,18966298.0,,,,,,,,,Registrant,,,06/09/2019,17:30,,,40.6674,-73.773636,"(40.6674, -73.773636)",BELT PARKWAY                    ,,,0.0,0.0,0,0,0,0,0,0,Unspecified,Unspecified,Unspecified,,,Sedan,Station Wagon/Sport Utility Vehicle,Station Wagon/Sport Utility Vehicle,,,2019-06-09 17:30:00
5763503,3406384,309714,OCCUPANT,UNSPECIFIED,,,16952204.0,,,,,,,,,Registrant,,,04/08/2016,20:20,MANHATTAN,10003.0,40.729504,-73.986145,"(40.729504, -73.986145)",,,209       EAST 10 STREET                ,1.0,0.0,0,0,1,0,0,0,Passenger Distraction,Driver Inattention/Distraction,,,,Station Wagon/Sport Utility Vehicle,Bike,,,,2016-04-08 20:20:00
12684637,4648642,ba83a0f8-9c7d-4fd5-acdb-0a03d89fcf9e,OCCUPANT,UNSPECIFIED,,,20483584.0,,,,,,,,,Registrant,,,07/24/2023,13:54,,,,,,VERRAZANO BRIDGE UPPER,,,1.0,0.0,0,0,0,0,1,0,Following Too Closely,Unspecified,,,,Sedan,Sedan,,,,2023-07-24 13:54:00
7322406,3858487,fe38da79-fa34-4945-8b33-0b4a778304d4,OCCUPANT,UNSPECIFIED,M,58.0,17696768.0,Not Ejected,Does Not Apply,Does Not Apply,"Front passenger, if two or more persons, including the driver, are in the front seat",Lap Belt & Harness,,,Does Not Apply,Passenger,,,03/06/2018,9:20,,,40.813374,-73.956276,"(40.813374, -73.956276)",AMSTERDAM AVENUE                ,,,0.0,0.0,0,0,0,0,0,0,Reaction to Uninvolved Vehicle,Passing Too Closely,,,,Box Truck,Sedan,,,,2018-03-06 09:20:00
6534522,3536645,2255755,OCCUPANT,UNSPECIFIED,F,37.0,17318001.0,Not Ejected,Does Not Apply,Does Not Apply,Driver,Lap Belt & Harness,,,Does Not Apply,Driver,,,10/08/2016,14:26,,,40.693657,-73.983604,"(40.693657, -73.983604)",DUFFIELD STREET                 ,MYRTLE AVENUE,,0.0,0.0,0,0,0,0,0,0,Failure to Keep Right,Following Too Closely,,,,Sedan,Sedan,,,,2016-10-08 14:26:00
7051886,3688596,f4cddda6-8f53-47fd-8adb-9fa35377a6cc,OCCUPANT,UNSPECIFIED,M,22.0,17566164.0,Not Ejected,Does Not Apply,Does Not Apply,Driver,Lap Belt & Harness,,,Does Not Apply,Driver,,,06/09/2017,17:46,BRONX,10475.0,40.884647,-73.82662,"(40.884647, -73.82662)",CONNER STREET                   ,HOLLERS AVENUE,,1.0,0.0,0,0,0,0,1,0,Unspecified,Unspecified,Unspecified,,,Sedan,Sedan,Sedan,,,2017-06-09 17:46:00
9850952,4139299,57ff9fd5-4557-411f-8701-df2da319de2f,OCCUPANT,UNSPECIFIED,M,0.0,18942341.0,,,,,,,,,Registrant,,,05/25/2019,18:05,MANHATTAN,10032.0,40.837452,-73.94242,"(40.837452, -73.94242)",,,3887      BROADWAY                      ,0.0,0.0,0,0,0,0,0,0,Driver Inattention/Distraction,Following Too Closely,,,,Station Wagon/Sport Utility Vehicle,Station Wagon/Sport Utility Vehicle,,,,2019-05-25 18:05:00
7578022,3855454,fe4594d0-61d8-4a42-be68-ba1cf0f98996,OCCUPANT,UNSPECIFIED,F,38.0,17822382.0,,,,,,,,,Registrant,,,03/02/2018,17:30,,,40.75829,-73.83431,"(40.75829, -73.83431)",COLLEGE POINT BOULEVARD         ,ROOSEVELT AVENUE,,0.0,0.0,0,0,0,0,0,0,Traffic Control Device Improper/Non-Working,Traffic Control Device Improper/Non-Working,,,,Sedan,Sedan,,,,2018-03-02 17:30:00
7724026,3759362,1f9ea86a-c9b9-40f7-814d-b3398ef35161,OCCUPANT,UNSPECIFIED,M,45.0,17893839.0,,,,,,,,,Registrant,,,09/28/2017,6:40,,,,,,WEST HOUSTON STREET             ,,,0.0,0.0,0,0,0,0,0,0,Following Too Closely,Unspecified,,,,Tractor Truck Diesel,Sedan,,,,2017-09-28 06:40:00
12155838,4511583,0ab97971-f728-457c-a05b-9f7900ad4949,OCCUPANT,UNSPECIFIED,F,18.0,20182062.0,Not Ejected,Does Not Apply,Does Not Apply,"Left rear passenger, or rear passenger on a bicycle, motorcycle, snowmobile",Lap Belt & Harness,,,Does Not Apply,Passenger,,,03/18/2022,10:22,,,,,,BRUCKNER EXPRESSWAY,,,2.0,0.0,0,0,0,0,2,0,Driver Inattention/Distraction,Unspecified,,,,Beverage Truck,Taxi,,,,2022-03-18 10:22:00
6159561,3625679,17d8e777-844a-43f4-b781-b19da84fb7d6,OCCUPANT,UNSPECIFIED,M,51.0,17141233.0,,,,,,,,,Registrant,,,03/04/2017,17:30,,,40.74106,-73.946106,"(40.74106, -73.946106)",LONG ISLAND EXPRESSWAY          ,,,0.0,0.0,0,0,0,0,0,0,Following Too Closely,Unspecified,,,,Station Wagon/Sport Utility Vehicle,Sedan,,,,2017-03-04 17:30:00
12242642,4533982,31bf4706-050a-466c-8b24-b49e030bdc93,OCCUPANT,UNSPECIFIED,F,31.0,20231657.0,,,,,,,,,Registrant,,,06/04/2022,12:30,,,,,,CLEARVIEW EXPRESSWAY,,,0.0,0.0,0,0,0,0,0,0,Driver Inattention/Distraction,Unspecified,Unspecified,,,Sedan,Convertible,Sedan,,,2022-06-04 12:30:00
6908710,3652432,cc02d298-4a03-4a13-b27e-67e0866fbdf1,OCCUPANT,UNSPECIFIED,M,48.0,17497553.0,,,,,,,,,Registrant,,,04/16/2017,22:00,BRONX,10461.0,40.84429,-73.829025,"(40.84429, -73.829025)",,,3033      MIDDLETOWN ROAD               ,0.0,0.0,0,0,0,0,0,0,Other Vehicular,Backing Unsafely,,,,Motorcycle,Station Wagon/Sport Utility Vehicle,,,,2017-04-16 22:00:00
9496585,4039278,0d34b848-9921-4f9a-a7ae-4b5692cf0012,OCCUPANT,UNSPECIFIED,,0.0,18766878.0,,,,,,,,,Registrant,,,12/02/2018,5:05,,,40.852386,-73.90369,"(40.852386, -73.90369)",EAST BURNSIDE AVENUE            ,GRAND CONCOURSE,,1.0,0.0,0,0,0,0,1,0,Unspecified,,,,,Taxi,,,,,2018-12-02 05:05:00
6245526,3477824,1174545,OCCUPANT,UNSPECIFIED,,,17181428.0,,,,,,,,,Registrant,,,07/08/2016,15:00,BROOKLYN,11217.0,40.67486,-73.97202,"(40.67486, -73.97202)",,,25        8 AVENUE                      ,0.0,0.0,0,0,0,0,0,0,Driver Inattention/Distraction,Unspecified,,,,Bus,4 dr sedan,,,,2016-07-08 15:00:00
9380362,3955600,0d5436b4-b112-498b-860b-21c257bc9733,OCCUPANT,UNSPECIFIED,,0.0,18709892.0,,,,,,,,,Registrant,,,08/01/2018,16:30,MANHATTAN,10018.0,40.751114,-73.98503,"(40.751114, -73.98503)",,,60        WEST 37 STREET                ,0.0,0.0,0,0,0,0,0,0,Driver Inattention/Distraction,Driver Inattention/Distraction,,,,Pick-up Truck,Pick-up Truck,,,,2018-08-01 16:30:00
13426897,4829058,fd95fa16-6b49-4fcd-b470-360692316fb9,BICYCLIST,INJURED,M,46.0,20907934.0,Not Ejected,Conscious,Knee-Lower Leg Foot,Driver,,,,Complaint of Pain or Nausea,Driver,,,07/20/2025,13:00,BROOKLYN,11229.0,,,"(0.0, 0.0)",,,1690      E 17 ST,1.0,0.0,0,0,1,0,0,0,Unspecified,Unspecified,,,,E-Bike,Bike,,,,2025-07-20 13:00:00
12610452,4629599,25959a90-1cbb-40b0-a4ea-7048c4d0ef87,OCCUPANT,UNSPECIFIED,M,47.0,20441631.0,,,,,,,,,Registrant,,,05/17/2023,8:43,MANHATTAN,10033.0,40.846153,-73.932335,"(40.846153, -73.932335)",AMSTERDAM AVENUE,WEST 178 STREET,,0.0,0.0,0,0,0,0,0,0,Unspecified,Unspecified,,,,Sedan,Bus,,,,2023-05-17 08:43:00
12185450,4519296,802d8dde-c996-4756-8da4-b0de72605821,OCCUPANT,UNSPECIFIED,F,54.0,20199119.0,,,,,,,,,Registrant,,,04/15/2022,15:26,QUEENS,11367.0,40.721054,-73.82255,"(40.721054, -73.82255)",,,138-36    77 AVENUE,1.0,0.0,0,0,0,0,1,0,Passing Too Closely,Unspecified,,,,Station Wagon/Sport Utility Vehicle,Station Wagon/Sport Utility Vehicle,,,,2022-04-15 15:26:00
7707022,3784883,ca30f30e-52f4-4d0c-82aa-051666beed48,OCCUPANT,UNSPECIFIED,M,33.0,17885643.0,Not Ejected,Does Not Apply,Does Not Apply,Unknown,,,,Does Not Apply,Driver,,,11/06/2017,8:09,BRONX,10462.0,40.84132,-73.86332,"(40.84132, -73.86332)",,,1901      EAST TREMONT AVENUE           ,0.0,0.0,0,0,0,0,0,0,Backing Unsafely,Unspecified,,,,Sedan,,,,,2017-11-06 08:09:00
11066831,4290142,0974fb1e-8d27-42f4-8a0f-dc77fadb87c0,OCCUPANT,UNSPECIFIED,,,19562165.0,,,,,,,,,Registrant,,,02/14/2020,18:17,BROOKLYN,11219.0,40.63298,-74.00695,"(40.63298, -74.00695)",,,947       61 STREET                     ,0.0,0.0,0,0,0,0,0,0,Unspecified,Unspecified,,,,Station Wagon/Sport Utility Vehicle,Box Truck,,,,2020-02-14 18:17:00
9462996,4020596,6769a306-1456-4e71-b630-0c02ac3a1fdd,OCCUPANT,UNSPECIFIED,M,34.0,18750414.0,,,,,,,,,Registrant,,,11/12/2018,0:09,,,40.67619,-73.9081,"(40.67619, -73.9081)",ATLANTIC AVENUE                 ,,,0.0,0.0,0,0,0,0,0,0,Driver Inexperience,Unspecified,,,,Sedan,Station Wagon/Sport Utility Vehicle,,,,2018-11-12 00:09:00
6215819,3453258,833452,OCCUPANT,UNSPECIFIED,M,,17167651.0,,,,,,,,,Registrant,,,05/29/2016,17:20,,,,,,CITY ISLAND CIRCLE              ,,,0.0,0.0,0,0,0,0,0,0,Unspecified,Unspecified,,,,4 dr sedan,Station Wagon/Sport Utility Vehicle,,,,2016-05-29 17:20:00
12096088,4495725,ed478482-0965-418b-9dfc-ecb242d79b7b,OCCUPANT,INJURED,M,29.0,20147585.0,Not Ejected,Conscious,Shoulder - Upper Arm,Driver,Lap Belt & Harness,,,Complaint of Pain or Nausea,Driver,,,01/15/2022,1:45,,,40.65011,-73.930214,"(40.65011, -73.930214)",UTICA AVENUE,,,6.0,0.0,0,0,0,0,6,0,Failure to Yield Right-of-Way,Unspecified,Unspecified,Unspecified,Unspecified,Station Wagon/Sport Utility Vehicle,Sedan,Sedan,Sedan,Sedan,2022-01-15 01:45:00
7030717,3678415,c270fcc8-ec39-45db-a376-d6ff33f0d4b6,OCCUPANT,UNSPECIFIED,F,31.0,17556046.0,Not Ejected,Does Not Apply,Does Not Apply,Driver,Unknown,,,Does Not Apply,Driver,,,05/25/2017,9:58,,,40.7599,-73.98043,"(40.7599, -73.98043)",AVENUE OF THE AMERICAS          ,,,0.0,0.0,0,0,0,0,0,0,Other Vehicular,Passing Too Closely,,,,Taxi,Van,,,,2017-05-25 09:58:00
6219290,3464877,1006444,OCCUPANT,UNSPECIFIED,M,36.0,17169255.0,,,,,,,,,Registrant,,,06/19/2016,9:45,STATEN ISLAND,10314.0,40.611427,-74.116844,"(40.611427, -74.116844)",SLOSSON AVENUE                  ,REON AVENUE,,0.0,0.0,0,0,0,0,0,0,Driver Inattention/Distraction,Unspecified,,,,4 dr sedan,4 dr sedan,,,,2016-06-19 09:45:00
11001140,4274739,5f01c8a2-5d54-443d-af58-f14fb2225970,OCCUPANT,UNSPECIFIED,M,54.0,19528514.0,Not Ejected,Does Not Apply,Does Not Apply,Driver,Unknown,,,Does Not Apply,Driver,,,01/16/2020,15:43,BRONX,10451.0,40.824398,-73.909706,"(40.824398, -73.909706)",,,503       EAST 163 STREET               ,1.0,0.0,1,0,0,0,0,0,Pedestrian/Bicyclist/Other Pedestrian Error/Confusion,,,,,Sedan,,,,,2020-01-16 15:43:00
12079304,4491502,d256a3f1-6d38-4a6c-b248-c669166469ab,OCCUPANT,UNSPECIFIED,M,37.0,20137641.0,Not Ejected,Does Not Apply,Does Not Apply,Driver,Unknown,,,Does Not Apply,Driver,,,01/02/2022,0:01,,,40.795322,-73.929825,"(40.795322, -73.929825)",FDR DRIVE,,,1.0,0.0,0,0,0,0,1,0,Pavement Defective,Following Too Closely,Following Too Closely,Following Too Closely,,Station Wagon/Sport Utility Vehicle,Station Wagon/Sport Utility Vehicle,Station Wagon/Sport Utility Vehicle,Sedan,,2022-01-02 00:01:00
7354409,3845979,97daacc3-1c1e-45a6-83c4-a0b2f966463c,PEDESTRIAN,INJURED,M,13.0,,,Conscious,Knee-Lower Leg Foot,,,Unknown,Unknown,Complaint of Pain,Pedestrian,Unspecified,Unspecified,02/12/2018,8:10,,,40.645725,-73.91004,"(40.645725, -73.91004)",EAST 92 STREET                  ,,,1.0,0.0,1,0,0,0,0,0,Driver Inexperience,,,,,,,,,,2018-02-12 08:10:00
5797708,3422407,338180,OCCUPANT,UNSPECIFIED,F,,16968986.0,,,,,,,,,Registrant,,,04/08/2016,6:00,,,,,,VANWYCK EXPRESSWAY              ,ATLANTIC AVENUE,,0.0,0.0,0,0,0,0,0,0,Failure to Yield Right-of-Way,Unspecified,,,,Station Wagon/Sport Utility Vehicle,Station Wagon/Sport Utility Vehicle,,,,2016-04-08 06:00:00
9644578,4009672,a3f18871-1fe5-41ef-b869-84b7b04aba7b,OCCUPANT,UNSPECIFIED,F,62.0,18840060.0,,,,,,,,,Registrant,,,10/27/2018,0:00,BRONX,10475.0,40.885063,-73.82704,"(40.885063, -73.82704)",,,3525      CONNER STREET                 ,0.0,0.0,0,0,0,0,0,0,Driver Inattention/Distraction,Unspecified,,,,Sedan,Station Wagon/Sport Utility Vehicle,,,,2018-10-27 00:00:00
12916804,4709225,3937a7c6-917c-48e4-a5e8-bb969bded5e4,OCCUPANT,UNSPECIFIED,M,28.0,20615817.0,,,,,,,,,Registrant,,,03/12/2024,9:33,MANHATTAN,10029.0,40.796005,-73.93542,"(40.796005, -73.93542)",EAST 116 STREET,1 AVENUE,,1.0,0.0,0,0,0,0,1,0,Turning Improperly,Unspecified,,,,Station Wagon/Sport Utility Vehicle,Box Truck,,,,2024-03-12 09:33:00
9686062,4040737,2ddef6b6-1fc8-4fb9-b97b-050835b851a3,OCCUPANT,UNSPECIFIED,M,51.0,18860694.0,Not Ejected,Does Not Apply,Does Not Apply,Driver,Lap Belt & Harness,,,Does Not Apply,Driver,,,09/08/2018,9:23,QUEENS,11361.0,,,,corporal kennedy street         ,northern blvd,,0.0,0.0,0,0,0,0,0,0,Alcohol Involvement,Driver Inattention/Distraction,,,,Tractor Truck Diesel,Sedan,,,,2018-09-08 09:23:00
9501477,3980694,1632356d-0ea1-4c9e-8262-faefa90f9c2e,OCCUPANT,UNSPECIFIED,M,10.0,18769329.0,Not Ejected,Does Not Apply,Does Not Apply,"Any person in the rear of a station wagon, pick-up truck, all passengers on a bus, etc",Lap Belt,,,Does Not Apply,Passenger,,,09/14/2018,15:10,BRONX,10465.0,40.833424,-73.825516,"(40.833424, -73.825516)",LOGAN AVENUE                    ,OTIS AVENUE,,0.0,0.0,0,0,0,0,0,0,Unspecified,Unspecified,,,,Station Wagon/Sport Utility Vehicle,Sedan,,,,2018-09-14 15:10:00
12288871,4545855,6f83e122-2ce6-4ade-acca-71db381fbd6b,OCCUPANT,INJURED,M,47.0,20258326.0,Not Ejected,Unknown,Unknown,Driver,Unknown,,,None Visible,Driver,,,07/09/2022,22:54,BRONX,10467.0,40.884026,-73.869286,"(40.884026, -73.869286)",,,3560      WEBSTER AVENUE,1.0,0.0,0,0,0,0,1,0,Fell Asleep,Unspecified,,,,Box Truck,Sedan,,,,2022-07-09 22:54:00
9851830,4141110,6bfeea65-f054-403a-abd7-027d9ebc6c59,OCCUPANT,UNSPECIFIED,M,27.0,18942780.0,Not Ejected,Does Not Apply,Does Not Apply,Driver,Lap Belt & Harness,,,Does Not Apply,Driver,,,05/29/2019,8:49,BROOKLYN,11205.0,40.696087,-73.96265,"(40.696087, -73.96265)",PARK AVENUE                     ,EMERSON PLACE,,0.0,0.0,0,0,0,0,0,0,Passing Too Closely,Unspecified,,,,Tractor Truck Diesel,Tractor Truck Diesel,,,,2019-05-29 08:49:00
6207724,3458989,903530,OCCUPANT,UNSPECIFIED,F,63.0,17163863.0,Not Ejected,Does Not Apply,Does Not Apply,Right rear passenger or motorcycle sidecar passenger,Lap Belt & Harness,,,Does Not Apply,Passenger,,,06/07/2016,18:50,,,,,,,,,0.0,0.0,0,0,0,0,0,0,Driver Inattention/Distraction,Unspecified,,,,4 dr sedan,Sedan,,,,2016-06-07 18:50:00
13172431,4753117,71ef6922-cb2a-4405-8f2a-fcd93cea1ff2,OCCUPANT,INJURED,M,23.0,20762658.0,Ejected,Shock,Elbow-Lower-Arm-Hand,Driver,,,,Abrasion,Driver,,,08/30/2024,21:29,QUEENS,11101.0,40.75747,-73.93911,"(40.75747, -73.93911)",21 STREET,38 AVENUE,,1.0,0.0,0,0,0,0,1,0,Failure to Yield Right-of-Way,Unspecified,,,,Station Wagon/Sport Utility Vehicle,Moped,,,,2024-08-30 21:29:00
6192610,3488810,1338048,OCCUPANT,UNSPECIFIED,M,47.0,17156781.0,,,,,,,,,Registrant,,,06/19/2016,4:30,BRONX,10463.0,40.874935,-73.903465,"(40.874935, -73.903465)",,,2914      HEATH AVENUE                  ,0.0,0.0,0,0,0,0,0,0,Unspecified,,,,,2 dr sedan,4 dr sedan,,,,2016-06-19 04:30:00
11348140,4330552,25b12591-095a-4d88-b893-501259a788fb,OCCUPANT,INJURED,F,4.0,19711738.0,Not Ejected,Conscious,Entire Body,"Left rear passenger, or rear passenger on a bicycle, motorcycle, snowmobile",Child Restraint Only,,,Complaint of Pain or Nausea,Passenger,,,07/20/2020,22:20,,,40.699757,-73.79359,"(40.699757, -73.79359)",BREWER BOULEVARD                ,,,3.0,0.0,0,0,0,0,3,0,Unsafe Speed,Unspecified,Unspecified,,,Station Wagon/Sport Utility Vehicle,Sedan,Station Wagon/Sport Utility Vehicle,,,2020-07-20 22:20:00
10217197,4203467,b392b30d-2073-43e2-86eb-04448872ce17,OCCUPANT,INJURED,M,49.0,19125341.0,Not Ejected,Conscious,Knee-Lower Leg Foot,Driver,Lap Belt & Harness,,,Complaint of Pain or Nausea,Driver,,,09/04/2019,16:30,MANHATTAN,10021.0,40.767532,-73.953255,"(40.767532, -73.953255)",YORK AVENUE                     ,EAST 73 STREET,,1.0,0.0,0,0,0,0,1,0,Unspecified,Unspecified,,,,Station Wagon/Sport Utility Vehicle,Sedan,,,,2019-09-04 16:30:00
12348768,4561860,8f934569-ce4c-4f6f-8878-23f3574e9a2b,OCCUPANT,UNSPECIFIED,M,39.0,20292844.0,Not Ejected,Does Not Apply,Does Not Apply,Unknown,Unknown,,,Does Not Apply,Driver,,,09/04/2022,17:00,BROOKLYN,11236.0,40.65191,-73.89588,"(40.65191, -73.89588)",,,553       EAST 108 STREET,0.0,0.0,0,0,0,0,0,0,Backing Unsafely,Unspecified,,,,Sedan,,,,,2022-09-04 17:00:00
6965948,3699189,3bd9e384-cd59-4360-b94e-8a5bf037cf96,OCCUPANT,UNSPECIFIED,M,58.0,17524904.0,Not Ejected,Does Not Apply,Does Not Apply,Unknown,Unknown,,,Does Not Apply,Driver,,,06/25/2017,19:44,BROOKLYN,11212.0,40.664543,-73.9063,"(40.664543, -73.9063)",,,360       DUMONT AVENUE                 ,0.0,0.0,0,0,0,0,0,0,Driver Inattention/Distraction,Unspecified,,,,Station Wagon/Sport Utility Vehicle,Station Wagon/Sport Utility Vehicle,,,,2017-06-25 19:44:00
5760582,3412259,255481,OCCUPANT,UNSPECIFIED,M,23.0,16950816.0,,,,,,,,,Registrant,,,03/27/2016,18:00,BRONX,10452.0,40.83716,-73.92171,"(40.83716, -73.92171)",,,1261      CROMWELL AVENUE               ,0.0,0.0,0,0,0,0,0,0,Pavement Slippery,Unspecified,,,,Station Wagon/Sport Utility Vehicle,Station Wagon/Sport Utility Vehicle,,,,2016-03-27 18:00:00
11313963,4321674,0044d565-801a-45d7-bf5d-91264aa9d227,OCCUPANT,UNSPECIFIED,M,,19692102.0,,,,,,,,,Registrant,,,06/21/2020,8:25,,,40.58525,-73.98728,"(40.58525, -73.98728)",CROPSEY AVENUE                  ,,,1.0,0.0,0,0,0,0,1,0,Alcohol Involvement,Unspecified,Unspecified,,,Station Wagon/Sport Utility Vehicle,Station Wagon/Sport Utility Vehicle,Sedan,,,2020-06-21 08:25:00
10020358,4176189,1316c35c-a113-4ea2-868e-b9df0f75e3a1,OCCUPANT,UNSPECIFIED,M,25.0,19026381.0,Not Ejected,Does Not Apply,Does Not Apply,"Any person in the rear of a station wagon, pick-up truck, all passengers on a bus, etc",Lap Belt,,,Does Not Apply,Passenger,,,07/24/2019,8:55,QUEENS,11411.0,40.697525,-73.746826,"(40.697525, -73.746826)",FRANCIS LEWIS BOULEVARD         ,116 AVENUE,,0.0,0.0,0,0,0,0,0,0,Unspecified,Unspecified,,,,Station Wagon/Sport Utility Vehicle,Bus,,,,2019-07-24 08:55:00
13464296,4838925,17c28a49-a5c7-471e-89d3-c0e3d020feda,OCCUPANT,UNSPECIFIED,M,31.0,20929674.0,,,,,,,,,Registrant,,,08/31/2025,13:25,MANHATTAN,10018.0,40.750793,-73.9864,"(40.750793, -73.9864)",,,72        W 36 ST,0.0,0.0,0,0,0,0,0,0,Unspecified,Unspecified,,,,Pick-up Truck,Sedan,,,,2025-08-31 13:25:00
12381785,4570424,8c2a59e9-4087-49e4-a380-93be2208d1ef,OCCUPANT,UNSPECIFIED,M,36.0,20311913.0,,,,,,,,,Registrant,,,09/28/2022,20:00,BROOKLYN,11216.0,40.68024,-73.946754,"(40.68024, -73.946754)",FULTON STREET,NEW YORK AVENUE,,0.0,0.0,0,0,0,0,0,0,Passing Too Closely,Unspecified,,,,Station Wagon/Sport Utility Vehicle,,,,,2022-09-28 20:00:00
9336002,3985292,01da0453-9f17-4aae-a20c-d0e719724de8,OCCUPANT,UNSPECIFIED,F,25.0,18688121.0,Not Ejected,Does Not Apply,Does Not Apply,Driver,,,,Does Not Apply,Driver,,,09/19/2018,22:15,,,40.71946,-73.93753,"(40.71946, -73.93753)",MORGAN AVENUE                   ,,,0.0,0.0,0,0,0,0,0,0,Failure to Yield Right-of-Way,Unspecified,,,,Sedan,Taxi,,,,2018-09-19 22:15:00
6522072,3463864,994082,OCCUPANT,UNSPECIFIED,F,28.0,17312089.0,,,,,,,,,Registrant,,,06/19/2016,0:50,QUEENS,11357.0,40.786476,-73.81628,"(40.786476, -73.81628)",149 STREET                      ,15 ROAD,,0.0,0.0,0,0,0,0,0,0,Following Too Closely,Unspecified,,,,Station Wagon/Sport Utility Vehicle,4 dr sedan,,,,2016-06-19 00:50:00
7632409,3766134,cfe91be6-a8c0-4360-b13c-c93054bc836d,OCCUPANT,UNSPECIFIED,M,25.0,17848920.0,Not Ejected,Does Not Apply,Does Not Apply,Driver,Lap Belt & Harness,,,Does Not Apply,Driver,,,10/08/2017,3:20,,,40.867027,-73.917046,"(40.867027, -73.917046)",10 AVENUE                       ,,,0.0,0.0,0,0,0,0,0,0,Alcohol Involvement,Unspecified,Unspecified,,,Sedan,Sedan,Sedan,,,2017-10-08 03:20:00
12605743,4628326,5c5f93af-8348-4b14-9e8d-3625f6aabb19,OCCUPANT,INJURED,F,60.0,20439026.0,Not Ejected,Conscious,Abdomen - Pelvis,Driver,Lap Belt,,,None Visible,Driver,,,05/10/2023,7:50,QUEENS,11366.0,40.721462,-73.804535,"(40.721462, -73.804535)",164 STREET,UNION TURNPIKE,,2.0,0.0,0,0,0,0,2,0,Driver Inattention/Distraction,Driver Inattention/Distraction,Unspecified,,,Sedan,Sedan,FDNY TRUCK,,,2023-05-10 07:50:00
6185101,3459052,905669,OCCUPANT,UNSPECIFIED,F,35.0,17153258.0,Not Ejected,Does Not Apply,Does Not Apply,"Front passenger, if two or more persons, including the driver, are in the front seat",Lap Belt,,,Does Not Apply,Passenger,,,06/09/2016,13:35,MANHATTAN,10024.0,40.785587,-73.98201,"(40.785587, -73.98201)",RIVERSIDE DRIVE                 ,WEST 80 STREET,,0.0,0.0,0,0,0,0,0,0,Backing Unsafely,Unspecified,,,,4 dr sedan,4 dr sedan,,,,2016-06-09 13:35:00
6740135,3585416,3149337,OCCUPANT,UNSPECIFIED,F,39.0,17416597.0,Not Ejected,Does Not Apply,Does Not Apply,Driver,Lap Belt,,,Does Not Apply,Driver,,,12/23/2016,8:00,QUEENS,11102.0,40.773388,-73.929,"(40.773388, -73.929)",14 STREET                       ,27 AVENUE,,0.0,0.0,0,0,0,0,0,0,Unspecified,Unspecified,,,,Tractor Truck Gasoline,Sedan,,,,2016-12-23 08:00:00
9686424,4039913,958cfe9a-fc4c-40eb-8dbd-4ddbab30fe8d,OCCUPANT,INJURED,F,64.0,18860877.0,Not Ejected,Conscious,Unknown,Driver,Lap Belt & Harness,,,None Visible,Driver,,,12/07/2018,8:40,QUEENS,11385.0,40.702892,-73.86916,"(40.702892, -73.86916)",79 LANE                         ,MYRTLE AVENUE,,1.0,0.0,0,0,0,0,1,0,Unspecified,Unspecified,,,,Sedan,Sedan,,,,2018-12-07 08:40:00
7084545,3690409,b6e62471-566c-4219-b462-5a263edd8314,OCCUPANT,UNSPECIFIED,F,64.0,17581729.0,Not Ejected,Does Not Apply,Does Not Apply,Driver,Lap Belt & Harness,,,Does Not Apply,Driver,,,06/13/2017,21:05,MANHATTAN,10028.0,40.774292,-73.95127,"(40.774292, -73.95127)",1 AVENUE                        ,EAST 82 STREET,,1.0,0.0,0,0,0,0,1,0,Passing or Lane Usage Improper,,,,,Sedan,,,,,2017-06-13 21:05:00
9287405,3920388,87493ff5-94b8-4f6f-aaaa-f23dc50320db,OCCUPANT,UNSPECIFIED,M,50.0,18664256.0,Not Ejected,Does Not Apply,Does Not Apply,Driver,Lap Belt & Harness,,,Does Not Apply,Driver,,,06/13/2018,21:30,,,40.830143,-73.92858,"(40.830143, -73.92858)",JEROME AVENUE                   ,,,0.0,0.0,0,0,0,0,0,0,Backing Unsafely,,,,,Sedan,,,,,2018-06-13 21:30:00
7659336,3875708,166b3b61-d851-49f1-99bd-24375f24eead,OCCUPANT,UNSPECIFIED,M,48.0,17862172.0,Not Ejected,Does Not Apply,Does Not Apply,Driver,Lap Belt & Harness,,,Does Not Apply,Driver,,,04/05/2018,8:00,,,40.748077,-73.72861,"(40.748077, -73.72861)",G.C.P / L.I.E. (CDR)            ,,,0.0,0.0,0,0,0,0,0,0,Following Too Closely,Unspecified,Unspecified,,,Sedan,Station Wagon/Sport Utility Vehicle,Station Wagon/Sport Utility Vehicle,,,2018-04-05 08:00:00
11547939,4383184,e785734b-a5f6-41ee-857e-51a3a742d630,OCCUPANT,UNSPECIFIED,F,51.0,19828120.0,Not Ejected,Does Not Apply,Does Not Apply,Driver,Unknown,,,Does Not Apply,Driver,,,01/11/2021,19:05,QUEENS,11433.0,40.695995,-73.782776,"(40.695995, -73.782776)",MERRICK BOULEVARD               ,110 AVENUE,,0.0,0.0,0,0,0,0,0,0,Unspecified,Unspecified,,,,Sedan,Sedan,,,,2021-01-11 19:05:00
12021689,4476223,3471ac2b-77c1-43cb-b5f9-84373c69082f,OCCUPANT,UNSPECIFIED,F,1.0,20104280.0,Not Ejected,Does Not Apply,Does Not Apply,Right rear passenger or motorcycle sidecar passenger,Child Restraint Only,,,Does Not Apply,Passenger,,,11/08/2021,19:19,,,40.86536,-73.87043,"(40.86536, -73.87043)",BRONX PARK EAST,,,1.0,0.0,1,0,0,0,0,0,Driver Inexperience,,,,,Sedan,,,,,2021-11-08 19:19:00
9543744,4005788,c74ff38a-391f-4d17-b614-d6c5a5e230c5,OCCUPANT,UNSPECIFIED,M,32.0,18790235.0,Not Ejected,Does Not Apply,Does Not Apply,"Front passenger, if two or more persons, including the driver, are in the front seat",Lap Belt & Harness,,,Does Not Apply,Passenger,,,10/23/2018,7:50,BROOKLYN,11218.0,40.6489,-73.96968,"(40.6489, -73.96968)",CATON AVENUE                    ,STRATFORD ROAD,,0.0,0.0,0,0,0,0,0,0,Driver Inattention/Distraction,Driver Inattention/Distraction,,,,Bus,Station Wagon/Sport Utility Vehicle,,,,2018-10-23 07:50:00
6799998,3676861,183ddb1c-7a07-424d-9bbd-623e2ca94b4c,OCCUPANT,UNSPECIFIED,M,57.0,17445330.0,,,,,,,,,Registrant,,,05/23/2017,16:25,MANHATTAN,10025.0,40.79704,-73.97369,"(40.79704, -73.97369)",,,258       RIVERSIDE DRIVE               ,0.0,0.0,0,0,0,0,0,0,Driver Inattention/Distraction,Unspecified,,,,Sedan,Motorcycle,,,,2017-05-23 16:25:00
8959422,4065117,cb5b7213-be2c-4cc3-a4db-5afedcad9740,OCCUPANT,UNSPECIFIED,M,23.0,18502382.0,Not Ejected,Does Not Apply,Does Not Apply,Driver,Unknown,,,Does Not Apply,Driver,,,01/10/2019,14:00,BRONX,10470.0,40.895245,-73.87967,"(40.895245, -73.87967)",,,1         EAST 233 STREET               ,0.0,0.0,0,0,0,0,0,0,Unspecified,Unspecified,,,,Box Truck,,,,,2019-01-10 14:00:00
9549227,4040681,01eeb1d1-f843-4514-bd77-628e10f0e33b,OCCUPANT,UNSPECIFIED,F,38.0,18792950.0,Not Ejected,Does Not Apply,Does Not Apply,Driver,Lap Belt & Harness,,,Does Not Apply,Driver,,,12/08/2018,11:50,BROOKLYN,11234.0,40.630867,-73.92234,"(40.630867, -73.92234)",EAST 56 STREET                  ,AVENUE I,,0.0,0.0,0,0,0,0,0,0,Failure to Yield Right-of-Way,Unspecified,,,,Station Wagon/Sport Utility Vehicle,Sedan,,,,2018-12-08 11:50:00
5832389,3426703,436568,OCCUPANT,UNSPECIFIED,F,47.0,16985989.0,,,,,,,,,Registrant,,,04/20/2016,19:30,QUEENS,11355.0,40.75661,-73.83301,"(40.75661, -73.83301)",,,132-18    41 AVENUE                     ,0.0,0.0,0,0,0,0,0,0,Failure to Yield Right-of-Way,Unspecified,,,,Station Wagon/Sport Utility Vehicle,Station Wagon/Sport Utility Vehicle,,,,2016-04-20 19:30:00
2247792,3200821,1,OCCUPANT,INJURED,,33.0,14650132.0,,,,,,,,,,,,04/11/2015,8:40,BROOKLYN,11207.0,40.65204,-73.88795,"(40.6520399, -73.8879488)",FLATLANDS AVENUE                ,GEORGIA AVENUE                  ,,2.0,0.0,0,0,0,0,2,0,Unspecified,Unspecified,,,,PASSENGER VEHICLE,SPORT UTILITY / STATION WAGON,,,,2015-04-11 08:40:00
5765624,3416750,228481,OCCUPANT,UNSPECIFIED,F,10.0,16953235.0,Not Ejected,Conscious,Does Not Apply,"Left rear passenger, or rear passenger on a bicycle, motorcycle, snowmobile",Lap Belt & Harness,,,Does Not Apply,Passenger,,,03/31/2016,17:55,,,40.60566,-74.03149,"(40.60566, -74.03149)",Belt Pkwy                       ,,,0.0,0.0,0,0,0,0,0,0,Lane Marking Improper/Inadequate,Lane Marking Improper/Inadequate,,,,Station Wagon/Sport Utility Vehicle,Station Wagon/Sport Utility Vehicle,,,,2016-03-31 17:55:00
11007477,4271781,aa44c9f3-3309-45d9-ac3f-e114898c72b4,OCCUPANT,UNSPECIFIED,,,19531739.0,,,,,,,,,Registrant,,,01/10/2020,10:15,QUEENS,11101.0,40.753784,-73.93203,"(40.753784, -73.93203)",31 STREET                       ,38 AVENUE,,0.0,0.0,0,0,0,0,0,0,Lost Consciousness,Unspecified,,,,Station Wagon/Sport Utility Vehicle,Taxi,,,,2020-01-10 10:15:00
13475528,4840884,abba76b2-9d45-4771-a5ff-9889d77a264c,OCCUPANT,INJURED,M,33.0,20936082.0,Not Ejected,Conscious,Head,Driver,Lap Belt & Harness,,,Whiplash,Driver,,,09/05/2025,6:25,,,40.756718,-73.73918,"(40.756718, -73.73918)",DOUGLASTON PARKWAY,LONG ISLAND EXPRESSWAY,,1.0,0.0,0,0,0,0,1,0,Failure to Yield Right-of-Way,Unspecified,,,,Tractor Truck Diesel,Station Wagon/Sport Utility Vehicle,,,,2025-09-05 06:25:00
5784098,3408170,206433,OCCUPANT,UNSPECIFIED,,,16962285.0,,,,,,,,,Registrant,,,03/29/2016,11:25,MANHATTAN,10022.0,,,,WEST 52 STREET                  ,5 AVENUE,,0.0,0.0,0,0,0,0,0,0,Turning Improperly,Unspecified,,,,Station Wagon/Sport Utility Vehicle,Station Wagon/Sport Utility Vehicle,,,,2016-03-29 11:25:00
9388695,3958315,f4001615-c14e-476d-b7aa-c3f148474081,OCCUPANT,UNSPECIFIED,M,69.0,18714011.0,Not Ejected,Does Not Apply,Does Not Apply,Driver,Lap Belt,,,Does Not Apply,Driver,,,08/10/2018,0:20,MANHATTAN,10022.0,40.75358,-73.96639,"(40.75358, -73.96639)",,,885       1 AVENUE                      ,0.0,0.0,0,0,0,0,0,0,Driver Inattention/Distraction,Unspecified,Unspecified,,,Taxi,Sedan,Sedan,,,2018-08-10 00:20:00
6450746,3516820,1912174,OCCUPANT,UNSPECIFIED,M,53.0,17278083.0,Not Ejected,Does Not Apply,Does Not Apply,"Left rear passenger, or rear passenger on a bicycle, motorcycle, snowmobile",Unknown,,,Does Not Apply,Passenger,,,09/09/2016,9:35,MANHATTAN,10001.0,40.75578,-74.00199,"(40.75578, -74.00199)",11 AVENUE                       ,WEST 34 STREET,,0.0,0.0,0,0,0,0,0,0,Unsafe Lane Changing,Unspecified,,,,Sedan,Pick-up Truck,,,,2016-09-09 09:35:00
5960371,3435773,629662,OCCUPANT,UNSPECIFIED,M,36.0,17045921.0,Not Ejected,Does Not Apply,Does Not Apply,Driver,Lap Belt & Harness,,,Does Not Apply,Driver,,,04/24/2016,11:10,BRONX,10467.0,40.879032,-73.86764,"(40.879032, -73.86764)",,,3536      OLINVILLE AVENUE              ,0.0,0.0,0,0,0,0,0,0,Driver Inattention/Distraction,Unspecified,Unspecified,Unspecified,,4 dr sedan,4 dr sedan,Station Wagon/Sport Utility Vehicle,4 dr sedan,,2016-04-24 11:10:00
11589784,4394578,17062f9f-67dc-4949-8472-bff6aaa31e99,OCCUPANT,UNSPECIFIED,M,38.0,19853218.0,Not Ejected,Does Not Apply,Does Not Apply,Driver,Lap Belt,,,Does Not Apply,Driver,,,02/25/2021,22:19,MANHATTAN,10016.0,40.744495,-73.98112,"(40.744495, -73.98112)",EAST 31 STREET                  ,LEXINGTON AVENUE,,1.0,0.0,0,0,0,0,1,0,Traffic Control Disregarded,Unspecified,Unspecified,,,Sedan,Sedan,Sedan,,,2021-02-25 22:19:00
11805535,4405690,01d679bf-9d0c-4cbf-9e96-565b29db363a,OCCUPANT,UNSPECIFIED,M,40.0,19978234.0,Not Ejected,Does Not Apply,Does Not Apply,Driver,Lap Belt & Harness,,,Does Not Apply,Driver,,,04/08/2021,9:36,,,40.83774,-73.91739,"(40.83774, -73.91739)",EAST CLARKE PLACE               ,,,0.0,0.0,0,0,0,0,0,0,Oversized Vehicle,Unspecified,,,,Chassis Cab,Sedan,,,,2021-04-08 09:36:00
12250673,4535936,50bb22b7-5172-44aa-8fb0-18bc95b89bb6,OCCUPANT,UNSPECIFIED,,,20236270.0,,,,,,,,,Registrant,,,06/09/2022,11:00,QUEENS,11354.0,40.76407,-73.80914,"(40.76407, -73.80914)",156 STREET,NORTHERN BOULEVARD,,0.0,0.0,0,0,0,0,0,0,Unspecified,Unspecified,,,,Sedan,Sedan,,,,2022-06-09 11:00:00
6739859,3526368,2075872,OCCUPANT,UNSPECIFIED,F,47.0,17416469.0,Not Ejected,Does Not Apply,Does Not Apply,Driver,Unknown,,,Does Not Apply,Driver,,,09/24/2016,12:57,QUEENS,11354.0,40.762733,-73.83321,"(40.762733, -73.83321)",PRINCE STREET                   ,NORTHERN BOULEVARD,,0.0,0.0,0,0,0,0,0,0,Turning Improperly,Unspecified,,,,Station Wagon/Sport Utility Vehicle,Station Wagon/Sport Utility Vehicle,,,,2016-09-24 12:57:00
7563504,3886393,fe1cc34f-fb3b-4654-93bc-21aceb213938,OCCUPANT,UNSPECIFIED,M,35.0,17815270.0,Not Ejected,Does Not Apply,Does Not Apply,Driver,Lap Belt,,,Does Not Apply,Driver,,,04/20/2018,16:30,BROOKLYN,11226.0,40.652348,-73.95552,"(40.652348, -73.95552)",,,77        LINDEN BOULEVARD              ,0.0,0.0,0,0,0,0,0,0,View Obstructed/Limited,Unspecified,,,,Station Wagon/Sport Utility Vehicle,Sedan,,,,2018-04-20 16:30:00
7311136,3828791,635e5c0a-8d32-43aa-8b17-ba0c04ef620c,OCCUPANT,UNSPECIFIED,M,51.0,17691248.0,,,,,,,,,Registrant,,,01/12/2018,6:25,BROOKLYN,11229.0,40.611786,-73.94601,"(40.611786, -73.94601)",EAST 28 STREET                  ,AVENUE P,,1.0,0.0,0,0,0,0,1,0,Traffic Control Disregarded,Unspecified,,,,Station Wagon/Sport Utility Vehicle,Sedan,,,,2018-01-12 06:25:00
12708104,4654491,9f02a53d-189b-4594-863b-7da6fc7ba034,OCCUPANT,UNSPECIFIED,F,39.0,20496946.0,Not Ejected,Does Not Apply,Does Not Apply,Driver,Lap Belt & Harness,,,Does Not Apply,Driver,,,08/04/2023,10:45,,,40.650146,-74.00508,"(40.650146, -74.00508)",5 AVENUE,,,1.0,0.0,0,0,0,0,0,0,Failure to Yield Right-of-Way,Unspecified,,,,Station Wagon/Sport Utility Vehicle,E-Bike,,,,2023-08-04 10:45:00
9294873,3970817,ea9c9a38-292e-4a98-aed5-1d62c9f7fe72,OCCUPANT,UNSPECIFIED,M,44.0,18667907.0,,,,,,,,,Registrant,,,08/24/2018,9:10,MANHATTAN,10002.0,40.715427,-73.993614,"(40.715427, -73.993614)",,,91        CANAL STREET                  ,0.0,0.0,0,0,0,0,0,0,Driver Inattention/Distraction,Pedestrian/Bicyclist/Other Pedestrian Error/Confusion,,,,Bike,Station Wagon/Sport Utility Vehicle,,,,2018-08-24 09:10:00
12332559,4557594,3b5a00fd-daad-443c-a8e5-c0e78a044216,OCCUPANT,UNSPECIFIED,M,22.0,20283413.0,,,,,,,,,Registrant,,,08/22/2022,22:20,BROOKLYN,11211.0,40.71582,-73.95988,"(40.71582, -73.95988)",,,241       BEDFORD AVENUE,0.0,0.0,0,0,0,0,0,0,Unspecified,,,,,Station Wagon/Sport Utility Vehicle,,,,,2022-08-22 22:20:00
9486483,3961697,c4d76cb3-56cb-415a-a8bb-d06d34124d5d,OCCUPANT,UNSPECIFIED,F,15.0,18761898.0,Not Ejected,Does Not Apply,Does Not Apply,"Front passenger, if two or more persons, including the driver, are in the front seat",Lap Belt,,,Does Not Apply,Passenger,,,08/11/2018,15:00,,,,,,82 AVENUE                       ,KEW GARDEN ROAD,,2.0,0.0,0,0,0,0,2,0,Driver Inattention/Distraction,Unspecified,,,,Sedan,Sedan,,,,2018-08-11 15:00:00
7211103,3717498,edc52880-6a56-4432-8871-a2cc3c5bcca7,OCCUPANT,UNSPECIFIED,M,38.0,17642564.0,Not Ejected,Does Not Apply,Does Not Apply,"Front passenger, if two or more persons, including the driver, are in the front seat",Unknown,,,Does Not Apply,Passenger,,,07/21/2017,14:15,,,40.817734,-73.8047,"(40.817734, -73.8047)",THROGS NECK BRIDGE              ,,,1.0,0.0,0,0,0,0,1,0,Unsafe Lane Changing,Unspecified,,,,Sedan,Pick-up Truck,,,,2017-07-21 14:15:00
7784117,3794776,ea4a867b-8690-4ab4-a3e7-2a15cee00ade,OCCUPANT,UNSPECIFIED,M,0.0,17922836.0,Not Ejected,Does Not Apply,Does Not Apply,"Middle rear seat, or passenger lying across a seat",Child Restraint Only,,,Does Not Apply,Passenger,,,11/21/2017,7:45,,,40.7025,-73.814964,"(40.7025, -73.814964)",JAMAICA AVENUE                  ,138 STREET,,1.0,0.0,0,0,0,0,1,0,Following Too Closely,Following Too Closely,Unspecified,,,Station Wagon/Sport Utility Vehicle,Station Wagon/Sport Utility Vehicle,Sedan,,,2017-11-21 07:45:00
13369786,4813607,77a4c789-5ceb-442e-a1fd-696cffc2e80f,OCCUPANT,UNSPECIFIED,F,7.0,20875015.0,Not Ejected,Does Not Apply,Does Not Apply,"Any person in the rear of a station wagon, pick-up truck, all passengers on a bus, etc",Lap Belt & Harness,,,Does Not Apply,Passenger,,,05/15/2025,14:09,BROOKLYN,11203.0,40.654743,-73.9404,"(40.654743, -73.9404)",LENOX RD,E 40 ST,,0.0,0.0,0,0,0,0,0,0,Unspecified,Unspecified,,,,Bus,Station Wagon/Sport Utility Vehicle,,,,2025-05-15 14:09:00
12724007,4658733,7e15abeb-e100-4dbe-b3d8-3472dc6e492c,OCCUPANT,UNSPECIFIED,M,,20506092.0,,,,,,,,,Registrant,,,09/01/2023,8:28,QUEENS,11367.0,40.72866,-73.82948,"(40.72866, -73.82948)",,,69-03     136 STREET,0.0,0.0,0,0,0,0,0,0,Alcohol Involvement,Unspecified,,,,Sedan,Sedan,Sedan,,,2023-09-01 08:28:00
9690278,4048016,02362811-b0f9-4380-9391-d7417104f098,OCCUPANT,UNSPECIFIED,M,27.0,18862821.0,,,,,,,,,Registrant,,,12/19/2018,6:16,STATEN ISLAND,10308.0,40.548397,-74.14017,"(40.548397, -74.14017)",FIELDWAY AVENUE                 ,GREENCROFT AVENUE,,0.0,0.0,0,0,0,0,0,0,Driver Inattention/Distraction,Unspecified,,,,Station Wagon/Sport Utility Vehicle,Sedan,,,,2018-12-19 06:16:00
12115673,4501129,cd51cea8-ec92-4b6b-b54d-e7944d118951,OCCUPANT,UNSPECIFIED,F,31.0,20159080.0,Not Ejected,Does Not Apply,Does Not Apply,Driver,Lap Belt & Harness,,,Does Not Apply,Driver,,,02/08/2022,19:39,,,40.743427,-73.775475,"(40.743427, -73.775475)",LONG ISLAND EXPRESSWAY,,,0.0,0.0,0,0,0,0,0,0,Unspecified,,,,,Sedan,,,,,2022-02-08 19:39:00
13459809,4837736,0a68bf4c-53d5-4ed6-9242-a6d900404909,OCCUPANT,UNSPECIFIED,M,26.0,20927096.0,Not Ejected,Does Not Apply,Does Not Apply,Driver,Lap Belt & Harness,,,Does Not Apply,Driver,,,08/22/2025,19:50,QUEENS,11368.0,40.755917,-73.84572,"(40.755917, -73.84572)",,,123-01    ROOSEVELT AVE,0.0,0.0,0,0,0,0,0,0,Driver Inattention/Distraction,Driver Inattention/Distraction,Driver Inattention/Distraction,,,Sedan,Sedan,Sedan,,,2025-08-22 19:50:00
12735942,4662182,0c0ed3c6-4a48-4ce0-b39b-9ed9b7cc13c1,OCCUPANT,UNSPECIFIED,F,71.0,20513125.0,Not Ejected,Does Not Apply,Does Not Apply,Driver,Lap Belt & Harness,,,Does Not Apply,Driver,,,09/14/2023,1:00,MANHATTAN,10037.0,40.809875,-73.93674,"(40.809875, -73.93674)",,,58        EAST 132 STREET,1.0,0.0,1,0,0,0,0,0,Unspecified,,,,,Taxi,,,,,2023-09-14 01:00:00
9500696,3988382,e3210c5e-a680-4388-bdc0-c95b360efe8d,OCCUPANT,INJURED,M,19.0,18768948.0,Not Ejected,Conscious,Back,Driver,Lap Belt & Harness,,,Complaint of Pain or Nausea,Driver,,,09/25/2018,15:00,QUEENS,11433.0,40.70793,-73.78383,"(40.70793, -73.78383)",JAMAICA AVENUE                  ,177 STREET,,1.0,0.0,0,0,0,0,1,0,Passing or Lane Usage Improper,Unsafe Lane Changing,,,,Sedan,Station Wagon/Sport Utility Vehicle,,,,2018-09-25 15:00:00
6735836,3541105,2325315,PEDESTRIAN,INJURED,M,25.0,,,Conscious,Knee-Lower Leg Foot,,,Pedestrian/Bicyclist/Other Pedestrian at Intersection,"Crossing, No Signal, or Crosswalk",Complaint of Pain,Pedestrian,Unspecified,Unspecified,10/14/2016,19:10,,,40.678165,-73.890785,"(40.678165, -73.890785)",HENDRIX STREET                  ,,,1.0,0.0,1,0,0,0,0,0,Failure to Yield Right-of-Way,,,,,Sedan,,,,,2016-10-14 19:10:00
9595289,4009199,67db253a-af23-477d-988c-a5a2b615cb15,OCCUPANT,UNSPECIFIED,,,18815902.0,,,,,,,,,Owner,,,10/27/2018,3:15,BROOKLYN,11203.0,40.654575,-73.943214,"(40.654575, -73.943214)",LENOX ROAD                      ,EAST 37 STREET,,1.0,0.0,0,0,0,0,1,0,Passing or Lane Usage Improper,Unspecified,,,,Station Wagon/Sport Utility Vehicle,Sedan,,,,2018-10-27 03:15:00
9491265,3914118,3d7189b8-9b0f-4a83-affc-78f9e5269e4d,OCCUPANT,UNSPECIFIED,M,37.0,18764251.0,Not Ejected,Does Not Apply,Does Not Apply,Driver,Lap Belt & Harness,,,Does Not Apply,Driver,,,06/01/2018,14:20,BROOKLYN,11207.0,40.66448,-73.89579,"(40.66448, -73.89579)",,,578       LIVONIA AVENUE                ,1.0,0.0,0,0,1,0,0,0,Driver Inattention/Distraction,Passing Too Closely,,,,Bike,Station Wagon/Sport Utility Vehicle,,,,2018-06-01 14:20:00
11497319,4369907,f2891b0d-9831-4c77-94f2-57c924cc92ca,OCCUPANT,UNSPECIFIED,M,23.0,19798485.0,Not Ejected,Does Not Apply,Does Not Apply,"Front passenger, if two or more persons, including the driver, are in the front seat",Lap Belt & Harness,,,Does Not Apply,Passenger,,,11/21/2020,15:08,BRONX,10460.0,40.841087,-73.86447,"(40.841087, -73.86447)",WHITE PLAINS ROAD               ,EAST TREMONT AVENUE,,0.0,0.0,0,0,0,0,0,0,Reaction to Uninvolved Vehicle,Unspecified,,,,Sedan,Sedan,,,,2020-11-21 15:08:00
11121583,4290858,9d005dfc-4efa-4474-8632-0205891c0a7a,OCCUPANT,UNSPECIFIED,F,33.0,19590779.0,,,,,,,,,Registrant,,,02/19/2020,19:38,,,40.718716,-73.79406,"(40.718716, -73.79406)",GRAND CENTRAL PKWY              ,,,0.0,0.0,0,0,0,0,0,0,Following Too Closely,Unspecified,,,,Sedan,Sedan,,,,2020-02-19 19:38:00
9174547,4107848,453c25c9-75ee-4239-a491-a0e92fcd77f2,OCCUPANT,INJURED,M,22.0,18608945.0,Not Ejected,Conscious,Back,Driver,Unknown,,,Complaint of Pain or Nausea,Driver,,,04/01/2019,22:19,BRONX,10467.0,40.88295,-73.8598,"(40.88295, -73.8598)",,,3809      BARNES AVENUE                 ,3.0,0.0,0,0,0,0,3,0,Following Too Closely,Unspecified,,,,Sedan,Sedan,,,,2019-04-01 22:19:00
9923741,4151832,7dcc36d2-174e-496f-a29d-6521100f59bc,OCCUPANT,UNSPECIFIED,M,34.0,18978283.0,Not Ejected,Does Not Apply,Does Not Apply,"Middle front seat, or passenger lying across a seat",Lap Belt & Harness,,,Does Not Apply,Passenger,,,06/15/2019,7:49,,,40.724934,-73.82976,"(40.724934, -73.82976)",VAN WYCK EXPWY                  ,,,0.0,0.0,0,0,0,0,0,0,Unsafe Lane Changing,Unspecified,,,,Armored Truck,Sedan,,,,2019-06-15 07:49:00
7691280,3770122,8ff3aff5-216d-4b9e-ac2d-1e1b90978811,OCCUPANT,UNSPECIFIED,F,27.0,17877899.0,Not Ejected,Does Not Apply,Does Not Apply,Driver,Lap Belt & Harness,,,Does Not Apply,Driver,,,10/10/2017,8:20,,,40.83999,-73.87757,"(40.83999, -73.87757)",EAST TREMONT AVENUE             ,,,0.0,0.0,0,0,0,0,0,0,Failure to Yield Right-of-Way,Unspecified,,,,Sedan,Sedan,,,,2017-10-10 08:20:00
11130041,4308981,a66cecd9-10f8-487e-b4f6-936219bba071,OCCUPANT,UNSPECIFIED,M,57.0,19595403.0,,,,,,,,,Registrant,,,04/14/2020,17:52,BROOKLYN,11218.0,40.643166,-73.9905,"(40.643166, -73.9905)",39 STREET                       ,FORT HAMILTON PARKWAY,,0.0,0.0,0,0,0,0,0,0,Unspecified,Unspecified,,,,Sedan,Station Wagon/Sport Utility Vehicle,,,,2020-04-14 17:52:00
11399344,4344081,ab0ba8dd-1eea-4180-9a37-e16e50d04aa0,OCCUPANT,UNSPECIFIED,M,42.0,19741571.0,Not Ejected,Does Not Apply,Does Not Apply,"Front passenger, if two or more persons, including the driver, are in the front seat",Lap Belt & Harness,,,Does Not Apply,Passenger,,,09/01/2020,20:45,STATEN ISLAND,10314.0,40.61324,-74.12045,"(40.61324, -74.12045)",BEECHWOOD PLACE                 ,VICTORY BOULEVARD,,0.0,0.0,0,0,0,0,0,0,Driver Inattention/Distraction,Unspecified,,,,Ambulance,Sedan,,,,2020-09-01 20:45:00
5949594,3445870,762144,OCCUPANT,UNSPECIFIED,,,17040853.0,,,,,,,,,Registrant,,,05/25/2016,11:30,MANHATTAN,10034.0,40.86397,-73.91928,"(40.86397, -73.91928)",,,3855      10 AVENUE                     ,0.0,0.0,0,0,0,0,0,0,Unspecified,Unspecified,,,,Station Wagon/Sport Utility Vehicle,Tractor Truck Gasoline,,,,2016-05-25 11:30:00
13481619,4842877,970d6c96-6354-4e60-9e62-bf7b9766121d,OCCUPANT,UNSPECIFIED,,,20939572.0,,,,,,,,,Registrant,,,09/16/2025,17:25,,,,,,ED KOCH QUEENSBORO BRG,ED KOCH QUEENSBORO BRG,,0.0,0.0,0,0,0,0,0,0,Driver Inattention/Distraction,Unspecified,Unspecified,,,Sedan,Station Wagon/Sport Utility Vehicle,Station Wagon/Sport Utility Vehicle,,,2025-09-16 17:25:00
6134302,3624860,30c04947-f5ca-49ea-a107-d9249f07421b,OCCUPANT,UNSPECIFIED,F,41.0,17128872.0,,,,,,,,,Registrant,,,03/02/2017,8:30,MANHATTAN,10013.0,40.716923,-74.01084,"(40.716923, -74.01084)",GREENWICH STREET                ,READE STREET,,0.0,0.0,0,0,0,0,0,0,Passing Too Closely,Unspecified,,,,Sedan,Pick-up Truck,,,,2017-03-02 08:30:00
6366002,3555739,2613024,OCCUPANT,UNSPECIFIED,M,29.0,17238013.0,Not Ejected,Does Not Apply,Does Not Apply,Driver,Lap Belt & Harness,,,Does Not Apply,Driver,,,11/06/2016,22:30,,,40.825504,-73.886086,"(40.825504, -73.886086)",SHERIDAN EXPRESSWAY             ,,,0.0,0.0,0,0,0,0,0,0,Following Too Closely,Unspecified,,,,Sedan,Sedan,,,,2016-11-06 22:30:00
11041244,4275258,cd5acacb-8952-4235-a251-2cfd9884c92a,OCCUPANT,UNSPECIFIED,M,54.0,19549050.0,,,,,,,,,Registrant,,,01/18/2020,14:25,QUEENS,11423.0,40.72176,-73.76001,"(40.72176, -73.76001)",FRANCIS LEWIS BOULEVARD         ,WHITEHALL TERRACE,,2.0,0.0,0,0,0,0,2,0,Unspecified,Unspecified,Unspecified,Unspecified,Unspecified,Station Wagon/Sport Utility Vehicle,Station Wagon/Sport Utility Vehicle,Station Wagon/Sport Utility Vehicle,Station Wagon/Sport Utility Vehicle,,2020-01-18 14:25:00
12005889,4472126,ae366466-5457-4aa7-8c40-3690203c6f70,OCCUPANT,UNSPECIFIED,M,,20095307.0,,,,,,,,,Registrant,,,10/27/2021,18:30,,,40.68211,-73.79464,"(40.68211, -73.79464)",147 STREET,,,0.0,0.0,0,0,0,0,0,0,Unsafe Lane Changing,Unspecified,,,,Sedan,Station Wagon/Sport Utility Vehicle,,,,2021-10-27 18:30:00
12129128,4504436,0c764c60-0dfa-428c-b628-0e8f01473616,OCCUPANT,UNSPECIFIED,M,37.0,20166717.0,,,,,,,,,Registrant,,,02/19/2022,5:00,BRONX,10472.0,40.8283,-73.88296,"(40.8283, -73.88296)",WESTCHESTER AVENUE,BRONX RIVER AVENUE,,1.0,0.0,0,0,1,0,0,0,Driver Inattention/Distraction,Unspecified,,,,Station Wagon/Sport Utility Vehicle,Bike,,,,2022-02-19 05:00:00
7614503,3894413,218e25aa-1b23-4f20-afe6-c0c76264a44f,OCCUPANT,UNSPECIFIED,F,32.0,17840324.0,,,,,,,,,Registrant,,,05/04/2018,15:00,QUEENS,11364.0,40.73578,-73.746544,"(40.73578, -73.746544)",SPRINGFIELD BOULEVARD           ,UNION TURNPIKE,,1.0,0.0,0,0,0,0,1,0,Unspecified,,,,,Sedan,,,,,2018-05-04 15:00:00
8950947,4058357,2223f8cf-822e-481f-8e78-7588d9e63ff5,OCCUPANT,UNSPECIFIED,F,0.0,18498175.0,,,,,,,,,Registrant,,,01/19/2019,1:46,MANHATTAN,10029.0,40.792927,-73.94791,"(40.792927, -73.94791)",EAST 106 STREET                 ,PARK AVENUE,,0.0,0.0,0,0,0,0,0,0,Driver Inattention/Distraction,Unspecified,,,,Sedan,Sedan,,,,2019-01-19 01:46:00
12384512,4571059,7020394d-c0c0-497b-8bd1-6f6c6c7844f9,OCCUPANT,UNSPECIFIED,F,28.0,20313483.0,,,,,,,,,Registrant,,,10/07/2022,18:35,BRONX,10467.0,40.8585,-73.86783,"(40.8585, -73.86783)",BOSTON ROAD,THWAITES PLACE,,0.0,0.0,0,0,0,0,0,0,Driver Inattention/Distraction,Unspecified,,,,Tow Truck / Wrecker,Sedan,,,,2022-10-07 18:35:00
11559796,4385589,c9c701d5-fbcd-4a33-a6ef-d8d36ba3789e,OCCUPANT,UNSPECIFIED,,,19835018.0,,,,,,,,,Registrant,,,01/17/2021,2:35,QUEENS,11421.0,40.69256,-73.86352,"(40.69256, -73.86352)",,,86-33     79 STREET                     ,0.0,0.0,0,0,0,0,0,0,Driver Inattention/Distraction,Unspecified,Unspecified,Unspecified,Unspecified,Sedan,Sedan,Sedan,Station Wagon/Sport Utility Vehicle,Sedan,2021-01-17 02:35:00
12407951,4577398,8acb283f-9481-45a2-80ec-7526ee104793,OCCUPANT,UNSPECIFIED,M,51.0,20326758.0,Not Ejected,Does Not Apply,Does Not Apply,Driver,Unknown,,,Does Not Apply,Driver,,,10/28/2022,13:00,,,40.750957,-73.98273,"(40.750957, -73.98273)",5 AVENUE,,,1.0,0.0,0,0,1,0,0,0,Failure to Yield Right-of-Way,Driver Inattention/Distraction,,,,Pick-up Truck,Bike,,,,2022-10-28 13:00:00
6538592,3507081,1706254,OCCUPANT,UNSPECIFIED,M,55.0,17319948.0,Not Ejected,Does Not Apply,Does Not Apply,Driver,Lap Belt,,,Does Not Apply,Driver,,,08/24/2016,18:47,QUEENS,11417.0,40.678787,-73.84427,"(40.678787, -73.84427)",CROSS BAY BOULEVARD             ,107 AVENUE,,0.0,0.0,0,0,0,0,0,0,Unspecified,Unspecified,,,,Sedan,Station Wagon/Sport Utility Vehicle,,,,2016-08-24 18:47:00
12304458,4549754,c6333628-0538-4e80-8962-4f19689a0aba,OCCUPANT,INJURED,M,63.0,20267187.0,Not Ejected,Conscious,Entire Body,Driver,Unknown,,,Complaint of Pain or Nausea,Driver,,,07/21/2022,21:30,BROOKLYN,11208.0,40.67072,-73.861206,"(40.67072, -73.861206)",,,781       DREW STREET,2.0,0.0,0,0,0,0,2,0,Unsafe Speed,Unspecified,Unspecified,Unspecified,,Station Wagon/Sport Utility Vehicle,Sedan,Sedan,Station Wagon/Sport Utility Vehicle,,2022-07-21 21:30:00
6097727,3612546,9037b870-5db6-47ed-b608-b05d62edc610,OCCUPANT,UNSPECIFIED,M,52.0,17111172.0,Not Ejected,Does Not Apply,Does Not Apply,Driver,Lap Belt & Harness,,,Does Not Apply,Driver,,,02/09/2017,9:18,BROOKLYN,11222.0,40.72305,-73.938255,"(40.72305, -73.938255)",,,18        ANTHONY STREET                ,0.0,0.0,0,0,0,0,0,0,Passing Too Closely,Unspecified,,,,Carry All,Sedan,,,,2017-02-09 09:18:00
12554232,4613300,1543d994-2efc-482c-9617-2edf31924a5c,OCCUPANT,UNSPECIFIED,,,20410008.0,,,,,,,,,Registrant,,,03/11/2023,2:03,MANHATTAN,10003.0,40.725292,-73.99219,"(40.725292, -73.99219)",,,315       BOWERY,0.0,0.0,0,0,0,0,0,0,Unspecified,Unspecified,Unspecified,,,Sedan,Sedan,Station Wagon/Sport Utility Vehicle,,,2023-03-11 02:03:00
7919133,3780736,82862b54-03e8-438b-8644-3b33cd1a30a4,OCCUPANT,UNSPECIFIED,M,53.0,17989065.0,,,,,,,,,Registrant,,,10/31/2017,12:50,,,40.74258,-73.729744,"(40.74258, -73.729744)",CROSS ISLAND PARKWAY            ,,,1.0,0.0,0,0,0,0,1,0,Unspecified,Unspecified,,,,Station Wagon/Sport Utility Vehicle,Pick-up Truck,,,,2017-10-31 12:50:00
7494005,3861680,2570d942-82c7-4429-9b98-f3fab2265cb3,OCCUPANT,UNSPECIFIED,M,43.0,17781125.0,Not Ejected,Does Not Apply,Does Not Apply,Driver,Lap Belt & Harness,,,Does Not Apply,Driver,,,03/13/2018,14:30,QUEENS,11419.0,40.689953,-73.826004,"(40.689953, -73.826004)",LEFFERTS BOULEVARD              ,101 AVENUE,,0.0,0.0,0,0,0,0,0,0,Driver Inattention/Distraction,Unspecified,,,,Taxi,Station Wagon/Sport Utility Vehicle,,,,2018-03-13 14:30:00
5962988,3434821,569418,OCCUPANT,INJURED,M,27.0,17047141.0,Not Ejected,Conscious,Neck,Driver,Lap Belt & Harness,,,Complaint of Pain,Driver,,,04/29/2016,6:54,BROOKLYN,11203.0,,,,UTICA AVENUE                    ,LINDEN BOULEVARD,,2.0,0.0,0,0,0,0,2,0,View Obstructed/Limited,View Obstructed/Limited,,,,4 dr sedan,4 dr sedan,,,,2016-04-29 06:54:00
12959581,4720037,1485ba68-626d-4a8e-9e2e-d61b96517d3a,OCCUPANT,INJURED,M,24.0,20640063.0,Not Ejected,Conscious,Neck,Driver,Lap Belt & Harness,,,Complaint of Pain or Nausea,Driver,,,04/25/2024,20:10,MANHATTAN,10027.0,40.81796,-73.960365,"(40.81796, -73.960365)",RIVERSIDE DRIVE,WEST 125 STREET,,1.0,0.0,0,0,0,0,1,0,Passing or Lane Usage Improper,Unspecified,Unspecified,Unspecified,,Sedan,Sedan,Sedan,Station Wagon/Sport Utility Vehicle,,2024-04-25 20:10:00
9434031,3973649,17193047-cf05-44ae-b456-a46269d40063,OCCUPANT,UNSPECIFIED,F,31.0,18736232.0,,,,,,,,,Registrant,,,09/04/2018,11:26,MANHATTAN,10016.0,40.74668,-73.9745,"(40.74668, -73.9745)",2 AVENUE                        ,EAST 37 STREET,,0.0,0.0,0,0,0,0,0,0,Driver Inattention/Distraction,Driver Inattention/Distraction,,,,Station Wagon/Sport Utility Vehicle,Sedan,,,,2018-09-04 11:26:00
12655924,4641092,6f38e42f-73b1-4139-8913-731e20f46dc5,OCCUPANT,UNSPECIFIED,F,42.0,20467244.0,Not Ejected,Does Not Apply,Does Not Apply,Driver,Lap Belt,,,Does Not Apply,Driver,,,06/21/2023,16:20,QUEENS,11379.0,40.71548,-73.87931,"(40.71548, -73.87931)",75 STREET,JUNIPER VALLEY ROAD,,0.0,0.0,0,0,0,0,0,0,Following Too Closely,Unspecified,,,,Sedan,,,,,2023-06-21 16:20:00
9987759,4168737,377d78f8-0693-4626-bfb1-c57d486902a8,OCCUPANT,UNSPECIFIED,,0.0,19010007.0,,,,,,,,,Registrant,,,07/11/2019,14:10,BROOKLYN,11237.0,40.712124,-73.934265,"(40.712124, -73.934265)",MORGAN AVENUE                   ,TEN EYCK STREET,,0.0,0.0,0,0,0,0,0,0,Driver Inattention/Distraction,Unspecified,,,,Sedan,Carry All,,,,2019-07-11 14:10:00
12670945,4645014,eee0d5e0-0d40-49a5-9f82-e23474e9dd5b,OCCUPANT,UNSPECIFIED,F,35.0,20475699.0,Not Ejected,Does Not Apply,Does Not Apply,Driver,Lap Belt,,,Does Not Apply,Driver,,,07/12/2023,12:12,QUEENS,11423.0,40.713318,-73.76402,"(40.713318, -73.76402)",JAMAICA AVENUE,196 STREET,,0.0,0.0,0,0,0,0,0,0,Unspecified,Unspecified,,,,Van,Station Wagon/Sport Utility Vehicle,,,,2023-07-12 12:12:00
11276640,3464015,1006729,OCCUPANT,UNSPECIFIED,,,,,,,,,,,,Registrant,,,06/17/2016,17:09,MANHATTAN,10022.0,40.7606,-73.96434,"(40.7606, -73.96434)",2 AVENUE                        ,EAST 59 STREET,,0.0,0.0,0,0,0,0,0,0,Aggressive Driving/Road Rage,Unspecified,Unspecified,,,,,,,,2016-06-17 17:09:00
13505149,4849820,8cf5884c-a382-4422-b906-dced01d0e232,OCCUPANT,INJURED,F,48.0,20953079.0,Not Ejected,Conscious,Neck,"Front passenger, if two or more persons, including the driver, are in the front seat",Lap Belt & Harness,,,Complaint of Pain or Nausea,Passenger,,,10/14/2025,21:04,,,40.584343,-73.962,"(40.584343, -73.962)",BELT PARKWAY,,,2.0,0.0,0,0,0,0,2,0,Reaction to Uninvolved Vehicle,Unspecified,,,,Box Truck,Station Wagon/Sport Utility Vehicle,,,,2025-10-14 21:04:00
9345136,3929078,6277ab19-bfde-4532-9cb0-6244748bf8e0,OCCUPANT,UNSPECIFIED,,0.0,18692694.0,,,,,,,,,Registrant,,,06/23/2018,23:35,BROOKLYN,11226.0,40.648922,-73.94938,"(40.648922, -73.94938)",NOSTRAND AVENUE                 ,SNYDER AVENUE,,0.0,0.0,0,0,0,0,0,0,Unspecified,Unspecified,,,,Sedan,Station Wagon/Sport Utility Vehicle,,,,2018-06-23 23:35:00
9300724,3926919,58faedf8-fc7b-420f-9882-95fe87ac3c0a,OCCUPANT,UNSPECIFIED,M,41.0,18670791.0,Partially Ejected,Does Not Apply,Does Not Apply,Driver,Lap Belt & Harness,,,Does Not Apply,Driver,,,06/21/2018,16:50,BROOKLYN,11219.0,40.629776,-73.994,"(40.629776, -73.994)",56 STREET                       ,14 AVENUE,,0.0,0.0,0,0,0,0,0,0,Backing Unsafely,Unspecified,,,,Sedan,Station Wagon/Sport Utility Vehicle,,,,2018-06-21 16:50:00
6043982,3593375,697b8f85-4c4a-4ae0-b173-ee024cf4befc,OCCUPANT,UNSPECIFIED,M,48.0,17085289.0,,,,,,,,,Registrant,,,01/06/2017,13:30,,,40.728947,-73.92793,"(40.728947, -73.92793)",BROOKLYN QUEENS EXPRESSWAY      ,,,3.0,0.0,0,0,0,0,3,0,Following Too Closely,Unspecified,,,,Station Wagon/Sport Utility Vehicle,Sedan,,,,2017-01-06 13:30:00
11572407,4389773,4253cff5-e75f-439b-8de4-5c55a84fc03e,OCCUPANT,UNSPECIFIED,M,,19842840.0,,,,,,,,,Registrant,,,02/06/2021,17:00,MANHATTAN,10001.0,,,,34 street                       ,9 ave,,1.0,0.0,1,0,0,0,0,0,,,,,,Sedan,,,,,2021-02-06 17:00:00
6592239,3498490,1548063,OCCUPANT,UNSPECIFIED,M,35.0,17345567.0,,,,,,,,,Registrant,,,08/12/2016,0:13,,,40.762268,-73.96315,"(40.762268, -73.96315)",2 AVENUE                        ,,,0.0,0.0,0,0,0,0,0,0,Unspecified,Unspecified,,,,Sedan,Station Wagon/Sport Utility Vehicle,,,,2016-08-12 00:13:00
9732079,4006824,eacf13cf-e52b-4687-9952-bea57f42e4c5,OCCUPANT,UNSPECIFIED,M,33.0,18883850.0,,,,,,,,,Registrant,,,10/24/2018,23:40,,,40.665733,-73.755585,"(40.665733, -73.755585)",BELT PARKWAY                    ,,,0.0,0.0,0,0,0,0,0,0,Unspecified,Unspecified,,,,Sedan,Station Wagon/Sport Utility Vehicle,,,,2018-10-24 23:40:00
5801992,3407422,343709,BICYCLIST,UNSPECIFIED,M,21.0,16971049.0,Does Not Apply,Conscious,Does Not Apply,Driver,-,,,Does Not Apply,Driver,,,04/12/2016,11:30,MANHATTAN,10016.0,,,,PARK AVENUE SOUTH               ,EAST 31 STREET,,0.0,0.0,0,0,0,0,0,0,Driver Inattention/Distraction,,,,,Bike,4 dr sedan,,,,2016-04-12 11:30:00
7425241,3846831,3e5d6d20-18b0-40f7-afcd-a7aca753d2fc,OCCUPANT,UNSPECIFIED,M,43.0,17747223.0,,,,,,,,,Registrant,,,02/15/2018,12:40,STATEN ISLAND,10312.0,40.5433,-74.16424,"(40.5433, -74.16424)",AMBOY ROAD                      ,RICHMOND AVENUE,,0.0,0.0,0,0,0,0,0,0,Following Too Closely,Unspecified,,,,Station Wagon/Sport Utility Vehicle,Station Wagon/Sport Utility Vehicle,,,,2018-02-15 12:40:00
12816788,4683245,d2462c34-2bfe-45d5-b64e-d0bd2820ea3c,OCCUPANT,UNSPECIFIED,,,20558919.0,,,,,,,,,Registrant,,,11/29/2023,19:33,BROOKLYN,11213.0,40.668613,-73.94505,"(40.668613, -73.94505)",UNION STREET,BROOKLYN AVENUE,,1.0,0.0,0,0,0,0,0,0,Unspecified,Unspecified,,,,Station Wagon/Sport Utility Vehicle,E-Scooter,,,,2023-11-29 19:33:00
13175368,4744903,6c458be5-f97c-4d1e-bb53-c6d7fd5e6641,OCCUPANT,INJURED,F,75.0,20764402.0,Not Ejected,Unknown,Unknown,Driver,Unknown,,,Unknown,Driver,,,08/01/2024,13:11,BROOKLYN,11208.0,40.67086,-73.863174,"(40.67086, -73.863174)",ELDERTS LANE,DUMONT AVENUE,,3.0,0.0,0,0,0,0,3,0,Aggressive Driving/Road Rage,Unspecified,Unspecified,Unspecified,Unspecified,Sedan,Sedan,Sedan,Sedan,Sedan,2024-08-01 13:11:00
13165194,4752155,c150c8ec-055d-47ba-9f59-dacbbf6ff5f8,OCCUPANT,UNSPECIFIED,M,41.0,20758229.0,Not Ejected,Does Not Apply,Does Not Apply,Driver,Lap Belt & Harness,,,Does Not Apply,Driver,,,08/30/2024,18:19,QUEENS,11385.0,40.69774,-73.89289,"(40.69774, -73.89289)",62 STREET,COOPER AVENUE,,0.0,0.0,0,0,0,0,0,0,Turning Improperly,Oversized Vehicle,,,,Sedan,Bus,,,,2024-08-30 18:19:00
9764780,4117337,41f13471-0b77-4c05-a646-ee2e12a789c1,OCCUPANT,UNSPECIFIED,M,43.0,18899850.0,,,,,,,,,Registrant,,,04/17/2019,15:50,QUEENS,11385.0,40.69928,-73.90479,"(40.69928, -73.90479)",HANCOCK STREET                  ,CYPRESS AVENUE,,0.0,0.0,0,0,0,0,0,0,Failure to Yield Right-of-Way,Unspecified,,,,Station Wagon/Sport Utility Vehicle,Station Wagon/Sport Utility Vehicle,,,,2019-04-17 15:50:00
9288931,4110284,248d696a-17a9-458e-a67e-85fc7c97c480,OCCUPANT,UNSPECIFIED,M,29.0,18664985.0,,,,,,,,,Registrant,,,04/05/2019,17:30,BROOKLYN,11208.0,40.67818,-73.870705,"(40.67818, -73.870705)",CRESCENT STREET                 ,LIBERTY AVENUE,,0.0,0.0,0,0,0,0,0,0,Passing or Lane Usage Improper,Unspecified,,,,Sedan,Taxi,,,,2019-04-05 17:30:00
7426379,3903393,e8588035-342e-4c16-b652-1edcf174a151,OCCUPANT,UNSPECIFIED,M,42.0,17747786.0,Not Ejected,Does Not Apply,Does Not Apply,Driver,Lap Belt & Harness,,,Does Not Apply,Driver,,,05/12/2018,15:37,MANHATTAN,10002.0,,,,PIKE STREET                     ,DIVISION STREET,,0.0,0.0,0,0,0,0,0,0,Backing Unsafely,Unspecified,,,,Pick-up Truck,Box Truck,,,,2018-05-12 15:37:00
12230106,4530905,cd9405ba-a83e-4344-81b7-9ead30feb9af,OCCUPANT,UNSPECIFIED,M,26.0,20224451.0,Not Ejected,Does Not Apply,Does Not Apply,"Front passenger, if two or more persons, including the driver, are in the front seat",Lap Belt,,,Does Not Apply,Passenger,,,05/23/2022,22:20,BRONX,10467.0,40.8585,-73.86783,"(40.8585, -73.86783)",BOSTON ROAD,THWAITES PLACE,,0.0,0.0,0,0,0,0,0,0,Driver Inattention/Distraction,Unspecified,,,,Pick-up Truck,Sedan,,,,2022-05-23 22:20:00
12409999,4577685,c9816754-e3a8-4a24-9744-7d0d9c954960,OCCUPANT,UNSPECIFIED,M,64.0,20327958.0,Not Ejected,Does Not Apply,Does Not Apply,Driver,Lap Belt & Harness,,,Does Not Apply,Driver,,,10/24/2022,6:30,,,40.606182,-74.07613,"(40.606182, -74.07613)",STATEN ISLAND EXPRESSWAY,,,0.0,0.0,0,0,0,0,0,0,Oversized Vehicle,Pavement Slippery,,,,Box Truck,Sedan,,,,2022-10-24 06:30:00
7644679,3868540,3649ba3b-01a1-46cf-88cd-aaab3d69a7ef,OCCUPANT,UNSPECIFIED,F,0.0,17854943.0,,,,,,,,,Registrant,,,03/24/2018,10:45,,,40.777203,-73.76756,"(40.777203, -73.76756)",CROSS ISLAND PARKWAY            ,,,0.0,0.0,0,0,0,0,0,0,Reaction to Uninvolved Vehicle,Unspecified,,,,Sedan,Sedan,,,,2018-03-24 10:45:00
9145744,4108036,2a320b0f-971b-46ee-83a2-1d27fe8eb194,OCCUPANT,UNSPECIFIED,F,40.0,18594658.0,,,,,,,,,Registrant,,,04/02/2019,7:45,,,40.843136,-73.91097,"(40.843136, -73.91097)",SHERIDAN AVENUE                 ,,,0.0,0.0,0,0,0,0,0,0,Passing or Lane Usage Improper,Unspecified,,,,Station Wagon/Sport Utility Vehicle,Sedan,,,,2019-04-02 07:45:00
7298225,3833188,b474dc02-c4de-4a2c-91bf-cdaf2caadabf,OCCUPANT,UNSPECIFIED,M,66.0,17684940.0,,,,,,,,,Registrant,,,01/08/2018,17:55,BRONX,10457.0,40.844784,-73.90847,"(40.844784, -73.90847)",EAST 174 STREET                 ,EASTBURN AVENUE,,1.0,0.0,1,0,0,0,0,0,View Obstructed/Limited,,,,,Sedan,,,,,2018-01-08 17:55:00
7925293,3781501,61a0fcc1-5e27-4845-a323-b0b72b8e9e89,OCCUPANT,UNSPECIFIED,F,20.0,17992064.0,,,,,,,,,Registrant,,,11/01/2017,16:00,,,40.789116,-73.82259,"(40.789116, -73.82259)",WHITESTONE EXPRESSWAY           ,,,1.0,0.0,0,0,0,0,1,0,Following Too Closely,Reaction to Uninvolved Vehicle,,,,Sedan,Station Wagon/Sport Utility Vehicle,,,,2017-11-01 16:00:00
12193630,4521327,ad0ebb91-e3dc-4963-adf9-ab4ee0615a36,OCCUPANT,UNSPECIFIED,F,5.0,20203798.0,Not Ejected,Does Not Apply,Does Not Apply,Right rear passenger or motorcycle sidecar passenger,Child Restraint Only,,,Does Not Apply,Passenger,,,04/23/2022,15:45,,,40.711033,-73.7281,"(40.711033, -73.7281)",CROSS ISLAND PARKWAY,,,0.0,0.0,0,0,0,0,0,0,Driver Inattention/Distraction,Unspecified,,,,Sedan,Sedan,,,,2022-04-23 15:45:00
9612966,4041160,cdf313ea-e488-4233-843f-be15a9dc28ff,OCCUPANT,UNSPECIFIED,F,57.0,18824523.0,,,,,,,,,Registrant,,,12/08/2018,23:30,QUEENS,11423.0,40.712467,-73.76872,"(40.712467, -73.76872)",,,190-34    JAMAICA AVENUE                ,0.0,0.0,0,0,0,0,0,0,Driver Inattention/Distraction,Unspecified,,,,Sedan,,,,,2018-12-08 23:30:00
7643981,3906800,27dbd929-e6ee-4f22-97d6-29643065f5e3,OCCUPANT,UNSPECIFIED,M,1.0,17854590.0,Not Ejected,Does Not Apply,Does Not Apply,"Left rear passenger, or rear passenger on a bicycle, motorcycle, snowmobile",Lap Belt & Harness,,,Does Not Apply,Passenger,,,05/18/2018,16:02,QUEENS,11378.0,40.72616,-73.90012,"(40.72616, -73.90012)",HAMILTON PLACE                  ,BORDEN AVENUE,,1.0,0.0,0,0,0,0,1,0,Driver Inattention/Distraction,Unspecified,,,,Sedan,Station Wagon/Sport Utility Vehicle,,,,2018-05-18 16:02:00
12343867,4560259,ea0d1bee-18a6-47ae-b2fe-cd3d4e6134f5,OCCUPANT,UNSPECIFIED,M,29.0,20290081.0,,,,,,,,,Registrant,,,09/01/2022,17:27,QUEENS,11435.0,40.701763,-73.80793,"(40.701763, -73.80793)",JAMAICA AVENUE,SUTPHIN BOULEVARD,,0.0,0.0,0,0,0,0,0,0,Failure to Yield Right-of-Way,Unspecified,,,,Sedan,Station Wagon/Sport Utility Vehicle,,,,2022-09-01 17:27:00
12541122,4608056,fdf59542-d80a-44bf-ac0c-95c5a9cd2cbf,OCCUPANT,UNSPECIFIED,M,30.0,20402674.0,Not Ejected,Does Not Apply,Does Not Apply,Driver,Lap Belt & Harness,,,Does Not Apply,Driver,,,02/24/2023,13:40,BROOKLYN,11228.0,40.61914,-74.02094,"(40.61914, -74.02094)",,,8501      7 AVENUE,0.0,0.0,0,0,0,0,0,0,Following Too Closely,Unspecified,,,,Sedan,,,,,2023-02-24 13:40:00
10303531,4242377,875f4ce1-238c-480c-bce8-390bbc160cd3,OCCUPANT,UNSPECIFIED,M,37.0,19168400.0,,,,,,,,,Registrant,,,11/15/2019,19:00,,,40.547836,-74.22037,"(40.547836, -74.22037)",BLOOMINGDALE ROAD               ,VETERANS ROAD EAST,,0.0,0.0,0,0,0,0,0,0,Failure to Yield Right-of-Way,Unspecified,,,,Sedan,Sedan,,,,2019-11-15 19:00:00
6922017,3648997,e665c846-14e6-4ca1-be21-9fd03f707af1,OCCUPANT,UNSPECIFIED,M,24.0,17503894.0,Not Ejected,Does Not Apply,Does Not Apply,"Front passenger, if two or more persons, including the driver, are in the front seat",Lap Belt & Harness,,,Does Not Apply,Passenger,,,04/10/2017,12:23,,,40.809563,-73.92923,"(40.809563, -73.92923)",EAST 135 STREET                 ,3 AVENUE,,0.0,0.0,0,0,0,0,0,0,Turning Improperly,Unspecified,,,,Sedan,Dump,,,,2017-04-10 12:23:00
9509627,3948738,29238588-1052-43cd-bb06-e8b7c94e8807,OCCUPANT,UNSPECIFIED,M,31.0,18773351.0,Not Ejected,Does Not Apply,Does Not Apply,Driver,Lap Belt & Harness,,,Does Not Apply,Driver,,,07/26/2018,10:03,MANHATTAN,10021.0,40.77233,-73.958725,"(40.77233, -73.958725)",3 AVENUE                        ,EAST 76 STREET,,0.0,0.0,0,0,0,0,0,0,Unsafe Lane Changing,Unspecified,,,,Station Wagon/Sport Utility Vehicle,Taxi,,,,2018-07-26 10:03:00
11919777,4449294,decbb3e5-92e3-48c3-a492-1919f75ab45a,OCCUPANT,UNSPECIFIED,F,29.0,20045374.0,Not Ejected,Does Not Apply,Does Not Apply,"Front passenger, if two or more persons, including the driver, are in the front seat",Unknown,,,Does Not Apply,Passenger,,,08/22/2021,11:00,,,,,,CROSS ISLAND PARKWAY,,,2.0,0.0,0,0,0,0,2,0,Pavement Slippery,Unspecified,,,,Station Wagon/Sport Utility Vehicle,Pick-up Truck,,,,2021-08-22 11:00:00
6366336,3543493,2386605,OCCUPANT,UNSPECIFIED,M,24.0,17238172.0,Not Ejected,Does Not Apply,Does Not Apply,Driver,Lap Belt & Harness,,,Does Not Apply,Driver,,,10/18/2016,22:00,BROOKLYN,11236.0,40.640373,-73.89702,"(40.640373, -73.89702)",ROCKAWAY PARKWAY                ,AVENUE K,,2.0,0.0,0,0,0,0,2,0,Unspecified,Unspecified,,,,Sedan,Sedan,,,,2016-10-18 22:00:00
7812923,3792703,cb0f9652-2a3f-4e95-a532-ee226a83394b,OCCUPANT,UNSPECIFIED,M,28.0,17936938.0,Not Ejected,Does Not Apply,Does Not Apply,Driver,Lap Belt & Harness,,,Does Not Apply,Driver,,,11/17/2017,8:30,MANHATTAN,10018.0,40.756527,-73.994026,"(40.756527, -73.994026)",WEST 39 STREET                  ,9 AVENUE,,0.0,0.0,0,0,0,0,0,0,Driver Inattention/Distraction,Driver Inattention/Distraction,,,,Box Truck,Tractor Truck Diesel,,,,2017-11-17 08:30:00
7021910,3687719,97552082-cfa4-4146-a764-cb83eee76a95,OCCUPANT,UNSPECIFIED,F,58.0,17551818.0,,,,,,,,,Registrant,,,06/10/2017,14:00,,,40.632786,-74.13712,"(40.632786, -74.13712)",PORT RICHMOND AVENUE            ,,,0.0,0.0,0,0,0,0,0,0,Driver Inattention/Distraction,Unspecified,,,,Pick-up Truck,Station Wagon/Sport Utility Vehicle,,,,2017-06-10 14:00:00
10059202,4185167,2d7f67a8-78a1-4b72-a8bb-ac024d26b861,OCCUPANT,UNSPECIFIED,M,48.0,19045724.0,,,,,,,,,Registrant,,,08/07/2019,6:45,,,40.716133,-73.8185,"(40.716133, -73.8185)",GRAND CENTRAL PKWY              ,,,0.0,0.0,0,0,0,0,0,0,Following Too Closely,Unspecified,,,,Station Wagon/Sport Utility Vehicle,Station Wagon/Sport Utility Vehicle,,,,2019-08-07 06:45:00
7070772,3700755,8963123e-182a-41ab-8cbb-a54304909e1c,OCCUPANT,INJURED,F,0.0,17575158.0,Not Ejected,Conscious,Head,"Middle front seat, or passenger lying across a seat",Unknown,,,Unknown,Passenger,,,06/25/2017,21:35,BRONX,10462.0,40.837795,-73.84817,"(40.837795, -73.84817)",ZEREGA AVENUE                   ,LYON AVENUE,,2.0,0.0,0,0,0,0,2,0,Unspecified,Unspecified,,,,Sedan,Station Wagon/Sport Utility Vehicle,,,,2017-06-25 21:35:00
9683992,4001690,a21f6963-6467-4bf7-bfcc-3e49f340a949,OCCUPANT,UNSPECIFIED,M,57.0,18859666.0,,,,,,,,,Registrant,,,10/17/2018,7:00,,,,,,49 STREET                       ,ASTORIA BOULEVARD,,0.0,0.0,0,0,0,0,0,0,Turning Improperly,Unspecified,,,,Sedan,Sedan,,,,2018-10-17 07:00:00
12469678,4593401,2c06a1d0-f4d5-44c8-996f-95f17e1b7c89,OCCUPANT,UNSPECIFIED,M,54.0,20361808.0,,,,,,,,,Registrant,,,12/27/2022,18:00,,,,,,92 STREET,,,0.0,0.0,0,0,0,0,0,0,Unspecified,Unspecified,,,,Pick-up Truck,Pick-up Truck,,,,2022-12-27 18:00:00
9666486,4046034,71dba4e2-58f8-4621-8a3a-4f21e510d93f,OCCUPANT,UNSPECIFIED,M,12.0,18851026.0,Not Ejected,Does Not Apply,Does Not Apply,"Middle rear seat, or passenger lying across a seat",Unknown,,,Does Not Apply,Passenger,,,12/16/2018,16:30,,,40.61816,-74.162315,"(40.61816, -74.162315)",STATEN ISLAND EXPRESSWAY        ,,,0.0,0.0,0,0,0,0,0,0,Driver Inattention/Distraction,Unspecified,,,,Station Wagon/Sport Utility Vehicle,Sedan,,,,2018-12-16 16:30:00
12256116,4537623,fb8c2843-f215-443e-9b0d-0444c44bb05a,OCCUPANT,UNSPECIFIED,M,43.0,20239457.0,Not Ejected,Does Not Apply,Does Not Apply,Driver,,,,Does Not Apply,Driver,,,06/14/2022,11:01,BRONX,10474.0,,,,,,1251      RANDALL AVENUE,0.0,0.0,0,0,0,0,0,0,Unspecified,Unspecified,,,,Sedan,Box Truck,,,,2022-06-14 11:01:00
11144279,4304486,d5343ba5-7b09-4eba-acbf-5512dd78c93b,OCCUPANT,UNSPECIFIED,M,,19603097.0,,,,,,,,,Registrant,,,03/27/2020,15:00,QUEENS,11416.0,40.684425,-73.85949,"(40.684425, -73.85949)",,,81-05     ROCKAWAY BOULEVARD            ,0.0,0.0,0,0,0,0,0,0,Unspecified,,,,,Sedan,,,,,2020-03-27 15:00:00
7176489,3708776,d7722c3c-d7e0-4135-97c3-8088a1509db8,OCCUPANT,UNSPECIFIED,F,0.0,17625796.0,,,,,,,,,Registrant,,,07/11/2017,9:20,BROOKLYN,11229.0,40.6036,-73.95608,"(40.6036, -73.95608)",,,1620      AVENUE S                      ,0.0,0.0,0,0,0,0,0,0,Turning Improperly,Unspecified,,,,Station Wagon/Sport Utility Vehicle,Sedan,,,,2017-07-11 09:20:00
11073272,4290560,eccfe267-faf7-4ab5-ad62-1c90bad93ea1,OCCUPANT,UNSPECIFIED,M,56.0,19565582.0,Not Ejected,Does Not Apply,Does Not Apply,Driver,Lap Belt & Harness,,,Does Not Apply,Driver,,,02/18/2020,8:13,,,40.639977,-73.9262,"(40.639977, -73.9262)",EAST 53 STREET                  ,FOSTER AVENUE,,0.0,0.0,0,0,0,0,0,0,Passing Too Closely,Unspecified,,,,Van,Box Truck,,,,2020-02-18 08:13:00
9943262,4158688,39a5f475-368e-4e5d-b2d0-51f7f84c8372,OCCUPANT,INJURED,F,29.0,18988003.0,Not Ejected,Conscious,Head,Driver,Lap Belt & Harness,,,Complaint of Pain or Nausea,Driver,,,06/22/2019,13:00,,,40.65461,-73.922,"(40.65461, -73.922)",KINGS HIGHWAY                   ,,,1.0,0.0,0,0,0,0,1,0,Unspecified,Unspecified,,,,Sedan,Sedan,,,,2019-06-22 13:00:00
11746996,4409171,5e3fec2d-0bb9-4dad-b207-cf2a37168499,OCCUPANT,UNSPECIFIED,,,19944289.0,,,,,,,,,Registrant,,,04/17/2021,1:00,MANHATTAN,10027.0,40.809605,-73.94981,"(40.809605, -73.94981)",,,253       WEST 125 STREET,0.0,0.0,0,0,0,0,0,0,Driver Inattention/Distraction,Failure to Yield Right-of-Way,,,,Sedan,Station Wagon/Sport Utility Vehicle,,,,2021-04-17 01:00:00
9608452,4030939,5e26a11b-4fe0-4112-8d9d-341287cc086f,OCCUPANT,UNSPECIFIED,M,38.0,18822359.0,,,,,,,,,Registrant,,,11/22/2018,11:33,QUEENS,11368.0,40.749416,-73.86739,"(40.749416, -73.86739)",,,98-09     ROOSEVELT AVENUE              ,0.0,0.0,0,0,0,0,0,0,Failure to Yield Right-of-Way,Unspecified,,,,Station Wagon/Sport Utility Vehicle,Station Wagon/Sport Utility Vehicle,,,,2018-11-22 11:33:00
9813897,4128994,7604412a-b2a3-47d6-97e4-e47b0df14663,OCCUPANT,UNSPECIFIED,M,29.0,18924070.0,,,,,,,,,Registrant,,,05/09/2019,23:15,STATEN ISLAND,10309.0,40.537647,-74.20094,"(40.537647, -74.20094)",,,455       RAMONA AVENUE                 ,0.0,0.0,0,0,0,0,0,0,Driver Inattention/Distraction,Unspecified,Unspecified,Unspecified,,Pick-up Truck,Sedan,Sedan,Sedan,,2019-05-09 23:15:00
9855572,4138943,e04efcf0-b72b-42bd-bd17-8948c5614a4b,OCCUPANT,UNSPECIFIED,F,18.0,18944622.0,Not Ejected,Does Not Apply,Does Not Apply,"Middle rear seat, or passenger lying across a seat",Lap Belt & Harness,,,Does Not Apply,Passenger,,,05/25/2019,2:40,,,40.84219,-73.89411,"(40.84219, -73.89411)",CROTONA AVENUE                  ,CROTONA PARK NORTH,,1.0,0.0,0,0,0,0,1,0,Other Vehicular,Driver Inexperience,,,,Taxi,Sedan,,,,2019-05-25 02:40:00
9661256,4019620,17a5cc63-a7e2-47a8-8b8c-d0d8c3ef9ca2,OCCUPANT,UNSPECIFIED,M,34.0,18848425.0,Not Ejected,Does Not Apply,Does Not Apply,Driver,Lap Belt & Harness,,,Does Not Apply,Driver,,,11/12/2018,16:30,,,40.75426,-73.74334,"(40.75426, -73.74334)",LONG ISLAND EXPRESSWAY          ,,,0.0,0.0,0,0,0,0,0,0,Following Too Closely,Unspecified,Unspecified,,,PK,Sedan,Sedan,,,2018-11-12 16:30:00
7522335,3845591,4c78933f-e7c1-4a8d-a01f-0e92e6e31fb2,OCCUPANT,UNSPECIFIED,,,17794998.0,,,,,,,,,Registrant,,,02/13/2018,20:25,,,,,,GRAND CENTRAL PARKWAY           ,LITTLE NECK PARKWAY,,0.0,0.0,0,0,0,0,0,0,Unspecified,Unspecified,,,,Station Wagon/Sport Utility Vehicle,Sedan,,,,2018-02-13 20:25:00
9788238,4122800,4f718eee-6117-44d4-afc1-320b1c8de425,OCCUPANT,INJURED,F,26.0,18911497.0,Not Ejected,Conscious,Back,Right rear passenger or motorcycle sidecar passenger,Lap Belt & Harness,,,Complaint of Pain or Nausea,Passenger,,,04/29/2019,20:45,BROOKLYN,11201.0,40.692055,-73.982544,"(40.692055, -73.982544)",FLATBUSH AVENUE EXTENSION       ,WILLOUGHBY STREET,,4.0,0.0,0,0,0,0,4,0,Passing or Lane Usage Improper,Unspecified,,,,Sedan,Dump,,,,2019-04-29 20:45:00
9647917,3996571,e5c50cfc-affe-40d6-9390-ae8612e95250,OCCUPANT,UNSPECIFIED,,0.0,18841748.0,,,,,,,,,Registrant,,,10/09/2018,10:30,QUEENS,11367.0,40.718227,-73.81515,"(40.718227, -73.81515)",UNION TURNPIKE                  ,147 STREET,,0.0,0.0,0,0,0,0,0,0,Oversized Vehicle,Unspecified,,,,Carry All,Sedan,,,,2018-10-09 10:30:00
7010989,3684499,e8cca6db-fdc9-41a6-b8e9-72d6a84d72d1,OCCUPANT,UNSPECIFIED,,0.0,17546563.0,,,,,,,,,Registrant,,,06/05/2017,17:00,QUEENS,11372.0,40.753925,-73.88319,"(40.753925, -73.88319)",34 AVENUE                       ,84 STREET,,0.0,0.0,0,0,0,0,0,0,Driver Inattention/Distraction,Unspecified,,,,Station Wagon/Sport Utility Vehicle,Station Wagon/Sport Utility Vehicle,,,,2017-06-05 17:00:00
